keyword,priority,volume,kd,cpc,intent,seed,flag,published,Ссылка конкурента 1,Ссылка конкурента 2,Ссылка конкурента 3,Заголовок конкурента 1,Заголовок конкурента 2,Заголовок конкурента 3,Сниппет конкурента 1,Сниппет конкурента 2,Сниппет конкурента 3
how to make an app,1,9900,70,2.75,I,make app,ok,,,,,5 Best App Builders of 2026,Build An App For Free,How To Make An App - A Step-by-Step Guide,,,
apps to make money,2,9900,75,2.09,I,make app,ok,,https://play.google.com/store/apps/details?id=com.real.cashapp.make.money.playing.games.earn.cash.rewards.paid.surveys&hl=en,https://wise.com/us/blog/best-apps-to-make-money,https://pollpay.app/,Make Money - Real Cash App,18 Best Apps To Make Money: A Quick Guide (2026),Poll Pay: Earn Money Quickly,This real cash app allows you to fetch rewards and earn fast PayPal money. Make money let's you earn quick dollars to your PayPal account.Read more,"Money-making apps consist of a few categories: Long-term freelancing apps, short-term task apps, delivery and taxi apps, and apps to sell your stuff.",Poll Pay has paid millions in cash rewards to members for doing everyday online activities like taking paid surveys or playing games.Read more
apps to make friends,3,6600,71,0.04,I,make app,ok,,https://www.reddit.com/r/DAE/comments/1fx5m2o/dae_wish_there_was_a_dating_app_for_making/,https://www.fodors.com/news/news/i-tested-4-friendship-apps-for-30-days-in-indianapolis-heres-what-worked,https://befriend.cc/2025/05/23/10-best-free-apps-to-make-new-friends-online-in-2025/,DAE wish there was a dating app for making friends and ...,I Tried 4 Friendship Apps to Make Friends in a New City,10 Best Free Apps to Make New Friends Online in 2025,"1. Bumble BFF: An extension of the Bumble dating app, Bumble BFF allows users to find friends by swiping on profiles. Women make the first move, ...Read more","Jan 30, 2026 — I tested four friendship apps in Indianapolis to build a real social life. Bumble BFF, Meetup, BeFriend and Friended delivered very ...","May 23, 2025 — The Top 10 Free Apps to Make New Friends in 2025 · 1. BeFriend – For Gen Z Who Want Real Friends · 2. Yubo – Video-first, Social Circles: · 3.Read more"
how to make apps,4,6600,73,2.75,I,make app,ok,,http://www.google.com/goto?url=CAESlgEBO6uMpRMYXauBAUaYykdK1yns1giQXf5QfxBjwDuvIuO-8DMt8pVqD3DJW-vMlRJ3BzSngETrAcXCM2X4zjB797K3TaRr1YvG1LPEnZ0LehLSS7Xz3U0k2qjAU2X54xb-ty15petEt1MI7ae-EAcY_EuSGwV_UcSJKkAGER368dCSG96TzvackIej7opr4P49ZWhu6WE=,http://www.google.com/goto?url=CAEShQEBO6uMpaYUAzuO_8tLRWCEA42d7mbt0zwTgNV-liaTuWKedQ-juhPWrS9ABBKVWYrfJJwcm_2icpq1lAl3hB4vlfYZ80ZCDv1OsOdFXeOuVjZAs23q_9rF04umA0ZCV9557aGjEVRGlihO43DWB-ZVTWmEl8j9olIk7s9KMK7p1Urf86_-,http://www.google.com/goto?url=CAESdAE7q4yl6JR_fD52vWBlgCYhShvfooDXTMje5ROSYTNG99iVjI4935AHhcqqT-XgOmicDgSMR_vPN07DLSQjNSy1-76Lq6QBT5tqMIaIkLHKMN7_vAdtvWx0dW1YVm3AMEY9_E9URdVS78PwQJgu-2M77VCA,How do I build an app from scratch? : r/learnprogramming,Create your first Android app - Android Developers,How To Design an App in 5 Steps,Build a web app in a framework like React first. The code is then really easy to put on mobile with React Native.Read more,Create your first Android app · 1. Before you begin · 2. Create a project using the template · 3. Find project files · 4. Update the text · 5. Change the ...Read more,"Step 1: Define your app idea. Every app starts with a clear idea. The more focused the concept, the easier it is to design, test, and build something that users ...Read more"
best apps to make money,5,4400,74,1.82,I,make app,ok,,https://www.reddit.com/r/povertyfinance/comments/1mdx7yy/best_moneymaking_apps_that_actually_work/,https://wise.com/us/blog/best-apps-to-make-money,https://www.moneysavingexpert.com/family/make-money-online/,Best money-making apps that actually work?,18 Best Apps To Make Money: A Quick Guide (2026),Make money online: Paying sites and apps for making cash,"FreeCash . The tasks vary, but surveys and offers from top providers actually paid out well. I earned $630 in one month just staying consistent.Read more","Money-making apps consist of a few categories: Long-term freelancing apps, short-term task apps, delivery and taxi apps, and apps to sell your stuff.","This guide lists 20+ (legit) ways to make money online – you can get paid just to watch videos, write, search on Google, sell photos, make your own YouTube ...Read more"
app to make,6,3600,65,5.33,I,make app,ok,,https://www.make.com/en,https://apphive.io/,https://www.figma.com/solutions/ai-app-builder/,Make: AI Workflow Automation Software & Tools,Apphive | Create an App | Online App maker | App Builder,Free No-code AI App Builder - Idea to App in Seconds,"Automate your work. Make allows you to visually build, scale and automate AI and agentic workflows. User friendly no-code integration tool.","Apphive is an app builder | The easiest way to make an app for android and IOS, you can create a free mobile app without programming, drag and drop elements ...","Apr 2, 2026 — Build apps with AI in Figma Make. Turn ideas into interactive, data-connected apps and prototypes—refine, test, and publish with no coding ..."
how to make app,7,3600,73,3.03,I,make app,ok,,,,,5 Best App Builders of 2026 - Build An App,Build Your Own App (Free),Build An App For Free,,,
apps make money,8,3200,72,1.96,I,make app,ok,,https://play.google.com/store/apps/details?id=com.real.cashapp.make.money.playing.games.earn.cash.rewards.paid.surveys&hl=en,https://wise.com/us/blog/best-apps-to-make-money,https://www.sidehustlenation.com/apps-that-pay-you/,Make Money - Real Cash App,18 Best Apps To Make Money: A Quick Guide (2026),37 Apps That Pay You Real Money: The Best ...,This real cash app allows you to fetch rewards and earn fast PayPal money. Make money let's you earn quick dollars to your PayPal account.Read more,"Money-making apps consist of a few categories: Long-term freelancing apps, short-term task apps, delivery and taxi apps, and apps to sell your stuff.","Jan 2, 2026 — Yes! There are dozens of legit apps that will pay you real money. Here are our top 40+ money making apps, that have paid me $100s so far."
music making apps,9,2900,66,0.52,I,make app,ok,,https://play.google.com/store/apps/details?id=com.bandlab.bandlab&hl=en,https://www.bandlab.com/?lang=en,https://www.reddit.com/r/musicproduction/comments/1kcwuks/whats_the_best_music_making_app_for_begginers/,BandLab – Music Making Studio - Apps on Google Play,BandLab - Make Music Online,Whats the best music making app for begginers?,"Our free music-making app empowers you to turn ideas into release-ready tracks fast. Record vocals, make beats, or mix demos – everything you need is built into ...Read more","Music creation for all. Record, mix and collaborate on your music projects from start to finish with our best-in-class and 100% free Studio.Read more",It depends what type of music you'll mostly be producing. For electronic music I'd say Ableton. If you're recording a lot of live instruments and vocals Logic ...Read more
apps to make,10,2400,68,5.33,I,make app,ok,,https://www.make.com/en/integrations,https://lovable.dev/guides/app-ideas-to-build,https://www.figma.com/pt-br/solucoes/criador-de-aplicativos-ia/,3000+ Integration Apps | Connect & Automate Software,10 App Ideas to Build With AI (No Code Required),Criador de aplicativos com IA grátis - Da ideia ao app,Explore over 3000 apps ✓ Integrate your tools and software in Make ✓ More than just no code automation ✓ Visual platform ✓ Get started ...,"Jan 9, 2026 — Find 10 validated app ideas with clear revenue paths. Build AI-powered finance dashboards, creator platforms, and local marketplaces using ...","Crie apps por IA no Figma Make. Transforme ideias em apps e protótipos interativos e conectados a dados: refine, teste e publique sem precisar de ..."
money making app,11,2400,74,1.96,I,make app,ok,,https://play.google.com/store/apps/details?id=com.real.cashapp.make.money.playing.games.earn.cash.rewards.paid.surveys&hl=en,https://www.sidehustlenation.com/apps-that-pay-you/,https://wise.com/us/blog/best-apps-to-make-money,Make Money - Real Cash App,37 Apps That Pay You Real Money: The Best ...,18 Best Apps To Make Money: A Quick Guide (2026),This real cash app allows you to fetch rewards and earn fast PayPal money. Make money let's you earn quick dollars to your PayPal account.Read more,"Jan 2, 2026 — Yes! There are dozens of legit apps that will pay you real money. Here are our top 40+ money making apps, that have paid me $100s so far.","Money-making apps consist of a few categories: Long-term freelancing apps, short-term task apps, delivery and taxi apps, and apps to sell your stuff."
app to make friends,12,1900,71,0.04,I,make app,ok,,https://www.fodors.com/news/news/i-tested-4-friendship-apps-for-30-days-in-indianapolis-heres-what-worked,https://www.reddit.com/r/LivingAlone/comments/1dz7s1g/does_anyone_know_of_any_friend_finding_apps/,https://www.bubblic.app/blog/best-apps-to-make-friends-2026.html,I Tried 4 Friendship Apps to Make Friends in a New City,Does anyone know of any friend finding apps? : r/LivingAlone,9 Best Apps to Make Friends in 2026: Your Complete Guide,"Jan 30, 2026 — For more than a month, I tested four platforms: Bumble BFF, Meetup, BeFriend, and Friended. Setting up my profile felt oddly vulnerable. What ...Read more",I'm recently single and living alone and having difficulty finding “friend-finding” apps! I tried one and it resembled a lot like Tinder so I deleted it lolRead more,"Jan 1, 2026 — Friendship App Categories for 2026: Neighborhood-Based Apps; Apps for Moms; Activity Meetup Apps; Dinner Meetup Apps; Apps for Deep Voice ...Read more"
clothing making websites,13,590,47,1.92,C,make website,ok,,https://tailornova.com/,https://www.printful.com/custom-clothing,https://www.customink.com/products/apparel/857,Tailornova | Online clothing design software,Custom clothing | Design your own clothes with Printful,Custom Apparel: Design Your Own ...,Tailornova is online 3D fashion design software that helps you create unlimited designs easier and faster than ever.,"Design clothes online and create custom clothing for yourself or to sell with Printful – no inventory, no order minimums.","Design your own custom apparel online. Free shipping, live help and tons of design ideas."
website making companies in india,14,590,48,6.22,"L,C",make website,ok,,https://www.goodfirms.co/companies/web-development-agency/in,https://agencies.semrush.com/list/web-development/india/,https://invoidea.com/,Top Web Development Companies in India - 2026 Reviews,Best Web Development Companies in India 2026,"Invoidea: Website Design Company in India, Web ...",List of India's Best Web Development Companies & Developers · SDLC Corp · Instinctools · OpenXcell · Closeloop Technologies · PageTraffic Inc · Sapphire ...Read more,"EmizenTech is a leading digital transformation company specializing in app and web development, eCommerce, AI, CRM, ERP, and IoT solutions, delivering tailored ...Read more","Invoidea is the Best Website Design Company in India, offering Web Development, Mobile App Development, Digital Marketing, UI UX and Logo Design Services."
make an app,15,1600,66,4.49,I,make app,ok,,https://apphive.io/,https://thunkable.com/,https://www.glideapps.com/,Apphive | Create an App | Online App maker | App Builder,Thunkable: Best no code app builder | No code app creation,"No Code App Builder: Create Custom, AI-Powered Apps | Glide","Apphive is an app builder | The easiest way to make an app for android and IOS, you can create a free mobile app without programming, drag and drop elements ...",Thunkable is the most powerful mobile app development platform that allows anyone to create an app without needing to know how to code.,Glide makes it easy to build and deploy powerful custom apps powered by AI with no code. Create your first app by trying Glide for free.
app that makes,16,1600,67,4.49,I,make app,ok,,https://www.make.com/en,https://www.figma.com/solutions/ai-app-builder/,https://apphive.io/,Make: AI Workflow Automation Software & Tools,Free No-code AI App Builder - Idea to App in Seconds,Apphive | Create an App | Online App maker | App Builder,"Automate your work. Make allows you to visually build, scale and automate AI and agentic workflows. User friendly no-code integration tool.","Apr 2, 2026 — Build apps with AI in Figma Make. Turn ideas into interactive, data-connected apps and prototypes—refine, test, and publish with no coding ...",Apphive is an advanced app builder that allows to make dynamic mobile applications without the need to write a single line of code.Read more
cheap websites for small business,17,590,50,7,C,website for small business,ok,,https://www.websiteplanet.com/blog/cheapest-website-builders/,https://www.reddit.com/r/website/comments/1m5g8qq/affordable_platforms_to_create_simple_websites/,https://zapier.com/blog/best-website-builder-for-small-business/,10 Best Cheap Website Builders (That Are Actually Good),Affordable platforms to create simple websites for small ...,The 9 best website builders for small business,"Dec 18, 2025 — 1. Wix: Most Flexible Free Plan · 2. SITE123: Affordable Builder to Get Online Quickly · 3. Webador: Excellent E-Commerce Tools at a Low Price · 4.Read more",I usually recommend Wix or Squarespace both are beginner-friendly and easy for clients to manage on their own. For really simple sites or ...Read more,"Feb 25, 2025 — Hostinger is definitely the most budget-friendly option on this list, with a low monthly cost that includes up to 100 websites (that's not a ...Read more"
app for making,18,1600,70,4.49,I,make app,ok,,,,,Build An App For Free,Top 5 Free App Makers,5 Best App Builders of 2026,,,
best money making apps,19,1600,72,1.82,I,make app,ok,,,,,,,,,,
making apps,20,1500,69,4.49,I,make app,ok,,https://www.glideapps.com/,https://www.figma.com/solutions/ai-app-builder/,https://developer.android.com/codelabs/basic-android-kotlin-compose-first-app,"No Code App Builder: Create Custom, AI-Powered Apps | Glide",Free No-code AI App Builder - Idea to App in Seconds,Create your first Android app - Android Developers,Glide makes it easy to build and deploy powerful custom apps powered by AI with no code. Create your first app by trying Glide for free.,"Apr 2, 2026 — Build apps with AI in Figma Make. Turn ideas into interactive, data-connected apps and prototypes—refine, test, and publish with no coding ...","In this codelab, you create your first Android app with a project template provided by Android Studio. You use Kotlin and Jetpack Compose to customize your app.Read more"
apps to make music,21,880,42,0.62,I,make app,ok,,,,https://play.google.com/store/apps/details?id=com.bandlab.bandlab&hl=en,"Your Music, Your Fans, No Fees - Fast. Simple. Powerful",Suno: Create Songs Instantly,BandLab – Music Making Studio - Apps on Google Play,,,"Our free music-making app empowers you to turn ideas into release-ready tracks fast. Record vocals, make beats, or mix demos – everything you need is built into ...Read more"
cheap website for small business,22,590,57,7,C,website for small business,ok,,https://www.websiteplanet.com/blog/cheapest-website-builders/,https://www.01net.com/en/website-builder/cheap/,https://www.reddit.com/r/website/comments/1m5g8qq/affordable_platforms_to_create_simple_websites/,10 Best Cheap Website Builders (That Are Actually Good),The Cheapest Website Builders of 2026,Affordable platforms to create simple websites for small ...,"Dec 18, 2025 — 10 Best Cheap Website Builders (That Are Actually Good) – 2026 · 1. Wix: Most Flexible Free Plan · 2. SITE123: Affordable Builder to Get Online ...Read more","Feb 24, 2026 — Shopify (Starting Price: $19/mo) ... Did someone mention Shopify? Oh, we did! Shopify is the best cheap website builder for online sales. While ...Read more",I usually recommend Wix or Squarespace both are beginner-friendly and easy for clients to manage on their own. For really simple sites or ...Read more
learn website making,23,590,61,2.99,"L,C",make website,ok,,https://web.dev/learn,https://developer.mozilla.org/en-US/docs/Learn_web_development/Getting_started/Your_first_website,https://www.codecademy.com/catalog/subject/web-design,Learn web development,Your first website - Learn web development | MDN,Web Design Courses + Classes,"Learn web development ... We want to help you build beautiful, accessible, fast, and secure websites that work cross-browser, and for all of your users.Read more","Jun 23, 2025 — This module introduces you to the practicalities of web development. You'll gather the assets and write the code to construct a simple webpage, then publish it ...Read more","Our web design courses will help you polish your HTML and CSS skills while learning about color design, navigation design, and more.Read more"
podcast making app,24,590,41,1.47,"I,N",make app,ok,,,,,ElevenLabs Podcast Generator,Make a Podcast - Easy to Use,Podcast & Audio Editor,,,
making app,25,1100,68,4.49,I,make app,ok,,https://developer.android.com/codelabs/basic-android-kotlin-compose-first-app,https://thunkable.com/,https://apphive.io/,Create your first Android app - Android Developers,Thunkable: Best no code app builder | No code app creation,Apphive | Create an App | Online App maker | App Builder,"In this codelab, you create your first Android app with a project template provided by Android Studio. You use Kotlin and Jetpack Compose to customize your app.Read more",Thunkable is the most powerful mobile app development platform that allows anyone to create an app without needing to know how to code.,"Apphive is an app builder | The easiest way to make an app for android and IOS, you can create a free mobile app without programming, drag and drop elements ..."
apps for making,26,920,57,4.49,I,make app,ok,,https://www.glideapps.com/,https://apphive.io/,https://www.figma.com/solutions/ai-app-builder/,"No Code App Builder: Create Custom, AI-Powered Apps | Glide",Apphive | Create an App | Online App maker | App Builder,Free No-code AI App Builder - Idea to App in Seconds,Glide makes it easy to build and deploy powerful custom apps powered by AI with no code. Create your first app by trying Glide for free.,"Apphive is an app builder | The easiest way to make an app for android and IOS, you can create a free mobile app without programming, drag and drop elements ...","Apr 2, 2026 — Build apps with AI in Figma Make. Turn ideas into interactive, data-connected apps and prototypes—refine, test, and publish with no coding ..."
affordable website for small business,27,590,45,7,"I,N",website for small business,ok,,https://www.reddit.com/r/website/comments/1m5g8qq/affordable_platforms_to_create_simple_websites/,https://www.websiteplanet.com/blog/cheapest-website-builders/,https://zapier.com/blog/best-website-builder-for-small-business/,Affordable platforms to create simple websites for small ...,10 Best Cheap Website Builders (That Are Actually Good),The 9 best website builders for small business,I usually recommend Wix or Squarespace both are beginner-friendly and easy for clients to manage on their own. For really simple sites or ...Read more,"Dec 18, 2025 — 1. Wix: Most Flexible Free Plan · 2. SITE123: Affordable Builder to Get Online Quickly · 3. Webador: Excellent E-Commerce Tools at a Low Price · 4.Read more","Feb 25, 2025 — Hostinger is definitely the most budget-friendly option on this list, with a low monthly cost that includes up to 100 websites (that's not a ...Read more"
music making app,28,720,46,0.52,I,make app,ok,,https://play.google.com/store/apps/details?id=com.bandlab.bandlab&hl=en,https://www.bandlab.com/?lang=en,https://apps.apple.com/us/app/bandlab-music-maker-beats/id968585775,BandLab – Music Making Studio - Apps on Google Play,BandLab - Make Music Online,BandLab – Music Maker & Beats - App Store - Apple,"Our free music-making app empowers you to turn ideas into release-ready tracks fast. Record vocals, make beats, or mix demos – everything you need is built into ...Read more","Music creation for all. Record, mix and collaborate on your music projects from start to finish with our best-in-class and 100% free Studio.Read more","Anyone can record, mix, and master music with BandLab, the mobile studio stocked with virtual instruments, AI tools, and a global community of collaborators.Read more"
apps for small business,29,1000,65,8,I,app for small business,ok,,https://www.ringcentral.com/us/en/blog/free-business-apps/,https://www.spendesk.com/blog/best-small-business-apps/,https://www.reddit.com/r/smallbusiness/comments/1di9fks/which_software_or_apps_do_you_find_the_most/,14 Free Business Apps Every Small Business Owner Needs,8 best small business apps for 2025,Which software or apps do you find the most helpful as a ...,File storage and sharing apps · 1. Evernote · 2. Google Drive · 3. Microsoft OneDrive · 4. Dropbox. dropbox file sharing app. Another of the great apps for ...Read more,"Mar 20, 2026 — 8 best small business apps for 2025 · 1. Best expense management tool: Spendesk · 2. Best payment solution: SumUp · 3. Best internal ...Read more","As a small business owner, Clariti is very helpful for streamlining communication by integrating emails, chats, and voice calls, which boosted ...Read more"
websites to make a website,30,990,68,4.45,I,make website,ok,,https://www.wix.com/,https://www.squarespace.com/,https://www.canva.com/website-builder/,Wix.com: Website Builder - Create a Free Website In Minutes,Website Builder – Easily Create Your Own Website ...,Website Builder - Create a Free Website,"Get everything you need to build a website your way. Wix's free, easy-to-use website builder offers 2000+ templates, built-in AI tools and a custom domain.","Create a website and grow your business with a free Squarespace trial. Start with customizable website templates, AI website builder tools, or a domain ...",Create free professional websites on your own domain in minutes. Canva's website builder makes launching a one-page website easy with customizable templates ...
app for making video of photos,31,590,41,1.08,I,make app,ok,,https://play.google.com/store/apps/details?id=com.music.slideshow.videoeditor.videomaker&hl=en,https://www.canva.com/create/photo-videos/,https://pixlr.com/video-generator/image-to-video/,Photo video maker with music - Apps on Google Play,Free Online Photo Video Maker,AI Image to Video Generator - Animate Your ...,"A powerful tool to create video from photos and music with an extremely diverse and unique photo library, sound effects, overlay effects, frames.Read more","With Canva's online picture video maker, you can easily edit a video using photos and images for free, no software installation or editing know-how required.Read more","Pixlr's Image to Video Generator allows you to animate any image and create professional-looking videos in seconds. Upload photos of your products, events, or ...Read more"
how to make a free app,32,590,41,2.81,I,make app,ok,,https://www.linkedin.com/pulse/how-create-free-app-without-knowing-code-dr-diane-hamilton-gvglc,https://www.figma.com/solutions/ai-app-builder/,https://www.appypie.com/app-builder/appmaker,How To Create A Free App Without Knowing How To Code,Free No-code AI App Builder - Idea to App in Seconds,App Builder | App Maker to Make Free App without Coding,"Next you will need to go to Netlify.com and create a free account. Click ""Add new site"" then ""Import from Git."" Choose GitHub and find the ...Read more","Apr 2, 2026 — How to build an app with AI in Figma Make · Step 1. Start with a frame · Step 2. Describe your app · Step 3. Watch your prototype come to life ...Read more",Build your app in minutes without coding. Create native Android and iOS apps with Appy Pie's cloud-based no-code app maker platform. Try our free app ...
apps for making videos with pictures,33,590,41,1.08,I,make app,ok,,https://www.canva.com/create/photo-videos/,https://play.google.com/store/apps/details?id=com.music.slideshow.videoeditor.videomaker&hl=en,https://www.capcut.com/resource/free-app-to-make-videos-with-pictures-and-music,Free Online Photo Video Maker,Photo video maker with music - Apps on Google Play,The 9 Best Free Apps to Make Videos with Pictures and ...,"With Canva's online picture video maker, you can easily edit a video using photos and images for free, no software installation or editing know-how required.Read more","A powerful tool to create video from photos and music with an extremely diverse and unique photo library, sound effects, overlay effects, frames.Read more","May 15, 2025 — Top 9 apps for making videos with pictures and music free · 1. CapCut: The best app to make a video with pictures and music · 2. FilmoraGo · 3.Read more"
app to make a video of photos,34,590,41,1.08,I,make app,ok,,,,,No-Cost AI Video Tool - Animate your image with AI - AI Photo To Video,Convert Photos to Videos,Online Photo Video Maker | Make a Video From Photos For Free,,,
