keyword,priority,volume,kd,cpc,intent,seed,flag,published,Ссылка конкурента 1,Ссылка конкурента 2,Ссылка конкурента 3,Заголовок конкурента 1,Заголовок конкурента 2,Заголовок конкурента 3,Сниппет конкурента 1,Сниппет конкурента 2,Сниппет конкурента 3
make a website for photography,81,590,47,4.4,I,make website,ok,,https://portfolio.adobe.com/photography,https://www.reddit.com/r/photography/comments/16lgm1r/making_your_own_website/,https://www.canva.com/create/photography-websites/,Create a beautiful photography website in minutes,Making your own website : r/photography,Free online photography website maker,"Showcase your work quickly and easily with Adobe Portfolio. Free with Creative Cloud, Portfolio is the best place to build a photography website.","Find a free webhost service , there a thousands of them. You don't need Wordpress, you don't need MySQL databases, you don't need x amount of GB ...Read more","Create a photography website in minutes with thousands of photographer-ready templates featuring full-screen hero images, clean galleries, and simple price ...Read more"
making a website on google,82,590,47,5.74,I,make website,ok,,,,,Construtor De Sites,Start Building Now at No Cost,Free Website - Create your Own Custom Website,,,
how make responsive website,83,590,47,1.2,I,make website,ok,,https://www.w3schools.com/html/html_responsive.asp,https://developer.mozilla.org/en-US/docs/Learn_web_development/Core/CSS_layout/Responsive_Design,https://www.reddit.com/r/Frontend/comments/ti1bca/easiest_way_to_make_website_responsive_on_all/,HTML Responsive Web Design,Responsive web design - Learn web development | MDN,Easiest way to make website responsive on all screens?,"Responsive Web Design is about using HTML and CSS to automatically resize, hide, shrink, or enlarge, a website, to make it look good on all devices.Read more","Dec 19, 2025 — Responsive web design (RWD) is a web design approach to make web pages render well on all screen sizes and resolutions while ensuring good usability.Read more",My suggestion is to simply look at the page while you resize the browser. Keep resizing until you feel it doesn't look good anymore.Read more
app for making memes,84,590,48,0.3,I,make app,ok,,https://play.google.com/store/apps/details?id=com.zombodroid.MemeGenerator&hl=en,https://apps.apple.com/us/app/mematic-the-meme-maker/id491076730,https://www.canva.com/create/memes/,Meme Generator - Apps on Google Play,Mematic - The Meme Maker - App Store - Apple,Free Meme Generator - Online Meme Maker & Creator,"Look no further than Meme Generator, the go-to app for meme enthusiasts and anyone who wants to start exploring the world of memes.Read more","The most popular meme maker app, with over 10 million downloads! Add captions to photos and videos. Use your own images or access a large collection of memes.Read more",Canva's online meme maker lets you find hundreds of ways to create a funny meme. Browse our free meme templates and customize one to your needs.Read more
app to make video from photos,85,590,48,1.08,I,make app,ok,,https://play.google.com/store/apps/details?id=com.music.slideshow.videoeditor.videomaker&hl=en,https://www.canva.com/create/photo-videos/,https://pixlr.com/video-generator/image-to-video/,Photo video maker with music - Apps on Google Play,Free Online Photo Video Maker,AI Image to Video Generator - Animate Your ...,"A powerful tool to create video from photos and music with an extremely diverse and unique photo library, sound effects, overlay effects, frames.Read more","With Canva's online picture video maker, you can easily edit a video using photos and images for free, no software installation or editing know-how required.Read more","Pixlr's Image to Video Generator allows you to animate any image and create professional-looking videos in seconds. Upload photos of your products, events, or ...Read more"
app for meme making,86,590,48,0.3,I,make app,ok,,https://play.google.com/store/apps/details?id=com.zombodroid.MemeGenerator&hl=en,https://apps.apple.com/us/app/mematic-the-meme-maker/id491076730,https://www.canva.com/create/memes/,Meme Generator - Apps on Google Play,Mematic - The Meme Maker - App Store - Apple,Free Meme Generator - Online Meme Maker & Creator,"Create fully custom memes with your own pictures or GIFs. Take control with custom layouts, including options like demotivational posters, collages, or ...Read more","The most popular meme maker app, with over 10 million downloads! Add captions to photos and videos. Use your own images or access a large collection of memes.Read more",Canva's online meme maker lets you find hundreds of ways to create a funny meme. Browse our free meme templates and customize one to your needs.Read more
app to make pictures into video,87,590,48,1.08,I,make app,ok,,https://www.canva.com/create/photo-videos/,https://play.google.com/store/apps/details?id=com.music.slideshow.videoeditor.videomaker&hl=en,https://pixlr.com/video-generator/image-to-video/,Free Online Photo Video Maker,Photo video maker with music - Apps on Google Play,AI Image to Video Generator - Animate Your ...,"With Canva's online picture video maker, you can easily edit a video using photos and images for free, no software installation or editing know-how required.Read more","A powerful tool to create video from photos and music with an extremely diverse and unique photo library, sound effects, overlay effects, frames.Read more","Pixlr's Image to Video Generator allows you to animate any image and create professional-looking videos in seconds. Upload photos of your products, events, or ...Read more"
money making game apps,88,590,48,1.98,I,make app,ok,,https://play.google.com/store/apps/details?id=com.justplay.app&hl=en,https://www.eneba.com/hub/play-to-earn/best-game-apps-to-win-real-money/,https://www.reddit.com/r/apps/comments/1l98dba/legit_phone_app_games_that_make_money/,JustPlay: Earn Money or Donate - Apps on Google Play,Games That Pay Real Money Instantly: 13 Best Apps in 2026,Legit phone app games that make money?,"Play fun mobile games, earn rewards, and cash out directly to your PayPal, grab amazing gift cards, or donate to good causes that matter most to you. No ...Read more","5 days ago — The best game apps to win real money include Snakzy, Mistplay, and Swagbucks. These apps offer a variety of games that allow players to earn ...Read more","Many people talk about Solitaire Cube, Blackout Bingo, and Mistplay. These often involve skill-based games where you can win cash prizes.Read more"
list making apps,89,590,48,0.85,I,make app,ok,,,,,10 Best To-Do List Apps in 2026,The #1 Task Management Tool | Mark This Task as Done,Easy To Use & Customize,,,
how to make responsive site,90,590,48,1.2,I,make site,ok,,https://www.w3schools.com/html/html_responsive.asp,https://developer.mozilla.org/en-US/docs/Learn_web_development/Core/CSS_layout/Responsive_Design,https://www.reddit.com/r/Frontend/comments/ti1bca/easiest_way_to_make_website_responsive_on_all/,HTML Responsive Web Design,Responsive web design - Learn web development | MDN,Easiest way to make website responsive on all screens?,"Responsive Web Design is about using HTML and CSS to automatically resize, hide, shrink, or enlarge, a website, to make it look good on all devices.Read more","Dec 19, 2025 — Responsive web design (RWD) is a web design approach to make web pages render well on all screen sizes and resolutions while ensuring good usability.Read more",My suggestion is to simply look at the page while you resize the browser. Keep resizing until you feel it doesn't look good anymore.Read more
websites to make music,91,590,48,0.55,I,make website,ok,,https://www.soundtrap.com/musicmakers,https://musiclab.chromeexperiments.com/Song-Maker,https://www.beepbox.co/,Soundtrap - Make music online,Song Maker - Chrome Music Lab,BeepBox,"Create & record easily with powerful tools and sounds, all in one place. · Vocal & mixing tools · Virtual instruments · Royalty-free sounds · Collaborative studio.Read more","Song Maker, an experiment in Chrome Music Lab, is a simple way for anyone to make and share a song.","BeepBox is an online tool for sketching and sharing instrumental music. Make sure that your volume is turned up, then press the play button!Read more"
easy money making apps,92,590,49,1.98,I,make app,ok,,,,,,,,,,
apps that make music beats,93,590,49,0.5,I,make app,ok,,,,,,,,,,
app to make a beat,94,590,49,0.5,I,make app,ok,,https://play.google.com/store/apps/details?id=com.bandlab.bandlab&hl=en,https://splice.com/sounds/beatmaker,https://www.reddit.com/r/audioengineering/comments/1fyy9an/best_free_beginner_daw_and_apps_for_making_music/,BandLab – Music Making Studio - Apps on Google Play,Beatmaker: Make a Beat for Free,best free beginner DAW and apps for making music ...,"Our free music-making app empowers you to turn ideas into release-ready tracks fast. Record vocals, make beats, or mix demos – everything you need is built ...Read more",Make a beat from millions of royalty-free samples and loops using Splice. Our beatmaker allows you to save your beat or download as MIDI. Start today!,"Are there apps that are free that can make music beats and such, like arrange compositions, and apps that can provide me a good sample quality for vocals.Read more"
app to make a meme,95,590,49,0.3,I,make app,ok,,,,,,,,,,
apps to make lists,96,590,49,0.85,I,make app,ok,,,,,,,,,,
online app making,97,590,60,4.75,"I,N",make app,ok,,,,,,,,,,
google make a website,98,590,50,5.74,I,make website,ok,,,,,,,,,,
how to make a html site,99,480,41,1.48,I,make site,ok,,,,,,,,,,
how to make a website in html,100,480,41,1.48,I,make website,ok,,https://www.w3schools.com/howto/howto_make_a_website.asp,https://developer.mozilla.org/en-US/docs/Learn_web_development/Getting_started/Your_first_website/Creating_the_content,https://medium.com/@glenpaulson/building-a-simple-html-css-js-website-9cc04a8bd761,How To Make a Website,HTML: Creating the content - Learn web development | MDN,"Building a simple HTML, CSS & JS Website",First Step - Basic HTML Page. HTML is the standard markup language for creating websites and CSS is the language that describes the style of an HTML document.Read more,"Nov 7, 2025 — This article provides a basic understanding of HTML and its functionality, and shows you how to create the basic content for your first website.Read more","Building a simple HTML, CSS & JS Website Why? I'm a react front-end developer I love to create & document the progress — no matter how small ..."
how to make a google website,101,480,41,2.38,I,make website,ok,,https://support.google.com/a/users/answer/9310491?hl=en,https://sites.google.com/site/horstwebdesign/about-google-sites,https://www.youtube.com/watch?v=dKpPpUGWRuw,Create your first site with Google Sites,Google Sites - Free Website Builder - Sign in,Build a FREE Website with Google Sites,"Add a site title · On a computer, open a site in Google Sites. · In the top left, click Enter site name. · Enter the name of your site. · Press Enter or Return.Read more",Anyone can use Google Sites to easily create and host simple business websites for free. Google Workspace customers can utilize Google Sites to develop secure ...Read more,I want to show you how to build a website using Google sites for free and then I want to show you how you can set it up with your own custom domain name.
accounting apps for small businesses,102,480,41,8.45,I,app for small business,ok,,https://www.pcmag.com/picks/the-best-small-business-accounting-software,https://www.reddit.com/r/smallbusiness/comments/1qvmalx/what_accounting_software_has_worked_best_for_your/,https://www.uschamber.com/co/run/finance/free-accounting-tools-for-small-businesses,The Best Accounting Software for Small Businesses in 2026,What accounting software has worked best for your small ...,10 Free Accounting Tools for Your Small Business,"Mar 3, 2026 — Our Top Tested Picks · Intuit QuickBooks Online · FreshBooks · Wave · Sage 50 Accounting · Zoho Books · Xero · Intuit QuickBooks Solopreneur.Read more",For startups that need the barebones I usually recommend Waveapps since there is a free tier (although they're starting to limit what's included ...Read more,"Aug 13, 2025 — Brightbook is a free online accounting system for small businesses with one to five employees. You can give your accountant and colleagues ...Read more"
account app for small business,103,480,41,8.45,I,app for small business,ok,,https://apps.apple.com/us/app/small-business-accounting/id1550552151,https://www.mcmanamonco.com/7-awesome-accounting-apps-for-small-business-owners/,https://www.pcmag.com/picks/the-best-small-business-accounting-software,Small Business Accounting - App Store - Apple,7 Awesome Accounting Apps for Small Business Owners,The Best Accounting Software for Small Businesses in 2026,"Small Business Accounting is an accounting app for iPhone, iPad, and Mac. It is easy to use with no registration or login required.Read more","Sep 6, 2025 — 7 Accounting Apps to Consider · QuickBooks Online · Expensify · Xero · Zoho Books · Wave · Patriot Software · Rydoo. Pricing: Essentials: $9/ ...Read more","Mar 3, 2026 — Our Top Tested Picks · Intuit QuickBooks Online · FreshBooks · Wave · Sage 50 Accounting · Zoho Books · Xero · Intuit QuickBooks Solopreneur · Patriot ...Read more"
make website using google,104,590,51,5.74,I,make website,ok,,https://workspace.google.com/products/sites/,https://sites.google.com/site/horstwebdesign/about-google-sites,https://support.google.com/a/users/answer/9310491?hl=en,Google Sites: Website Creator and Hosting,Google Sites - Free Website Builder - Sign in,Create your first site with Google Sites,Easily create and edit your sites with drag-and-drop design. The automatic grid layout ensures everything looks great and scales perfectly on any device.Read more,Anyone can use Google Sites to easily create and host simple business websites for free. Google Workspace customers can utilize Google Sites to develop secure ...Read more,"On a computer, open a site in Google Sites. · At the right, click Pages. · At the bottom right, hover over Add New page . · Click New page Add . · Enter the page ...Read more"
app making online,105,590,62,4.75,"I,N",make app,ok,,,,,Build An App For Free,Create apps in minutes,5 Best AI App Builders (2026) - We Tried Them All,,,
how do you make a website for your business,106,590,62,5,"I,N",make website,ok,,,,,,,,,,
best software for website making,107,480,42,3.29,I,make website,ok,,,,,,,,,,
bookkeeping app for small business,108,480,42,8.45,I,app for small business,ok,,,,,,,,,,
make a free app,109,590,52,3.53,I,make app,ok,,,,,,,,,,
list making app,110,590,52,0.85,I,make app,ok,,,,,,,,,,
app for making lists,111,590,52,0.85,I,make app,ok,,https://zapier.com/blog/best-todo-list-apps/,https://play.google.com/store/apps/details?id=com.garbek.listwizard&hl=en,https://www.todoist.com/,7 best to do list apps of 2026,Make-A-List - Apps on Google Play,Todoist | A To-Do List to Organize Your Work & Life,"Dec 9, 2025 — Todoist for balancing power and simplicity. TickTick for embedded calendars and timers. Microsoft To Do for Microsoft power users.Read more","Keep yourself organized with Make-A-List! You can create a grocery list, todo list, wish list, or anything else you need a list for! Key Features:Read more","Trusted by 30 million people and teams. Todoist is the world's favorite task manager and to-do list app. Finally become focused, organized and calm."
make a free apps,112,590,52,3.53,I,make app,ok,,https://www.andromo.com/,https://thunkable.com/,https://www.mobiroller.com/en/free-app-maker/,Andromo - Mobile App builder for Android and iOS,Thunkable: Best no code app builder | No code app creation,Free App Maker - Make an App for iOS & Android,Andromo is a premium app building platform where you can create professional Android and iOS apps without writing a single line of code.,Thunkable is the most powerful mobile app development platform that allows anyone to create an app without needing to know how to code.,Mobiroller allows you to easily create your mobile app with the free app maker. Make your Android and iOS app with free app maker and publish your app to ...Read more
make a photography site,113,590,52,4.4,I,make site,ok,,https://portfolio.adobe.com/photography,https://themframes.com/features/best-photography-website-builder/,https://pixieset.com/website/,Create a beautiful photography website in minutes,Best Photography Website Builder: Tested by a Photographer,"Photography Website, Portfolio & Blog","Showcase your work quickly and easily with Adobe Portfolio. Free with Creative Cloud, Portfolio is the best place to build a photography website.",Find the best photography website builder to showcase your work. Build a stunning site in hours and grow your online audience.,"The dream website builder for photographers. Pixieset makes it fun and easy to build a stunning photography website, portfolio or blog that stands out online.Read more"
how can i make a website on google,114,590,52,3.21,I,make website,ok,,https://sites.google.com/site/horstwebdesign/about-google-sites,https://workspace.google.com/products/sites/,https://support.google.com/a/users/answer/9310491?hl=en,Google Sites - Free Website Builder - Sign in,Google Sites: Website Creator and Hosting,Create your first site with Google Sites,"Google Sites are free to build, host, and maintain with a Google or Gmail account. There are no web hosting fees. If, however, you are using Google Sites in ...Read more",Easily create and edit your sites with drag-and-drop design. The automatic grid layout ensures everything looks great and scales perfectly on any device.Read more,"On a computer, open a site in Google Sites. · At the right, click Pages. · At the bottom right, hover over Add New page . · Click New page Add . · Enter the page ...Read more"
make traffic on website,115,590,52,4.22,I,make website,ok,,https://www.sparktraffic.com/,https://adsense.google.com/start/resources/how-to-grow-your-website-traffic/,https://www.reddit.com/r/SEO/comments/lgrmua/how_to_raise_the_organic_traffic_of_a_new_website/,Increase Website Traffic #1 Free Trial,How to grow your website traffic,How to raise the organic traffic of a new website from 0?,"SparkTraffic provides multiple ways to improve your website's rank, from simple website traffic injection to sophisticated analysis of On-site and Off-site SEO ...Read more",1. Organic social media. This can be a highly effective way to build your audience and drive traffic. The key is to do your research and find the social media ...Read more,Build backlinks to increase visibility and improve search ranks. Make sure your SEO is buttoned up on your site as well. Don't take my feedback ...Read more
make a website free trial,116,590,63,12.83,"I,N",make website,ok,,,,,Make A Website With Free Trial | Build Your Free Trial Today,"100% Free. No Fees - Your Idea, No Code",Deploy Websites for Free,,,
app to make videos,117,590,53,0.87,I,make app,ok,,https://play.google.com/store/apps/details?id=videoeditor.videomaker.videoeditorforyoutube&hl=en,https://www.canva.com/video-editor/,https://play.google.com/store/apps/details?id=com.camerasideas.instashot&hl=en,AI Video Maker - Apps on Google Play,Free Online Video Editor & Maker | Canva (Drag-and-drop),Video Editor & Maker - InShot - Apps on Google Play,"Easy-to-use video maker, no watermark! With Video Guru, you can export 4k video without watermark, easily share to YouTube and other social media like Instagram ...Read more","Create engaging professional videos from your browser using Canva's drag-and-drop editor with transitions, animations, designer fonts, audio library, ...","Feb 11, 2026 — Powerful all-in-one Video Editor and Video Maker with professional features. Add music, text, transition effects for videos, make smooth slow motion, make ...Read more"
virtual make up app,118,590,53,0.86,I,make app,ok,,https://play.google.com/store/apps/details?id=com.meitu.makeup&hl=en,https://play.google.com/store/apps/details?id=com.photosolutions.makeup,https://apps.apple.com/br/app/youcam-makeup-editor-de-rosto/id863844475,MakeupPlus - Virtual Makeup - Apps on Google Play,Virtual Makeup & Makeup Editor - Apps on Google Play,YouCam Makeup: Editor de Rosto - App Store - Apple,"Nov 13, 2025 — Take the guesswork out of buying makeup online! With our COUNTER function, you can see how makeup products look in real-time with our AR camera.Read more","Makeup Editor allows you to add beauty makeup on photo in 5 seconds! Just select makeup items you like (lipstick, eyebrows, eyelashes, eye ) and Best Makeup ...Read more","Junte-se a mais de 300 milhões de usuários, experimente novos penteados, makes incríveis e leve suas selfies para outro nível com o YouCam Makeup.Read more"
app making free,119,590,53,3.53,I,make app,ok,,https://www.figma.com/solutions/ai-app-builder/,https://thunkable.com/,https://www.glideapps.com/,Free No-code AI App Builder - Idea to App in Seconds,Thunkable: Best no code app builder | No code app creation,"No Code App Builder: Create Custom, AI-Powered Apps | Glide","Apr 2, 2026 — Build apps with AI in Figma Make. Turn ideas into interactive, data-connected apps and prototypes—refine, test, and publish with no coding ...",Thunkable is the most powerful mobile app development platform that allows anyone to create an app without needing to know how to code.,Glide makes it easy to build and deploy powerful custom apps powered by AI with no code. Create your first app by trying Glide for free.
app for making videos from photos,120,590,53,1.08,I,make app,ok,,https://play.google.com/store/apps/details?id=com.music.slideshow.videoeditor.videomaker&hl=en,https://www.canva.com/create/photo-videos/,https://pixlr.com/video-generator/image-to-video/,Photo video maker with music - Apps on Google Play,Free Online Photo Video Maker,AI Image to Video Generator - Animate Your ...,"A powerful tool to create video from photos and music with an extremely diverse and unique photo library, sound effects, overlay effects, frames.Read more","With Canva's online picture video maker, you can easily edit a video using photos and images for free, no software installation or editing know-how required.Read more","Pixlr's Image to Video Generator allows you to animate any image and create professional-looking videos in seconds. Upload photos of your products, events, or ...Read more"
app to make meme,121,590,53,0.3,I,make app,ok,,https://www.canva.com/create/memes/,https://apps.apple.com/us/app/mematic-the-meme-maker/id491076730,https://play.google.com/store/apps/details?id=com.zombodroid.MemeGenerator&hl=en,Free Meme Generator - Online Meme Maker & Creator,Mematic - The Meme Maker - App Store - Apple,Meme Generator - Apps on Google Play,Canva's online meme maker lets you find hundreds of ways to create a funny meme. Browse our free meme templates and customize one to your needs.Read more,"The most popular meme maker app, with over 10 million downloads! Add captions to photos and videos. Use your own images or access a large collection of memes.Read more","Unleash Your Creativity: Create fully custom memes with your own pictures or GIFs. Take control with custom layouts, including options like demotivational ...Read more"
invitation making website,122,590,53,1,I,make website,ok,,https://www.canva.com/create/invitation-cards/,https://www.greetingsisland.com/invitations,https://www.evite.com/,Free Invitation Maker - Create Invitations Online,Free Online Invitation Maker,"Evite: Online Invitations, eCards & Party Ideas","With hundreds of free templates to choose from and easy-to-use tools, you'll love creating invitation cards in Canva. Create Invitation Cards Lead. Invitation ...Read more","Design invitation cards with our free online maker. Choose from thousands of templates to customize, download as an image to share, or print with RSVP.",Evite makes bringing people together easy! Send online invitations with free RSVP tracking and eCards by email or text. Get great gift and party ideas too!
website for making invitations,123,590,53,1,I,make website,ok,,https://www.canva.com/create/invitation-cards/,https://www.greetingsisland.com/invitations,https://www.evite.com/,Free Invitation Maker - Create Invitations Online,Free Online Invitation Maker,"Evite: Online Invitations, eCards & Party Ideas","Canva's invitation creator has a template for every occasion, from birthdays to charity events, from weddings to retirement parties and so much more.Read more",Our platform allows you to create invitations that reflect your style. Browse thousands of exclusive designs and use our helpful filters to help you find the ...Read more,Evite makes bringing people together easy! Send online invitations with free RSVP tracking and eCards by email or text. Get great gift and party ideas too!
