keyword,priority,volume,kd,cpc,intent,seed,flag,published,Ссылка конкурента 1,Ссылка конкурента 2,Ссылка конкурента 3,Заголовок конкурента 1,Заголовок конкурента 2,Заголовок конкурента 3,Сниппет конкурента 1,Сниппет конкурента 2,Сниппет конкурента 3
app to make photo video,35,590,41,1.08,I,make app,ok,,https://play.google.com/store/apps/details?id=com.music.slideshow.videoeditor.videomaker&hl=en,https://www.canva.com/create/photo-videos/,https://pixlr.com/video-generator/image-to-video/,Photo video maker with music - Apps on Google Play,Free Online Photo Video Maker,AI Image to Video Generator - Animate Your ...,"A powerful tool to create video from photos and music with an extremely diverse and unique photo library, sound effects, overlay effects, frames.Read more","With Canva's online picture video maker, you can easily edit a video using photos and images for free, no software installation or editing know-how required.Read more","Pixlr's Image to Video Generator allows you to animate any image and create professional-looking videos in seconds. Upload photos of your products, events, or ...Read more"
apps to make videos with photos,36,590,41,1.08,I,make app,ok,,https://www.canva.com/create/photo-videos/,https://play.google.com/store/apps/details?id=com.music.slideshow.videoeditor.videomaker&hl=en,https://www.capcut.com/resource/free-app-to-make-videos-with-pictures-and-music,Free Online Photo Video Maker,Photo video maker with music - Apps on Google Play,The 9 Best Free Apps to Make Videos with Pictures and ...,"With Canva's online picture video maker, you can easily edit a video using photos and images for free, no software installation or editing know-how required.Read more","A powerful tool to create video from photos and music with an extremely diverse and unique photo library, sound effects, overlay effects, frames.Read more","May 15, 2025 — Top 9 apps for making videos with pictures and music free · 1. CapCut: The best app to make a video with pictures and music · 2. FilmoraGo · 3.Read more"
apps to make photo videos,37,590,41,1.08,I,make app,ok,,https://www.canva.com/create/photo-videos/,https://play.google.com/store/apps/details?id=com.music.slideshow.videoeditor.videomaker&hl=en,https://pixlr.com/video-generator/image-to-video/,Free Online Photo Video Maker,Photo video maker with music - Apps on Google Play,AI Image to Video Generator - Animate Your ...,"With Canva's online picture video maker, you can easily edit a video using photos and images for free, no software installation or editing know-how required.Read more","A powerful tool to create video from photos and music with an extremely diverse and unique photo library, sound effects, overlay effects, frames.Read more","Pixlr's Image to Video Generator allows you to animate any image and create professional-looking videos in seconds. Upload photos of your products, events, or ...Read more"
make video with pictures app,38,590,41,1.08,I,make app,ok,,https://play.google.com/store/apps/details?id=com.music.slideshow.videoeditor.videomaker&hl=en,https://www.canva.com/create/photo-videos/,https://apps.apple.com/us/app/picplaypost-video-editor/id498127541,Photo video maker with music - Apps on Google Play,Free Online Photo Video Maker,PicPlayPost: Video Editor - App Store - Apple,"A powerful tool to create video from photos and music with an extremely diverse and unique photo library, sound effects, overlay effects, frames.Read more","With Canva's online picture video maker, you can easily edit a video using photos and images for free, no software installation or editing know-how required.Read more","PicPlayPost is the only HD video editor app you need to create content that will make people stop scrolling. Add music, trim videos, add AI effects, create ...Read more"
apps to make memes,39,590,41,0.3,I,make app,ok,,https://apps.apple.com/us/app/mematic-the-meme-maker/id491076730,https://www.canva.com/create/memes/,https://play.google.com/store/apps/details?id=cocostudios.meme.maker&hl=en,Mematic - The Meme Maker - App Store - Apple,Free Meme Generator - Online Meme Maker & Creator,Meme Maker: Meme Creator - Apps on Google Play,"The most popular meme maker app, with over 10 million downloads! Add captions to photos and videos. Use your own images or access a large collection of memes.Read more",Canva's online meme maker lets you find hundreds of ways to create a funny meme. Browse our free meme templates and customize one to your needs.Read more,"Funny Memes App is your ultimate destination to build, customize, and share hilarious memes effortlessly. Whether you're a beginner or a meme legend, this Meme ...Read more"
how do i make a website on google,40,590,41,3.21,I,make website,ok,,https://support.google.com/a/users/answer/9310491?hl=en,https://workspace.google.com/products/sites/,https://sites.google.com/site/horstwebdesign/about-google-sites,Create your first site with Google Sites,Google Sites: Website Creator and Hosting,Google Sites - Free Website Builder - Sign in,"On a computer, open a site in Google Sites. · At the right, click Pages. · At the bottom right, hover over Add New page . · Click New page Add . · Enter the page ...Read more",Easily create and edit your sites with drag-and-drop design. The automatic grid layout ensures everything looks great and scales perfectly on any device.Read more,"Google Sites are free to build, host, and maintain with a Google or Gmail account. There are no web hosting fees. If, however, you are using Google Sites in ...Read more"
how to make the website responsive,41,590,41,1.2,I,make website,ok,,,,,,,,,,
easiest way to make a website,42,590,50,5.28,"I,N",make website,ok,,https://www.reddit.com/r/Entrepreneur/comments/c177lr/whats_the_easiest_way_to_make_a_website/,https://www.canva.com/website-builder/,https://www.wix.com/blog/how-to-build-website-from-scratch-guide,What's the easiest way to make a website? : r/Entrepreneur,Website Builder - Create a Free Website,How to Create a Website From Scratch in 10 Steps ...,Wordpress is by far the easiest way to start a website. They have a bunch of plugins that will help with any type of website she is looking for.Read more,"Design and launch a professional, no-code website in minutes with Canva's free website builder. Publish in moments, not months.Read more","Feb 23, 2026 — The fastest and most beginner-friendly way is to use a no-coding website builder, which gives you all the tools you need to design, customize ...Read more"
how to make responsive sites,43,590,42,1.2,I,make site,ok,,,,,,,,,,
payroll apps for small business,44,590,42,49.53,I,app for small business,ok,,https://gusto.com/resources/guides/best-payroll-apps,https://www.reddit.com/r/smallbusiness/comments/1pviibf/whats_the_best_payroll_software_for_small/,https://www.forbes.com/advisor/business/software/best-payroll-apps/,8 Best Payroll Apps in 2026,What's the best payroll software for small businesses,Best Payroll Apps In 2026,"Feb 10, 2026 — Patriot Payroll is a cost-effective payroll solution built for small businesses that want essential payroll features without high monthly fees.Read more","Easy, rivit.work is a powerful workforce management website/app that has small businesses in mind and its free!Read more","Dec 11, 2025 — Homebase, QuickBooks Payroll and Square are among the payroll apps that allow workers to clock in and out from their phones. Most also let ...Read more"
cheapest website for small business,45,590,42,7,I,website for small business,ok,,https://www.websiteplanet.com/blog/cheapest-website-builders/,https://www.reddit.com/r/website/comments/1m5g8qq/affordable_platforms_to_create_simple_websites/,https://zapier.com/blog/best-website-builder-for-small-business/,10 Best Cheap Website Builders (That Are Actually Good),Affordable platforms to create simple websites for small ...,The 9 best website builders for small business,"Dec 18, 2025 — 10 Best Cheap Website Builders (That Are Actually Good) – 2026 · 1. Wix: Most Flexible Free Plan · 2. SITE123: Affordable Builder to Get Online ...Read more","For really simple sites or landing pages, Carrd is super affordable and fast to set up. I hand them off with a quick tutorial video and they're ...Read more","Feb 25, 2025 — Hostinger is definitely the most budget-friendly option on this list, with a low monthly cost that includes up to 100 websites (that's not a ...Read more"
best driver app to make money,46,590,43,1,I,make app,ok,,,,,,,,,,
clothing making website,47,590,43,1.92,I,make website,ok,,,,,Create & Sell Custom Products - Create a New Product In 3 Mins,Design Your Own Clothes,Free Online T-Shirt Design Maker - Create Your Own Custom Tee | Kittl,,,
how can we make a website on google,48,590,43,3.21,I,make website,ok,,https://workspace.google.com/products/sites/,https://support.google.com/a/users/answer/9310491?hl=en,https://sites.google.com/site/horstwebdesign/about-google-sites,Google Sites: Website Creator and Hosting,Create your first site with Google Sites,Google Sites - Free Website Builder - Sign in,Easily create and edit your sites with drag-and-drop design. The automatic grid layout ensures everything looks great and scales perfectly on any device.Read more,"On a computer, open a site in Google Sites. · At the right, click Pages. · At the bottom right, hover over Add New page . · Click New page Add . · Enter the page ...Read more","Google Sites are free to build, host, and maintain with a Google or Gmail account. There are no web hosting fees. If, however, you are using Google Sites in ...Read more"
how to make a website for selling products,49,590,43,4.2,I,make website,ok,,,,,Create a Website in Minutes,Ecommerce Website Builder | Create a Free Store in Minutes - Shopify,Crie sua loja online hoje,,,
make pictures into video app,50,590,44,1.08,I,make app,ok,,,,,,,,,,
apps for making podcasts,51,590,44,1.47,I,make app,ok,,https://www.thepodcasthost.com/editing-production/best-podcast-making-app/,https://play.google.com/store/apps/details?id=com.spreaker.android.studio,https://www.reddit.com/r/podcasting/comments/1ltnvc2/hey_iwas_wondering_what_apps_everyone_use_for/,Best Podcast Making Apps to Make Podcasting Simple,Podcast Studio - Apps on Google Play,"Hey, Iwas wondering what apps everyone use for ...","Oct 8, 2023 — Best Podcast Making Apps to Make Podcasting Simple · 1. Alitu: The Podcast Maker Tool · 2. Podbean Podcast App · 3. Podcast Studio, by Spreaker.Read more","Podcast Studio App lets you record, publish, distribute and analyze your podcast, whenever and wherever, easily. Our unique in-app features, give you total ...Read more",Audacity has worked great for me. Easy to learn and free.Read more
apps to make a beat,52,590,44,0.5,I,make app,ok,,https://www.reddit.com/r/audioengineering/comments/1fyy9an/best_free_beginner_daw_and_apps_for_making_music/,https://www.tracklib.com/blog/best-beat-making-apps,https://play.google.com/store/apps/details?id=com.mwm.sampler&hl=en,best free beginner DAW and apps for making music ...,"Best Beat Making Apps of 2026: Pro Reviews, Features & ...",Beat Maker Pro - DJ Drum Pad - Apps on Google Play,"Are there apps that are free that can make music beats and such, like arrange compositions, and apps that can provide me a good sample quality for vocals.Read more","If you're an artist, mobile beat maker apps like BandLab and GarageBand could be very interesting. But I always tell people that if you take music production ...Read more","Beat Maker Pro - DJ Drum Pad is the easiest way to become a DJ beat maker in no time! Make a beat, groove to music, and play with drum pad machine!Read more"
making a website with google,53,590,44,5.74,I,make website,ok,,https://sites.google.com/site/horstwebdesign/about-google-sites,https://workspace.google.com/products/sites/,https://support.google.com/a/users/answer/9310491?hl=en,Google Sites - Free Website Builder - Sign in,Google Sites: Website Creator and Hosting,Create your first site with Google Sites,"Google Sites are free to build, host, and maintain with a Google or Gmail account. There are no web hosting fees. If, however, you are using Google Sites in ...Read more",Easily create and edit your sites with drag-and-drop design. The automatic grid layout ensures everything looks great and scales perfectly on any device.Read more,"On a computer, open a site in Google Sites. · At the right, click Pages. · At the bottom right, hover over Add New page . · Click New page Add . · Enter the page ...Read more"
google make website,54,590,53,5.74,"I,N",make website,ok,,https://workspace.google.com/products/sites/,https://sites.google.com/site/horstwebdesign/about-google-sites,https://support.google.com/a/users/answer/9310491?hl=en,Google Sites: Website Creator and Hosting,Google Sites - Free Website Builder - Sign in,Create your first site with Google Sites,Easily create and edit your sites with drag-and-drop design. The automatic grid layout ensures everything looks great and scales perfectly on any device.Read more,"Google Sites is a free web building platform by Google. It is purposed for both public websites, company intranets and private portals.Read more","On a computer, open a site in Google Sites. · At the right, click Pages. · At the bottom right, hover over Add New page . · Click New page Add . · Enter the page ...Read more"
make movie app,55,590,45,0.84,I,make app,ok,,https://play.google.com/store/apps/details?id=ph.app.moviemaker&hl=en,https://apps.microsoft.com/detail/9nvwc4s69vxm?hl=en-US&gl=US,https://www.canva.com/create/movie-maker/,Movie Maker - Apps on Google Play,Make Movie - Edit Video - Download and install on Windows,Free Movie Maker - Create a Movie Online,Movie Maker - Photo Video Maker With Music is the best video/photo editor app that lets users create stylish and personalized videos.Read more,"Dec 1, 2025 — Make Movie – Edit Video is a powerful and beautifully designed video editor that helps you turn your ideas into stunning videos.","Canva's free online movie maker has everything you need to create a compelling movie — complete with music, subtitles, and film credits. Be your own movie ...Read more"
movie making app,56,590,45,0.84,I,make app,ok,,,,,,,,,,
apps to make photos into videos,57,590,45,1.08,I,make app,ok,,,,,Free AI lmage to Video - Turn Photo to Video - Free AI Video Maker,Image-to-video AI generation tools,Convert Photos to Videos,,,
app for list making,58,590,45,0.85,I,make app,ok,,https://zapier.com/blog/best-todo-list-apps/,https://www.todoist.com/,https://play.google.com/store/apps/details?id=com.garbek.listwizard&hl=en,7 best to do list apps of 2026,Todoist | A To-Do List to Organize Your Work & Life,Make-A-List - Apps on Google Play,"Dec 9, 2025 — Todoist for balancing power and simplicity. TickTick for embedded calendars and timers. Microsoft To Do for Microsoft power users.Read more","Trusted by 30 million people and teams. Todoist is the world's favorite task manager and to-do list app. Finally become focused, organized and calm.","Keep yourself organized with Make-A-List! You can create a grocery list, todo list, wish list, or anything else you need a list for!Read more"
app that makes music beats,59,590,45,0.5,I,make app,ok,,,,,Suno—Create Beats in Seconds,Create Your Own Beats,Free DJ Software App for Online Mixing and Music Discovery,,,
make video from pictures app,60,590,45,1.08,I,make app,ok,,https://play.google.com/store/apps/details?id=com.music.slideshow.videoeditor.videomaker&hl=en,https://www.canva.com/create/photo-videos/,https://play.google.com/store/apps/details?id=com.slideshow.photomovie.videomaker&hl=en,Photo video maker with music - Apps on Google Play,Free Online Photo Video Maker,Video Maker with Photo & Music - Apps on Google Play,"A powerful tool to create video from photos and music with an extremely diverse and unique photo library, sound effects, overlay effects, frames.Read more","With Canva's online picture video maker, you can easily edit a video using photos and images for free, no software installation or editing know-how required.Read more",Photo video maker is an application for joining multiple photos with music to create videos with quality up to Full HD 1080P.Read more
logo making sites,61,480,74,1.26,"L,C",make site,ok,,,,,,,,,,
app that make,62,760,59,4.49,I,make app,ok,,,,,,,,,,
logo making site,63,480,75,1.26,"L,C",make site,ok,,,,,,,,,,
make movies app,64,590,46,0.84,I,make app,ok,,https://play.google.com/store/apps/details?id=ph.app.moviemaker&hl=en,https://www.canva.com/create/movie-maker/,https://www.andromo.com/app-builder/movies-application/,Movie Maker - Apps on Google Play,Free Movie Maker - Create a Movie Online,Movies App Maker: Create the Best Application for Movie,Movie Maker - Photo Video Maker With Music is the best video/photo editor app that lets users create stylish and personalized videos.Read more,"Canva's free online movie maker has everything you need to create a compelling movie — complete with music, subtitles, and film credits. Be your own movie ...Read more","Andromo, an innovative app creator that allows users to build the best app to watch movies without any coding experience.Read more"
make a app free,65,590,46,3.53,I,make app,ok,,,,,,,,,,
app to make a photo video,66,590,46,1.08,I,make app,ok,,https://www.canva.com/create/photo-videos/,https://play.google.com/store/apps/details?id=com.music.slideshow.videoeditor.videomaker&hl=en,https://www.adobe.com/express/create/video/photo,Free Online Photo Video Maker,Photo video maker with music - Apps on Google Play,Free Photo Video Maker Online | Adobe Express,"With Canva's online picture video maker, you can easily edit a video using photos and images for free, no software installation or editing know-how required.Read more","A powerful tool to create video from photos and music with an extremely diverse and unique photo library, sound effects, overlay effects, frames.Read more","Adobe Express is the best online editing app to make videos with pictures and music. Make your video from photos today with free templates at your side, ..."
app to make memes,67,590,46,0.3,I,make app,ok,,,,,,,,,,
make website with google,68,590,46,5.74,I,make website,ok,,,,,,,,,,
make photography website,69,590,46,4.4,I,make website,ok,,https://pixieset.com/website/,https://portfolio.adobe.com/photography,https://www.canva.com/create/photography-websites/,"Photography Website, Portfolio & Blog",Create a beautiful photography website in minutes,Free online photography website maker,"The best way to create a beautiful website, portfolio or blog for photographers. No coding or design skills needed. Get started for free today!","Showcase your work quickly and easily with Adobe Portfolio. Free with Creative Cloud, Portfolio is the best place to build a photography website.","Create a photography website in minutes with thousands of photographer-ready templates featuring full-screen hero images, clean galleries, and simple price ...Read more"
apps to make videos with pictures,70,590,47,1.08,I,make app,ok,,https://www.canva.com/create/photo-videos/,https://play.google.com/store/apps/details?id=com.slideshow.photomovie.videomaker&hl=en,https://www.capcut.com/resource/free-app-to-make-videos-with-pictures-and-music,Free Online Photo Video Maker,Video Maker with Photo & Music - Apps on Google Play,The 9 Best Free Apps to Make Videos with Pictures and ...,"With Canva's online picture video maker, you can easily edit a video using photos and images for free, no software installation or editing know-how required.Read more",Photo video maker is an application for joining multiple photos with music to create videos with quality up to Full HD 1080P.Read more,"May 15, 2025 — Top 9 apps for making videos with pictures and music free · 1. CapCut: The best app to make a video with pictures and music · 2. FilmoraGo · 3.Read more"
app to make videos from photos,71,590,47,1.08,I,make app,ok,,,,,Image-to-video AI generation tools,Generate Videos from Images,Image to Video AI - No Watermark,,,
app to make videos with pictures,72,590,47,1.08,I,make app,ok,,,,,Generate Videos from Images,Generate Videos from Images,Crie vídeos de fotos,,,
how to make a site responsive,73,590,47,1.2,I,make site,ok,,https://www.w3schools.com/html/html_responsive.asp,https://developer.mozilla.org/en-US/docs/Learn_web_development/Core/CSS_layout/Responsive_Design,https://www.reddit.com/r/Frontend/comments/ti1bca/easiest_way_to_make_website_responsive_on_all/,HTML Responsive Web Design,Responsive web design - Learn web development | MDN,Easiest way to make website responsive on all screens?,"Responsive Web Design is about using HTML and CSS to automatically resize, hide, shrink, or enlarge, a website, to make it look good on all devices.Read more","Dec 19, 2025 — Responsive web design (RWD) is a web design approach to make web pages render well on all screen sizes and resolutions while ensuring good usability.Read more",My suggestion is to simply look at the page while you resize the browser. Keep resizing until you feel it doesn't look good anymore.Read more
how make site map,74,590,47,1.69,I,make site,ok,,,,,,,,,,
how to make a website responsive,75,590,47,1.2,I,make website,ok,,https://www.w3schools.com/html/html_responsive.asp,https://developer.mozilla.org/en-US/docs/Learn_web_development/Core/CSS_layout/Responsive_Design,https://www.reddit.com/r/Frontend/comments/ti1bca/easiest_way_to_make_website_responsive_on_all/,HTML Responsive Web Design,Responsive web design - Learn web development | MDN,Easiest way to make website responsive on all screens?,"Responsive Web Design is about using HTML and CSS to automatically resize, hide, shrink, or enlarge, a website, to make it look good on all devices.Read more","Dec 19, 2025 — Responsive web design (RWD) is a web design approach to make web pages render well on all screen sizes and resolutions while ensuring good usability.Read more",My suggestion is to simply look at the page while you resize the browser. Keep resizing until you feel it doesn't look good anymore.Read more
how to make website responsive,76,590,47,1.2,I,make website,ok,,https://www.w3schools.com/html/html_responsive.asp,https://developer.mozilla.org/en-US/docs/Learn_web_development/Core/CSS_layout/Responsive_Design,https://www.reddit.com/r/Frontend/comments/ti1bca/easiest_way_to_make_website_responsive_on_all/,HTML Responsive Web Design,Responsive web design - Learn web development | MDN,Easiest way to make website responsive on all screens?,"Responsive Web Design is about using HTML and CSS to automatically resize, hide, shrink, or enlarge, a website, to make it look good on all devices.Read more","Dec 19, 2025 — Responsive web design (RWD) is a web design approach to make web pages render well on all screen sizes and resolutions while ensuring good usability.Read more",My suggestion is to simply look at the page while you resize the browser. Keep resizing until you feel it doesn't look good anymore.Read more
making a photography website,77,590,47,4.4,I,make website,ok,,https://www.reddit.com/r/photography/comments/16lgm1r/making_your_own_website/,https://portfolio.adobe.com/photography,https://pixieset.com/website/,Making your own website : r/photography,Create a beautiful photography website in minutes,"Photography Website, Portfolio & Blog","Find a free webhost service , there a thousands of them. You don't need Wordpress, you don't need MySQL databases, you don't need x amount of GB ...Read more","Showcase your work quickly and easily with Adobe Portfolio. Free with Creative Cloud, Portfolio is the best place to build a photography website.","The best way to create a beautiful website, portfolio or blog for photographers. No coding or design skills needed. Get started for free today!"
how to make responsive website,78,590,47,1.2,I,make website,ok,,,,,,,,,,
how make website responsive,79,590,47,1.2,I,make website,ok,,https://www.w3schools.com/html/html_responsive.asp,https://developer.mozilla.org/en-US/docs/Learn_web_development/Core/CSS_layout/Responsive_Design,https://www.reddit.com/r/Frontend/comments/ti1bca/easiest_way_to_make_website_responsive_on_all/,HTML Responsive Web Design,Responsive web design - Learn web development | MDN,Easiest way to make website responsive on all screens?,"Responsive Web Design is about using HTML and CSS to automatically resize, hide, shrink, or enlarge, a website, to make it look good on all devices.Read more","Dec 19, 2025 — Responsive web design (RWD) is a web design approach to make web pages render well on all screen sizes and resolutions while ensuring good usability.Read more",My suggestion is to simply look at the page while you resize the browser. Keep resizing until you feel it doesn't look good anymore.Read more
how to make a responsive website,80,590,47,1.2,I,make website,ok,,https://www.w3schools.com/html/html_responsive.asp,https://developer.mozilla.org/en-US/docs/Learn_web_development/Core/CSS_layout/Responsive_Design,https://www.reddit.com/r/Frontend/comments/ti1bca/easiest_way_to_make_website_responsive_on_all/,HTML Responsive Web Design,Responsive web design - Learn web development | MDN,Easiest way to make website responsive on all screens?,"Responsive Web Design is about using HTML and CSS to automatically resize, hide, shrink, or enlarge, a website, to make it look good on all devices.Read more","Dec 19, 2025 — Responsive web design (RWD) is a web design approach to make web pages render well on all screen sizes and resolutions while ensuring good usability.Read more",My suggestion is to simply look at the page while you resize the browser. Keep resizing until you feel it doesn't look good anymore.Read more
