keyword,priority,volume,kd,cpc,intent,seed,flag,published,Ссылка конкурента 1,Ссылка конкурента 2,Ссылка конкурента 3,Заголовок конкурента 1,Заголовок конкурента 2,Заголовок конкурента 3,Сниппет конкурента 1,Сниппет конкурента 2,Сниппет конкурента 3
make apps online,171,590,65,4.75,I,make app,ok,,,,,Build An App For Free,Crie Aplicativos Sem Minutos,Replit – Build apps and sites with AI,,,
easy making money apps,172,590,65,1.98,I,make app,ok,,https://wise.com/us/blog/best-apps-to-make-money,https://www.moneysavingexpert.com/family/make-money-online/,https://play.google.com/store/apps/details?id=com.freecash.app2&hl=en,18 Best Apps To Make Money: A Quick Guide (2026),Make money online: Paying sites and apps for making cash,Freecash: Earn Money - Apps on Google Play,18 Best Money-Making Apps ; 1. Upwork ; 2. Fiverr ; 3. Freelancer.com ; 4. Toptal ; 5. FlexJobs.Read more,"This guide lists 20+ (legit) ways to make money online – you can get paid just to watch videos, write, search on Google, sell photos, make your own YouTube ...Read more","Mar 23, 2026 — Freecash is an easy-to-use app where you get real rewards by playing games, responding to surveys, and testing products.Read more"
apps to make songs,173,480,53,0.76,I,make app,ok,,https://play.google.com/store/apps/details?id=com.bandlab.bandlab&hl=en,https://www.bandlab.com/?lang=en,https://musiclab.chromeexperiments.com/Song-Maker,BandLab – Music Making Studio - Apps on Google Play,BandLab - Make Music Online,Song Maker - Chrome Music Lab,"Our free music-making app empowers you to turn ideas into release-ready tracks fast. Record vocals, make beats, or mix demos – everything you need is built into ...Read more","Music creation for all. Record, mix and collaborate on your music projects from start to finish with our best-in-class and 100% free Studio.Read more","Song Maker, an experiment in Chrome Music Lab, is a simple way for anyone to make and share a song."
best video making app,174,480,53,1.2,I,make app,ok,,https://diyvideoeditor.com/best-video-editors-compared/,https://play.google.com/store/apps/details?id=com.camerasideas.instashot&hl=en,https://smartfilming.blog/2021/01/10/37-best-video-editors-video-editing-apps-for-android-in-2021/,Best Video Editing Software 2026 Reviewed and Compared,Video Editor & Maker - InShot - Apps on Google Play,#37 Best video editors / video editing apps for Android ...,What is the Best Video Editing Software? · CyberLink PowerDirector 2026 / 365 · Wondershare Filmora · Best Easy to Learn and Use Video Editing Software · Movavi ...Read more,"Feb 11, 2026 — Powerful all-in-one Video Editor and Video Maker with professional features. Add music, text, transition effects for videos, make smooth slow motion, make ...Read more","Jan 10, 2021 — LumaFusion is – hands down – the most advanced mobile video editing app out there – and for many, it will also be the best!Read more"
best sites to make money online,175,480,53,1.44,I,make site,ok,,https://www.moneysavingexpert.com/family/make-money-online/,https://trymata.com/blog/make-money-online/,https://www.reddit.com/r/beermoneyindia/comments/1f6i5uq/a_list_of_all_sites_to_make_money_online/,Make money online: Paying sites and apps for making cash,15 Best Secret Websites to Make Money Online in 2026,A list of all sites to make money online. : r/beermoneyindia,"This guide lists 20+ (legit) ways to make money online – you can get paid just to watch videos, write, search on Google, sell photos, make your own YouTube ...Read more",15 Secret Websites to Make Money in 2026 · 1. Trymata · 2. Userfeel · 3. Survey Junkie · 4. Prolific · 5. UserTesting · 6. PlaytestCloud · 7. Respondent.io · 8.Read more,Awign - Top pick · Crowdgen by Appen - Recomended · Oneforma -- Recomended · Telus International - Recomended · Toloka · Remotask and Outlier - Top ...Read more
free beat making sites,176,480,53,0.31,I,make site,ok,,https://splice.com/sounds/beatmaker,https://www.soundtrap.com/musicmakers,https://musiclab.chromeexperiments.com/Song-Maker,Beatmaker: Make a Beat for Free,Soundtrap - Make music online,Song Maker - Chrome Music Lab,Make a beat from millions of royalty-free samples and loops using Splice. Our beatmaker allows you to save your beat or download as MIDI. Start today!,"Make music together online. Free instruments, loops, drum kits, and vocal tuner in one studio. Record, edit, mix, and master your audio, no downloads - sign ...","Song Maker, an experiment in Chrome Music Lab, is a simple way for anyone to make and share a song."
free poster making sites,177,480,53,0.55,I,make site,ok,,https://www.canva.com/create/posters/,https://www.adobe.com/express/create/poster,https://www.postermywall.com/index.php/l/poster-maker,Free Online Poster Maker: Design Custom Posters With ...,Free Poster Maker: Create a Poster Online | Adobe Express,Free Online Poster Maker,Create & print your own custom posters with Canva's free online poster maker and get results in minutes. Free Shipping on with printing today!,The Adobe Express free online poster maker helps you easily design different sizes of digital posters in minutes. Create your own custom poster design or ...,Create your own posters in minutes with PosterMyWall's online poster maker. Choose from 1312810+ free design templates for effortless promotion.
make e commerce site,178,480,53,6.81,I,make site,ok,,https://www.wix.com/ecommerce/website,https://freewebstore.com/,https://www.odoo.com/app/ecommerce,eCommerce Website Builder: Build An eCommerce Site,Create a Free Online Store or eCommerce Website,eCommerce website design,Wix eCommerce is your all-in-one eCommerce platform. Create a fully customizable free eCommerce website & upgrade to start selling everywhere.,Create a free ecommerce store · 1. Create your FREE account. Choose a store design · 2. Choose your store design. Upload your own products · 3. Upload your own ...Read more,"Use Odoo's open-source eCommerce website builder and benefit from integrated inbound marketing, order, and inventory management tools. Try it now!"
free beat making website,179,480,53,0.31,I,make website,ok,,https://splice.com/sounds/beatmaker,https://musiclab.chromeexperiments.com/Song-Maker,https://www.bandlab.com/?lang=en,Beatmaker: Make a Beat for Free,Song Maker - Chrome Music Lab,BandLab - Make Music Online,Make a beat from millions of royalty-free samples and loops using Splice. Our beatmaker allows you to save your beat or download as MIDI. Start today!,"Song Maker, an experiment in Chrome Music Lab, is a simple way for anyone to make and share a song.","Music creation for all. Record, mix and collaborate on your music projects from start to finish with our best-in-class and 100% free Studio.Read more"
best make money online websites,180,480,53,1.44,I,make website,ok,,https://trymata.com/blog/make-money-online/,https://www.moneysavingexpert.com/family/make-money-online/,https://www.clickworker.com/clickworker/,15 Best Secret Websites to Make Money Online in 2026,Make money online: Paying sites and apps for making cash,Become a Clickworker and earn money online,15 Secret Websites to Make Money in 2026 · 1. Trymata · 2. Userfeel · 3. Survey Junkie · 4. Prolific · 5. UserTesting · 6. PlaytestCloud · 7. Respondent.io · 8.Read more,"This guide lists 20+ (legit) ways to make money online – you can get paid just to watch videos, write, search on Google, sell photos, make your own YouTube ...Read more",Earn money online with microjobs. As a clickworker you set your own hours and work independently from any computer with an Internet connection.
free website to make beats,181,480,53,0.31,I,make website,ok,,,,,,,,,,
best platform to make website,182,480,53,5,I,make platform,ok,,,,,,,,,,
invoicing apps for small business,183,480,53,8,I,app for small business,ok,,,,,,,,,,
make an app online,184,590,66,4.75,I,make app,ok,,,,,Criar App APK com Manus Fácil - Crie Aplicativos Sem Minutos,Create your own website or app,Build An App For Free,,,
make online app,185,590,66,4.75,I,make app,ok,,,,,Build An App For Free,Create apps in minutes,Build Your Own App (Free) - 100% Free. No Fees,,,
app make online,186,590,66,4.75,I,make app,ok,,,,,,,,,,
how to make a free website,187,590,66,2.9,I,make website,ok,,https://www.wix.com/,https://www.canva.com/website-builder/,https://www.website.com/,Wix.com: Website Builder - Create a Free Website In Minutes,Website Builder - Create a Free Website,Create Your Free Website | Free Website Builder | Website.com,"Get everything you need to build a website your way. Wix's free, easy-to-use website builder offers 2000+ templates, built-in AI tools and a custom domain.",Create free professional websites on your own domain in minutes. Canva's website builder makes launching a one-page website easy with customizable templates ...,"Create a professional website for free with the Website.com website builder. Domain names, web hosting, website templates, and ecommerce solutions included."
best places to make a website,188,590,66,7.64,I,make website,ok,,https://www.experte.com/website-builder,https://www.reddit.com/r/smallbusiness/comments/1fhx0gm/what_is_the_best_platform_to_build_a_website_on/,https://www.top10-websitehosting.co.uk/best-free-website-builders/,14 Best Website Builders for 2026 - Tested & Ranked,What is the best platform to build a website on?,8 Best Free Website Builders 2026 (My Personal Experience),"Don't waste money on the wrong website builder. See our unbiased ranking of the 14 best website builders for 2026, ranked by ease of use, template quality ...",Squarespace and Shopify are pretty impressive website builder for creating any type of website.Read more,1. Hostinger – Best Website Builder Overall. Beginner users who need to build their very first website will find the intuitiveness of Hostinger to be ideal.Read more
best site to make money online,189,480,54,1.44,I,make site,ok,,https://www.moneysavingexpert.com/family/make-money-online/,https://trymata.com/blog/make-money-online/,https://www.clickworker.com/clickworker/,Make money online: Paying sites and apps for making cash,15 Best Secret Websites to Make Money Online in 2026,Become a Clickworker and earn money online,"This guide lists 20+ (legit) ways to make money online – you can get paid just to watch videos, write, search on Google, sell photos, make your own YouTube ...Read more",15 Secret Websites to Make Money in 2026 · 1. Trymata · 2. Userfeel · 3. Survey Junkie · 4. Prolific · 5. UserTesting · 6. PlaytestCloud · 7. Respondent.io · 8. User ...Read more,Earn money online with microjobs. As a clickworker you set your own hours and work independently from any computer with an Internet connection.
best platform to make a website,190,480,54,5,I,make platform,ok,,https://www.experte.com/website-builder,https://www.reddit.com/r/smallbusiness/comments/1fhx0gm/what_is_the_best_platform_to_build_a_website_on/,https://www.top10-websitehosting.co.uk/best-free-website-builders/,14 Best Website Builders for 2026 - Tested & Ranked,What is the best platform to build a website on?,8 Best Free Website Builders 2026 (My Personal Experience),"Hostinger makes it easy to create professional websites and offers attractive templates for various industries. Plus, Hostinger is one of the most affordable ...Read more","For a user-friendly platform to build an interactive website without coding, try Wix or Squarespace. Both offer drag-and-drop editors and customizable ...Read more",1. Hostinger – Best Website Builder Overall. Beginner users who need to build their very first website will find the intuitiveness of Hostinger to be ideal.Read more
easy money making app,191,590,67,1.98,I,make app,ok,,,,,,,,,,
make a video free app,192,590,67,0.72,I,make app,ok,,,,,,,,,,
best ways to make a website,193,590,67,5.14,I,make website,ok,,,,,,,,,,
graph making site,194,480,55,1.84,I,make site,ok,,https://www.canva.com/graphs/,https://charts.livegap.com/,https://www.desmos.com/calculator,Graph Maker - Create online charts & diagrams in minutes,Graph Maker - Create Charts Online for Free,Graphing Calculator,Easily create your customized charts & diagrams with Canva's free online graph maker. Choose from 20+ chart types & hundreds of templates.,"LiveGap Charts is a free website where teachers can create and share all kinds of charts: line, bar, area, pie, radar, icon matrix, and more.Read more","Explore math with our beautiful, free online graphing calculator. Graph functions, plot points, visualize algebraic equations, add sliders, animate graphs, ..."
brochure making sites,195,480,55,1.5,I,make site,ok,,,,,Site oficial do Canva,2026 Best Brochure Templates,Free Online Brochure Maker - Create a Brochure | Kittl,,,
poster making site free,196,480,55,0.55,I,make site,ok,,,,,,,,,,
best website to make money online,197,480,55,1.44,I,make website,ok,,,,,,,,,,
best platforms to make a website,198,480,55,5,I,make platform,ok,,https://www.experte.com/website-builder,https://www.reddit.com/r/smallbusiness/comments/1fhx0gm/what_is_the_best_platform_to_build_a_website_on/,https://www.top10-websitehosting.co.uk/best-free-website-builders/,14 Best Website Builders for 2026 - Tested & Ranked,What is the best platform to build a website on?,8 Best Free Website Builders 2026 (My Personal Experience),"Hostinger makes it easy to create professional websites and offers attractive templates for various industries. Plus, Hostinger is one of the most affordable ...Read more","For a user-friendly platform to build an interactive website without coding, try Wix or Squarespace. Both offer drag-and-drop editors and customizable ...Read more",1. Hostinger – Best Website Builder Overall. Beginner users who need to build their very first website will find the intuitiveness of Hostinger to be ideal.Read more
best place to make a website,199,590,68,7.64,I,make website,ok,,,,,,,,,,
how to make your business website,200,590,68,5,I,make website,ok,,,,,Criador de sites web com IA | Criação de apps web com IA,Make A Website For Free,Website Builder - Create a Free Website In Minutes | Wix.com,,,
best way make website,201,590,68,5.14,I,make website,ok,,,,,,,,,,
invitation making sites,202,590,69,1,I,make site,ok,,https://www.canva.com/create/invitation-cards/,https://www.greetingsisland.com/invitations,https://www.evite.com/,Free Invitation Maker - Create Invitations Online,Free Online Invitation Maker,"Evite: Online Invitations, eCards & Party Ideas","Canva's invitation creator has a template for every occasion, from birthdays to charity events, from weddings to retirement parties and so much more.Read more","Design invitation cards with our free online maker. Choose from thousands of templates to customize, download as an image to share, or print with RSVP.",Evite makes bringing people together easy! Send online invitations with free RSVP tracking and eCards by email or text. Get great gift and party ideas too!
easiest way make website,203,590,69,5.28,I,make website,ok,,,,,,,,,,
easy way to make websites,204,590,69,5.28,I,make website,ok,,,,,,,,,,
song making sites,205,480,56,0.64,I,make site,ok,,https://musiclab.chromeexperiments.com/Song-Maker,https://www.soundtrap.com/musicmakers,https://www.beepbox.co/,Song Maker - Chrome Music Lab,Soundtrap - Make music online,BeepBox,"Song Maker, an experiment in Chrome Music Lab, is a simple way for anyone to make and share a song.","Make music together online. Free instruments, loops, drum kits, and vocal tuner in one studio. Record, edit, mix, and master your audio, no downloads - sign ...","BeepBox is an online tool for sketching and sharing instrumental music. Make sure that your volume is turned up, then press the play button!Read more"
best sites for making money online,206,480,56,1.44,I,make site,ok,,https://www.moneysavingexpert.com/family/make-money-online/,https://trymata.com/blog/make-money-online/,https://www.reddit.com/r/beermoneyindia/comments/1f6i5uq/a_list_of_all_sites_to_make_money_online/,Make money online: Paying sites and apps for making cash,15 Best Secret Websites to Make Money Online in 2026,A list of all sites to make money online. : r/beermoneyindia,"This guide lists 20+ (legit) ways to make money online – you can get paid just to watch videos, write, search on Google, sell photos, make your own YouTube ...Read more",15 Secret Websites to Make Money in 2026 · 1. Trymata · 2. Userfeel · 3. Survey Junkie · 4. Prolific · 5. UserTesting · 6. PlaytestCloud · 7. Respondent.io · 8.Read more,Awign - Top pick · Crowdgen by Appen - Recomended · Oneforma -- Recomended · Telus International - Recomended · Toloka · Remotask and Outlier - Top ...Read more
graph making website,207,480,56,1.84,I,make website,ok,,https://www.canva.com/graphs/,https://charts.livegap.com/,https://www.desmos.com/calculator,Graph Maker - Create online charts & diagrams in minutes,Graph Maker - Create Charts Online for Free,Graphing Calculator,Easily create your customized charts & diagrams with Canva's free online graph maker. Choose from 20+ chart types & hundreds of templates.,"LiveGap Charts is a free website where teachers can create and share all kinds of charts: line, bar, area, pie, radar, icon matrix, and more.Read more","Explore math with our beautiful, free online graphing calculator. Graph functions, plot points, visualize algebraic equations, add sliders, animate graphs, ..."
graph making websites,208,480,56,1.84,I,make website,ok,,,,,,,,,,
song making website,209,480,56,0.64,I,make website,ok,,https://musiclab.chromeexperiments.com/Song-Maker,https://suno.com/,https://www.soundtrap.com/musicmakers,Song Maker - Chrome Music Lab,Suno | AI Music Generator,Soundtrap - Make music online,"Song Maker, an experiment in Chrome Music Lab, is a simple way for anyone to make and share a song.","Create stunning original music for free in seconds using our AI generator. Make your own masterpieces, share with friends, and discover music from artists ...","Make music together online. Free instruments, loops, drum kits, and vocal tuner in one studio. Record, edit, mix, and master your audio, no downloads - sign ..."
best software for making websites,210,480,56,3.29,I,make website,ok,,,,,,,,,,
make a graph website,211,480,56,1.84,I,make website,ok,,https://www.canva.com/graphs/,https://www.visme.co/graph-maker/,https://csacademy.com/app/graph_editor/,Graph Maker - Create online charts & diagrams in minutes,Free Graph Maker: Create Graphs & Charts in Minutes,Graph Editor - CS Academy,Easily create your customized charts & diagrams with Canva's free online graph maker. Choose from 20+ chart types & hundreds of templates.,"Create over 30+ charts & diagrams with ease in Visme's graph maker. Access customizable templates, live data integration and interactive graph capabilities.Read more","Draw mode · Clicking anywhere on the graph canvas creates a new node. · Clicking on a node starts the drawing process of a new edge. · To cancel the new edge, ...Read more"
song making websites,212,480,56,0.64,I,make website,ok,,,,,,,,,,
invoicing app for small business,213,480,56,8,I,app for small business,ok,,https://invoiceninja.com/,https://invoicely.com/,https://www.cnbc.com/select/best-invoicing-software-for-small-businesses/,Invoice Ninja - Free Invoicing Software for Small Businesses ...,Free Online Invoicing for Small Businesses - invoicely,5 best invoicing and billing software for small businesses,"Invoice Ninja is a robust, flexible, yet surprisingly affordable invoicing and expense management tool that more than 200,000 sole proprietors and small ...Read more","invoicely is free online invoicing for small businesses. Create and send invoices and estimates, track time and expenses and accept online payments.","Jan 26, 2026 — Best free plan: Zoho Invoice · Best for international sales: Stripe Invoicing · Best free trial offer: FreshBooks · Best for unlimited invoices: ...Read more"
easiest website builder for small business,214,480,56,9.49,I,website for small business,ok,,https://www.reddit.com/r/smallbusiness/comments/1qgohxa/whats_a_beginner_friendly_website_builder_for_a/,https://www.websitebuilderexpert.com/website-builders/small-business/,https://www.sitebuilderreport.com/easiest-website-builders,What's a beginner friendly website builder for a small ...,5 Best Small Business Website Builders for 2026,The 7 Easiest Website Builders For Beginners In 2026,"Hey, for what you described, all in one builders like Wix, Squarespace, or Shopify are usually the easiest place to start since they include ...Read more","Mar 27, 2026 — Hostinger: Easiest Builder for Small Businesses. Overall rating: 4.2/5 ⭐; Hostinger pricing: $1.99 – $2.99 per month; Read our Hostinger ...Read more","Squarespace is the best all-around website builder. It's an excellent choice for all types of websites: portfolios, blogs, ecommerce, small businesses, etc.Read more"
make a website with ai,215,590,70,6.08,I,make website,ok,,https://www.figma.com/solutions/ai-website-builder/,https://www.relume.io/,https://codedesign.ai/,AI Website Builder - Prompt to Website in Seconds,Relume — Websites designed & built faster with AI | AI ...,CodeDesign.ai: AI Website Builder,"Go from idea to live website with Figma Make. Use AI prompts to create responsive, interactive sites with real content—no coding required.","Use AI as your design ally, not as a replacement. Effortlessly generate sitemaps and wireframes for marketing websites in minutes with Relume's AI website","Instead of starting from scratch, you simply describe your business in a chat, and the AI generates a professional, fully functional website in seconds. It ...Read more"
how do you create a website for your business,216,590,70,5,I,create website for business,ok,,https://www.canva.com/create/business-websites/,https://www.website.com/,https://www.wix.com/business/website,Free Business Website Maker - Create a ...,Create Your Free Website | Free Website Builder | Website.com,Create a Small Business Website,"Create a website for your business—no coding required. With our free business website maker, you can build a beautiful, one-page website in minutes.Read more","Create a professional website for free with the Website.com website builder. Domain names, web hosting, website templates, and ecommerce solutions included.",1. Plan your website ; 2. Build with AI or choose a template ; 3. Customize your website ; 4. Get a domain name ; 5. Optimize for search engines ...Read more
best way to make a website,217,590,71,5.14,I,make website,ok,,https://www.reddit.com/r/Entrepreneur/comments/c177lr/whats_the_easiest_way_to_make_a_website/,https://www.canva.com/website-builder/,https://www.wix.com/blog/how-to-build-website-from-scratch-guide,What's the easiest way to make a website? : r/Entrepreneur,Website Builder - Create a Free Website,How to Create a Website From Scratch in 10 Steps ...,Wordpress is by far the easiest way to start a website. They have a bunch of plugins that will help with any type of website she is looking for.Read more,"Design and launch a professional, no-code website in minutes with Canva's free website builder. Publish in moments, not months.Read more","Feb 23, 2026 — The fastest and most beginner-friendly way is to use a no-coding website builder, which gives you all the tools you need to design, customize ...Read more"
easy way to make a website,218,590,71,5.28,I,make website,ok,,,,,Create Your Own Website,Construtor De Sites - 5 Melhores Criadores de Sites,We Tried Them All - Our Best Choices for 2026,,,
best websites to make money online,219,480,58,1.44,I,make website,ok,,https://trymata.com/blog/make-money-online/,https://www.moneysavingexpert.com/family/make-money-online/,https://www.iubenda.com/en/blog/10-legit-ways-to-make-money-online-for-beginners/,15 Best Secret Websites to Make Money Online in 2026,Make money online: Paying sites and apps for making cash,10 Legit Ways to Make Money Online for Beginners,15 Secret Websites to Make Money in 2026 · 1. Trymata · 2. Userfeel · 3. Survey Junkie · 4. Prolific · 5. UserTesting · 6. PlaytestCloud · 7. Respondent.io · 8.Read more,"This guide lists 20+ (legit) ways to make money online – you can get paid just to watch videos, write, search on Google, sell photos, make your own YouTube ...Read more","Websites like Udemy, Teachable, and VIP Kid allow you to create and sell courses or provide one-on-one tutoring sessions. This avenue is particularly suitable ...Read more"
developing websites for small businesses,220,480,58,11.31,I,website for small business,ok,,,,,,,,,,
make an e commerce site,221,480,59,6.81,I,make site,ok,,,,,,,,,,
best site for making money online,222,480,59,1.44,I,make site,ok,,,,,Work with AI - Trabalhe de casa,Make $25/Hr Or More From Home - Earn Money Online,23 Proven Ways To Make Money Online in 2026 - Shopify,,,
best websites making money online,223,480,59,1.44,I,make website,ok,,,,,,,,,,
make my own websites,224,540,67,5.59,I,make website,ok,,,,,Construtor De Sites - 5 Melhores Criadores de Sites,Make A Website For Free - Squarespace Website Builder,"Build Your Own Website Now - No code, no setup, no hassle",,,
good online money making sites,225,480,60,1.44,I,make site,ok,,,,,,,,,,
make an ecommerce site,226,480,60,6.81,I,make site,ok,,,,,,,,,,
easy way make website,227,590,74,5.28,I,make website,ok,,,,,Build Your Website Free Today,Manus: Crie App Web em Minutos,Create a Custom Website,,,
make myown website,228,540,68,5.59,I,make website,ok,,,,,,,,,,
app making software free,229,480,61,4.24,I,make app,ok,,,,,Build An App For Free,Top 5 Free App Builders - 100% Free. No Fees,Top 5 Free App Builders,,,
