keyword,priority,volume,kd,cpc,position,intent,competitor,Ссылка конкурента 1,Ссылка конкурента 2,Ссылка конкурента 3,Заголовок конкурента 1,Заголовок конкурента 2,Заголовок конкурента 3,Сниппет конкурента 1,Сниппет конкурента 2,Сниппет конкурента 3
1v1 video chat,1,5400,24,0.51,81,I,bubble.io,https://1v1chat.me/,https://www.liveme.com/,https://play.google.com/store/apps/details?id=com.duolive.app&hl=pt_PT,1v1Chat: Experience Real Human Connection Via 1 on 1 ...,LiveMe - Live Video Chat & 1v1 Video Call with Girls,DuoLive: 1v1 Live Chat – Apps no ...,"1v1Chat is here to break the cycle. We connect you with someone new over 1 on 1 video chat – no more waiting, 100% real people waiting to connect.Read more",LiveMe offers 1v1 live video chat & live streaming to talk to strangers. Enjoy smooth HD online video to connect and socialize with new people worldwide.,"Através da nossa função de chat, você pode se comunicar com amigos de todo o mundo, compartilhar a vida e a cultura uns dos outros. A função de bate-papo por ...Read more"
visual matrix login,2,4400,33,0,31,I,bubble.io,https://login.vmcloudpms.com/,https://visualmatrix.com/,https://enterprise.vmmop.com/,VisualMatrix Login,Visual Matrix: Home,MOP Sign up or sign in,Visual Matrix. Property. User Name. Password. Forgot Password? Login. We now have on property alerts!Read more,"Visual Matrix is the indispensable hotel PMS software that helps understaffed, under-pressure hotels rise to every occasion.Read more",Sign in with your username. Username. Password Forgot your password? Sign in. OR. Don't have an account?Sign up now.Read more
grade easy,3,4400,37,0,20,I,bubble.io,https://www.gradecalculator.com/,https://play.google.com/store/apps/details?id=com.redcubez.easygrader&hl=pt,https://apps.apple.com/br/app/easy-grade-ez-grader/id564423623?l=en-GB,Grade Calculator - Online Easy Grader for Grading (EZ ...,Easy Grader- Simple scorecard,Easy Grade - EZ Grader - App Store,"Grade Calculator. Use this simple EZ Grading calculator to find quiz, test and assignment scores: Easy Grader · Average Grade CalculatorRead more","Com nosso rastreador de notas intuitivo, avaliar trabalhos e testes é tão fácil quanto alguns toques em seu smartphone. Basta inserir o número de perguntas e o ...Read more",Easy Grade makes it easy to grade your students' papers when you don't have the cardboard EZ Grader with you. Easy Grade has many options that make it the ...Read more
girls video chat,4,4400,39,0,89,I,bubble.io,https://azarlive.com/,https://www.liveme.com/,https://camloo.com/,Azar: Video Chat with New People,LiveMe - Live Video Chat & 1v1 Video Call with Girls,Camloo: Free Random Video Chat with Strangers,"Azar lets you access a variety of fun features for free, but customizing who you meet by gender and region filter is available through our Gems on our website.Read more","Explore LiveMe for exciting live interactions—social media girls, video chat vibes, and authentic social commentary ...Read more",Camloo connects you with a random person on the other side of the screen in mere seconds. Our video chat feature is completely free.Read more
bubbly meaning,5,990,12,0,69,I,bubble.io,https://dictionary.cambridge.org/us/dictionary/english/bubbly,https://www.reddit.com/r/Sidemen/comments/1m4xa6k/what_is_a_bubbly/,https://www.merriam-webster.com/dictionary/bubbly,BUBBLY | definition in the Cambridge English Dictionary,What is a bubbly? : r/Sidemen,BUBBLY Definition & Meaning,BUBBLY meaning: 1. (especially of a woman or girl) attractively full of energy and enthusiasm: 2. champagne…. Learn more.,Meaning of bubbly in UK slang. Bubbly personality traits and characteristics. Synonyms for bubbly personality. Cockney rhyming slang for bubble.Read more,"1 ... full of bubbles : effervescent sense 1 ... a bubbly bottle of pop ... 2 ... cheerful and high-spirited : lively, vivacious ... a bubbly personality ... 3 ... resembling ...Read more"
in pixels,6,1900,28,0,60,I,bubble.io,https://pixelsconverter.com/inches-to-pixels,https://www.unitconverters.net/typography/inch-to-pixel-x.htm,https://www.pixelto.net/inches-to-px-converter,Inches to Pixels Converter,Convert Inch to Pixel (X),Inches to Pixels Converter (in to px),"For web works, 1 inch is equal to 96px or 96 pixels per inch (PPI). What this means is that a 96px width on your screen looks exact same on a 1 inch width in ...Read more",Instant free online tool for inch to pixel (X) conversion or vice versa. The inch [in] to pixel (X) conversion table and conversion steps are also listed.,Use our pixel converter to convert inches to pixels. Please type the inch value and the resolution value to convert inches to pixels (px).Read more
real life examples,7,990,16,0,63,I,bubble.io,https://simplicable.com/life/real-life,https://fiveable.me/introduction-public-speaking/key-terms/real-life-examples,https://www.reddit.com/r/Life/comments/1mxfeky/real_life_examples/,110 Examples of Real Life,Real-life examples - Intro to Public Speaking,Real life examples : r/Life,"Oct 10, 2024 — The list above includes five distinct meanings of real life: everyday life, real life challenges, real action, real successes and real experiences.Read more",Real-life examples are specific instances or anecdotes drawn from actual experiences that help illustrate a point or concept in a clear and relatable manner.Read more,Can you guys give me some real life examples of someone kicking another person when they're already down?
add more,8,1900,39,0,1,I,bubble.io,https://www.linguee.com.br/ingles-portugues/traducao/add+more.html,https://context.reverso.net/traducao/ingles-portugues/add+more,https://www.addmore.pt/,add more - Tradução em português,add more - Tradução em português - exemplos inglês,Addmore - What's Your Fight?,add (sth.) v — · adicionar (algo) · acrescentar (algo) · somar · anexar · aumentar · agregar · juntar · acrescer algo v. ·. calcular v. ·. aditar algo v.Read more,"Tradução de ""add more"" em português ... adicionar mais acrescentar mais colocar mais agregar mais dar mais incluir mais juntar mais adicionar outros pôr mais. Ver ...Read more","A newsletter Addmore é um canal de comunicação que visa manter os subscritores atualizados acerca do nosso trabalho, da sua qualidade e pertinência. Join via ...Read more"
list comparer,9,1300,40,2.11,17,"I,N",bubble.io,https://comparetwolists.com/,https://www.listdiff.com/,https://difflists.com/,Compare two lists - easy online listdiff tool,ListDiff - Compare two lists to find list differences,DiffLists.com - compare lists online tool,"Want to compare lists of Instagram followers, names, e-mails, domains, genes or something else? This tool shows you the unique and shared values in your two ...","Comparing Two Lists To Find Differences · This list comparison tool will perform SET Operations over lists of words, numbers etc with formatted results ...Read more",Use our free online tool to compare lists from different sources. It's quick and easy to do. Just paste 2 lists below (List 1 and List 2) and click on Compare ...Read more
babbel languages,10,990,36,1.28,56,"I,N",bubble.io,https://www.babbel.com/,https://play.google.com/store/apps/details?id=com.babbel.mobile.android.en&hl=en,https://www.babbelforbusiness.com/us/faq/what-languages-are-available-on-the-babbel-app/,Babbel: Learn a Language Online - Fast & Effective,Babbel - Learn Languages - Apps on Google Play,What Languages Are Available on the Babbel App?,"Babbel is the effective way to learn a new language. Our system uses scientifically proven methods to improve your grammar, vocabulary, and pronunciation.","Not a native speaker but want to talk just like one? Download Babbel and improve your German language learning, learn English or discover how to speak Spanish.Read more",Complete Language Portfolio · Spanish (European and Mexican) · French · German · Italian · Portuguese (Brazilian) · Dutch · Swedish · Norwegian; Danish; Polish ...Read more
