keyword,priority,volume,kd,cpc,intent,seed,flag,published,Ссылка конкурента 1,Ссылка конкурента 2,Ссылка конкурента 3,Заголовок конкурента 1,Заголовок конкурента 2,Заголовок конкурента 3,Сниппет конкурента 1,Сниппет конкурента 2,Сниппет конкурента 3
free portfolio builder website,68,590,47,3.03,I,website builder,ok,,https://www.canva.com/create/portfolios/,https://www.portfoliobox.com/,https://portfolio.adobe.com/,Free Portfolio Website Maker - Create a Porfolio Website,Portfoliobox: Create your Free Portfolio Website,Adobe Portfolio | Build your own personalized website,"Canva's free online portfolio website builder. Easily create professional-looking portfolios that showcase your skills, qualifications, and best work.Read more","Portfoliobox is the best website builder for creatives. Make your your free portfolio website now. The easy-to-use website builder, designed for creatives.Read more",Quickly and simply build a personalized website to showcase your creative work with Adobe Portfolio. Now included free with any Creative Cloud subscription.
web page builder app,69,590,47,3.71,I,app builder,ok,,https://play.google.com/store/apps/details?id=com.simple_different.android&hl=en,https://efficient.app/best/website-builder,https://apps.microsoft.com/detail/9n0ds51wkq9w?hl=pt-BR&gl=ST,Website Builder for Android - Apps on Google Play,Best Website Builders (2026): Ranked & Reviewed,Website Builder WP - Download e instalação gratuitos no ...,"SimDif website builder helps you create, edit, and publish a clear, effective site from your phone, tablet, or computer, with the same features on every device.Read more","Jan 20, 2026 — 1. Framer. Best · Best for designers who already use Figma ; 2. Webflow. Best · Best for scalable marketing websites ; 3. Webstudio. Recommended.Read more","Website Builder WP is free tool to create a website on your Windows in a few clicks. You can select a beautiful theme, add your favorite plugins, add pages and ...Read more"
best website creator for photographers,70,590,47,3.96,I,website creator,ok,,https://themframes.com/features/best-photography-website-builder/,https://www.tooltester.com/en/blog/best-website-builder-for-photographers/,https://www.reddit.com/r/photography/comments/1rkpwoe/whats_the_best_website_builder_for_photographers/,Best Photography Website Builder: Tested by a Photographer,Best Website Builder for Photographers: 7 Standout Picks,What's the best website builder for photographers right now?,"FORMAT – A website builder with beautiful templates, powerful customizations and great value. Squarespace – Popular with the pros thanks to it's bold ...Read more","Feb 26, 2026 — The 7 best website builders for photographers · 1. Wix – The website builder with it all · 2. Squarespace – The website builder for creatives.Read more",I've tested quite a few and squarespace is by far the best. Most of my site contains videos and they load so fast even my dad mentioned it.Read more
free portfolio website creator,71,590,47,3.03,I,website creator,ok,,https://www.squarespace.com/websites/create-a-portfolio,https://www.canva.com/create/portfolios/,https://www.portfoliobox.com/,Create A Portfolio Website - Create Your Portfolio,Free Portfolio Website Maker - Create a Porfolio Website,Portfoliobox: Create your Free Portfolio Website,,"Canva's free online portfolio website builder. Easily create professional-looking portfolios that showcase your skills, qualifications, and best work.Read more","You can create your portfolio website for free with Portfoliobox. Just sign up and build your website directly in the browser. Once you're finished, publish it ...Read more"
best ai image generator app,72,590,47,1.51,I,ai app generator,ok,,https://zapier.com/blog/best-ai-image-generator/,https://www.experte.com/ai-image-generators,https://www.canva.com/ai-image-generator/,The 8 best AI image generators in 2026,The 12 Best AI Image Generators 2026 (Free and Paid),Free AI Image Generator: Online Text to Image App,ChatGPT for the best AI image generator overall. Nano Banana for Google users. Midjourney for artistic results. Reve for overall prompt adherence.Read more,"Currently, Nano Banana 2, GPT Image 1.5, and FLUX.2 are among the best AI image generator models. Google's Nano Banana 2 stands out with strong text ...Read more","Produce AI generated images and art with a text prompt using Text to Image, Canva's AI photo generator. Create unique content everytime, fast."
best ai image generator apps,73,590,47,1.51,I,ai app generator,ok,,https://zapier.com/blog/best-ai-image-generator/,https://www.experte.com/ai-image-generators,https://www.reddit.com/r/AIAssisted/comments/1p8va2k/what_are_the_best_ai_image_generators_people_are/,The 8 best AI image generators in 2026,The 12 Best AI Image Generators 2026 (Free and Paid),What are the best AI image generators people are using ...,ChatGPT for the best AI image generator overall. Nano Banana for Google users. Midjourney for artistic results. Reve for overall prompt adherence.Read more,"Nano Banana 2 delivers strong results overall and ranks among the best AI image generators currently available. Prompts are followed accurately, subjects stay ...Read more","Midjourney for style, iMini for speed solid split. Freepik worth testing if you need generation + upscaling + stock combo.Read more"
mobile app builder,74,810,65,5.41,I,app builder,ok,,https://www.andromo.com/,https://thunkable.com/,https://manus.im/tools/mobile-app-builder,Andromo - Mobile App builder for Android and iOS,Thunkable: Best no code app builder | No code app creation,AI No-Code Mobile App Builder: Build iOS & Android ...,Andromo is a premium app building platform where you can create professional Android and iOS apps without writing a single line of code.,Thunkable is the most powerful mobile app development platform that allows anyone to create an app without needing to know how to code.,Build mobile apps with no code or technical skills. Chat with Manus AI to create fully functional iOS and Android apps in minutes. Try it today.
wix website builder prices,75,590,57,3.57,"I,N",website builder,ok,,https://www.wix.com/plans,https://www.wix.com/blog/how-much-is-a-wix-website,https://www.wix.com/blog/how-much-does-a-website-cost,Wix Pricing Information | Upgrade to a Premium Plan,How much is a Wix website?,How much does a website cost in 2026?,"Creating your own website is free. With a Premium plan you can connect your own domain, remove Wix branding from your site, and more. Most Premium plans include ...Read more","Jul 15, 2025 — Wix paid plans explained · 01. Light plan ($17/month) · 02. Core plan ($29/month) · 03. Business plan ($39/month) · 04. Business elite ($159/month).Read more","Mar 31, 2026 — Website builders like Wix offer free plans with limited features, ads and branded subdomains. Others charge as little as $16 per month and as ...Read more"
chatgpt free alternatives,76,590,48,0.86,I,chatgpt alternative,ok,,https://ai.plainenglish.io/top-10-chatgpt-alternatives-that-dont-cost-a-penny-b6f285de5db2,https://deepai.org/chat/chatgpt-alternative,https://bit-flows.com/blog/best-chatgpt-alternatives/,Top 10 ChatGPT Alternatives That Don't Cost a Penny,ChatGPT Alternative,The Best ChatGPT Alternatives in 2026: Free and Paid ...,"Jul 31, 2025 — 1. Google Gemini (formerly Bard) · 2. Perplexity AI · 3. Microsoft Copilot · 4. Claude by Anthropic · 5. Poe by Quora · 6. Chatsonic by Writesonic · 7 ...Read more",Looking for something similar to ChatGPT from OpenAI? Try the ChatGPT Alternative! Note that ChatGPT Alternative has no affiliation with OpenAI.Read more,"Oct 9, 2025 — With so many AI models, which is the best ChatGPT alternative? We compare Gemini and Claude for developers, marketers, and researchers."
no code platforms,77,590,48,4.83,I,no code platform,ok,,https://go.outsystems.com/low-code-demo,https://replit.com/,https://manus.im/pt-br/tools/mobile-app-builder,OutSystems Official Site - Build & Launch Top Apps Fast,AI App Generator,Criar App Sem Código | Criação de App Preço Acessível,,,
icon creator website,78,590,48,0.75,I,website creator,ok,,https://www.canva.com/create/icons/,https://realfavicongenerator.net/,https://icon.kitchen/,Free Icon Maker & Generator - Icon Creator Online,Favicon Generator for perfect icons on all browsers,Icon Kitchen,"On Canva's free online icon maker, you can generate icons with the help of our available layouts and tools. Easily create visual and textual synergies in your ...Read more",The ultimate favicon generator. Design your icons platform per platform and make them look great everywhere. Including in Google results pages.,"Quickly generate app icons for Android, iOS, the Web and more."
shopify ai website builder,79,590,58,4.44,"I,N",website builder,ok,,https://chatgpt.com/codex/,https://www.shopify.com/ppc/website-builder,https://replit.com/,Build with Codex - Build Beautiful Front-Ends,Shopify Website Builder,AI App & Website Builder - Build an AI Powered App - AI App Dev,,,
wix pricing plans,80,440,44,3.06,"I,N",wix pricing,ok,,https://www.wix.com/plans,https://pt.wix.com/premium-purchase-plan/dynamo,https://www.wix.com/blog/how-much-is-a-wix-website,Wix Pricing Information | Upgrade to a Premium Plan,Faça Upgrade Para um Plano Premium,How much is a Wix website?,"Upgrade your Wix website to a premium plan and get a custom domain name, extra storage, traffic analytics and more. Check out Wix's Premium Pricing Plans!","Faça o upgrade do seu site Wix para um plano Premium e receba um domínio personalizado, armazenamento extra, análise de tráfego e mais. Confira os preços de ...","Jul 15, 2025 — Wix paid plans explained · 01. Light plan ($17/month) · 02. Core plan ($29/month) · 03. Business plan ($39/month) · 04. Business elite ($159/month).Read more"
wix plan pricing,81,440,44,3.06,"I,N",wix pricing,ok,,https://www.wix.com/plans,https://pt.wix.com/premium-purchase-plan/dynamo,https://www.wix.com/blog/how-much-is-a-wix-website,Wix Pricing Information | Upgrade to a Premium Plan,Faça Upgrade Para um Plano Premium,How much is a Wix website?,"Upgrade your Wix website to a premium plan and get a custom domain name, extra storage, traffic analytics and more. Check out Wix's Premium Pricing Plans!",Planos Premium Wix · InicialCrie sua presença online. $ 17. /mês. Mostrar recursos · EssencialAlcance sua audiência. $ 29. /mês. Mostrar recursos · RECOMENDADO.Read more,"Jul 15, 2025 — Wix paid plans explained · 01. Light plan ($17/month) · 02. Core plan ($29/month) · 03. Business plan ($39/month) · 04. Business elite ($159/month).Read more"
wix pricing plan,82,440,44,3.06,"I,N",wix pricing,ok,,https://www.wix.com/plans,https://pt.wix.com/premium-purchase-plan/dynamo,https://www.wix.com/blog/how-much-is-a-wix-website,Wix Pricing Information | Upgrade to a Premium Plan,Faça Upgrade Para um Plano Premium,How much is a Wix website?,"Upgrade your Wix website to a premium plan and get a custom domain name, extra storage, traffic analytics and more. Check out Wix's Premium Pricing Plans!","Faça o upgrade do seu site Wix para um plano Premium e receba um domínio personalizado, armazenamento extra, análise de tráfego e mais. Confira os preços de ...","Jul 15, 2025 — Wix paid plans explained · 01. Light plan ($17/month) · 02. Core plan ($29/month) · 03. Business plan ($39/month) · 04. Business elite ($159/month).Read more"
compare site builders,83,590,60,4,"I,N",site builder,ok,,https://www.experte.com/website-builder,https://www.pcmag.com/picks/the-best-website-builders,https://www.name.com/pt-br/website-builder,14 Best Website Builders for 2026 - Tested & Ranked,The Best Website Builders We've Tested for 2026,Compare Website Builder Solutions,"Don't waste money on the wrong website builder. See our unbiased ranking of the 14 best website builders for 2026, ranked by ease of use, template quality ...","Mar 23, 2026 — Best Overall. Wix Website Builder · Remarkably intuitive interface; Numerous widgets ; Best for Website Customization. Squarespace Website Builder.Read more","We've got business website plans to fit every project. Whether you're looking for professional, easy-to-use templates from our business website builder, Wix, or ...Read more"
wix web builder prices,84,590,60,3.57,"I,N",wix pricing,ok,,https://www.wix.com/plans,https://pt.wix.com/premium-purchase-plan/dynamo,https://www.wix.com/blog/how-much-does-a-website-cost,Wix Pricing Information | Upgrade to a Premium Plan,Faça Upgrade Para um Plano Premium,How much does a website cost in 2026?,"Upgrade your Wix website to a premium plan and get a custom domain name, extra storage, traffic analytics and more. Check out Wix's Premium Pricing Plans!",Planos Premium Wix · InicialCrie sua presença online. $ 17. /mês. Mostrar recursos · EssencialAlcance sua audiência. $ 29. /mês. Mostrar recursos · RECOMENDADO.Read more,"Mar 31, 2026 — Website builders like Wix offer free plans with limited features, ads and branded subdomains. Others charge as little as $16 per month and as ...Read more"
large ecommerce platforms,85,590,50,2.62,I,ecommerce platform,ok,,https://www.emailvendorselection.com/best-ecommerce-platforms-review/,https://www.expertmarket.com/uk/website-builders/best-ecommerce-platform-large-company,https://www.statista.com/statistics/245340/leading-large-cap-e-commerce-companies-market-cap/,"10 Best Ecommerce Platforms in 2026 (Reviewed, ...",The 5 Best Ecommerce Platforms for Large Companies,Top large cap e-commerce companies by market cap 2026,"Dec 2, 2025 — BigCommerce is one of the biggest ecommerce platforms, with sales above $25 billion across 120 countries. The BigCommerce eCommerce platform ...Read more","Jul 7, 2025 — Our in-depth research and testing found Shopify to be the best overall platform for large companies, closely followed by Wix.Read more","Feb 17, 2026 — With a market cap of over two trillion U.S. dollars, Amazon ranks first among the leading large-cap e-commerce companies worldwide.Read more"
websites builder reviews,86,480,41,4.09,I,website builder,ok,,https://www.top10.com/hosting/comparison,https://www.hostinger.com/tutorials/best-website-builder,https://top5-websitebuilders.com/best-vibe-coding/,Our Best Choices for 2026,10 best website builders to create your website,"We Tried Them All - Your Idea, No Code",,,
website creator review,87,480,41,4.09,I,website creator,ok,,https://www.experte.com/website-builder,https://www.websitebuilderexpert.com/website-builders/,https://zapier.com/blog/best-website-builders/,14 Best Website Builders for 2026 - Tested & Ranked,Best 5 Website Builders for 2026: My Tried & Tested Picks,The 5 best free website builders,"Don't waste money on the wrong website builder. See our unbiased ranking of the 14 best website builders for 2026, ranked by ease of use, template quality ...","Mar 27, 2026 — Wix is the best website builder I've tested. Wix is our top choice for users who want total creative control, though its larger feature set ...Read more","Sep 4, 2025 — Square Online for eCommerce. HubSpot CMS for growing businesses. Canva for beautifully designed static websites. Wix for robust features.Read more"
top ten site builders,88,480,41,3.8,I,site builder,ok,,https://titan.email/best-ai-website-builders/,https://www.experte.com/website-builder,https://simvoly.com/the-best-website-builder,The 10 Best AI Website Builders in 2026: A Global Guide - Titan,14 Best Website Builders for 2026 - Tested & Ranked,Best Website Builder 2026: Top 7 Platforms Reviewed ...,"Mar 11, 2026 — Discover the 10 best AI website builders like Neo Sites, Olitt, Wix ADI, Hostinger, 10Web, Durable and more, to create a professional site ...","Don't waste money on the wrong website builder. See our unbiased ranking of the 14 best website builders for 2026, ranked by ease of use, template quality ...","Jan 14, 2026 — Stop searching for the top website builder. We reviewed Simvoly, Wix, Shopify, and more to find the best value for SEO, marketing, ..."
woocommerce ecommerce platforms,89,480,41,0,I,ecommerce platform,ok,,https://www.shoplazza.com/ai-store-builder,https://woocommerce.com/,https://woocommerce.com/pt-br/,E commerce store builder - Simple eCommerce store builder,WooCommerce,A plataforma de eCommerce mais confiável,,WooCommerce is the open-source ecommerce platform that helps merchants and developers build successful businesses for the long term.,WooCommerce é a plataforma de comércio eletrônico de código aberto que ajuda comerciantes e desenvolvedores a construir negócios de sucesso a longo prazo.
online form builder html,90,480,41,2.63,I,form builder,ok,,https://www.zoho.com/forms/,https://www.jotform.com/registration-form/,https://www.typeform.com/try/form-builder,Unlimited Submissions - Ready-To-Use Templates - No Code,Generate Your Custom Forms,Create HTML Form,,,
wix website builder pricing,91,590,61,3.57,"I,N",website builder,ok,,https://www.wix.com/plans,https://www.wix.com/blog/how-much-is-a-wix-website,https://www.wix.com/,Wix Pricing Information | Upgrade to a Premium Plan,How much is a Wix website?,Wix.com: Website Builder - Create a Free Website In Minutes,"Creating your own website is free. With a Premium plan you can connect your own domain, remove Wix branding from your site, and more. Most Premium plans include ...","Jul 15, 2025 — If you need a custom domain, Wix offers free domains for the first year in most paid plans. After that, domains typically renew at $14.95–$24.95 ...Read more","On a website builder such as Wix, you can build as many websites as you want for free, however, you'll have to upgrade to a Premium plan to connect a custom ...Read more"
wp forms builder,92,590,61,2.55,"I,N",form builder,ok,,https://wpforms.com/,https://br.wordpress.org/plugins/wpforms-lite/,https://mercadoonlinedigital.com/produto/wpforms-drag-drop-wordpress-form-builder/,WPForms: Best WordPress Forms Plugin | Free Online Form ...,WPForms –Editor de formulários simplificado para o ...,WPForms Drag & Drop WordPress Form Builder,"WPForms AI + easy drag-and-drop WordPress form builder allows you to create contact forms, online surveys, donation forms, online order forms, and other custom ...Read more","O melhor plugin de formulário de contato para o WordPress. Arraste e solte o editor de formulários para criar incríveis formulários de contato, de pagamento ...",O WPforms é extremamente essencial para incluir um formulário no seu site e ampliar engajamento dos usuários. Como ele você amplia a sua comunidade de ...Read more
no code web development platforms,93,590,51,0,I,no code platform,ok,,https://nocodestartup.io/melhores-ferramentas-no-code/,https://www.nocode.tech/,https://www.blaze.tech/post/no-code-development-platforms,As 12 Melhores Ferramentas No Code,The Home of No-Code,12 Best No-Code Development Platforms 2026: Tested + ...,"Sep 17, 2025 — Quais são as 12 melhores ferramentas no-code · Criação de sites no-code · Desenvolvimento de Aplicativos Web · Desenvolvimento de Apps No-Code.Read more","NoCode.Tech is a media platform aiming to help anyone, no matter their technical skills, navigate the digital world and build their own software using no-code ...Read more","Mar 2, 2026 — Most no-code development platforms overpromise and underdeliver. After testing 45, these 12 stood out. Compare features, pricing ..."
site builder open source,94,590,51,1.84,I,site builder,ok,,https://webstudio.is/,https://www.reddit.com/r/homelab/comments/1dtmx0j/best_open_source_free_website_builder_software/,https://www.silex.me/,Webstudio — Advanced Open Source Website Builder,Best open source (free) website builder software : r/homelab,"Silex: Free Website Builder, Libre Software, Open-Source No ...",Webstudio is an open source website builder that empowers creators to build highly maintainable and fast websites using modern web standards.,"You can try Webstudio. It's open source and selfhosting is completely free. It features a website builder, CMS, SEO, etc. joeyme. • ...Read more","Create fast websites visually, free open source tool for professional web designers and no-code developers."
wix web builder pricing,95,590,51,3.57,I,wix pricing,ok,,https://www.wix.com/plans,https://www.wix.com/blog/how-much-is-a-wix-website,https://www.wix.com/,Wix Pricing Information | Upgrade to a Premium Plan,How much is a Wix website?,Wix.com: Website Builder - Create a Free Website In Minutes,"Start for free. All plans include: Custom domain, Reliable web hosting, AI creation tools, 24/7 customer care.","Nov 6, 2025 — If you need a custom domain, Wix offers free domains for the first year in most paid plans. After that, domains typically renew at $14.95–$24.95 ...Read more","On a website builder such as Wix, you can build as many websites as you want for free, however, you'll have to upgrade to a Premium plan to connect a custom ...Read more"
website builder comparison,96,590,62,4,"I,N",website builder,ok,,https://www.tooltester.com/en/best-website-builder/,https://www.pcmag.com/picks/the-best-website-builders,https://zapier.com/blog/best-website-builders/,17 Best Website Builders in 2026,The Best Website Builders We've Tested for 2026,The 5 best free website builders,"3 days ago — In our study of the 17 top website builders, we included Wix, Squarespace, WordPress and more. But which site builder is best for you?","Best Overall. Wix Website Builder · Remarkably intuitive interface ; Best for Website Customization. Squarespace Website Builder · Beautiful, responsive designs ...Read more","Sep 4, 2025 — Square Online for eCommerce. HubSpot CMS for growing businesses. Canva for beautifully designed static websites. Wix for robust features.Read more"
website builders compared,97,590,62,4,"I,N",website builder,ok,,https://www.tooltester.com/en/best-website-builder/,https://www.pcmag.com/picks/the-best-website-builders,https://www.youtube.com/watch?v=I16w2xV4KTM,17 Best Website Builders in 2026,The Best Website Builders We've Tested for 2026,I Ranked Every Website Builder [TIER LIST],"3 days ago — In our study of the 17 top website builders, we included Wix, Squarespace, WordPress and more. But which site builder is best for you?","Best Overall. Wix Website Builder · Remarkably intuitive interface ; Best for Website Customization. Squarespace Website Builder · Beautiful, responsive designs ...Read more",I'll be ranking every major website builder in a tier list from S tier being the absolute best to F tier reserved for the builders that you should avoid.
website builder compare,98,590,62,4,"I,N",website builder,ok,,https://www.tooltester.com/en/best-website-builder/,https://www.pcmag.com/picks/the-best-website-builders,https://zapier.com/blog/best-website-builders/,17 Best Website Builders in 2026,The Best Website Builders We've Tested for 2026,The 5 best free website builders,"3 days ago — In our study of the 17 top website builders, we included Wix, Squarespace, WordPress and more. But which site builder is best for you?","Best Overall. Wix Website Builder · Remarkably intuitive interface ; Best for Website Customization. Squarespace Website Builder · Beautiful, responsive designs ...Read more","Sep 4, 2025 — Square Online for eCommerce. HubSpot CMS for growing businesses. Canva for beautifully designed static websites. Wix for robust features.Read more"
best inexpensive website builder,99,480,42,6.44,I,website builder,ok,,https://www.websiteplanet.com/blog/cheapest-website-builders/,https://www.01net.com/en/website-builder/cheap/,https://www.reddit.com/r/EcommerceWebsite/comments/1relzab/pls_whats_the_best_and_cheapest_website_builder/,10 Best Cheap Website Builders (That Are Actually Good),The Cheapest Website Builders of 2026,Pls What's the Best and Cheapest Website Builder Currently?,"Dec 18, 2025 — Wix is my top pick – on top of a great free plan, you get a range of affordable paid options with marketing integrations, e-commerce tools, and ...Read more","Feb 24, 2026 — Best Affordable Website Builders: Expert Reviews · 1. Hostinger Website Builder (Starting Price: $2.99/mo) · 2. Squarespace (Starting Price: $16 ...Read more","Woocommerce is one of best ecommerce website builder, it is far affordable than shopify but you may find it little difficult to use than shopify ...Read more"
google app builder,100,480,42,4.9,I,app builder,ok,,https://aistudio.google.com/,https://firebase.google.com/,https://about.appsheet.com/home/,Google AI Studio,Firebase | Google's Mobile and Web App Development Platform,Google AppSheet | Build apps with no code,The fastest path from prompt to production with Gemini.,"Firebase is a platform of services to help you and AI agents build and run intelligent apps with more speed, security, and scalability. Designed for the ...Read more","AppSheet is a true no-code platform, which means anyone can build rich apps and automated processes without writing a line of code. The AppSheet Editor helps ...Read more"
