keyword,priority,volume,kd,cpc,intent,seed,flag,published,Ссылка конкурента 1,Ссылка конкурента 2,Ссылка конкурента 3,Заголовок конкурента 1,Заголовок конкурента 2,Заголовок конкурента 3,Сниппет конкурента 1,Сниппет конкурента 2,Сниппет конкурента 3
wordpress website builder,1,6600,48,4.61,I,website builder,ok,,https://wordpress.com/,https://play.google.com/store/apps/details?id=org.wordpress.android&hl=en,https://wordpress.org/plugins/tags/website-builder/,WordPress.com: Everything You Need to Build Your Website,WordPress – Website Builder - Apps on Google Play,Plugin Tag: website builder,"Create your WordPress website with built-in hosting, premium themes, and powerful tools. No technical setup required. Start building today—free plan ...","WordPress for Android is a website builder and a blog maker. Pick the right look and feel from a wide selection of WordPress themes, then customize with photos ...Read more","Easy Drag & Drop Page Builder. A complete solution to create a WordPress Website, Custom Themes, Landing Pages, Coming Soon & Maintenance Mode Pages. SeedProd ...Read more"
squarespace website builder,2,6600,72,5.34,"I,N",website builder,ok,,https://www.squarespace.com/website-design,https://www.squarespace.com/,https://www.youtube.com/watch?v=uPVXRan67is,Squarespace Build A Website,Website Builder – Easily Create Your Own Website ...,Squarespace Tutorial - How To Build a Website For Beginners ...,,Websites made with Squarespace · samfresquez.com · andamirobk.com · maevedesigncollective.com · yarzatwins.com · myrtlegreen.org · littleripper.la · breathpod.com.,I'm going to show you how to build a website using Squarespace. I'm going to walk you through step by step in the process.
pc builder website,3,6600,62,0.16,I,website builder,ok,,https://pcpartpicker.com/,https://www.buildcores.com/,https://meupc.net/build,PCPartPicker: Pick parts. Build your PC. Compare and share.,BuildCores: 3D PC Builder and Part Picker,Monte seu PC - MEUPC.NET,This website uses cookies for performance monitoring to help us improve the website. ... Build Your PC. Compare and Share. We provide part selection ...,3D PC Builder and Part Picker. Find compatible parts for the lowest prices and see how your build looks before you buy.,"A melhor ferramenta para montar computadores. Monte seu PC — gamer ou profissional — pelo menor preço, com tudo compatível e sem complicação.Read more"
no code app builder,4,6600,73,5,I,app builder,ok,,https://www.glideapps.com/,https://thunkable.com/,https://www.reddit.com/r/nocode/comments/1rdp1hm/whats_the_best_no_code_app_builder_that_actually/,"No Code App Builder: Create Custom, AI-Powered Apps | Glide",Thunkable: Best no code app builder | No code app creation,What's the best no code app builder that actually works for ...,Glide makes it easy to build and deploy powerful custom apps powered by AI with no code. Create your first app by trying Glide for free.,Thunkable is the most powerful mobile app development platform that allows anyone to create an app without needing to know how to code.,"For a beginner-friendly start, tools like Glide, Adalo, or Bubble are usually good no-code options. They let you drag and drop features and ...Read more"
canva website builder,5,5400,72,3.17,"I,N",website builder,ok,,https://www.canva.com/website-builder/,https://www.canva.com/pt_pt/criar/websites/,https://www.canva.com/create/business-websites/,Website Builder - Create a Free Website,Criador de Website Grátis,Free Business Website Maker - Create a ...,Create free professional websites on your own domain in minutes. Canva's website builder makes launching a one-page website easy with customizable templates ...,O criador do website gratuito da Canva permite-te fazer o teu próprio website em menos de uma hora e optimizá-lo para o ambiente de trabalho ou para o telemóvel ...Read more,Create a business website with our free business website builder. Choose from beautiful templates and customize with easy drag-and-drop editing.
google website builder,6,5700,73,4.02,I,website builder,ok,,https://workspace.google.com/products/sites/,https://sites.google.com/site/horstwebdesign/about-google-sites,https://support.google.com/a/users/answer/9310491?hl=pt-BR,Google Sites: Website Creator and Hosting,Google Sites - Free Website Builder - Sign in,Criar seu primeiro site com o Google Sites,Easily create and edit your sites with drag-and-drop design. The automatic grid layout ensures everything looks great and scales perfectly on any device.Read more,"Google Sites is a free web building platform by Google. It is purposed for both public websites, company intranets and private portals.Read more","Criar e nomear seu site · Escolha uma opção: Na parte de cima da página inicial do Sites, clique em Em branco ou em Galeria de modelos para selecionar um modelo ...Read more"
ecommerce platforms,7,5700,74,2.45,I,ecommerce platform,ok,,https://www.emailvendorselection.com/best-ecommerce-platforms-review/,https://zapier.com/blog/best-ecommerce-shopping-cart-software/,https://melhorenvio.com.br/blog/ecommerce-e-marketplace/melhores-plataformas-de-e-commerce/,"10 Best Ecommerce Platforms in 2026 (Reviewed, ...",The 6 best eCommerce website building platforms in 2026,Melhores plataformas de e-commerce: 13 opções do ...,"Dec 2, 2025 — Summary: What is the Best Ecommerce Platform in 2026? · The best ecommerce software platforms for beginners are Ecwid, Sellfy, and Shopify · For ...Read more","Jan 23, 2026 — The 6 best eCommerce website building platforms for online stores in 2026 · Shopify · Square · Ecwid by Lightspeed · BigCommerce · WooCommerce ...Read more","Jun 18, 2025 — As melhores plataformas de e-commerce do mercado são: Tray E-commerce, Bagy, Shopify, WooCommerce, Wix e Wake Commerce. Entenda cada uma ...Read more"
shopify website builder,8,4400,71,4.43,"I,N",website builder,ok,,https://www.shopify.com/website/builder,https://www.buildyourstore.ai/,https://www.shopifywebsitebuilders.com/,Ecommerce Website Builder | Create a Free Store in Minutes,Build Your Store - Free AI Shopify Store Builder,Shopify Website Builder | eCommerce Store Creation,"Shopify's ecommerce website builder allows you to create a free, custom online store with AI in minutes—no coding required. Choose from a variety of ...","Launch your Shopify store in minutes with our free AI store builder. Enjoy a fully optimized Shopify store with winning products, high-converting themes, ...",Shopify Website Builder is a Shopify Partner that specialises in custom shopify store setup & creation for all size of businesses.
lego builder app,9,5400,74,0.11,I,app builder,ok,,https://www.lego.com/en-us/builder-app,https://play.google.com/store/apps/details?id=com.lego.legobuildinginstructions&hl=en,https://www.lego.com/pt-br/service/device-guide/lego-building-instructions-app,LEGO Builder app | Official LEGO® Shop US,LEGO® Builder: 3D Instructions - Apps on Google Play,LEGO® Builder app,"Download the free LEGO® Builder app where you can discover digital, online, interactive building instructions for your new LEGO sets.","LEGO® Builder is the official building instructions app for LEGO® sets that guides you on an easy, fun, and collaborative digital building adventure.Read more",A maneira mais fácil de descobrir se seu dispositivo funciona com o app LEGO® Builder é encontrar e baixar o app. Os dispositivos que podem baixar e ...Read more
alternatives to chatgpt,10,4400,61,1.25,I,chatgpt alternative,ok,,https://zapier.com/blog/chatgpt-alternatives/,https://ai.plainenglish.io/top-10-chatgpt-alternatives-that-dont-cost-a-penny-b6f285de5db2,https://deepai.org/chat/chatgpt-alternative,The 8 best ChatGPT alternatives in 2026,Top 10 ChatGPT Alternatives That Don't Cost a Penny,ChatGPT Alternative,The best ChatGPT alternatives · Claude for professionals · Google Gemini for Google integrations · Zapier Agents for creating an AI agent · Microsoft Copilot ...Read more,"Jul 31, 2025 — Top 10 ChatGPT Alternatives That Don't Cost a Penny · 1. Google Gemini (formerly Bard) · 2. Perplexity AI · 3. Microsoft Copilot · 4. Claude by ...Read more",Looking for something similar to ChatGPT from OpenAI? Try the ChatGPT Alternative! Note that ChatGPT Alternative has no affiliation with OpenAI.Read more
sites builders,11,2400,70,5,"L,C",site builder,ok,,https://pt.squarespace.com/,https://www.wix.com/,https://www.godaddy.com/pt-br/sites/criador-de-sites,Squarespace: Construtor de sites – Crie o seu site,Wix.com: Website Builder - Create a Free Website In Minutes,Criador de Sites | Crie um site Gratuito em minutos,"Crie um site e expanda sua empresa com uma avaliação gratuita do Squarespace. Comece com templates personalizáveis, ferramentas com IA para criação de sites ...","Get everything you need to build a website your way. Wix's free, easy-to-use website builder offers 2000+ templates, built-in AI tools and a custom domain.","Seu site gratuito é apenas o começo. Crie um site gratuito, otimizado para dispositivo móvel, para sua empresa e veja ele decolar com o marketing integrado.Read more"
ai app builder,12,4400,71,5.98,I,app builder,ok,,https://chatgpt.com/codex/,https://base44.com/lp-en,https://sonary.com/compare/best-ai-app-builders/,Build with Codex,Build An App For Free,Ai App Builder,,,
alternative to chatgpt,13,3600,65,1.25,I,chatgpt alternative,ok,,https://deepai.org/chat/chatgpt-alternative,https://zapier.com/blog/chatgpt-alternatives/,https://ai.plainenglish.io/top-10-chatgpt-alternatives-that-dont-cost-a-penny-b6f285de5db2,ChatGPT Alternative,The 8 best ChatGPT alternatives in 2026,Top 10 ChatGPT Alternatives That Don't Cost a Penny,Looking for something similar to ChatGPT from OpenAI? Try the ChatGPT Alternative! Note that ChatGPT Alternative has no affiliation with OpenAI.,The best ChatGPT alternatives · Claude for professionals · Google Gemini for Google integrations · Zapier Agents for creating an AI agent · Microsoft Copilot ...Read more,"Jul 31, 2025 — Top 10 ChatGPT Alternatives That Don't Cost a Penny · 1. Google Gemini (formerly Bard) · 2. Perplexity AI · 3. Microsoft Copilot · 4. Claude by ...Read more"
best ai website builder,14,2400,70,5.3,I,website builder,ok,,https://chatgpt.com/codex/,https://www.shoplazza.com/ai-store-builder,https://base44.com/lp-en,Build with Codex,2026 AI Website Generator - Best ai website builder,Base44: Best AI to Build Site,,,
ai website builder free,15,2400,71,4.32,I,website builder,ok,,https://webwave.me/ai-website-builder,https://www.jotform.com/ai/website-builder/,https://quillbot.com/ai-website-builder,Free AI Website Builder | Create an AI Website in Minutes,Free AI Website Builder for 2026,"AI Website Builder - create web pages, portfolios, and more",With our free AI website builder you create your dream website in minutes and customize it with no coding. AI Website Generator powered by ChatGPT.,"Build your website in minutes with our free AI website builder. No coding, no design skills — just describe your idea and publish instantly.","Turn your ideas into live websites with our AI Website Builder. Use AI prompts to create responsive, interactive sites with real content without any coding."
no-code app builder,16,2400,73,5,I,app builder,ok,,https://base44.com/lp-en,https://bestaibuilders.com/,https://replit.com/,Code-Free App Building,5 Best App Builders (2026) - No Code App Builder,No-Code App Builder,,,
free ai website builder,17,1900,70,3.98,I,website builder,ok,,https://webwave.me/ai-website-builder,https://www.jotform.com/ai/website-builder/,https://bookipi.com/ai-website-builder/,Free AI Website Builder | Create an AI Website in Minutes,Free AI Website Builder for 2026,free AI website builder,With our free AI website builder you create your dream website in minutes and customize it with no coding. AI Website Generator powered by ChatGPT.,"Build your website in minutes with our free AI website builder. No coding, no design skills — just describe your idea and publish instantly.",Use our free AI website generator to make your own professional website with just a “Prompt“. Build your webpages in just 30 seconds and we'll host it for free.Read more
website builder and seo,18,590,44,7.09,"L,C",website builder,ok,,https://www.reddit.com/r/WebsiteSEO/comments/1rqrzw8/best_website_builder_for_seo_if_you_want_rankings/,https://aioseo.com/best-website-builder-for-seo/,https://www.duda.co/,Best website builder for SEO if you want rankings and ...,My Top 12 Picks for the Best Website Builders for SEO (2026),Duda | The AI-Ready Website Platform Built for Pros,"If you (or they) are not super technical, then the all-in-one platforms - Wix, Squarespace, Shopify are the best bets and are easy to use for ...Read more","Feb 25, 2026 — I tested the best website builders for SEO and narrowed it down to 12 platforms. See which ones made the cut, featuring WordPress, Wix, ...","Builders can generate and modify text, improve their SEO, recommend additional pages, improve page design, create custom widgets, enhance client onboarding ...Read more"
westlaw form builder,19,1300,60,0.77,"I,N",form builder,ok,,https://forms.westlaw.com/,https://legal.thomsonreuters.com/en/products/form-builder,https://training.thomsonreuters.com/legal-westlaw-form-builder,Westlaw Form Builder Signon,Westlaw Form Builder,Westlaw Form Builder,"See how our online document assembly tool can help you efficiently build and complete forms. More details. Custom Forms. Customize, build, and save your own ...","Westlaw Form Builder is the convenient, easy-to-use, online legal document assembly tool that speeds up the form building process.Read more","Westlaw Form Builder is an easy-to-use, online legal document assembly tool. Sign in Getting started Explore all Getting started with Westlaw Form BuilderRead more"
t bar row alternative,20,1500,64,0,I,rows alternative,ok,,https://steelsupplements.com/blogs/steel-blog/10-best-t-bar-row-alternative-exercises-for-strength,https://www.reddit.com/r/workout/comments/1qpj8a2/t_bar_row_replacement/,https://www.youtube.com/shorts/3etSV7wqaq0,10 Best T-Bar Row Alternative Exercises for Strength,T bar row replacement : r/workout,T-Bar Row Alternative,"Aug 21, 2021 — First off, bent-over barbell rows are perhaps the most popular t-bar alternative. Not only that, but they are also probably the most popular ...Read more","Basically any row should be fine. Bent-over barbell, dumbbell, chest supported row machine, cable row, etc. Wider elbows up and flared targets ...Read more","Here's the easiest way to mimic a T-bar row if your gym doesn't have one! 🏋️‍♂️ Grab an incline bench and some dumbbells or kettlebells, ..."
app builder companies,21,480,41,15,"L,C",app builder,ok,,https://zapier.com/blog/best-ai-app-builder/,https://www.weweb.io/blog/best-app-builder-platforms,https://www.figma.com/resource-library/ai-app-builders/,The 6 best AI app builders in 2026,Top 10 App Builder Platforms for 2026: Build Without Code,7 of the Best AI App Builders for 2026,"Feb 6, 2026 — The 6 best AI-powered app builders · Softr for ease of use and speed · Zapier for AI automation · Microsoft Power Apps for creating and editing ...Read more","Feb 24, 2026 — Explore the top app builder platforms for 2026. Compare features, pricing, pros/cons, and use cases across WeWeb, Bubble, FlutterFlow, ...",Create interactive apps faster with some of the best AI app builders for 2026. Build no-code or low-code apps with Figma Make and other AI-powered ...
website builder software best,22,480,46,3.29,C,website builder software,ok,,https://efficient.app/best/website-builder,https://www.top10-websitehosting.co.uk/best-free-website-builders/,https://simvoly.com/the-best-website-builder,Best Website Builders (2026): Ranked & Reviewed,8 Best Free Website Builders 2026 (My Personal Experience),Best Website Builder 2026: Top 7 Platforms Reviewed ...,"Jan 20, 2026 — 1. Framer. Best · Best for designers who already use Figma ; 2. Webflow. Best · Best for scalable marketing websites ; 3. Webstudio. Recommended.Read more",1. Hostinger – Best Website Builder Overall. Beginner users who need to build their very first website will find the intuitiveness of Hostinger to be ideal.Read more,"Jan 14, 2026 — Stop searching for the top website builder. We reviewed Simvoly, Wix, Shopify, and more to find the best value for SEO, marketing, ..."
top 10 website creators,23,480,47,3.8,"L,C",website creator,ok,,https://www.wix.com/studio,https://www.hostinger.com/recommended/horizons-ai,https://www.squarespace.com/go/create-a-website,Wix Studio | Build with Total Freedom | +1000 Website Templates,AI Website Builder | Crie seu site web com IA,Squarespace Website Builder | Make A Website For Free,,,
best ecommerce platform,24,810,42,2.72,I,ecommerce platform,ok,,https://www.emailvendorselection.com/best-ecommerce-platforms-review/,https://www.reddit.com/r/ecommerce/comments/1n6s43r/which_ecommerce_platform_should_i_use_for_my/,https://zapier.com/blog/best-ecommerce-shopping-cart-software/,"10 Best Ecommerce Platforms in 2026 (Reviewed, ...",Which E-Commerce Platform Should I Use for My Online ...,The 6 best eCommerce website building platforms in 2026,"Dec 2, 2025 — Shopify is the most popular ecommerce platform in the world. Launched in 2004, Shopify hosts over 1 million eshops.Read more",Shopify is the go-to ecommerce platform. The business was created to be an e-commerce platform and everything they do is to make business owners ...Read more,"Jan 23, 2026 — The 6 best eCommerce website building platforms for online stores in 2026 · Shopify · Square · Ecwid by Lightspeed · BigCommerce · WooCommerce ...Read more"
best website software builder,25,480,52,3.29,"L,C",website builder software,ok,,https://simvoly.com/the-best-website-builder,https://www.top10-websitehosting.co.uk/best-free-website-builders/,https://www.reddit.com/r/smallbusiness/comments/1fhx0gm/what_is_the_best_platform_to_build_a_website_on/,Best Website Builder 2026: Top 7 Platforms Reviewed ...,8 Best Free Website Builders 2026 (My Personal Experience),What is the best platform to build a website on?,"Jan 14, 2026 — Stop searching for the top website builder. We reviewed Simvoly, Wix, Shopify, and more to find the best value for SEO, marketing, ...",1. Hostinger – Best Website Builder Overall. Beginner users who need to build their very first website will find the intuitiveness of Hostinger to be ideal.Read more,Squarespace and Shopify are pretty impressive website builder for creating any type of website.Read more
ai site builder,26,1300,72,5.35,I,site builder,ok,,https://www.relume.io/,https://titan.email/best-ai-website-builders/,https://webflow.com/ai-site-builder,Relume — Websites designed & built faster with AI | AI ...,The 10 Best AI Website Builders in 2026: A Global Guide - Titan,AI site builder,"Use AI as your design ally, not a replacement. Instantly generate Sitemaps, Wireframes and Style Guides for marketing websites—all in minutes.Read more","Mar 11, 2026 — Discover the 10 best AI website builders like Neo Sites, Olitt, Wix ADI, Hostinger, 10Web, Durable and more, to create a professional site ...",Webflow's AI site builder creates a functional site and a foundational design system that you can shape to meet your needs. Prompt. A bespoke floral studio ...Read more
builder funnels,27,480,55,7.3,"L,C",funnel builder,ok,,https://www.builderfunnel.com/,https://br.builderall.com/funnel-builder,https://www.convertflow.com/,Builder Funnel | The Marketing Agency for Remodelers + ...,Funnel Builder,ConvertFlow - Funnel Builder,A strategic marketing and advertising agency on a mission to help design-build remodelers and custom home builders achieve sustainable business growth.Read more,Funnel Builder.,"Launch and A/B test funnels quickly with AI using ConvertFlow's funnel builder. Use AI to remix 400+ funnel templates for landing pages, quizzes, forms, ..."
e commerce website builders,28,590,68,6.3,"L,C",website builder,ok,,https://www.wix.com/ecommerce/website,https://zapier.com/blog/best-ecommerce-shopping-cart-software/,https://www.squarespace.com/ecommerce-website,eCommerce Website Builder: Build An eCommerce Site,The 6 best eCommerce website building platforms in 2026,Ecommerce Website Builder - Start an Online Store,Wix eCommerce is your all-in-one eCommerce platform. Create a fully customizable free eCommerce website & upgrade to start selling everywhere.,"Jan 23, 2026 — The 6 best eCommerce website building platforms for online stores in 2026 · Shopify · Square · Ecwid by Lightspeed · BigCommerce · WooCommerce ...Read more","Create an ecommerce website with Squarespace to sell products, services, or content with our powerful platform. Pick a template and start your online store ..."
best affordable website builders,29,480,58,6.44,"L,C",best website builder,ok,,https://www.websiteplanet.com/blog/cheapest-website-builders/,https://www.01net.com/en/website-builder/cheap/,https://www.reddit.com/r/smallbusiness/comments/1f7qbnu/can_you_recommend_me_some_best_cheap_website/,10 Best Cheap Website Builders (That Are Actually Good),The Cheapest Website Builders of 2026,Can you recommend me some best & cheap website ...,"Dec 18, 2025 — WordPress.com offers a completely free plan as well as an affordable Personal plan starting at $4.00 per month. Though it doesn't come with very ...Read more","Feb 24, 2026 — Best Affordable Website Builders: Expert Reviews · 1. Hostinger Website Builder (Starting Price: $2.99/mo) · 2. Squarespace (Starting Price: $16 ...Read more","For a budget-friendly option, I'd recommend checking out Wix or Weebly they both offer plans around $5/month that are perfect for simple ...Read more"
whitelabel website builder,30,590,43,6.67,"I,N",website builder,ok,,https://www.brizy.io/white-label-website-builder,https://www.duda.co/website-builder/white-label,https://simvoly.com/the-best-white-label-website-builder,Customizable White Label Website Builder for Agencies & ...,White Label Website Builder - Duda,Top 3 White Label Website Builders of 2026,"Add your own branding on top of our complete solution for building websites. 100% customizable, allowing you to offer a truly unique service to your clients ...Read more",Duda's white label website builder gives you everything you need to build highly-personalized client sites at scale - all under your brand.,"Feb 10, 2026 — Comparing the 3 best white label website builders for agencies in 2026: Simvoly, Duda, and GoHighLevel. Discover which platform is the ..."
platforms for ecommerce,31,740,48,2.69,I,ecommerce platform,ok,,https://www.emailvendorselection.com/best-ecommerce-platforms-review/,https://www.reddit.com/r/ecommerce/comments/1n6s43r/which_ecommerce_platform_should_i_use_for_my/,https://ecommerce-platforms.com/,"10 Best Ecommerce Platforms in 2026 (Reviewed, ...",Which E-Commerce Platform Should I Use for My Online ...,Ecommerce Platforms - Top Ecommerce Platforms Compared ...,"Dec 2, 2025 — Summary: What is the Best Ecommerce Platform in 2026? · The best ecommerce software platforms for beginners are Ecwid, Sellfy, and Shopify · For ...Read more",Shopify is the go-to ecommerce platform. The business was created to be an e-commerce platform and everything they do is to make business owners ...Read more,The best ecommerce platforms for a successful online store · Shopify · Wix · BigCommerce · Squarespace · Printful · Printify · Gelato. Full Review. Production ...Read more
elementor site builder,32,590,46,2.12,"I,N",site builder,ok,,https://elementor.com/,https://wordpress.org/plugins/elementor/,https://www.youtube.com/watch?v=aKPXXx94CUc,Website builder: Create a Website Now | Elementor,Elementor Website Builder – more than just a page builder,Elementor Tutorial in 13 Minutes,Elementor's free website builder makes it easy for web creators. Build a website or online store- no coding required. Start creating now!,"Elementor, the leading WordPress website creation platform, empowers you to build professional, pixel-perfect websites seamlessly.Read more",This video will have six parts the overview of Elementor containers and columns standards templating and header and footer tips and tricks.
free portfolio website builder,33,590,41,3.03,I,website builder,ok,,https://www.squarespace.com/websites/create-a-portfolio,https://www.top-5best.com/br,https://lovable.dev/,Create A Portfolio Website - Make Your Portfolio,Construtor De Sites - 5 Melhores Criadores de Sites,Lovable,,,
open source site builder,34,590,41,1.84,I,site builder,ok,,https://webstudio.is/,https://www.reddit.com/r/homelab/comments/1dtmx0j/best_open_source_free_website_builder_software/,https://www.silex.me/,Webstudio — Advanced Open Source Website Builder,Best open source (free) website builder software : r/homelab,"Silex: Free Website Builder, Libre Software, Open-Source No ...",Webstudio is an open source website builder that empowers creators to build highly maintainable and fast websites using modern web standards.,"You can try Webstudio. It's open source and selfhosting is completely free. It features a website builder, CMS, SEO, etc. joeyme. • ...Read more","Create fast websites visually, free open source tool for professional web designers and no-code developers."
