keyword,priority,volume,kd,cpc,intent,seed,flag,published,Ссылка конкурента 1,Ссылка конкурента 2,Ссылка конкурента 3,Заголовок конкурента 1,Заголовок конкурента 2,Заголовок конкурента 3,Сниппет конкурента 1,Сниппет конкурента 2,Сниппет конкурента 3
best site builder software,201,480,53,3.29,I,site builder,ok,,https://www.top10-websitehosting.co.uk/best-free-website-builders/,https://efficient.app/best/website-builder,https://zapier.com/blog/best-website-builders/,8 Best Free Website Builders 2026 (My Personal Experience),Best Website Builders (2026): Ranked & Reviewed,The 5 best free website builders,1. Hostinger – Best Website Builder Overall. Beginner users who need to build their very first website will find the intuitiveness of Hostinger to be ideal.Read more,"Jan 20, 2026 — 1. Framer. Best · Best for designers who already use Figma ; 2. Webflow. Best · Best for scalable marketing websites ; 3. Webstudio. Recommended.Read more","Sep 4, 2025 — Square Online for eCommerce. HubSpot CMS for growing businesses. Canva for beautifully designed static websites. Wix for robust features.Read more"
best website builder cheap,202,480,53,6.44,I,best website builder,ok,,,,,Wix Studio,Build Your Website Free Today,Our Best Choices for 2026 - Side-By-Side Comparison,,,
comparison website builder,203,590,66,4,I,website builder,ok,,,,,,,,,,
web to app builder,204,590,66,4.48,I,app builder,ok,,https://median.co/,https://replit.com/build/web-app-builder,https://bubble.io/,Median.co: Convert any website to iOS & Android native apps,AI Web App Builder | Create for Free,Bubble: Build web & mobile apps with the only no-code AI app ...,The world's most powerful webview app development platform. With Median.co it's never been easier to build and maintain high-quality iOS and Android native ...,Use Replit's free web app builder to bring your ideas to life. Create and deploy powerful web applications directly from your browser. No setup required.,Bubble is the only AI-powered app builder with robust capabilities for both web and mobile — so you can truly build once and ship to any device. Get started ...Read more
website builder reviews,205,480,54,4.09,I,website builder,ok,,https://www.top10-websitehosting.co.uk/best-free-website-builders/,https://www.experte.com/website-builder,https://www.pcmag.com/picks/the-best-website-builders,8 Best Free Website Builders 2026 (My Personal Experience),14 Best Website Builders for 2026 - Tested & Ranked,The Best Website Builders We've Tested for 2026,1. Hostinger – Best Website Builder Overall ... Beginner users who need to build their very first website will find the intuitiveness of Hostinger to be ideal.Read more,You can find all of our website builder reviews in our comprehensive comparison. We've also separately compared the most popular builders for online shops.Read more,"Best Overall. Wix Website Builder · Remarkably intuitive interface ; Best for Website Customization. Squarespace Website Builder · Beautiful, responsive designs ...Read more"
no coding mobile app builder,206,480,54,4.51,I,app builder,ok,,,,,,,,,,
app builder company,207,480,65,15,"I,N",app builder,ok,,,,,,,,,,
ai app builders,208,480,54,5.98,I,app builder,ok,,,,,Build AI-Enriched Applications,Build with Codex,Launch Projects in Minutes,,,
best website creator software,209,480,54,3.29,I,website creator,ok,,https://efficient.app/best/website-builder,https://www.top10-websitehosting.co.uk/best-free-website-builders/,https://simvoly.com/the-best-website-builder,Best Website Builders (2026): Ranked & Reviewed,8 Best Free Website Builders 2026 (My Personal Experience),Best Website Builder 2026: Top 7 Platforms Reviewed ...,"Jan 20, 2026 — 1. Framer. Best · Best for designers who already use Figma ; 2. Webflow. Best · Best for scalable marketing websites ; 3. Webstudio. Recommended.Read more",1. Hostinger – Best Website Builder Overall. Beginner users who need to build their very first website will find the intuitiveness of Hostinger to be ideal.Read more,"Jan 14, 2026 — Stop searching for the top website builder. We reviewed Simvoly, Wix, Shopify, and more to find the best value for SEO, marketing, ..."
top website builders software,210,480,54,3.29,I,website builder software,ok,,https://simvoly.com/the-best-website-builder,https://www.top10-websitehosting.co.uk/best-free-website-builders/,https://zapier.com/blog/best-website-builders/,Best Website Builder 2026: Top 7 Platforms Reviewed ...,8 Best Free Website Builders 2026 (My Personal Experience),The 5 best free website builders,"Jan 14, 2026 — Stop searching for the top website builder. We reviewed Simvoly, Wix, Shopify, and more to find the best value for SEO, marketing, ...",We take a look at the best free website builders including pros & cons in 2026 to help you decide on which platform is best suited for you.,"Sep 4, 2025 — Square Online for eCommerce. HubSpot CMS for growing businesses. Canva for beautifully designed static websites. Wix for robust features.Read more"
wix web hosting prices,211,480,65,2.72,"I,N",wix pricing,ok,,,,https://www.wix.com/plans,Free Webpage Hosting Solutions - Deploy Websites for Free,Choose Your Hosting Plan - Free Domain for a Year - WordPress.com,Wix Pricing Information | Upgrade to a Premium Plan,,,"Upgrade your Wix website to a premium plan and get a custom domain name, extra storage, traffic analytics and more. Check out Wix's Premium Pricing Plans!"
website to app builder,212,590,67,4.48,I,website builder,ok,,,,,Criar App APK com Manus Fácil,Build with Codex,Create your own website or app,,,
free website ecommerce builder,213,590,67,4.1,I,website builder,ok,,https://freewebstore.com/,https://squareup.com/us/en/online-store,https://www.weebly.com/?lang=en,Create a Free Online Store or eCommerce Website,Sell online - build a free online store or eCommerce website,Free Website Builder: Build a Free Website or Online Store ...,Our simple yet powerful ecommerce solution allows users of all abilities to operate a successful online store - for free.Read more,Create and customize an eCommerce website that fits your brand with the all-in-one website platform. Start your free trial today.,"Weebly's free website builder makes it easy to create a website, blog, or online store. Find customizable templates, domains, and easy-to-use tools for any ..."
best and cheapest website builder,214,480,55,6.44,I,website builder,ok,,https://www.top10-websitehosting.co.uk/best-free-website-builders/,https://www.reddit.com/r/EcommerceWebsite/comments/1relzab/pls_whats_the_best_and_cheapest_website_builder/,https://www.01net.com/en/website-builder/cheap/,8 Best Free Website Builders 2026 (My Personal Experience),Pls What's the Best and Cheapest Website Builder Currently?,The Cheapest Website Builders of 2026,We take a look at the best free website builders including pros & cons in 2026 to help you decide on which platform is best suited for you.,"If you're trying to stay around ~$5/mo, these are the best options right now: Carrd (super clean + cheapest for a simple portfolio/contact site) ...Read more","Feb 24, 2026 — Best Affordable Website Builders: Expert Reviews · 1. Hostinger Website Builder (Starting Price: $2.99/mo) · 2. Squarespace (Starting Price: $16 ...Read more"
app android builder,215,480,55,3.64,I,app builder,ok,,https://play.google.com/store/apps/details?id=freeapp.builderme&hl=pt_PT,https://www.andromo.com/,https://replit.com/build/android-app-builder,Android Builder - App Creator – Apps no Google Play,Andromo - Mobile App builder for Android and iOS,AI Android App Builder | Create for Free,"1. permite que você crie gratuitamente, facilmente e sem conhecimento de programação seu aplicativo nativo para telefones e tablets Android. 2. O aplicativo ...Read more",Andromo is a premium app building platform where you can create professional Android and iOS apps without writing a single line of code.,Build your dream app with Replit's no-code Android app builder. Turn your ideas into reality without writing a single line of code. Start now!
free html website creator,216,480,55,1.75,I,website creator,ok,,,,,,,,,,
what is cms platform,217,480,55,1.57,I,cms platform,ok,,,,,,,,,,
best website builder platforms,218,480,55,5,I,best website builder,ok,,,,,,,,,,
free website builder for ecommerce,219,590,68,4.1,I,website builder,ok,,,,,Compare All Free App Makers - No Credit Card Required,Create a Free Store in Minutes,Construtor De Sites - Dominio Gratuito Incluso,,,
website citation creator,220,590,68,0.04,I,website creator,ok,,https://www.mybib.com/,https://www.scribbr.com/citation/generator/,https://www.citationmachine.net/apa/cite-a-website,"MyBib – A New FREE APA, Harvard, & MLA Citation Generator","Free Citation Generator | APA, MLA, Chicago",Citing a Website in APA,"MyBib creates accurate citations automatically for books, journals, websites, and videos just by searching for a title or identifier (such as a URL or ISBN).Read more","Generate citations in APA, MLA, Chicago, and Harvard style with Scribbr's free Citation Generator. Trusted by students worldwide.",Creating accurate citations in APA has never been easier! Automatically cite a website in APA by using Citation Machine's free citation generator.
website citation builder,221,590,69,0.04,I,website builder,ok,,https://www.scribbr.com/citation/generator/,https://www.mybib.com/,https://www.citationmachine.net/,"Free Citation Generator | APA, MLA, Chicago","MyBib – A New FREE APA, Harvard, & MLA Citation Generator","Citation Machine®: Format & Generate - APA, MLA, & Chicago","Generate citations in APA, MLA, Chicago, and Harvard style with Scribbr's free Citation Generator. Trusted by students worldwide.","MyBib creates accurate citations automatically for books, journals, websites, and videos just by searching for a title or identifier (such as a URL or ISBN).Read more","Generate citations for any assignment in thousands of styles, including MLA, APA, Chicago and Harvard. Instantly export bibliographies.Read more"
online app builder,222,590,69,4.75,I,app builder,ok,,https://apphive.io/,https://thunkable.com/,https://www.glideapps.com/,Apphive | Create an App | Online App maker | App Builder,Thunkable: Best no code app builder | No code app creation,"No Code App Builder: Create Custom, AI-Powered Apps | Glide","Apphive is an app builder | The easiest way to make an app for android and IOS, you can create a free mobile app without programming, drag and drop elements ...",Thunkable is the most powerful mobile app development platform that allows anyone to create an app without needing to know how to code.,Glide makes it easy to build and deploy powerful custom apps powered by AI with no code. Create your first app by trying Glide for free.
easiest website builder for small business,223,480,56,9.49,I,website builder,ok,,https://www.reddit.com/r/smallbusiness/comments/1qgohxa/whats_a_beginner_friendly_website_builder_for_a/,https://www.websitebuilderexpert.com/website-builders/small-business/,https://zapier.com/blog/best-website-builder-for-small-business/,What's a beginner friendly website builder for a small ...,5 Best Small Business Website Builders for 2026,The 9 best website builders for small business,"Hey, for what you described, all in one builders like Wix, Squarespace, or Shopify are usually the easiest place to start since they include ...Read more","Mar 27, 2026 — Hostinger: Easiest Builder for Small Businesses. Overall rating: 4.2/5 ⭐; Hostinger pricing: $1.99 – $2.99 per month; Read our Hostinger ...Read more","Feb 25, 2025 — Wix for ease of use. Squarespace for service-based businesses. Shopify for eCommerce. Webflow for advanced design.Read more"
app builder ai,224,480,56,6.21,I,app builder,ok,,,,,,,,,,
best online store builders,225,480,56,6.03,I,online store builder,ok,,https://dokan.co/blog/498189/best-online-store-builders/,https://zapier.com/blog/best-ecommerce-shopping-cart-software/,https://www.reddit.com/r/BusinessDevelopment/comments/1p13svm/whats_the_best_ecommerce_website_builder_for_a/,7 Best Online Store Builders to Launch Your Business,The 6 best eCommerce website building platforms in 2026,What's the Best Ecommerce Website Builder for a Small ...,"Apr 22, 2025 — Best online store builders: 1. Dokan Cloud, 2. Shopify, 3. Wix, 4. BigCommerce, 5. Squarespace, 6. WooCommerce, and 7 ...","Jan 23, 2026 — Gumroad, E-junkie, and SendOwl are all worth looking at, and work out much cheaper than larger platforms if you're only selling a few items a ...Read more","For beginners, Shopify is the easiest to get running fast, but if you want the cheapest and simplest, Wix or Squarespace work great for small ...Read more"
what is a cms platform,226,480,56,1.57,I,cms platform,ok,,,,,,,,,,
website builder app,227,590,70,3.71,I,website builder,ok,,https://play.google.com/store/apps/details?id=com.simple_different.android&hl=en,https://zapier.com/blog/best-website-builders/,https://www.wix.com/,Website Builder for Android - Apps on Google Play,The 5 best free website builders,Wix.com: Website Builder - Create a Free Website In Minutes,"SimDif website builder helps you create, edit, and publish a clear, effective site from your phone, tablet, or computer, with the same features on every device.Read more","Sep 4, 2025 — Square Online for eCommerce. HubSpot CMS for growing businesses. Canva for beautifully designed static websites. Wix for robust features.Read more","Get everything you need to build a website your way. Wix's free, easy-to-use website builder offers 2000+ templates, built-in AI tools and a custom domain."
website builder applications,228,590,70,3.71,I,website builder,ok,,https://efficient.app/best/website-builder,https://www.wix.com/,https://zapier.com/blog/best-website-builders/,Best Website Builders (2026): Ranked & Reviewed,Wix.com: Website Builder - Create a Free Website In Minutes,The 5 best free website builders,"Jan 20, 2026 — 1. Framer. Best · Best for designers who already use Figma ; 2. Webflow. Best · Best for scalable marketing websites ; 3. Webstudio. Recommended.Read more","Get everything you need to build a website your way. Wix's free, easy-to-use website builder offers 2000+ templates, built-in AI tools and a custom domain.","Sep 4, 2025 — Square Online for eCommerce. HubSpot CMS for growing businesses. Canva for beautifully designed static websites. Wix for robust features.Read more"
best website builders for online stores,229,480,57,3.11,I,website builder,ok,,https://www.experte.com/website-builder,https://www.reddit.com/r/BusinessDevelopment/comments/1p13svm/whats_the_best_ecommerce_website_builder_for_a/,https://zapier.com/blog/best-ecommerce-shopping-cart-software/,14 Best Website Builders for 2026 - Tested & Ranked,What's the Best Ecommerce Website Builder for a Small ...,The 6 best eCommerce website building platforms in 2026,"Squarespace is well-suited for small to medium-sized online stores. In addition to physical and digital products, you can sell services, courses, memberships, ...Read more","For beginners, Shopify is the easiest to get running fast, but if you want the cheapest and simplest, Wix or Squarespace work great for small ...Read more","Jan 23, 2026 — Shopify for getting up and running quickly. Square for selling in-person and online. Ecwid by Lightspeed for starting with a cheap plan—then ...Read more"
top website builder software,230,480,57,3.29,I,website builder,ok,,https://www.top10-websitehosting.co.uk/best-free-website-builders/,https://efficient.app/best/website-builder,https://simvoly.com/the-best-website-builder,8 Best Free Website Builders 2026 (My Personal Experience),Best Website Builders (2026): Ranked & Reviewed,Best Website Builder 2026: Top 7 Platforms Reviewed ...,1. Hostinger – Best Website Builder Overall. Beginner users who need to build their very first website will find the intuitiveness of Hostinger to be ideal.Read more,"Jan 20, 2026 — 1. Framer. Best · Best for designers who already use Figma ; 2. Webflow. Best · Best for scalable marketing websites ; 3. Webstudio. Recommended.Read more","Jan 14, 2026 — Stop searching for the top website builder. We reviewed Simvoly, Wix, Shopify, and more to find the best value for SEO, marketing, ..."
free website builder html,231,480,57,1.75,I,website builder,ok,,,,,Construtor De Sites,Build Your Own Website Now,Create Your Own Website | Exceptionally Simple,,,
free website builder with html,232,480,57,1.75,I,website builder,ok,,,,,Make A Website For Free,Drag & Drop App Builders,Lovable,,,
app website builder,233,590,71,3.71,I,website builder,ok,,https://play.google.com/store/apps/details?id=com.simple_different.android&hl=en,https://www.odoo.com/app/website,https://www.wix.com/,Website Builder for Android - Apps on Google Play,"The #1 free, open-source Website Builder",Wix.com: Website Builder - Create a Free Website In Minutes,"SimDif website builder helps you create, edit, and publish a clear, effective site from your phone, tablet, or computer, with the same features on every device.Read more","Create a free website in minutes and enjoy Odoo's open-source CMS, both mobile- and SEO-friendly. Discover it now!","Get everything you need to build a website your way. Wix's free, easy-to-use website builder offers 2000+ templates, built-in AI tools and a custom domain."
web builder app,234,590,71,3.71,I,app builder,ok,,https://play.google.com/store/apps/details?id=com.simple_different.android&hl=en,https://efficient.app/best/website-builder,https://zapier.com/blog/best-website-builders/,Website Builder for Android - Apps on Google Play,Best Website Builders (2026): Ranked & Reviewed,The 5 best free website builders,"SimDif website builder helps you create, edit, and publish a clear, effective site from your phone, tablet, or computer, with the same features on every device.Read more","Jan 20, 2026 — 1. Framer. Best · Best for designers who already use Figma ; 2. Webflow. Best · Best for scalable marketing websites ; 3. Webstudio. Recommended.Read more","Sep 4, 2025 — Square Online for eCommerce. HubSpot CMS for growing businesses. Canva for beautifully designed static websites. Wix for robust features.Read more"
free html website builder,235,480,58,1.75,I,website builder,ok,,https://www.wix.com/builder/html,https://www.canva.com/website-builder/,https://teleporthq.io/professional-website-builder,HTML Website Builder: Create For Free,Website Builder - Create a Free Website,Drag and Drop Website Builder with Code Export,Create without limits using an HTML website builder. Build a unique powerful website using 1000s of intuitive design features and advanced AI tools.Read more,"Design and launch a professional, no-code website in minutes with Canva's free website builder. Publish in moments, not months.Read more","TeleportHQ is a professional FREE drag and drop website builder, with clean code export to HTML, CSS, and 5 different JavaScript frameworks.Read more"
no code mobile app builder,236,480,58,4.51,I,app builder,ok,,https://thunkable.com/,https://www.reddit.com/r/nocode/comments/1lw5icp/what_is_the_best_and_cost_effective_no_code/,https://www.glideapps.com/,Thunkable: Best no code app builder | No code app creation,What is the best and cost effective no code mobile app ...,"No Code App Builder: Create Custom, AI-Powered Apps | Glide",Thunkable is the most powerful mobile app development platform that allows anyone to create an app without needing to know how to code.,There are a few beginner-friendly no-code platforms that make it easy to build and publish Android apps. Adalo and FlutterFlow are two of the ...Read more,Glide makes it easy to build and deploy powerful custom apps powered by AI with no code. Create your first app by trying Glide for free.
free website builder using html,237,480,58,1.75,I,free website builder,ok,,,,,Make A Website For Free,Top 5 Free App Builders - The Winner Is Clear,Lovable - Create a Website in Minutes,,,
website builder html free,238,480,58,1.75,I,free website builder,ok,,,,,"Arraste e solte, sem código",Make A Website For Free,Create a Website in Minutes,,,
free html site builder,239,480,58,1.75,I,site builder,ok,,,,,Top 5 Free App Builders - The Winner Is Clear,Create a Website in Minutes,Drag & Drop App Builders,,,
best web builder for online store,240,480,58,3.11,I,online store builder,ok,,https://www.experte.com/website-builder,https://www.reddit.com/r/web_design/comments/ylm1ic/whats_the_best_website_builder_for_an_ecommerce/,https://zapier.com/blog/best-ecommerce-shopping-cart-software/,14 Best Website Builders for 2026 - Tested & Ranked,What's the best website builder for an e-commerce? (or any ...,The 6 best eCommerce website building platforms in 2026,"Wix offers the best balance of user-friendliness, flexibility, and features in the website builder market: If you want to create a dynamic, personalized website ...Read more","Shopify is the best eCommerce builder. Webflow is good but when it comes to ease of use, Shopify is the best. Even a newbie can build the store ...Read more","Jan 23, 2026 — The 6 best eCommerce website building platforms for online stores in 2026 · Shopify · Square · Ecwid by Lightspeed · BigCommerce · WooCommerce ...Read more"
ai generated app,241,480,58,1.67,I,ai app generator,ok,,https://play.google.com/store/apps/details?id=ai.leonardo.leonardo&hl=en,https://www.figma.com/solutions/ai-app-builder/,https://apps.apple.com/br/app/ai-generated-images-al-art/id6686406968,Leonardo.Ai - Image Generator - Apps on Google Play,Free No-code AI App Builder - Idea to App in Seconds,AI Generated Images - Al Art - App Store,3 days ago — Leonardo.Ai is a powerful AI art generator that lets you create stunning visuals and videos using world-class AI models. Whether you're ...Read more,"Apr 2, 2026 — Build apps with AI in Figma Make. Turn ideas into interactive, data-connected apps and prototypes—refine, test, and publish with no coding ...","Baixe o app AI Generated Images - Al Art de Dmitrii Solovev a partir da App Store. Veja capturas de tela, classificações e avaliações, dicas de usuários e ..."
ai generate app,242,480,58,1.67,I,ai app generator,ok,,,,,Build with Codex,Build Gen AI Apps with MongoDB,Build AI-Enriched Applications | Gen AI is Easier with MongoDB,,,
wix website hosting prices,243,480,70,2.72,"I,N",wix pricing,ok,,https://www.wix.com/plans,https://pt.wix.com/premium-purchase-plan/dynamo,https://www.wix.com/blog/how-much-is-a-wix-website,Wix Pricing Information | Upgrade to a Premium Plan,Faça Upgrade Para um Plano Premium,How much is a Wix website?,"Upgrade your Wix website to a premium plan and get a custom domain name, extra storage, traffic analytics and more. Check out Wix's Premium Pricing Plans!",Planos Premium Wix · InicialCrie sua presença online. $ 17. /mês. Mostrar recursos · EssencialAlcance sua audiência. $ 29. /mês. Mostrar recursos · RECOMENDADO.Read more,"Jul 15, 2025 — 01. Light plan ($17/month) · 02. Core plan ($29/month) · 03. Business plan ($39/month) · 04. Business elite ($159/month).Read more"
website builder apps,244,590,72,3.71,I,website builder,ok,,,,,Squarespace Website Builder,Build a Website,Wix Studio,,,
phone app builder software,245,480,59,5.08,I,app builder,ok,,,,,Build An App For Free,App Building Platform,No-Code Mobile App Creator | Send Push Notifications Easily,,,
html website builder free,246,480,59,1.75,I,free website builder,ok,,https://www.wix.com/builder/html,https://teleporthq.io/professional-website-builder,https://www.canva.com/website-builder/,HTML Website Builder: Create For Free,Drag and Drop Website Builder with Code Export,Website Builder - Create a Free Website,Create without limits using an HTML website builder. Build a unique powerful website using 1000s of intuitive design features and advanced AI tools.Read more,"TeleportHQ is a professional FREE drag and drop website builder, with clean code export to HTML, CSS, and 5 different JavaScript frameworks.Read more","Design and launch a professional, no-code website in minutes with Canva's free website builder. Publish in moments, not months.Read more"
website builder free html,247,480,59,1.75,I,free website builder,ok,,https://www.wix.com/builder/html,https://www.canva.com/website-builder/,https://teleporthq.io/professional-website-builder,HTML Website Builder: Create For Free,Website Builder - Create a Free Website,Drag and Drop Website Builder with Code Export,Create without limits using an HTML website builder. Build a unique powerful website using 1000s of intuitive design features and advanced AI tools.Read more,"Design and launch a professional, no-code website in minutes with Canva's free website builder. Publish in moments, not months.Read more","TeleportHQ is a professional FREE drag and drop website builder, with clean code export to HTML, CSS, and 5 different JavaScript frameworks.Read more"
free html website builders,248,480,59,1.75,I,free website builder,ok,,,,,Best No-Code Builders 2026,Make A Website For Free,Hostinger Website Builder | Sites Lindos em Qualquer Tela,,,
