keyword,priority,volume,kd,cpc,intent,seed,flag,published,Ссылка конкурента 1,Ссылка конкурента 2,Ссылка конкурента 3,Заголовок конкурента 1,Заголовок конкурента 2,Заголовок конкурента 3,Сниппет конкурента 1,Сниппет конкурента 2,Сниппет конкурента 3
best website builder programs,134,480,45,3.29,I,best website builder,ok,,https://www.top10-websitehosting.co.uk/best-free-website-builders/,https://www.experte.com/website-builder,https://www.reddit.com/r/smallbusiness/comments/1fhx0gm/what_is_the_best_platform_to_build_a_website_on/,8 Best Free Website Builders 2026 (My Personal Experience),14 Best Website Builders for 2026 - Tested & Ranked,What is the best platform to build a website on?,1. Hostinger – Best Website Builder Overall. Beginner users who need to build their very first website will find the intuitiveness of Hostinger to be ideal.Read more,"Wix offers the best balance of user-friendliness, flexibility, and features in the website builder market: If you want to create a dynamic, personalized website ...Read more",Squarespace and Shopify are pretty impressive website builder for creating any type of website.Read more
comparison website builders,135,590,67,4,"I,N",website builder,ok,,,,,Best Website Builder for Pros - Best Place to Create a Website,Award-Winning Web Designs,10 best website builders to create your website,,,
no-code website builder,136,590,56,3.22,I,website builder,ok,,https://www.framer.com/,https://www.reddit.com/r/nocode/comments/1kxwfnf/best_no_code_website_builders_for_beginners/,https://siter.io/,"Framer: Create a professional website, free. No code website ...",Best no code website builders for beginners? : r/nocode,"Siter.io: No-Code Website Builder, Web Design Tool","Build a free website with Framer—enjoy full design freedom, powerful CMS, built-in SEO, and real-time collaboration. Create professional, fully custom sites ...","Go with an established tool and a vibrant community like Flutter Flow, Glide, Adalo, Wappler, Framer, Wix, Bubble.Read more","Unlock your creative potential with our intuitive no-code website builder. Craft websites in minutes, no coding needed, and tailor every detail to your vision.Read more"
no-code website builders,137,590,56,3.22,I,website builder,ok,,https://www.reddit.com/r/nocode/comments/1kxwfnf/best_no_code_website_builders_for_beginners/,https://lovable.dev/guides/best-no-code-website-builders,https://siter.io/,Best no code website builders for beginners? : r/nocode,Best No-Code Website Builders Compared (2025),"Siter.io: No-Code Website Builder, Web Design Tool","Go with an established tool and a vibrant community like Flutter Flow, Glide, Adalo, Wappler, Framer, Wix, Bubble.Read more","Oct 20, 2025 — Best No-Code Website Builders Compared (2025) · 1. Lovable · 2. Webflow · 3. Framer · 4. Wix · 5. Softr · 6. Bubble. Bubble provides a visual ...Read more","Unlock your creative potential with our intuitive no-code website builder. Craft websites in minutes, no coding needed, and tailor every detail to your vision.Read more"
site builder wysiwyg,138,590,56,1.33,I,site builder,ok,,,,,"AI AppGen, Enterprise Secure - Don't Build From Scratch",Wix Studio,Construtor De Sites - 5 Melhores Criadores de Sites,,,
website builder free trial,139,590,68,12.83,"I,N",website builder,ok,,https://www.wix.com/,https://www.squarespace.com/free-website-builder-trial,https://www.weebly.com/?lang=en,Wix.com: Website Builder - Create a Free Website In Minutes,Create a Website for Free — Website Builder Trial,Free Website Builder: Build a Free Website or Online Store ...,"Get everything you need to build a website your way. Wix's free, easy-to-use website builder offers 2000+ templates, built-in AI tools and a custom domain.","Try Squarespace for free to explore our website builder and features before subscribing. Start your free website trial today, no credit card required.","Weebly's free website builder makes it easy to create a website, blog, or online store. Find customizable templates, domains, and easy-to-use tools for any ..."
offline website creator software,140,480,46,1.56,I,website creator,ok,,https://nicepage.com/lp-offline-website-builder,https://superbwebsitebuilders.com/best-offline-website-builder-software/,https://cpoclub.com/tools/best-offline-web-design-software/,Offline Website Builder Software,Best Offline Website Builder Software | 15 Free Downloadable ...,10 Best Offline Web Design Software Reviewed in 2026,All You Need For HTML And More · 15000+ Templates · Easy Drag-n-Drop · No Coding · Mobile-Friendly. Build websites that look great on all modern devices ...Read more,"Jan 10, 2025 — Best Offline Website Builder Software · 1. WordPress · 2. Webflow · 3. Dreamweaver · 4. Mobirise · 5. TemplateToaster · 6. Wix · 7. Adobe ...Read more","Feb 23, 2026 — Best Offline Web Design Software Shortlist · 1. Adobe Dreamweaver — Best for coding flexibility · 2. Appy Pie — Best for AI-powered no-code app ...Read more"
affiliate website creator,141,480,46,3.46,I,website creator,ok,,https://replit.com/build/affiliate-website-builder,https://www.websiteplanet.com/blog/best-website-builders-for-affiliate-marketing/,https://www.boxmode.com/affiliate-marketing-website-builder,AI Affiliate Website Builder | Create for Free,10 Best Website Builders for Affiliate Marketing in 2026,"Affiliate Website Builder | Amazon, eBay, Clickbank ...","Build your site with Replit, the best website builder for affiliate marketing. Our Affiliate Website Builder helps you go from idea to launch fast.","Oct 10, 2025 — Webador is a beginner-friendly builder that simplifies the creation of basic affiliate websites. Its drag-and-drop editor is intuitive and easy ...Read more",Boxmode is a leading website builder for affiliate marketing that can help you create a suitable website for your business.Read more
top 10 site builders,142,480,46,3.8,I,site builder,ok,,https://www.experte.com/website-builder,https://www.tooltester.com/en/best-website-builder/,https://elementor.com/blog/pt-br/7-melhores-criadores-de-sites-gratuitos-de-year/,14 Best Website Builders for 2026 - Tested & Ranked,17 Best Website Builders in 2026,7 Melhores Criadores de Sites Gratuitos de 2026,Strikingly is worth a look if you're searching for an affordable website builder for one-pagers and simple sites that aren't going to win any design awards.Read more,"3 days ago — In our study of the 17 top website builders, we included Wix, Squarespace, WordPress and more. But which site builder is best for you?","Dec 26, 2025 — Elementor: Focado em design, fácil de usar, grande flexibilidade de design, AI Builder, recursos avançados (Melhor para SEO). Wix: Fácil de usar ...Read more"
ai app builder free,143,590,57,4.4,I,app builder,ok,,https://www.figma.com/solutions/ai-app-builder/,https://www.glideapps.com/,https://base44.com/blog/best-free-ai-app-builders,Free No-code AI App Builder - Idea to App in Seconds,"No Code App Builder: Create Custom, AI-Powered Apps | Glide",5 best free AI app builders to use now,"Apr 2, 2026 — Build apps with AI in Figma Make. Turn ideas into interactive, data-connected apps and prototypes—refine, test, and publish with no coding ...",Glide makes it easy to build and deploy powerful custom apps powered by AI with no code. Create your first app by trying Glide for free.,"Mar 22, 2026 — 5 best free AI app builders to start using today · 01. Base44 · 02. Bubble · 03. Glide · 04. Softr · 05. Emergent.Read more"
leading ecommerce platforms,144,590,57,2.62,I,ecommerce platform,ok,,https://www.emailvendorselection.com/best-ecommerce-platforms-review/,https://www.iubenda.com/en/blog/top-5-most-popular-ecommerce-platforms-for-your-online-store/,https://www.statista.com/statistics/245340/leading-large-cap-e-commerce-companies-market-cap/,"10 Best Ecommerce Platforms in 2026 (Reviewed, ...",Top 5 Most Popular Ecommerce Platforms for Your Online ...,Top large cap e-commerce companies by market cap 2026,"Dec 2, 2025 — Shopify is the most popular ecommerce platform in the world. Launched in 2004, Shopify hosts over 1 million eshops.Read more",Which Popular Ecommerce Platform is Right for Your Business? · Shopify – The Leading Ecommerce Platform · BigCommerce – The Scalable Solution for Growing ...Read more,"Feb 17, 2026 — With a market cap of over two trillion U.S. dollars, Amazon ranks first among the leading large-cap e-commerce companies worldwide.Read more"
forms builder wordpress,145,590,57,2.55,I,form builder,ok,,https://www.gravityforms.com/,https://br.wordpress.org/plugins/wpforms-lite/,https://jetformbuilder.com/,Gravity Forms | The Best WordPress Form Plugin | Form Builder,WPForms –Editor de formulários simplificado para o ...,JetFormBuilder – Best WordPress Form Builder Plugin,"Create custom forms on WordPress with Gravity Forms, the easiest-to-use, secure, and reliable WordPress form builder plugin for your website.","O melhor plugin de formulário de contato para o WordPress. Arraste e solte o editor de formulários para criar incríveis formulários de contato, de pagamento ...","Build custom WordPress forms visually in the Block editor, Elementor, and Bricks using JetFormBuilder core and add-ons. Discover 19 field types, AI form ..."
seo website builder,146,590,58,7.09,I,website builder,ok,,https://www.duda.co/,https://aioseo.com/best-website-builder-for-seo/,https://developers.google.com/search/docs/fundamentals/seo-starter-guide,Duda | The AI-Ready Website Platform Built for Pros,My Top 12 Picks for the Best Website Builders for SEO (2026),Search Engine Optimization (SEO) Starter Guide,"Builders can generate and modify text, improve their SEO, recommend additional pages, improve page design, create custom widgets, enhance client onboarding ...Read more","Feb 25, 2026 — Best WordPress Builders for SEO · 1. WordPress.org (Self-Hosted) · 2. SeedProd · 3. MemberPress · 4. Avada · 5. WPBakery · WPBakery home page ...Read more",A knowledge of basic SEO can have a noticeable impact. Explore the Google SEO starter guide for an overview of search engine optimization essentials.
free website builder with ecommerce,147,590,58,4.1,I,website builder,ok,,https://www.weebly.com/?lang=en,https://www.reddit.com/r/ecommerce/comments/1hhmi60/any_free_ecommerce_website_builders_with_no/,https://freewebstore.com/,Free Website Builder: Build a Free Website or Online Store ...,Any free e-commerce website builders with no monthly/ ...,Create a Free Online Store or eCommerce Website,"Weebly's free website builder makes it easy to create a website, blog, or online store. Find customizable templates, domains, and easy-to-use tools for any ...",Jotform Store Builder is a free e-commerce website builder that has a free plan. That might be enough for you. It doesn't take commissions ...Read more,Our simple yet powerful ecommerce solution allows users of all abilities to operate a successful online store - for free.Read more
no-code ai app builder,148,590,58,4.89,I,app builder,ok,,https://www.glideapps.com/,https://shipper.now/ai-no-code-app-builders/,https://www.figma.com/solutions/ai-app-builder/,"No Code App Builder: Create Custom, AI-Powered Apps | Glide",Best AI No-Code App Builders in 2026: Tested & Reviewed,Free No-code AI App Builder - Idea to App in Seconds,Glide makes it easy to build and deploy powerful custom apps powered by AI with no code. Create your first app by trying Glide for free.,"Jan 14, 2026 — Currently, these are the best AI no-code app builders: 1) Shipper, 2) v0, 3) Lovable, 4) Replit, 5) Bubble, 6) Base44. But what makes ...Read more","Apr 2, 2026 — Build apps with AI in Figma Make. Turn ideas into interactive, data-connected apps and prototypes—refine, test, and publish with no coding ..."
major ecommerce platforms,149,590,58,2.62,I,ecommerce platform,ok,,https://www.emailvendorselection.com/best-ecommerce-platforms-review/,https://businesswith.com/e-commerce-platform/,https://zapier.com/blog/best-ecommerce-shopping-cart-software/,"10 Best Ecommerce Platforms in 2026 (Reviewed, ...",Best E-commerce Platforms 2026 | Compare 85 Systems,The 6 best eCommerce website building platforms in 2026,"Dec 2, 2025 — Shopify is the most popular ecommerce platform in the world. Launched in 2004, Shopify hosts over 1 million eshops.Read more","Compare the best E-commerce Platforms of 2026. Reviews, prices, and features help you find the right system.","Jan 23, 2026 — The 6 best eCommerce website building platforms for online stores in 2026 · Shopify · Square · Ecwid by Lightspeed · BigCommerce · WooCommerce · Wix ...Read more"
ai landing page builder,150,590,58,6.96,I,landing page builder,ok,,,,,Build Beautiful Front-Ends,Fast AI Landing Page Generator,Build Landing Pages with AI | No-Code Landing Page Builder,,,
ai generator apps,151,590,58,1.31,I,ai app generator,ok,,https://play.google.com/store/apps/details?id=ai.leonardo.leonardo&hl=en,https://zapier.com/blog/best-ai-image-generator/,https://www.canva.com/ai-image-generator/,Leonardo.Ai - Image Generator - Apps on Google Play,The 8 best AI image generators in 2026,Free AI Image Generator: Online Text to Image App,3 days ago — Leonardo.Ai is a powerful AI art generator that lets you create stunning visuals and videos using world-class AI models. Whether you're ...Read more,ChatGPT for the best AI image generator overall. Nano Banana for Google users. Midjourney for artistic results. Reve for overall prompt adherence.Read more,"Produce AI generated images and art with a text prompt using Text to Image, Canva's AI photo generator. Create unique content everytime, fast."
ai photo generator apps,152,590,58,1.19,I,ai app generator,ok,,,,,AI image generation for free,Generate Images with AI,Free AI Image Generator - Fastest AI Photo Editor,,,
free trial website builder,153,590,71,12.83,"I,N",website builder,ok,,https://www.wix.com/,https://www.squarespace.com/free-website-builder-trial,https://www.canva.com/website-builder/,Wix.com: Website Builder - Create a Free Website In Minutes,Create a Website for Free — Website Builder Trial,Website Builder - Create a Free Website,"Get everything you need to build a website your way. Wix's free, easy-to-use website builder offers 2000+ templates, built-in AI tools and a custom domain.","Try Squarespace for free to explore our website builder and features before subscribing. Start your free website trial today, no credit card required.","Design and launch a professional, no-code website in minutes with Canva's free website builder. Publish in moments, not months.Read more"
no code web development platform,154,590,59,0,I,no code platform,ok,,https://nocodestartup.io/melhores-ferramentas-no-code/,https://www.nocode.tech/,https://www.oracle.com/br/application-development/no-code/,As 12 Melhores Ferramentas No Code,The Home of No-Code,What Is No-Code Development? Building Apps Without ...,"Sep 17, 2025 — Quais são as 12 melhores ferramentas no-code · Criação de sites no-code · Desenvolvimento de Aplicativos Web · Desenvolvimento de Apps No-Code.Read more","NoCode.Tech is a media platform aiming to help anyone, no matter their technical skills, navigate the digital world and build their own software using no-code ...Read more","Discover how no-code development platforms are revolutionizing app creation. Learn the benefits, use cases, and how anyone can build powerful applications."
website creator comparison,155,590,59,4,I,website creator,ok,,https://www.tooltester.com/en/best-website-builder/,https://www.pcmag.com/picks/the-best-website-builders,https://zapier.com/blog/best-website-builders/,17 Best Website Builders in 2026,The Best Website Builders We've Tested for 2026,The 5 best free website builders,"3 days ago — In our study of the 17 top website builders, we included Wix, Squarespace, WordPress and more. But which site builder is best for you?","Best Overall. Wix Website Builder · Remarkably intuitive interface ; Best for Website Customization. Squarespace Website Builder · Beautiful, responsive designs ...Read more","Sep 4, 2025 — Square Online for eCommerce. HubSpot CMS for growing businesses. Canva for beautifully designed static websites. Wix for robust features.Read more"
open source website creator,156,590,59,1.84,I,website creator,ok,,https://webstudio.is/,https://www.reddit.com/r/homelab/comments/1dtmx0j/best_open_source_free_website_builder_software/,https://www.odoo.com/app/website,Webstudio — Advanced Open Source Website Builder,Best open source (free) website builder software : r/homelab,"The #1 free, open-source Website Builder",Webstudio is an open source website builder that empowers creators to build highly maintainable and fast websites using modern web standards.,"You can try Webstudio. It's open source and selfhosting is completely free. It features a website builder, CMS, SEO, etc.Read more","Create a free website in minutes and enjoy Odoo's open-source CMS, both mobile- and SEO-friendly. Discover it now!"
top landing page builder,157,590,59,6.02,I,landing page builder,ok,,https://www.emailvendorselection.com/best-landing-page-builders/,https://www.emailtooltester.com/en/blog/best-landing-page-builder/,https://unbounce.com/,12 Best Landing Page Builders in 2026 (Free & Paid),The Best Landing Page Builder Top 13 Tools on the Market,Unbounce: The Best Landing Page Builder and CRO platform,"Feb 18, 2026 — 12 Best Landing Page Builders in 2026 (Free & Paid) · 1. Landingi · 2. Swipe Pages · 3. Unbounce · 4. Leadpages · 5. Clickfunnels · 6. Instapage.Read more","Mar 25, 2026 — If you're running a WordPress website, Elementor is our pick for the best free landing page builder (although you will still need to pay for web ...Read more","Unbounce, the leading landing page platform built for marketers and agencies. Leverage AI-driven insights powered by billions of conversions to deliver better ...Read more"
ai generator app,158,590,59,1.31,I,ai app generator,ok,,https://play.google.com/store/apps/details?id=com.tapuniverse.aiartgenerator&hl=pt,https://www.canva.com/ai-image-generator/,https://zapier.com/blog/best-ai-image-generator/,AI Art Generator: AI Picture – Apps no ...,Free AI Image Generator: Online Text to Image App,The 8 best AI image generators in 2026,"AI Art Generator usa inteligência artificial para criar obras de arte únicas e belas, inspiradas em sua própria criatividade. Com apenas alguns toques, você ...Read more","Produce AI generated images and art with a text prompt using Text to Image, Canva's AI photo generator. Create unique content everytime, fast.",ChatGPT for the best AI image generator overall. Nano Banana for Google users. Midjourney for artistic results. Reve for overall prompt adherence.Read more
ai photo generator app,159,590,59,1.19,I,ai app generator,ok,,https://play.google.com/store/apps/details?id=com.ai.photo.video.generator&hl=pt,https://zapier.com/blog/best-ai-image-generator/,https://www.canva.com/ai-image-generator/,UnicAI: AI Photo Generator – Apps no ...,The 8 best AI image generators in 2026,Free AI Image Generator: Online Text to Image App,Crie fotos incríveis com IA usando o UnicAI! Transforme suas fotos em obras de arte deslumbrantes e modernas.,ChatGPT for the best AI image generator overall. Nano Banana for Google users. Midjourney for artistic results. Reve for overall prompt adherence.Read more,"Produce AI generated images and art with a text prompt using Text to Image, Canva's AI photo generator. Create unique content everytime, fast."
website builder review,160,480,48,4.09,I,website builder,ok,,https://www.experte.com/website-builder,https://www.top10-websitehosting.co.uk/best-free-website-builders/,https://www.pcmag.com/picks/the-best-website-builders,14 Best Website Builders for 2026 - Tested & Ranked,8 Best Free Website Builders 2026 (My Personal Experience),The Best Website Builders We've Tested for 2026,"Wix offers the best balance of user-friendliness, flexibility, and features in the website builder market: If you want to create a dynamic, personalized website ...Read more",We take a look at the best free website builders including pros & cons in 2026 to help you decide on which platform is best suited for you.,"Best Overall. Wix Website Builder · Remarkably intuitive interface ; Best for Website Customization. Squarespace Website Builder · Beautiful, responsive designs ...Read more"
best website store builder,161,480,48,6.03,I,website builder,ok,,https://www.experte.com/website-builder,https://www.reddit.com/r/web_design/comments/1n92wet/whats_the_best_ecommerce_website_builder_for_a/,https://zapier.com/blog/best-ecommerce-shopping-cart-software/,14 Best Website Builders for 2026 - Tested & Ranked,What's the best ecommerce website builder for a small ...,The 6 best eCommerce website building platforms in 2026,Strikingly is worth a look if you're searching for an affordable website builder for one-pagers and simple sites that aren't going to win any design awards.Read more,"If you've already got a bricks and mortar store, Shopify will probably cover everything you need. It's quick to set up, handles the basics well, ...Read more","Jan 23, 2026 — Wix is one of the most popular site builders around, so there's also a healthy third-party app and extension marketplace. If you want to ...Read more"
10 best website builder,162,480,48,3.8,I,website builder,ok,,https://www.top10-websitehosting.co.uk/best-free-website-builders/,https://simvoly.com/the-best-website-builder,https://www.cpanel.net/blog/app-spotlight/website-builders/,8 Best Free Website Builders 2026 (My Personal Experience),Best Website Builder 2026: Top 7 Platforms Reviewed ...,10 Best Website Builders to Launch Your Site in Minutes,Hostinger – Best Website Builder Overall. Beginner users who need to build their very first website will find the intuitiveness of Hostinger to be ideal.Read more,"Jan 14, 2026 — Stop searching for the top website builder. We reviewed Simvoly, Wix, Shopify, and more to find the best value for SEO, marketing, ...","Apr 15, 2025 — Discover the top 10 website builders, their pros and cons, and features that make them perfect for building your site."
free offline drag and drop website builder,163,480,48,1.62,I,website builder,ok,,https://www.silex.me/,https://www.reddit.com/r/website/comments/1mjd215/any_free_easy_draganddropsimilar_web_design_tools/,https://www.sitebuilderreport.com/best-drag-and-drop-website-builders,"Silex: Free Website Builder, Libre Software, Open-Source No ...",Any (free) easy drag-and-drop/similar web design tools to ...,The 7 Best Drag and Drop Website Builders (2026),"Create fast websites visually, free open source tool for professional web designers and no-code developers.",There are actually quite a few website builders (e.g. Wix) that let you play around for free. You'll usually get a free subdomain (e.g. username ...Read more,"Squarespace is the best all-around website builder. It is an excellent choice for all types of websites: small businesses, bloggers, portfolios, online stores, ...Read more"
top 10 website creator,164,480,48,3.8,I,website creator,ok,,https://titan.email/best-ai-website-builders/,https://www.experte.com/website-builder,https://www.top10-websitehosting.co.uk/best-free-website-builders/,The 10 Best AI Website Builders in 2026: A Global Guide - Titan,14 Best Website Builders for 2026 - Tested & Ranked,8 Best Free Website Builders 2026 (My Personal Experience),"Mar 11, 2026 — Discover the 10 best AI website builders like Neo Sites, Olitt, Wix ADI, Hostinger, 10Web, Durable and more, to create a professional site ...","Don't waste money on the wrong website builder. See our unbiased ranking of the 14 best website builders for 2026, ranked by ease of use, template quality ...",1. Hostinger – Best Website Builder Overall. Beginner users who need to build their very first website will find the intuitiveness of Hostinger to be ideal.Read more
site builders reviews,165,480,48,4.09,I,site builder,ok,,https://www.experte.com/website-builder,https://www.top10-websitehosting.co.uk/best-free-website-builders/,https://larryludwig.com/sitebuilder-review/,14 Best Website Builders for 2026 - Tested & Ranked,8 Best Free Website Builders 2026 (My Personal Experience),SiteBuilder Review – Pros & Cons Of Using Website Builder,You can find all of our website builder reviews in our comprehensive comparison. We've also separately compared the most popular builders for online shops.Read more,1. Hostinger – Best Website Builder Overall. Beginner users who need to build their very first website will find the intuitiveness of Hostinger to be ideal.Read more,"Jun 23, 2023 — SiteBuilder is a great choice for a simple, quick, no-fuss website. They have competitive pricing, good functionality, and a good user ...Read more"
top 10 web builder sites,166,480,48,3.8,I,site builder,ok,,https://titan.email/best-ai-website-builders/,https://www.top10-websitehosting.co.uk/best-free-website-builders/,https://www.experte.com/website-builder,The 10 Best AI Website Builders in 2026: A Global Guide - Titan,8 Best Free Website Builders 2026 (My Personal Experience),14 Best Website Builders for 2026 - Tested & Ranked,"Mar 11, 2026 — Discover the 10 best AI website builders like Neo Sites, Olitt, Wix ADI, Hostinger, 10Web, Durable and more, to create a professional site ...",We take a look at the best free website builders including pros & cons in 2026 to help you decide on which platform is best suited for you.,Strikingly is worth a look if you're searching for an affordable website builder for one-pagers and simple sites that aren't going to win any design awards.Read more
