keyword,priority,volume,kd,cpc,intent,seed,flag,published,Ссылка конкурента 1,Ссылка конкурента 2,Ссылка конкурента 3,Заголовок конкурента 1,Заголовок конкурента 2,Заголовок конкурента 3,Сниппет конкурента 1,Сниппет конкурента 2,Сниппет конкурента 3
who created chatgpt,1,9900,72,0.02,I,chatgpt,ok,,,,,,,,,,
how do i disable javascript in tor,2,590,5,0,I,javascript,ok,,https://www.reddit.com/r/TOR/comments/t36oqt/how_to_disable_javascript_properly/,https://support.torproject.org/tor-browser/features/plugins/,https://4geeks.com/how-to/how-to-disable-javascript-in-tor,How to disable Javascript properly? : r/TOR,"Can I use plugins, add-ons, or extensions in Tor Browser?",How to disable Javascript in tor?,"Tor -> Options -> Privacy & Security -> Safest mode. Or in the url tab put in "" about:config "" and search for "" ...Read more","For users who want to have JavaScript disabled on all HTTP sites by default, we recommend changing your Tor Browser's Security Levels option. This can be done ...Read more","To disable Javascrpt in Tor browser, you´ll have to go to Settings -> Privacy and Security -> scroll down until Security level and select the option you want, ...Read more"
when was chatgpt released,3,6600,71,0,I,chatgpt,ok,,,,,,,,,,
javascript what,4,6600,73,0.07,I,javascript,ok,,,,,,,,,,
how to disable javascript in tor,5,590,6,0,I,javascript,ok,,,,,,,,,,
how to turn off javascript on tor,6,590,6,0,I,javascript,ok,,https://www.reddit.com/r/TOR/comments/1lu92j9/why_cant_i_disable_javascript/,https://support.torproject.org/tor-browser/features/plugins/,https://4geeks.com/how-to/how-to-disable-javascript-in-tor,Why can't i disable javascript? : r/TOR,"Can I use plugins, add-ons, or extensions in Tor Browser?",How to disable Javascript in tor?,"type ""about:config"" in the address bar and search java then change javascript.enabled to false. Nika_4791. OP • 9mo ago. Can this also be ...Read more","For users who want to have JavaScript disabled on all HTTP sites by default, we recommend changing your Tor Browser's Security Levels option. This can be done ...Read more","To disable Javascrpt in Tor browser, you´ll have to go to Settings -> Privacy and Security -> scroll down until Security level and select the option you want, ...Read more"
how much does chatgpt cost,7,5400,74,0.41,I,chatgpt,ok,,https://chatgpt.com/pricing/,https://openai.com/pt-BR/business/chatgpt-pricing/,https://chatgpt.com/pt-BR/pricing/,"ChatGPT Plans | Free, Go, Plus, Pro, Business, and ...",Preços do ChatGPT,"Planos do ChatGPT | Gratuito, Go, Plus, Pro, Business e ...","The free version of ChatGPT is available to everyone. Upgrading to Go, Plus, Business, or Enterprise offers a more powerful experience through additional ...Read more","Confira os preços dos nossos planos individuais, planos Business e Enterprise. Business. Um espaço de trabalho seguro ...Read more","Mensagens ilimitadas do GPT-5.4, com acesso generoso ao GPT-5.4 Thinking e ao GPT-5.4 Pro — além da flexibilidade para adicionar créditos conforme necessário.Read more"
how much is chatgpt,8,5400,75,0.65,I,chatgpt,ok,,,,,,,,,,
what is a saas,9,4400,77,0.35,I,saas,ok,,,,,,,,,,
how long does it take to learn javascript,10,390,7,1.42,I,javascript,ok,,https://www.reddit.com/r/learnprogramming/comments/qz5els/realistically_how_long_will_it_take_to_learn/,https://www.coursera.org/articles/how-long-does-it-take-to-learn-javascript,https://tripleten.com/blog/posts/mastering-javascript-a-comprehensive-guide-tripleten-bootcamp,Realistically how long will it take to learn JavaScript?,How Long Does It Take to Learn JavaScript?,How Long Does It Take to Learn JavaScript in 2025?,It can take six to nine months to become proficient in JavaScript if you are learning on your own. Some of that time is spent learning how to think like a ...Read more,"Sep 24, 2025 — While you can grasp the fundamentals of JavaScript in a few weeks to months, achieving proficiency in more advanced concepts typically takes ...Read more","Feb 22, 2024 — On average, it could take you anywhere from 3-6 months depending on how dedicated you are. You can certainly gain an entry-level, working knowledge of ...Read more"
how to end a program in python,11,590,12,0,I,python programming,ok,,https://stackoverflow.com/questions/73663/how-do-i-terminate-a-script,https://www.codecademy.com/article/python-exit-commands-quit-exit-sys-exit-os-exit-and-keyboard-shortcuts,https://www.reddit.com/r/learnpython/comments/16o2mzm/terminate_code/,python - How do I terminate a script?,"Python Exit Commands: quit(), exit(), sys.exit(), os._exit() ...",Terminate code : r/learnpython,"A simple way to terminate a Python script early is to use the built-in quit() function. There is no need to import any library, and it is efficient and simple.Read more","Typing quit shows message: “Use Ctrl-D (i.e., EOF) to exit.” Same message as quit(). Both are effectively the same under the hood, intended for convenience ...Read more","Your program will terminate normally when you reach the end. You just have to make sure it reaches the end. Without seeing what you're doing, it's hard to give ...Read more"
how do you end a program in python,12,590,12,0,I,python programming,ok,,https://stackoverflow.com/questions/73663/how-do-i-terminate-a-script,https://www.codecademy.com/article/python-exit-commands-quit-exit-sys-exit-os-exit-and-keyboard-shortcuts,https://www.reddit.com/r/learnpython/comments/16o2mzm/terminate_code/,python - How do I terminate a script?,"Python Exit Commands: quit(), exit(), sys.exit(), os._exit() ...",Terminate code : r/learnpython,"A simple way to terminate a Python script early is to use the built-in quit() function. There is no need to import any library, and it is efficient and simple.Read more",Using quit() to exit Python program. The quit() command in Python is often used to stop execution while working in the interpreter. It offers a quick and ...Read more,"Your program will terminate normally when you reach the end. You just have to make sure it reaches the end. Without seeing what you're doing, it's hard to give ...Read more"
how to exit a program in python,13,590,12,0,I,python programming,ok,,https://stackoverflow.com/questions/73663/how-do-i-terminate-a-script,https://www.codecademy.com/article/python-exit-commands-quit-exit-sys-exit-os-exit-and-keyboard-shortcuts,https://www.geeksforgeeks.org/python/python-exit-commands-quit-exit-sys-exit-and-os-_exit/,python - How do I terminate a script?,"Python Exit Commands: quit(), exit(), sys.exit(), os._exit() ...","Python exit commands: quit(), exit(), sys.exit() and os._exit()","A simple way to terminate a Python script early is to use the built-in quit() function. There is no need to import any library, and it is efficient and simple.Read more",Using quit() to exit Python program. The quit() command in Python is often used to stop execution while working in the interpreter. It offers a quick and ...Read more,"Jul 12, 2025 — Note: In interactive mode (running Python in the terminal), you can typically exit by typing exit() or quit() without parentheses. Python Exit ...Read more"
how to end python program,14,590,12,0,I,python programming,ok,,,,,,,,,,
how to enable javascript,15,3200,76,0.03,I,javascript,ok,,https://www.enable-javascript.com/,https://support.google.com/adsense/answer/12654?hl=en,https://www.google.com/httpservice/retry/enablejs,How to enable JavaScript in your browser and why,Allow JavaScript in your browser - Google AdSense Help,Enable JavaScript to use search,"In the ""Security"" tab section ""Web content"" mark the ""Enable JavaScript"" checkbox. Click on the ""Reload the current page"" button of ...Read more","Under ""Advanced,"" tap Site settings and then JavaScript. Turn on Javascript. On your iPhone and iPad. JavaScript is turned on by default for iPhone and ...Read more","Go to Settings. Click Advanced in the left sidebar, and click Privacy & security. Click Site settings. Click JavaScript. At the top, turn on Allowed."
how to execute javascript,16,590,14,1.09,I,javascript,ok,,https://www.reddit.com/r/learnjavascript/comments/qx7d14/how_do_i_execute_my_javascript_code/,https://developer.chrome.com/docs/devtools/console/javascript,https://stackoverflow.com/questions/8532960/how-do-you-run-javascript-script-through-the-terminal,how do i execute my javascript code ? : r/learnjavascript,Run JavaScript in the Console | Chrome DevTools,How do you run JavaScript script through the Terminal?,"A quick and simple way to run JS without installing anything is with your web browser. On any tab you can hit F12 or Ctrl+Shift+I , which should ...Read more","Apr 18, 2018 — This interactive tutorial shows you how to run JavaScript in the Chrome DevTools Console. See Get Started With Logging Messages to learn how to log messages to ...Read more","Another answer would be the NodeJS! Node.js is a platform built on Chrome's JavaScript runtime for easily building fast, scalable network ...Read more"
how run javascript,17,590,14,1.09,I,javascript,ok,,https://www.reddit.com/r/learnjavascript/comments/qx7d14/how_do_i_execute_my_javascript_code/,https://developer.chrome.com/docs/devtools/console/javascript,https://stackoverflow.com/questions/8532960/how-do-you-run-javascript-script-through-the-terminal,how do i execute my javascript code ? : r/learnjavascript,Run JavaScript in the Console | Chrome DevTools,How do you run JavaScript script through the Terminal?,"A quick and simple way to run JS without installing anything is with your web browser. On any tab you can hit F12 or Ctrl+Shift+I , which should ...Read more","Apr 18, 2018 — This interactive tutorial shows you how to run JavaScript in the Chrome DevTools Console. See Get Started With Logging Messages to learn how to log messages to ...Read more","Another answer would be the NodeJS! Node.js is a platform built on Chrome's JavaScript runtime for easily building fast, scalable network ...Read more"
how to run javascript,18,590,14,1.09,I,javascript,ok,,https://www.reddit.com/r/learnjavascript/comments/qx7d14/how_do_i_execute_my_javascript_code/,https://developer.chrome.com/docs/devtools/console/javascript,https://www.youtube.com/watch?v=w2z-HAf1qQk,how do i execute my javascript code ? : r/learnjavascript,Run JavaScript in the Console | Chrome DevTools,How To Run JavaScript locally on your computer,"A quick and simple way to run JS without installing anything is with your web browser. On any tab you can hit F12 or Ctrl+Shift+I , which should ...Read more","Apr 18, 2018 — This interactive tutorial shows you how to run JavaScript in the Chrome DevTools Console. See Get Started With Logging Messages to learn how to log messages to ...Read more",In this video I wanted to talk through four different ways that you can run JavaScript locally on your computer.
how do i run javascript,19,590,14,1.09,I,javascript,ok,,https://www.reddit.com/r/learnjavascript/comments/qx7d14/how_do_i_execute_my_javascript_code/,https://developer.chrome.com/docs/devtools/console/javascript,https://code.visualstudio.com/docs/languages/javascript,how do i execute my javascript code ? : r/learnjavascript,Run JavaScript in the Console | Chrome DevTools,JavaScript in Visual Studio Code,"A quick and simple way to run JS without installing anything is with your web browser. On any tab you can hit F12 or Ctrl+Shift+I , which should ...Read more","Apr 18, 2018 — Press Command+Option+J (Mac) or Control+Shift+J (Windows, Linux, ChromeOS) to open the Console, right here on this very page.Read more","To check if a JavaScript file is part of JavaScript project, just open the file in VS Code and run the JavaScript: Go to Project Configuration command.Read more"
how to run a javascript,20,590,16,1.09,I,javascript,ok,,https://www.reddit.com/r/learnjavascript/comments/qx7d14/how_do_i_execute_my_javascript_code/,https://developer.chrome.com/docs/devtools/console/javascript,https://code.visualstudio.com/docs/languages/javascript,how do i execute my javascript code ? : r/learnjavascript,Run JavaScript in the Console | Chrome DevTools,JavaScript in Visual Studio Code,"A quick and simple way to run JS without installing anything is with your web browser. On any tab you can hit F12 or Ctrl+Shift+I , which should ...Read more","Apr 18, 2018 — This interactive tutorial shows you how to run JavaScript in the Chrome DevTools Console. See Get Started With Logging Messages to learn how to log messages to ...Read more","To check if a JavaScript file is part of JavaScript project, just open the file in VS Code and run the JavaScript: Go to Project Configuration command.Read more"
what is typescript,21,2400,70,0.06,I,typescript,ok,,https://www.typescriptlang.org/,https://www.reddit.com/r/javascript/comments/1f0ee5i/askjs_what_is_typescript_though/,https://www.w3schools.com/typescript/typescript_intro.php,TypeScript: JavaScript With Syntax For Types.,[AskJS] what IS typescript though? : r/javascript,TypeScript Introduction,"TypeScript is a strongly typed programming language that builds on JavaScript, giving you better tooling at any scale.Read more",TypeScript is a free and open-source high-level programming language developed by Microsoft that adds static typing with optional type ...Read more,"TypeScript is a syntactic superset of JavaScript which adds static typing. This basically means that TypeScript adds syntax on top of JavaScript, allowing ...Read more"
how to end program in python,22,590,18,0,I,python programming,ok,,https://stackoverflow.com/questions/73663/how-do-i-terminate-a-script,https://www.codecademy.com/article/python-exit-commands-quit-exit-sys-exit-os-exit-and-keyboard-shortcuts,https://www.reddit.com/r/learnpython/comments/16o2mzm/terminate_code/,python - How do I terminate a script?,"Python Exit Commands: quit(), exit(), sys.exit(), os._exit() ...",Terminate code : r/learnpython,"A simple way to terminate a Python script early is to use the built-in quit() function. There is no need to import any library, and it is efficient and simple.Read more","When a Python program needs to terminate instantly, bypassing all cleanup routines and exception handling, os._exit() is the go-to command. This low-level ...Read more","Your program will terminate normally when you reach the end. You just have to make sure it reaches the end. Without seeing what you're doing, it's hard to give ...Read more"
how to enable javascript in mac,23,480,15,0,I,javascript,ok,,https://discussions.apple.com/thread/254033496,https://www.bu.edu/tech/support/browsers/display-mixed-content/mac/enable-cookies-and-javascript/mac/,https://www.browserstack.com/guide/enabling-javascript-on-safari,How do I enable Java script,Enable Cookies and JavaScript – Mac OS X : TechWeb,Enabling JavaScript on Safari,"Jul 11, 2022 — Go to Safari > Preferences and click on Security (has a padlock symbol). There at the bottom you'll see a check box for activating/de-activating Java script.Read more","Enable Cookies and JavaScript – Mac OS X. Safari 5 to 10, Firefox 4 to (FRC), Chrome (SRC). Enable Cookies; Enable JavaScript. fx-logo-sm Enable cookies in ...Read more","Dec 13, 2024 — On Mac: Open Safari, click Safari in the top menu, select Settings, go to Security, and check “Enable JavaScript.” · On iOS: Go to Settings > ..."
how to enable javascript on mac,24,480,15,0,I,javascript,ok,,https://discussions.apple.com/thread/254033496,https://www.bu.edu/tech/support/browsers/display-mixed-content/mac/enable-cookies-and-javascript/mac/,https://www.browserstack.com/guide/enabling-javascript-on-safari,How do I enable Java script,Enable Cookies and JavaScript – Mac OS X : TechWeb,Enabling JavaScript on Safari,"Jul 11, 2022 — Go to Safari > Preferences and click on Security (has a padlock symbol). There at the bottom you'll see a check box for activating/de-activating Java script.Read more","Enable Cookies and JavaScript – Mac OS X. Safari 5 to 10, Firefox 4 to (FRC), Chrome (SRC). Enable Cookies; Enable JavaScript. fx-logo-sm Enable cookies in ...Read more","Dec 13, 2024 — On Mac: Open Safari, click Safari in the top menu, select Settings, go to Security, and check “Enable JavaScript.” · On iOS: Go to Settings > ..."
how to enable javascript on a mac,25,480,15,0,I,javascript,ok,,,,,,,,,,
how to get chatgpt,26,2400,81,0.98,I,chatgpt,ok,,https://chatgpt.com/auth/login,https://chatgpt.com/,https://chatgpt.com/download/,Get started,ChatGPT,Download ChatGPT,Get started. Log in. Sign up for free. Try it first. ChatGPT. Terms of use|Privacy policy.Read more,"ChatGPT is your AI chatbot for everyday use. Chat with the most advanced AI to explore ideas, solve problems, and learn faster.","Download ChatGPT. Chat on the go, have voice conversations, and ask about photos. Download for Android.Read more"
how to print javascript,27,390,13,0,I,javascript,ok,,https://www.w3schools.com/js/js_output.asp,https://stackoverflow.com/questions/34733505/how-can-i-print-to-the-console-using-javascript,https://www.altcademy.com/blog/how-to-print-in-javascript/,JavaScript Output,How can I print to the console using JavaScript?,How To Print In JavaScript - Altcademy.com,The only exception is that you can call the window.print() method in the browser to print the content of the current window. Example. Read more,"That looks like you're confusing JavaScript with Java. They're not the same language. NetBeans is a development environment for Java, ...Read more","Jun 2, 2023 — In this blog post, we learned about various methods to print in JavaScript, including console.log() , document.write() , innerHTML , innerText , ...Read more"
who invented chatgpt,28,1900,70,0.02,I,chatgpt,ok,,https://en.wikipedia.org/wiki/Sam_Altman,https://www.scribbr.com/frequently-asked-questions/who-created-chatgpt/,https://www.spurnow.com/en/blogs/who-invented-chatgpt-and-when,Sam Altman,Who created ChatGPT?,Who Invented ChatGPT? (It Wasn't One Person) - Spur,"Samuel Harris Altman (born April 22, 1985) is an American businessman and entrepreneur who has been the chief executive officer (CEO) of the artificial ...Read more","ChatGPT was created by OpenAI, an AI research company. It started as a nonprofit company in 2015 but became for-profit in 2019. Its CEO is Sam Altman.Read more","Nov 20, 2025 — TL;DR: ChatGPT wasn't invented by one person. It's the result of collaborative work by OpenAI's team of researchers and engineers, led by CEO ...Read more"
how to pronounce saas,29,390,14,0,I,saas,ok,,https://www.reddit.com/r/sales/comments/142c451/how_do_you_pronounce_saas/,https://www.oxfordlearnersdictionaries.com/us/definition/english/saas,https://www.howtopronounce.com/saas,How do you pronounce SaaS? : r/sales,"SaaS noun - Definition, pictures, pronunciation and usage ...",How to pronounce SAaS | HowToPronounce.com,"SaaS, which stands for ""Software as a Service,"" is typically pronounced as ""sass."" JustEconomist3112. • 3y ago. Ass… the first S is ...Read more","Definition of SaaS noun in Oxford Advanced Learner's Dictionary. Meaning, pronunciation, picture, example sentences, grammar, usage notes, synonyms and ...","How to say SAaS in English? Pronunciation of SAaS with 23 audio pronunciations, 4 meanings, 5 translations, 4 sentences and more for SAaS."
how to comment in javascript,30,390,14,0,I,javascript,ok,,https://www.w3schools.com/js/js_comments.asp,https://mimo.org/glossary/javascript/comment,https://brainstation.io/learn/javascript/comment,JavaScript Comments,"JavaScript Comment: Syntax, Usage, and Examples",JavaScript Comment (2026 Tutorial & Examples),Multi-line comments start with /* and end with */ . Any text between /* and */ will be ignored by JavaScript. This example uses a multi-line comment (a comment ...Read more,"Write clear, purposeful JavaScript comments to explain logic, disable code, and document functions. Use // for single lines and /* */ for blocks.","When testing your own code, adding two forward slashes // in front of code lines will convert the code to a comment, rather than an executable line.Read more"
how do you run javascript,31,590,22,1.09,I,javascript,ok,,,,,,,,,,
how to run a python program in terminal,32,590,24,0.32,I,python programming,ok,,https://discuss.python.org/t/how-to-run-python-terminal/74519,https://realpython.com/run-python-scripts/,https://www.reddit.com/r/learnpython/comments/111e0gu/what_is_the_simplest_way_to_run_a_a_python_script/,How to run Python Terminal,How to Run Your Python Scripts and Code,what is the simplest way to run a a python script?,"Dec 17, 2024 — Open Windows Terminal with either cmd or powershell and the command should work. cmd, powershell and python are all different programs and expect different ...Read more","Feb 25, 2026 — To run Python scripts with the python command, you need to open a command-line window and type in the word python followed by the path to your target script.Read more","Open a terminal , navigate to the folder the script is in, do python3 FILENAME.py .Read more"
what is a javascript,33,1800,77,0.07,I,javascript,ok,,,,,,,,,,
how to open javascript file,34,390,16,0,I,javascript,ok,,,,,,,,,,
how to trick chatgpt,35,390,16,0.07,I,chatgpt,ok,,https://www.reddit.com/r/ChatGPTPromptGenius/comments/1lrjfcm/5_tiny_prompt_tricks_i_wish_id_known_sooner/,https://medium.com/@reviewraccoon/10-crazy-chatgpt-tricks-that-blew-my-mind-a44279210547,https://creditosocial2023.patos.pb.gov.br/book-search/VFrmrx/0OK009/HowToTrickChatgptToAnswerQuestions.pdf,5 tiny prompt tricks I wish I'd known sooner.,10 Crazy ChatGPT Tricks That Blew My Mind,How To Trick Chatgpt To Answer Questions,"Drop the ChatGPT tone. No assistant voice, no filler, no extra context unless I ask. Respond like a real person — clean, direct, conversational.Read more",The trick: Use ChatGPT as a bias detector. Feed it your reasoning about important decisions and ask it to identify where your thinking might be ...Read more,"This article will delve into various strategies for engaging with ChatGPT effectively, helping you get the answers you seek, even when the AI may be reluctant ...Read more"
what is the difference between java and javascript,36,590,26,0.05,I,javascript,ok,,,,,,,,,,
what is difference between java and javascript,37,590,26,0.05,I,javascript,ok,,,,,,,,,,
why chatgpt is not working,38,480,21,0.12,I,chatgpt,ok,,,,,,,,,,
how do you pronounce saas,39,390,17,0,I,saas,ok,,,,,,,,,,
how to allow javascript on mac,40,480,22,0,I,javascript,ok,,,,,,,,,,
what is vertical saas,41,320,15,0.27,I,saas,ok,,,,,,,,,,
how to disable javascript in firefox,42,480,23,0,I,javascript,ok,,,,,,,,,,
what are closures in javascript,43,480,24,0.02,I,javascript,ok,,,,,,,,,,
how do i disable javascript in firefox,44,480,24,0,I,javascript,ok,,,,,,,,,,
how do i turn off javascript in firefox,45,480,24,0,I,javascript,ok,,,,,,,,,,
what is closures in javascript,46,480,24,0.02,I,javascript,ok,,https://developer.mozilla.org/en-US/docs/Web/JavaScript/Guide/Closures,https://www.w3schools.com/js/js_function_closures.asp,https://developer.mozilla.org/pt-BR/docs/Web/JavaScript/Guide/Closures,Closures - JavaScript - MDN Web Docs - Mozilla,JavaScript Function Closures,Closures - JavaScript - MDN Web Docs,"Nov 4, 2025 — A closure is the combination of a function bundled together (enclosed) with references to its surrounding state (the lexical environment).Read more","A closure is a function that has access to the parent scope, after the parent function has closed.Read more","Apr 27, 2025 — Uma closure é a combinação de uma função com as referências ao estado que a circunda (o ambiente léxico). Em outras palavras, uma closure lhe dá ...Read more"
python how to program pdf,47,480,24,1.01,I,python programming,ok,,https://theswissbay.ch/pdf/Gentoomen%20Library/Programming/Python/Python%20-%20How%20to%20Program.pdf,https://assets.openstax.org/oscms-prodcms/media/documents/Introduction_to_Python_Programming_-_WEB.pdf,https://www.halvorsen.blog/documents/programming/python/resources/Python%20Programming.pdf,Python - How to Program.pdf,Introduction to Python Programming,Python Programming.pdf,"Introduction to Computers, Internet and the World Wide Web. 2. Introduction to Python Programming. 3. Control Structures. 4. Functions.Read more","This book utilizes the OpenStax. Python Code Runner. The code runner is developed by Wiley and is All Rights Reserved. Trademarks. The OpenStax name, OpenStax ...Read more","Aug 12, 2020 — Python Programming - This is a textbook in Python Programming with lots of Practical Examples and Exercises. You will learn the necessary.Read more"
javascript how to call a function,48,590,36,0,"I,N",javascript,ok,,,,,,,,,,
what can you do with python programming language,49,590,36,0.13,"I,N",python programming,ok,,https://www.reddit.com/r/learnpython/comments/15ane9q/what_can_i_use_python_for/,https://www.coursera.org/articles/what-is-python-used-for-a-beginners-guide-to-using-python,https://realpython.com/what-can-i-do-with-python/,What can I use Python for? : r/learnpython,What Is Python Used For? A Beginner's Guide,What Can I Do With Python?,"Python is commonly used for developing websites and software, task automation, data analysis, and data visualization. Since it's relatively easy ...Read more","May 20, 2025 — Python is a computer programming language often used to build websites and software, automate tasks, and conduct data analysis.Read more","Oct 22, 2025 — Python is used in many fields, including web and desktop development, data science, artificial intelligence (AI), automation, robotics, and more ...Read more"
