keyword,priority,volume,kd,cpc,intent,seed,flag,published,Ссылка конкурента 1,Ссылка конкурента 2,Ссылка конкурента 3,Заголовок конкурента 1,Заголовок конкурента 2,Заголовок конкурента 3,Сниппет конкурента 1,Сниппет конкурента 2,Сниппет конкурента 3
what can python programming language be used for,165,390,52,0.2,I,python programming,ok,,,,,,,,,,
how do you open javascript,166,320,43,0,I,javascript,ok,,,,,,,,,,
how to run python program in windows,167,320,43,0,I,python programming,ok,,,,,,,,,,
why learn python programming,168,210,28,0.28,I,python programming,ok,,,,,,,,,,
who can see my chatgpt conversations,169,210,28,0,I,chatgpt,ok,,,,,,,,,,
what are saas paas iaas,170,210,29,0.03,I,saas,ok,,,,,,,,,,
what is python programming language good for,171,320,45,0.11,I,python programming,ok,,,,,,,,,,
what's saas,172,480,69,0.69,I,saas,ok,,,,,,,,,,
how do you enable javascript in firefox,173,320,46,0,I,javascript,ok,,,,,,,,,,
how to enable javascript in firefox browser,174,320,46,0,I,javascript,ok,,,,,,,,,,
how to learn programming python,175,320,46,1.43,I,python programming,ok,,,,,,,,,,
what is angular javascript,176,320,47,0,I,javascript,ok,,,,,,,,,,
how do i open javascript,177,320,47,0,I,javascript,ok,,,,,,,,,,
what is an object in javascript,178,260,38,0,I,javascript,ok,,,,,,,,,,
what is no code,179,210,31,0.82,I,no code,ok,,,,,,,,,,
how do you get javascript,180,260,39,0.07,I,javascript,ok,,,,,,,,,,
who created python programming,181,260,40,0,I,python programming,ok,,,,,,,,,,
how do i talk to chatgpt,182,260,40,0.69,I,chatgpt,ok,,,,,,,,,,
what is nextjs used for,183,210,33,0.01,I,nextjs,ok,,,,,,,,,,
how to learn javascript,184,290,46,1.04,I,javascript,ok,,,,,,,,,,
what is iaas paas and saas,185,210,34,0.03,I,saas,ok,,,,,,,,,,
what is chatgpt plus,186,270,44,0.09,I,chatgpt,ok,,,,,,,,,,
what is saas and cloud computing,187,260,43,0.45,I,saas,ok,,,,,,,,,,
how do i check if javascript is enabled,188,260,43,0,I,javascript,ok,,,,,,,,,,
how to start python programming,189,260,43,1.21,I,python programming,ok,,,,,,,,,,
how to use github copilot,190,240,40,1.55,I,github copilot,ok,,,,,,,,,,
what is saas iaas paas,191,210,35,0.03,I,saas,ok,,,,,,,,,,
what is saas solution,192,320,54,0.65,I,saas,ok,,,,,,,,,,
learn how to javascript,193,330,56,1.24,I,javascript,ok,,,,,,,,,,
what is low code no code,194,210,36,0.79,I,no code,ok,,,,,,,,,,
what is iaas paas saas,195,210,36,0.03,I,saas,ok,,,,,,,,,,
what are iaas paas and saas,196,210,36,0.03,I,saas,ok,,,,,,,,,,
how to javascript,197,320,56,0.7,I,javascript,ok,,,,,,,,,,
how to start a python program,198,260,46,1.21,I,python programming,ok,,,,,,,,,,
how to start learning python programming,199,260,46,1.56,I,python programming,ok,,,,,,,,,,
who created python programming language,200,260,46,0,I,python programming,ok,,,,,,,,,,
how to learn python programming fast,201,260,46,1.39,I,python programming,ok,,,,,,,,,,
how is claude different from chatgpt,202,260,46,0.02,I,chatgpt,ok,,,,,,,,,,
what is a saas business,203,260,47,0.36,I,saas,ok,,,,,,,,,,
how to make an app no code,204,260,49,3.14,I,no code,ok,,,,,,,,,,
how to start with python programming,205,260,49,1.21,I,python programming,ok,,,,,,,,,,
what is a saas solution,206,320,61,0.65,I,saas,ok,,,,,,,,,,
what is saas solutions,207,320,61,0.65,I,saas,ok,,,,,,,,,,
what are saas solutions,208,320,63,0.65,I,saas,ok,,,,,,,,,,
how to make an app no coding,209,260,52,3.14,I,no code,ok,,,,,,,,,,
saas what is it,210,290,59,0.35,I,saas,ok,,,,,,,,,,
how can i get javascript,211,260,54,0.07,I,javascript,ok,,,,,,,,,,
what does saas stand for in business,212,260,55,0.32,I,saas,ok,,,,,,,,,,
what is saas in cloud computing,213,260,57,0.45,I,saas,ok,,,,,,,,,,
what is the best way to learn python programming,214,210,46,1.87,I,python programming,ok,,,,,,,,,,
what is cloud saas,215,260,58,0.45,I,saas,ok,,,,,,,,,,
what is saas in cloud,216,260,58,0.45,I,saas,ok,,,,,,,,,,
what is cloud computing saas,217,260,58,0.45,I,saas,ok,,,,,,,,,,
where to program python,218,260,58,1.49,I,python programming,ok,,,,,,,,,,
what is saas cloud computing,219,260,61,0.45,I,saas,ok,,,,,,,,,,
what is saas cloud,220,260,61,0.45,I,saas,ok,,,,,,,,,,
how was chatgpt made,221,210,51,0,I,chatgpt,ok,,,,,,,,,,
what is python used to program,222,210,52,0.13,I,python programming,ok,,,,,,,,,,
what is python used for programming,223,210,52,0.13,I,python programming,ok,,,,,,,,,,
what is python used for in programming,224,210,54,0.13,I,python programming,ok,,,,,,,,,,
