keyword,priority,volume,kd,cpc,intent,seed,flag,published,Ссылка конкурента 1,Ссылка конкурента 2,Ссылка конкурента 3,Заголовок конкурента 1,Заголовок конкурента 2,Заголовок конкурента 3,Сниппет конкурента 1,Сниппет конкурента 2,Сниппет конкурента 3
how to disable javascript,50,440,22,0,I,javascript,ok,,https://developer.chrome.com/docs/devtools/javascript/disable,https://www.reddit.com/r/privacy/comments/ul3vv6/disable_javascript/,https://chromewebstore.google.com/detail/toggle-javascript/cidlcjdalomndpeagkjpnefhljffbnlo?hl=pt-BR,Disable JavaScript | Chrome DevTools,Disable JavaScript! : r/privacy,Toggle JavaScript - Chrome Web Store,"The Command Menu opens. Start typing javascript , select Disable JavaScript, and then press Enter to run the command. JavaScript is now disabled.Read more","Press on ublock icon. Press on the cogs to go to the dashboard. Scroll to the bottom. And under ""Default Behavior"", click on "" Disable ...Read more","Enable or disable JavaScript without the hassle. Toggle JavaScript provides a simple, easy-to-access browser button to enable or disable JavaScript globally.Read more"
what is document object model in javascript,51,590,32,0.06,I,javascript,ok,,https://www.w3schools.com/js/js_htmldom.asp,https://developer.mozilla.org/en-US/docs/Web/API/Document_Object_Model,https://www.youtube.com/watch?v=NO5kUNxGIu0,JavaScript HTML DOM,Document Object Model (DOM) - Web APIs - MDN Web Docs,The JavaScript DOM explained in 5 minutes!,"""The W3C Document Object Model (DOM) is a platform and language-neutral interface that allows programs and scripts to dynamically access and update the content, ...Read more",3 days ago — The Document Object Model (DOM) is a programming interface for web documents. It represents the page so that programs can change the document ...Read more,The Dom is the document object model. It's a JavaScript object that represents the page you see in the web browser.
how to make money using chatgpt,52,320,17,0.92,I,chatgpt,ok,,https://www.reddit.com/r/ChatGPTPro/comments/1nvzf0t/what_are_your_reallife_stories_of_making_money/,https://medium.com/@godfreyigaa/how-to-make-money-with-chat-gpt-the-exact-workflow-i-used-to-build-a-3k-month-gpt-9988a40f21db,https://www.investopedia.com/10-simple-chatgpt-methods-for-non-techies-to-earn-money-with-ease-11928848,What are your real-life stories of making money with ...,"How to make money with chat gpt ,The Exact Workflow I ...",10 Simple ChatGPT Methods for Non-Techies to Earn ...,"Made $22,000 additional after-tax income in 2023 after using ChatGPT to learn new skills, skills that the job I wanted required but not the job ...Read more","Stage 1: Problem discovery & niche pick · Stage 2: Prototype / MVP with GPT · Stage 3: Test / validate · Stage 4: Packaging, pricing & launch.Read more","Mar 21, 2026 — 10 Simple ChatGPT Methods for Non-Techies to Earn Money with Ease · Tutoring · Virtual Assistant · Travel Agent · Content Writing and Editing ...Read more"
how to print in javascript,53,390,21,0,I,javascript,ok,,https://www.w3schools.com/js/js_output.asp,https://stackoverflow.com/questions/34733505/how-can-i-print-to-the-console-using-javascript,https://www.altcademy.com/blog/how-to-print-in-javascript/,JavaScript Output,How can I print to the console using JavaScript?,How To Print In JavaScript - Altcademy.com,The only exception is that you can call the window.print() method in the browser to print the content of the current window. Example. Read more,"That looks like you're confusing JavaScript with Java. They're not the same language. NetBeans is a development environment for Java, ...Read more","Jun 2, 2023 — In this blog post, we learned about various methods to print in JavaScript, including console.log() , document.write() , innerHTML , innerText , ...Read more"
how disable javascript firefox,54,480,27,0,I,javascript,ok,,https://support.mozilla.org/en-US/kb/javascript-settings-for-interactive-web-pages,https://www.reddit.com/r/firefox/comments/12z3b40/is_there_a_way_to_turn_javascript_on_or_off/,https://www.ionos.com/digitalguide/websites/web-development/deactivating-javascript/,JavaScript settings and preferences for interactive web pages,Is there a way to turn javascript on or off without going ...,"How to disable JavaScript in Firefox, Chrome and Edge","Aug 16, 2025 — Turn off any settings to disable JavaScript in your installed extensions or try disabling your extensions to see if you can find the problem.Read more","Check Disable JavaScript in your settings to disable it by default. Using medium mode is more practical, though.Read more","Mar 13, 2024 — Step 1: Click on the menu icon (three points) in the upper right corner of your browser window and select Settings to open the browser settings.Read more"
how to turn off javascript in chrome,55,390,22,0,I,javascript,ok,,,,,,,,,,
what is closure in javascript,56,480,28,0.02,I,javascript,ok,,https://developer.mozilla.org/en-US/docs/Web/JavaScript/Guide/Closures,https://www.w3schools.com/js/js_function_closures.asp,https://developer.mozilla.org/pt-BR/docs/Web/JavaScript/Guide/Closures,Closures - JavaScript - MDN Web Docs - Mozilla,JavaScript Function Closures,Closures - JavaScript - MDN Web Docs,"Nov 4, 2025 — A closure is the combination of a function bundled together (enclosed) with references to its surrounding state (the lexical environment).Read more","A closure is a function that has access to the parent scope, after the parent function has closed.Read more","Apr 27, 2025 — Uma closure é a combinação de uma função com as referências ao estado que a circunda (o ambiente léxico). Em outras palavras, uma closure lhe dá ...Read more"
what is javascript closure,57,480,28,0.02,I,javascript,ok,,https://developer.mozilla.org/en-US/docs/Web/JavaScript/Guide/Closures,https://www.w3schools.com/js/js_function_closures.asp,https://developer.mozilla.org/pt-BR/docs/Web/JavaScript/Guide/Closures,Closures - JavaScript - MDN Web Docs - Mozilla,JavaScript Function Closures,Closures - JavaScript - MDN Web Docs,"Nov 4, 2025 — A closure is the combination of a function bundled together (enclosed) with references to its surrounding state (the lexical environment).Read more","A closure is a function that has access to the parent scope, after the parent function has closed.Read more","Apr 27, 2025 — Uma closure é a combinação de uma função com as referências ao estado que a circunda (o ambiente léxico). Em outras palavras, uma closure lhe dá ...Read more"
what is closure javascript,58,480,28,0.02,I,javascript,ok,,https://developer.mozilla.org/en-US/docs/Web/JavaScript/Guide/Closures,https://developer.mozilla.org/pt-BR/docs/Web/JavaScript/Guide/Closures,https://www.w3schools.com/js/js_function_closures.asp,Closures - JavaScript - MDN Web Docs - Mozilla,Closures - JavaScript - MDN Web Docs,JavaScript Function Closures,"Nov 4, 2025 — A closure is the combination of a function bundled together (enclosed) with references to its surrounding state (the lexical environment).Read more","Apr 27, 2025 — Uma closure é a combinação de uma função com as referências ao estado que a circunda (o ambiente léxico). Em outras palavras, uma closure lhe dá ...Read more","A closure is a function that has access to the parent scope, after the parent function has closed.Read more"
what is a javascript file,59,590,35,0,I,javascript,ok,,https://www.reddit.com/r/MacOS/comments/uijecy/what_are_js_files_can_i_delete_them/,https://developer.mozilla.org/en-US/docs/Web/API/File,https://medium.com/dev-red/what-is-a-javascript-file-82fb0d1befa9,What are JS files? Can I delete them? : r/MacOS,File - Web APIs - MDN Web Docs - Mozilla,What is a JavaScript File?,"JS files are JavaScript files, typically used to make web pages or interactive web content within apps. I'm not sure if deleting them is ...Read more","Oct 2, 2024 — The File interface provides information about files and allows JavaScript in a web page to access their content. File objects are generally ...Read more","Given what we know about computer programs, we can say that a JavaScript file is a program or a part of a program of instructions meant to be ...Read more"
how to sell saas,60,210,12,2.74,I,saas,ok,,https://www.zendesk.com.br/blog/saas-sales/,https://www.reddit.com/r/SaaS/comments/15rz8ht/how_do_you_sell_your_saas/,https://www.atlassian.com/blog/loom/saas-sales,SaaS sales 101: A beginner's guide to selling software,How do you sell your SAAS?,SaaS Sales: A Complete 2025 Guide + 5 Effective Strategies,Know the product inside and out · Stay persistent · Set up an email drip campaign · Call prospects as soon as they sign up · Offer short product demos.Read more,"Start by getting clear on your target audience and their pain points. Creating valuable content that addresses those needs like blogs, webinars, ...Read more","Nov 6, 2024 — 1. Focus on the relationship · 2. Lead with your product · 3. Provide a strategic free trial · 4. Offer annual pricing · 5. Incentivize referrals.Read more"
what is dom in javascript,61,590,36,0.06,I,javascript,ok,,https://www.w3schools.com/js/js_htmldom.asp,https://developer.mozilla.org/en-US/docs/Web/API/Document_Object_Model,https://www.youtube.com/watch?v=NO5kUNxGIu0,JavaScript HTML DOM,Document Object Model (DOM) - Web APIs - MDN Web Docs,The JavaScript DOM explained in 5 minutes!,"""The W3C Document Object Model (DOM) is a platform and language-neutral interface that allows programs and scripts to dynamically access and update the content, ...Read more",3 days ago — The Document Object Model (DOM) is a programming interface for web documents. It represents the page so that programs can change the document ...Read more,The Dom is the document object model. It's a JavaScript object that represents the page you see in the web browser.
when was javascript developed,62,480,30,0,I,javascript,ok,,https://en.wikipedia.org/wiki/JavaScript,https://www.w3schools.com/js/js_history.asp,https://medium.com/@abdulshekurabdullahclement/2-history-of-javascript-42852cb839db,JavaScript,JavaScript History,2. History of JavaScript.,"It was created by Brendan Eich in 1995. As of 2025, the overwhelming majority of websites (98.9%) uses JavaScript for client side webpage behavior.Read more","JavaScript was invented by Brendan Eich in 1995. It was developed for the Netscape browser, and then handed over to ECMA and became the ECMA-262 standard in ...Read more",Brendan Eich developed JavaScript at Netscape Communications in 1995. Netscape and Eich created JavaScript as a scripting language for use with ...Read more
how to enable javascript on macbook,63,480,30,0,I,javascript,ok,,,,,,,,,,
when was javascript created,64,480,30,0,I,javascript,ok,,https://en.wikipedia.org/wiki/JavaScript,https://www.w3schools.com/js/js_history.asp,https://cybercultural.com/p/1995-the-birth-of-javascript/,JavaScript,JavaScript History,1995: The Birth of JavaScript,"It was created by Brendan Eich in 1995. As of 2025, the overwhelming majority of websites (98.9%) uses JavaScript for client side webpage behavior.Read more","JavaScript was invented by Brendan Eich in 1995. It was developed for the Netscape browser, and then handed over to ECMA and became the ECMA-262 standard in ...Read more","Dec 22, 2020 — JavaScript is invented in a two-week flurry in May 1995 by Brendan Eich, a newly hired developer at browser company Netscape.Read more"
why is chatgpt down,65,590,45,0,"I,N",chatgpt,ok,,https://status.openai.com/,https://www.reddit.com/r/OpenAI/comments/1qv361u/is_chat_gpt_down_or_is_it_just_me/,https://downdetector.com/status/openai/,OpenAI Status,Is chat GPT down or is it just me? : r/OpenAI,OpenAI down? Current problems and outages,We're not aware of any issues affecting our systems. System status. Jan 2026-Apr 2026. APIs. 12 components. 99.99 % uptime. APIs. 12 components. ChatGPT.Read more,"It's a global outage; I thought it was only happening to me, so I logged out, uninstalled, and turned off my phone, but I saw that it was a ...Read more",Real-time problems and outages for OpenAI. Is OpenAI down? Here you see what is going on.
what is javascript dom,66,590,38,0.06,I,javascript,ok,,,,,,,,,,
what does saas stand for,67,810,53,0.21,I,saas,ok,,,,,,,,,,
how to create a javascript function,68,480,31,0,I,javascript,ok,,,,,,,,,,
how to create javascript function,69,480,31,0,I,javascript,ok,,,,,,,,,,
how to turn off javascript in firefox,70,480,31,0,I,javascript,ok,,,,,,,,,,
how much is chatgpt 4,71,390,52,1.44,C,chatgpt,ok,,,,,,,,,,
what python programming can do,72,480,32,0.2,I,python programming,ok,,,,,,,,,,
how to print from javascript,73,390,26,0,I,javascript,ok,,,,,,,,,,
how to insert javascript in html,74,390,26,0,I,javascript,ok,,,,,,,,,,
how to allow javascript on ipad,75,260,17,0,I,javascript,ok,,,,,,,,,,
what can you do with python programming,76,590,40,0.13,I,python programming,ok,,,,,,,,,,
how to get chatgpt to make images,77,210,14,0.97,I,chatgpt,ok,,,,,,,,,,
how to call a javascript function,78,390,27,0,I,javascript,ok,,https://www.w3schools.com/js/js_function_invocation.asp,https://www.w3schools.com/js/js_function_call.asp,https://developer.mozilla.org/en-US/docs/Web/JavaScript/Guide/Functions,JavaScript Function Invocation,JavaScript Function call() Method,Functions - JavaScript - MDN Web Docs,"Calling a Function. A JavaScript function runs when it is called. To call a function, write the name followed by parentheses like name(). Function ...Read more",The call() method is used to call a function with an object as an argument. The call() method takes this as the first argument.Read more,"Jul 8, 2025 — const foo = function bar() { // statements go here };. Within the function body, you can refer to the function itself either as bar or foo , and ...Read more"
how do you create a function in javascript,79,480,34,0,I,javascript,ok,,,,,,,,,,
how to include javascript in html,80,390,28,0,I,javascript,ok,,,,,,,,,,
how to call a function in javascript,81,390,29,0,I,javascript,ok,,,,,,,,,,
how to call function in javascript,82,390,29,0,I,javascript,ok,,,,,,,,,,
how to call functions in javascript,83,390,29,0,I,javascript,ok,,https://www.w3schools.com/js/js_function_call.asp,https://www.w3schools.com/js/js_function_invocation.asp,https://developer.mozilla.org/en-US/docs/Web/JavaScript/Reference/Global_Objects/Function/call,JavaScript Function call() Method,JavaScript Function Invocation,Function.prototype.call() - JavaScript - MDN Web Docs,The call() method is used to call a function with an object as an argument. The call() method takes this as the first argument.Read more,"Calling a Function. A JavaScript function runs when it is called. To call a function, write the name followed by parentheses like name(). Function ...Read more","Jul 10, 2025 — The call() method of Function instances calls this function with a given this value and arguments provided individually.Read more"
python programming what can you do,84,590,45,0.13,I,python programming,ok,,,,,,,,,,
what is nrr in saas,85,260,20,0.11,I,saas,ok,,,,,,,,,,
what is saas marketing,86,210,16,0.43,I,saas,ok,,https://www.cognism.com/blog/saas-marketing,https://www.coursera.org/articles/saas-marketing,https://amplitude.com/explore/digital-marketing/what-is-saas-marketing,What is Saas Marketing? How to Do It Right in 2026,What Is SaaS Marketing?,What is SaaS Marketing? Strategies and Examples Included,"Aug 15, 2025 — SaaS marketing stands for Software as a Service marketing. It's a type of marketing that focuses on digitally promoting and generating leads for subscription- ...Read more","Nov 11, 2025 — SaaS marketing means developing marketing strategies to encourage customers to discover software services, usually those that require a ...Read more",SaaS marketing is the strategies and techniques used to promote these products. The subscription-based nature of SaaS tools makes marketing them slightly ...Read more
what can i do with python programming,87,480,38,0.2,I,python programming,ok,,,,,,,,,,
how to call javascript function,88,390,31,0,I,javascript,ok,,https://www.w3schools.com/js/js_function_call.asp,https://developer.mozilla.org/en-US/docs/Web/JavaScript/Reference/Global_Objects/Function/call,https://www.w3schools.com/js/js_function_invocation.asp,JavaScript Function call() Method,Function.prototype.call() - JavaScript - MDN Web Docs,JavaScript Function Invocation,The call() method is used to call a function with an object as an argument. The call() method takes this as the first argument.Read more,"Jul 10, 2025 — The call() method of Function instances calls this function with a given this value and arguments provided individually.Read more","Calling a Function. A JavaScript function runs when it is called. To call a function, write the name followed by parentheses like name(). Function ...Read more"
how to insert javascript into html,89,390,31,0,I,javascript,ok,,https://www.w3schools.com/js/js_whereto.asp,https://developer.mozilla.org/en-US/docs/Web/HTML/How_to/Add_JavaScript_to_your_web_page,https://www.digitalocean.com/community/tutorials/how-to-add-javascript-to-html,JavaScript Where To,Add JavaScript to your web page - HTML | MDN,How to Add JavaScript to HTML for Beginners,"In HTML, JavaScript code is inserted between tags. Example.  document.getElementById(""demo"").Read more","Sep 11, 2025 — To call JavaScript code from within HTML, you need the  element. There are two ways to use script , depending on whether you're linking ...Read more","Jul 13, 2025 — The  tag can be placed in the  section of your HTML or in the  section, depending on when you want the JavaScript to load.Read more"
chrome how to enable javascript,90,320,26,0,I,javascript,ok,,https://support.google.com/adsense/answer/12654?hl=en,https://www.google.com/httpservice/retry/enablejs,https://www.larimer.gov/it/enable-javascript,Allow JavaScript in your browser - Google AdSense Help,Enable JavaScript to use search,How to Enable JavaScript in Your Browser,"On your Android phone or tablet, open Chrome. At the top right, tap More More and then Settings. Under ""Advanced,"" tap Site settings and then JavaScript.Read more","Go to Settings. Click Advanced in the left sidebar, and click Privacy & security. Click Site settings. Click JavaScript. At the top, turn on Allowed.","Enable JavaScript in Google Chrome. Open a window in Google Chrome. At the top right, click More Settings. At the bottom, click Show advanced settings.Read more"
how to create a function in javascript,91,480,40,0,I,javascript,ok,,https://www.w3schools.com/js/js_functions.asp,https://developer.mozilla.org/en-US/docs/Web/JavaScript/Guide/Functions,https://developer.mozilla.org/en-US/docs/Web/JavaScript/Reference/Functions,JavaScript Function Study Path,Functions - JavaScript - MDN Web Docs,Functions - JavaScript - MDN Web Docs,Functions are executed when they are called or invoked · You call a function by adding parentheses to its name: name().Read more,"Jul 8, 2025 — A function in JavaScript is similar to a procedure—a set of statements that performs a task or calculates a value, but for a procedure to ...Read more","Jul 8, 2025 — The Function() constructor, function expression, and function declaration syntaxes create full-fledged function objects, which can be ...Read more"
what can i do with python programming language,92,480,40,0.2,I,python programming,ok,,https://www.reddit.com/r/learnpython/comments/15ane9q/what_can_i_use_python_for/,https://realpython.com/what-can-i-do-with-python/,https://www.coursera.org/articles/what-is-python-used-for-a-beginners-guide-to-using-python,What can I use Python for? : r/learnpython,What Can I Do With Python?,What Is Python Used For? A Beginner's Guide,"Python is commonly used for developing websites and software, task automation, data analysis, and data visualization. Since it's relatively easy ...Read more","Oct 22, 2025 — You can use Python to create arcade games, adventure games, and puzzle games that you can deploy within a few hours. You can also code classic ...Read more","May 20, 2025 — Python is a computer programming language often used to build websites and software, automate tasks, and conduct data analysis.Read more"
how to compile a python program,93,210,17,0,I,python programming,ok,,https://www.reddit.com/r/learnpython/comments/14gsaaz/how_do_i_compile_my_python_files_into_a_single/,https://stackoverflow.com/questions/1957054/is-it-possible-to-compile-a-program-written-in-python,https://packaging.python.org/tutorials/packaging-projects/,"How do I ""compile"" my python files into a single executable ...",Is it possible to compile a program written in Python? [closed],Packaging Python Projects,"Use PyInstaller to bundle your Python files and a copy of the Python runtime into a ZIP-file, which is then made into an executable file. Use ...Read more",I think Compiling Python Code would be a good place to start: Python source code is automatically compiled into Python byte code by the CPython interpreter.Read more,This tutorial walks you through how to package a simple Python project. It will show you how to add the necessary files and structure to create the package.Read more
how to code with javascript,94,590,50,0.56,I,javascript,ok,,https://www.w3schools.com/js/,https://www.codecademy.com/learn/introduction-to-javascript,https://developer.mozilla.org/en-US/docs/Learn_web_development/Core/Scripting/What_is_JavaScript,JavaScript Tutorial,Learn JavaScript,What is JavaScript? - Learn web development | MDN,This tutorial covers everything from basic JavaScript up to the latest 2026 version. Start learning JavaScript now ». Examples in Each Chapter. With our Try it ...Read more,"In this course, you will learn how to use for and while loops to execute blocks of code multiple times.Read more","JavaScript is a scripting language that enables you to create dynamically updating content, control multimedia, animate images, and pretty much everything else.Read more"
how to add javascript in html,95,390,33,0,I,javascript,ok,,https://www.w3schools.com/js/js_whereto.asp,https://developer.mozilla.org/en-US/docs/Web/HTML/How_to/Add_JavaScript_to_your_web_page,https://www.youtube.com/watch?v=pT03xeVYBT8&vl=en,JavaScript Where To,Add JavaScript to your web page - HTML | MDN,How to Add JavaScript to HTML,"In HTML, JavaScript code is inserted between tags. Example.  document.getElementById(""demo"").Read more","Sep 11, 2025 — Take your webpages to the next level by harnessing JavaScript. Learn in this article how to trigger JavaScript right from your HTML documents.Read more",How To Add JavaScript to HTML | Step-by-Step Tutorial for Beginners Want to bring interactivity and logic to your website?
what's python programming,96,480,41,0.61,I,python programming,ok,,https://www.python.org/doc/essays/blurb/,https://en.wikipedia.org/wiki/Python_(programming_language),https://www.coursera.org/articles/what-is-python-used-for-a-beginners-guide-to-using-python,What is Python? Executive Summary,Python (programming language),What Is Python Used For? A Beginner's Guide,"Python is an interpreted, object-oriented, high-level programming language with dynamic semantics. Its high-level built in data structures, combined with ...Read more","Python is a high-level, general-purpose programming language that emphasizes code readability, simplicity, and ease-of-writing with the use of significant ...Read more","May 20, 2025 — Python is a computer programming language often used to build websites and software, automate tasks, and conduct data analysis.Read more"
how to use chatgpt apis,97,260,22,4.26,I,chatgpt,ok,,https://developers.openai.com/api/docs/quickstart,https://medium.com/@tinabhowal88/using-chatgpt-openai-api-for-the-first-time-as-a-beginner-5e6fe6412447,https://www.datacamp.com/tutorial/a-beginners-guide-to-chatgpt-api,Developer quickstart | OpenAI API,"Using ChatGPT OpenAI API for the first time, as a beginner.",A Beginner's Guide to Using the ChatGPT API,"Before you begin, create an API key in the dashboard, which you'll use to securely access the API. Store the key in a safe location, like a .zshrc file or ...Read more","Create an account on the OpenAI website: Once logged in, you can check out the documentation in the API reference . · ChatGPT Playground: Before ...Read more","Dec 14, 2023 — This guide walks you through the basics of the ChatGPT API, demonstrating its potential in natural language processing and AI-driven communication.Read more"
what can i do python programming,98,480,42,0.2,I,python programming,ok,,https://www.reddit.com/r/learnpython/comments/15ane9q/what_can_i_use_python_for/,https://realpython.com/what-can-i-do-with-python/,https://www.python.org/about/apps/,What can I use Python for? : r/learnpython,What Can I Do With Python?,Applications for Python,"Python is commonly used for developing websites and software, task automation, data analysis, and data visualization. Since it's relatively easy ...Read more","Oct 22, 2025 — You can use Python to create arcade games, adventure games, and puzzle games that you can deploy within a few hours. You can also code classic ...Read more","Python is often used as a support language for software developers, for build control and management, testing, and in many other ways.Read more"
