keyword,priority,volume,kd,cpc,intent,seed,flag,published,Ссылка конкурента 1,Ссылка конкурента 2,Ссылка конкурента 3,Заголовок конкурента 1,Заголовок конкурента 2,Заголовок конкурента 3,Сниппет конкурента 1,Сниппет конкурента 2,Сниппет конкурента 3
what is saas experience,99,390,34,0.2,I,saas,ok,,https://www.reddit.com/r/CustomerSuccess/comments/q0vwdi/saas_experience/,https://azure.microsoft.com/en-us/resources/cloud-computing-dictionary/what-is-saas,https://www.salesforce.com/saas/,SaaS experience : r/CustomerSuccess,What is Software as a Service (SaaS)?,What is SaaS (Software as a Service)?,"SaaS means software as a service so this type of experience would be heavy with IT knowledge, doing online demos, onboardings, using virtual ...Read more",SaaS is a cloud-based software delivery model where individuals or organizations subscribe to applications rather than purchasing and installing them locally.Read more,Software as a service (SaaS) is a way of delivering applications remotely over the internet instead of locally on machines (known as “on-premise” software).Read more
how to add javascript to html,100,390,34,0,I,javascript,ok,,https://www.w3schools.com/js/js_whereto.asp,https://developer.mozilla.org/en-US/docs/Web/HTML/How_to/Add_JavaScript_to_your_web_page,https://stackoverflow.com/questions/13739568/how-do-i-link-a-javascript-file-to-a-html-file,JavaScript Where To,Add JavaScript to your web page - HTML | MDN,How do I link a JavaScript file to a HTML file?,"You can place any number of scripts in an HTML document. Scripts can be placed in the , or in the  section of an HTML page, or in both.Read more","Sep 11, 2025 — Take your webpages to the next level by harnessing JavaScript. Learn in this article how to trigger JavaScript right from your HTML documents.Read more",To include an external Javascript file you use the  tag. The src attribute points to the location of your Javascript file within your web project.Read more
how to compile python program,101,210,18,0,I,python programming,ok,,,,,,,,,,
why is chatgpt not working,102,330,29,1.16,I,chatgpt,ok,,https://help.openai.com/en/articles/7996703-troubleshooting-chatgpt-error-messages,https://www.reddit.com/r/ChatGPT/comments/1pb6753/chatgpt_is_not_working_for_me/,https://www.youtube.com/watch?v=eq-uGRyTUbc,Troubleshooting ChatGPT Error Messages,ChatGPT is not working for me,How To Fix ChatGPT Not Working or Loading Error (Quick ...,"ChatGPT may occasionally encounter technical issues due to factors like network configuration, browser extensions, or transient server-side problems.Read more",I have tried clearing cookies and my cache. I have restarted my computer. I have used a different browser. I tried using ChatGPT on my phone.Read more,I'll show you how to fix a chat gpt if it's not working or loading all right.
how to call function javascript,103,390,35,0,I,javascript,ok,,https://www.w3schools.com/js/js_function_call.asp,https://developer.mozilla.org/en-US/docs/Web/JavaScript/Reference/Global_Objects/Function/call,https://www.w3schools.com/js/js_function_invocation.asp,JavaScript Function call() Method,Function.prototype.call() - JavaScript - MDN Web Docs,JavaScript Function Invocation,The call() method is used to call a function with an object as an argument. The call() method takes this as the first argument.Read more,"Jul 10, 2025 — The call() method of Function instances calls this function with a given this value and arguments provided individually.Read more","Calling a Function. A JavaScript function runs when it is called. To call a function, write the name followed by parentheses like name(). Function ...Read more"
how do i call a function in javascript,104,390,35,0,I,javascript,ok,,https://www.w3schools.com/js/js_function_call.asp,https://developer.mozilla.org/en-US/docs/Web/JavaScript/Guide/Functions,https://www.w3schools.com/js/js_function_invocation.asp,JavaScript Function call() Method,Functions - JavaScript - MDN Web Docs,JavaScript Function Invocation,The call() method is used to call a function with an object as an argument. The call() method takes this as the first argument.Read more,"Jul 8, 2025 — Within the function body, you can refer to the function itself either as bar or foo , and call itself using bar() or foo() . A function that ...Read more","Calling a Function. A JavaScript function runs when it is called. To call a function, write the name followed by parentheses like name(). Function ...Read more"
how to javascript code,105,590,54,0.56,I,javascript,ok,,https://www.w3schools.com/js/,https://www.reddit.com/r/learnjavascript/comments/rah67g/where_do_i_code_javascript/,https://developer.mozilla.org/en-US/docs/Learn_web_development/Core/Scripting/What_is_JavaScript,JavaScript Tutorial,Where do i code javascript : r/learnjavascript,What is JavaScript? - Learn web development | MDN,This tutorial covers everything from basic JavaScript up to the latest 2026 version. Start learning JavaScript now ». Examples in Each Chapter. With our Try it ...Read more,"If you want to get code running on a webpage, you can create your webpage using html (and save as .html). Then use a script tag somewhere in ...Read more","Welcome to the MDN beginner's JavaScript course! In this article we will look at JavaScript from a high level, answering questions such as ""What is it?"
where to learn python programming,106,590,54,1.74,I,python programming,ok,,https://www.reddit.com/r/learnpython/comments/ulmfb8/where_to_start_to_learn_python/,https://www.codecademy.com/catalog/language/python,https://www.learnpython.org/,where to start to learn python : r/learnpython,Best Python Courses + Tutorials,Learn Python - Free Interactive Python Tutorial,"Official Python Beginner's Guide, FreeCodeCamp.org, While main course is about full stack JS dev they also have several GREAT 10hs (or so) video curses.Read more","Start your coding journey with Python courses and tutorials. From basic to advanced projects, grow your Python skills at Codecademy.",Get started learning Python with DataCamp's Intro to Python tutorial. Learn Data Science by completing interactive coding challenges and watching videos by ...Read more
what is a callback in javascript,107,320,29,0,I,javascript,ok,,https://www.w3schools.com/js/js_callback.asp,https://developer.mozilla.org/en-US/docs/Glossary/Callback_function,https://developer.mozilla.org/pt-BR/docs/Glossary/Callback_function,JavaScript Callbacks,Callback function - Glossary - MDN Web Docs - Mozilla,Função Callback - Glossário do MDN Web Docs,"A JavaScript callback is a function passed as an argument to another function, which is then executed (or ""called back"") at a later point in time to complete a ...Read more","Aug 19, 2025 — A callback function is a function passed into another function as an argument, which is then invoked inside the outer function to complete some kind of routine ...Read more","Nov 19, 2023 — Uma função callback é uma função passada a outra função como argumento, que é então invocado dentro da função externa para completar algum ..."
how do i enable javascript in firefox,108,320,29,0,I,javascript,ok,,,,,,,,,,
what is saas stands for,109,590,55,0.23,I,saas,ok,,https://azure.microsoft.com/en-us/resources/cloud-computing-dictionary/what-is-saas,https://www.salesforce.com/saas/,https://en.wikipedia.org/wiki/Software_as_a_service,What is Software as a Service (SaaS)?,What is SaaS (Software as a Service)?,Software as a service,SaaS is a cloud-based software delivery model where individuals or organizations subscribe to applications rather than purchasing and installing them locally.Read more,Software as a Service (SaaS) is a way of delivering centrally-hosted applications to customers over the internet. Learn about the advantages of using SaaS.,Software as a service (SaaS /sæs/) is a cloud computing service model in which a provider delivers application software to clients while managing the required ...Read more
how to code in javascript,110,590,55,0.56,I,javascript,ok,,,,,,,,,,
how do i turn on javascript in firefox,111,320,30,0,I,javascript,ok,,https://support.mozilla.org/en-US/kb/javascript-settings-for-interactive-web-pages,https://support.mozilla.org/en-US/questions/967344,https://www.ionos.com/digitalguide/websites/web-development/enable-javascript-in-firefox/,JavaScript settings and preferences for interactive web pages,how do i enable javascript if there is no option to enable ...,How to enable JavaScript in Firefox,"Aug 16, 2025 — Type about:config in the address bar and press EnterReturn. A warning page may appear. Click Accept the Risk and Continue to go to the about: ...Read more","Aug 8, 2013 — Right click the result named ""javascript.enabled"" and click ""Toggle"". JavaScript is now disabled. To Re-enable JavaScript, repeat these steps.Read more","Jul 17, 2024 — In order to enable JavaScript in Firefox, you need to use the command about:config . By default, the scripting language is enabled in all ...Read more"
how to declare a variable in javascript,112,320,30,0,I,javascript,ok,,,,,,,,,,
what is a saas company,113,390,37,0.26,I,saas,ok,,,,,,,,,,
how to add javascript into html,114,390,37,0,I,javascript,ok,,https://www.w3schools.com/js/js_whereto.asp,https://developer.mozilla.org/en-US/docs/Web/HTML/How_to/Add_JavaScript_to_your_web_page,https://www.youtube.com/watch?v=pT03xeVYBT8&vl=en,JavaScript Where To,Add JavaScript to your web page - HTML | MDN,How to Add JavaScript to HTML,"In HTML, JavaScript code is inserted between tags. Example.  document.getElementById(""demo"").Read more","Sep 11, 2025 — To call JavaScript code from within HTML, you need the  element. There are two ways to use script , depending on whether you're linking ...Read more","In this beginner-friendly web development tutorial, you'll learn how to add JavaScript to your HTML pages using three simple and effective ..."
javascript when then,115,390,37,0,I,javascript,ok,,https://developer.mozilla.org/pt-BR/docs/Web/JavaScript/Reference/Global_Objects/Promise/then,https://stackoverflow.com/questions/3884281/what-does-the-function-then-mean-in-javascript,https://www.w3schools.com/js/js_promise.asp,Promise.prototype.then() - JavaScript - MDN Web Docs,What does the function then() mean in JavaScript?,JavaScript Promises,"Feb 3, 2024 — O método then() retorna uma Promise. Possui dois argumentos, ambos são ""call back functions"", sendo uma para o sucesso e outra para o fracasso ...Read more","The traditional way to deal with asynchronous calls in JavaScript has been with callbacks. Say we had to make three calls to the server, one after the other, ...Read more","then() takes two arguments, one callback function for success and another for failure. Both are optional, so you can add a callback function for success or ...Read more"
how to code javascript,116,590,57,0.56,I,javascript,ok,,https://www.w3schools.com/js/,https://www.codecademy.com/learn/introduction-to-javascript,https://developer.mozilla.org/en-US/docs/Learn_web_development/Core/Scripting/What_is_JavaScript,JavaScript Tutorial,Learn JavaScript,What is JavaScript? - Learn web development | MDN,This tutorial covers everything from basic JavaScript up to the latest 2026 version. Start learning JavaScript now ». Examples in Each Chapter. With our Try it ...Read more,"In this course, you will learn how to use for and while loops to execute blocks of code multiple times.Read more","JavaScript is a scripting language that enables you to create dynamically updating content, control multimedia, animate images, and pretty much everything else.Read more"
how do i turn on javascript on firefox,117,320,31,0,I,javascript,ok,,,,,,,,,,
how do you turn on javascript in firefox,118,320,31,0,I,javascript,ok,,https://support.mozilla.org/en-US/kb/javascript-settings-for-interactive-web-pages,https://www.enable-javascript.com/,https://support.mozilla.org/en-US/questions/967344,JavaScript settings and preferences for interactive web pages,How to enable JavaScript in your browser and why,how do i enable javascript if there is no option to enable ...,"Aug 16, 2025 — Type about:config in the address bar and press EnterReturn. A warning page may appear. · Find the javascript.enabled preference. It should be set ...Read more","When the dialog window opens, look for the ""JavaScript"" section and select ""Allow all sites to run JavaScript (recommended)"". Click on the ""OK"" button to close ...Read more","Aug 8, 2013 — Right click the result named ""javascript.enabled"" and click ""Toggle"". JavaScript is now disabled. To Re-enable JavaScript, repeat these steps.Read more"
how much is github copilot,119,320,31,1.67,I,github copilot,ok,,,,,,,,,,
how to use github copilot in visual studio,120,260,25,1.22,I,github copilot,ok,,https://docs.github.com/en/copilot/get-started/quickstart,https://code.visualstudio.com/docs/copilot/getting-started,https://learn.microsoft.com/en-us/visualstudio/ide/visual-studio-github-copilot-get-started?view=visualstudio,Quickstart for GitHub Copilot,Get started with GitHub Copilot in VS Code,Get Started with GitHub Copilot - Visual Studio (Windows),"On GitHub, navigate to a repository and open a file. · Click the Copilot icon ( ) at the top right of the file view. · Type a question in the ""Ask Copilot"" box at ...Read more","Create a new folder called .github in your project root. · Inside the .github folder, create a file called copilot-instructions.md . · Add the following content:.Read more","Mar 12, 2026 — Select the GitHub Copilot badge in the upper-right corner of Visual Studio, and select Open Chat Window. Screenshot of the GitHub Copilot badge ...Read more"
what can python programming be used for,121,390,39,0.2,I,python programming,ok,,https://www.reddit.com/r/learnpython/comments/15ane9q/what_can_i_use_python_for/,https://www.python.org/about/apps/,https://www.coursera.org/articles/what-is-python-used-for-a-beginners-guide-to-using-python,What can I use Python for? : r/learnpython,Applications for Python,What Is Python Used For? A Beginner's Guide,"Python is commonly used for developing websites and software, task automation, data analysis, and data visualization. Since it's relatively easy ...Read more","Python is often used as a support language for software developers, for build control and management, testing, and in many other ways.Read more","May 20, 2025 — Python is a computer programming language often used to build websites and software, automate tasks, and conduct data analysis.Read more"
how to start programming python,122,390,39,1.09,I,python programming,ok,,https://www.python.org/about/gettingstarted/,https://www.reddit.com/r/learnpython/comments/121uq73/what_tools_do_i_need_to_start_coding_in_python/,https://www.w3schools.com/python/python_getstarted.asp,Python For Beginners,What tools do I need to start coding in python? : r/learnpython,Python Getting Started,Welcome! Are you completely new to programming? If not then we presume you will be looking for information about why and how to get started with Python.Read more,Start watching a lot of python videos that offer to teach you to code in python. They mostly go through tools and how to setup your machine.Read more,"Get Started With Python. At W3Schools, you can try Python without installing anything. Our Online Python Editor runs directly in your browser, and shows both ...Read more"
how javascript,123,320,32,0.7,I,javascript,ok,,,,,,,,,,
what is saas stand for,124,590,60,0.23,I,saas,ok,,https://en.wikipedia.org/wiki/Software_as_a_service,https://azure.microsoft.com/en-us/resources/cloud-computing-dictionary/what-is-saas,https://www.salesforce.com/saas/,Software as a service,What is Software as a Service (SaaS)?,What is SaaS (Software as a Service)?,Software as a service (SaaS /sæs/) is a cloud computing service model in which a provider delivers application software to clients while managing the required ...Read more,SaaS is a cloud-based software delivery model where individuals or organizations subscribe to applications rather than purchasing and installing them locally.Read more,Software as a Service (SaaS) is a way of delivering centrally-hosted applications to customers over the internet. Learn about the advantages of using SaaS.
how to declare variables in javascript,125,320,33,0,I,javascript,ok,,https://www.w3schools.com/js/js_variables.asp,https://developer.mozilla.org/en-US/docs/Learn_web_development/Core/Scripting/Variables,https://javascript.info/variables,JavaScript Variables,Storing the information you need — Variables - MDN Web Docs,Variables,Creating a variable in JavaScript is called declaring a variable. You declare a JavaScript variable with the let keyword or the const keyword. Declaring a ...Read more,"Aug 18, 2025 — A variable is a container for a value, like a number we might use in a sum, or a string that we might use as part of a sentence.Read more","Feb 25, 2026 — To create a variable in JavaScript, use the let keyword. The ... We can also declare two variables and copy data from one into the other.Read more"
how do you declare variables in javascript,126,320,33,0,I,javascript,ok,,https://www.w3schools.com/js/js_variables.asp,https://developer.mozilla.org/en-US/docs/Learn_web_development/Core/Scripting/Variables,https://javascript.info/variables,JavaScript Variables,Storing the information you need — Variables - MDN Web Docs,Variables,Creating a variable in JavaScript is called declaring a variable. You declare a JavaScript variable with the let keyword or the const keyword. Declaring a ...Read more,"Aug 18, 2025 — A variable is a container for a value, like a number we might use in a sum, or a string that we might use as part of a sentence.Read more","Feb 25, 2026 — To create a variable in JavaScript, use the let keyword. The ... We can also declare two variables and copy data from one into the other.Read more"
how to declare javascript variable,127,320,33,0,I,javascript,ok,,,,,,,,,,
how do you turn on javascript on firefox,128,320,33,0,I,javascript,ok,,https://support.mozilla.org/en-US/kb/javascript-settings-for-interactive-web-pages,https://support.mozilla.org/en-US/questions/967344,https://www.ionos.com/digitalguide/websites/web-development/enable-javascript-in-firefox/,JavaScript settings and preferences for interactive web pages,how do i enable javascript if there is no option to enable ...,How to enable JavaScript in Firefox,"Aug 16, 2025 — Type about:config in the address bar and press EnterReturn. A warning page may appear. Click Accept the Risk and Continue to go to the about: ...Read more","Aug 8, 2013 — Right click the result named ""javascript.enabled"" and click ""Toggle"". JavaScript is now disabled. To Re-enable JavaScript, repeat these steps.Read more","Jul 17, 2024 — In order to enable JavaScript in Firefox, you need to use the command about:config . By default, the scripting language is enabled in all ...Read more"
who invented javascript,129,320,34,0,I,javascript,ok,,https://en.wikipedia.org/wiki/Brendan_Eich,https://www.reddit.com/r/IAmA/comments/dwfbmf/im_brendan_eich_inventor_of_javascript_and/,https://en.wikipedia.org/wiki/JavaScript,Brendan Eich,"I'm Brendan Eich, inventor of JavaScript and cofounder ...",JavaScript,"Brendan Eich is an American computer programmer and technology executive. He created the JavaScript programming language and co-founded the Mozilla project, ...Read more","I'm Brendan Eich, CEO and co-founder of Brave. In 1995, I created the JavaScript programming language in 10 days while at Netscape.Read more","It was created by Brendan Eich in 1995. As of 2025, the overwhelming majority of websites (98.9%) uses JavaScript for client side webpage behavior.Read more"
python how to run a program,130,210,22,1.58,I,python programming,ok,,,,,,,,,,
why learn python programming language,131,210,22,0.28,I,python programming,ok,,,,,,,,,,
how to get chatgpt to generate images,132,260,28,0.99,I,chatgpt,ok,,https://help.openai.com/en/articles/8932459-creating-images-in-chatgpt,https://chatgpt.com/images/,https://www.reddit.com/r/ChatGPT/comments/176hot4/how_do_i_make_chatgpt_generate_pictures/,Creating images in ChatGPT,AI Image Generator,how do I make chatgpt generate pictures?,"You can generate images with ChatGPT by simply asking the model to create an image with the details you want, or by selecting the 'View all tools' option.Read more","Generate high-quality AI images quickly with ChatGPT Images, featuring precise edits, preset filters and trending prompts.",I'm a text-based AI and cannot generate pictures or images. My capabilities are limited to generating text-based responses and providing information and ...Read more
what is github copilot,133,480,53,0.44,I,github copilot,ok,,https://docs.github.com/en/copilot/get-started/what-is-github-copilot,https://github.com/features/copilot,https://en.wikipedia.org/wiki/GitHub_Copilot,What is GitHub Copilot?,GitHub Copilot · Your AI pair programmer,GitHub Copilot,"GitHub Copilot is an AI coding assistant that helps you write code faster and with less effort. Then, you can focus more energy on problem solving and ...Read more","GitHub Copilot works alongside you directly in your editor, suggesting whole lines or entire functions for you.","GitHub Copilot is a code completion and programming AI-assistant developed by GitHub and OpenAI that assists users of Visual Studio Code, Visual Studio, ...Read more"
how do i access chatgpt,134,590,66,0.98,I,chatgpt,ok,,https://chatgpt.com/,https://www.scribbr.com/frequently-asked-questions/how-do-i-access-chatgpt/,https://chatgpt.com/auth/login,ChatGPT,How do I access ChatGPT?,Get started,"ChatGPT is your AI chatbot for everyday use. Chat with the most advanced AI to explore ideas, solve problems, and learn faster.","You can access ChatGPT by signing up for a free account. A ChatGPT app is also available for iOS, and an Android app is planned for the future.Read more",Get started. Log in. Sign up for free. Try it first. ChatGPT. Terms of use|Privacy policy.Read more
what is a saas app,135,480,65,0.55,"I,N",saas,ok,,https://azure.microsoft.com/en-us/resources/cloud-computing-dictionary/what-is-saas,https://www.reddit.com/r/webdev/comments/119ynyo/what_exactly_is_a_saas_from_a_technical_point_of/,https://www.salesforce.com/saas/,What is Software as a Service (SaaS)?,What exactly is a SAAS from a technical point of view?,What is SaaS (Software as a Service)?,SaaS is a cloud-based software delivery model where individuals or organizations subscribe to applications rather than purchasing and installing them locally.Read more,"A SaaS is a cloud-hosted software application accessed over the internet, where users don't install or manage infrastructure. It's built to ...Read more",Software as a service (SaaS) is a way of delivering applications remotely over the internet instead of locally on machines (known as “on-premise” software).Read more
what is a saas application,136,480,65,0.55,"I,N",saas,ok,,,,,,,,,,
chatgpt teacher,137,330,37,1,I,chatgpt,ok,,,,,,,,,,
how to build an ai agent with chatgpt,138,260,29,3.66,I,chatgpt,ok,,https://openai.com/business/guides-and-resources/a-practical-guide-to-building-ai-agents/,https://chatgpt.com/features/agent/,https://dust.tt/blog/how-to-create-an-agent-in-chatgpt,A practical guide to building agents,ChatGPT Agent,How to create an agent in ChatGPT (and what to do when ...,"A comprehensive guide to designing, orchestrating, and deploying AI agents—covering use cases, model selection, tool design, guardrails, and multi-agent ...",Click the '+' in the chat box and select 'Agent mode' from the dropdown. Dropdown menu with a selection of AI actions on a blue gradient background. The cursor ...Read more,"Feb 25, 2026 — Step 1: Access the GPT builder · Step 2: Define your agent's purpose · Step 3: Configure instructions and knowledge · Step 4: Enable capabilities.Read more"
what saas stands for,139,590,68,0.23,I,saas,ok,,,,,,,,,,
how to learn python programming,140,390,46,1.62,I,python programming,ok,,,,,,,,,,
how to enable javascript in firefox,141,320,38,0,I,javascript,ok,,,,,,,,,,
what is saas mean,142,480,58,0.35,I,saas,ok,,,,,,,,,,
how to use github copilot in vscode,143,260,31,2.03,I,github copilot,ok,,,,,,,,,,
how to use chatgpt api,144,260,31,4.26,I,chatgpt,ok,,,,,,,,,,
what is saas app,145,480,59,0.55,I,saas,ok,,,,,,,,,,
what saas application,146,480,59,0.55,I,saas,ok,,,,,,,,,,
how to allow javascript in firefox,147,320,39,0,I,javascript,ok,,,,,,,,,,
who created javascript,148,320,39,0,I,javascript,ok,,,,,,,,,,
how to open javascript,149,320,39,0,I,javascript,ok,,,,,,,,,,
what is python programming good for,150,320,39,0.11,I,python programming,ok,,,,,,,,,,
how to execute python program in windows,151,320,39,0,I,python programming,ok,,,,,,,,,,
how to run a python program in windows,152,320,39,0,I,python programming,ok,,,,,,,,,,
how was chatgpt trained,153,320,40,0,I,chatgpt,ok,,,,,,,,,,
what is javascript object,154,260,33,0,I,javascript,ok,,,,,,,,,,
what saas,155,480,62,0.69,I,saas,ok,,,,,,,,,,
what is saas application,156,480,62,0.55,I,saas,ok,,,,,,,,,,
how to allow javascript on firefox,157,320,41,0,I,javascript,ok,,,,,,,,,,
how to activate javascript in firefox,158,320,41,0,I,javascript,ok,,,,,,,,,,
how can i enable javascript in firefox,159,320,41,0,I,javascript,ok,,,,,,,,,,
how much is chatgpt enterprise,160,320,41,5.61,I,chatgpt,ok,,,,,,,,,,
what is paas saas iaas,161,210,27,0.03,I,saas,ok,,,,,,,,,,
what are saas paas and iaas,162,210,27,0.03,I,saas,ok,,,,,,,,,,
how to start programming in python,163,390,51,1.09,I,python programming,ok,,,,,,,,,,
what is saas meaning,164,480,64,0.35,I,saas,ok,,,,,,,,,,
