keyword,priority,volume,kd,cpc,position,intent,competitor,Ссылка конкурента 1,Ссылка конкурента 2,Ссылка конкурента 3,Заголовок конкурента 1,Заголовок конкурента 2,Заголовок конкурента 3,Сниппет конкурента 1,Сниппет конкурента 2,Сниппет конкурента 3
the collaborative,1,2400,16,0.14,68,"L,C",replit.com,https://www.thecollaborative.com/,https://the-collaborative.com/,https://tc.design/,The Collaborative,The Collaborative: Professional Development Programs,The Collaborative,"The Collaborative is a national public policy, planning, design, and communications firm that builds strong communities and organizations.Read more","We help financial institutions and professionals meet their goals through coaching, team building, team facilitation, training, program development, customized ...Read more","As a group of architects, landscape architects, interior designers, and planners, we support an interactive design process.Read more"
jt auto,2,3600,34,0.65,57,"L,C",replit.com,https://www.autoeletricojt.com.br/,https://www.instagram.com/jt.autocenter/,https://empresas.serasaexperian.com.br/consulta-gratis/J-T-AUTO-ELETRICO-LTDA-48882757000182,Auto Elétrico | Auto Eletrico Jt | São Paulo,JT auto center (@jt.autocenter) - Instagram,J T AUTO ELETRICO LTDA - Consulta CNPJ,Auto Elétrico JT · Unidade Av. Moema 736. Atendemos somente neste endereço! Tel - 5051-4046. Entre em Contato! E SAIA DIRIGINDO SEU CARRO COM TUDO FUNCIONANDO ...Read more,Instalação de ar condicionado Split e manutenção❄️    ‍   Manutenção automotiva e linha agrícola     Credenciado Elgin Gree Agratto Tcl Komeko · Agora com garantia de ...Read more,"O CNPJ da empresa J T AUTO ELETRICO LTDA () é 48.882.757/0001-82. Com sede em SAO PAULO, SP, possui 48 anos, 8 meses e 2 dias e foi fundada em 05/07/1977."
1v1 lol github,3,6600,40,0,14,"I,N",replit.com,https://1v1-lol-online.github.io/,https://github.com/TheRealJoelmatic/1v1.lol-cheat,https://github.com/Zordon1337/1v1.lol-offsetdumper,1v1.LOL Update Version,TheRealJoelmatic/1v1.lol-cheat,"SDK Generator for now dead battle royale game ""1v1.lol""","Experience the ultimate gaming thrill with 1v1.LOL! Play directly in your browser, enjoy fullscreen mode, and immerse yourself in uninterrupted gameplay ...",This was a cheat made for the il2cpp version 1v1.lol. When the game updated to mono this cheats stoped working and as IL2CPP_Resolver is made for IL2CPP.Read more,"Dec 22, 2025 — SDK Generator for now dead battle royale game ""1v1.lol"" - Zordon1337/1v1.lol-sdkgen."
application that,4,990,6,2.21,16,I,replit.com,https://play.google.com/store/apps/details?id=com.brazole.lastversion&hl=pt_BR,https://www.linguee.com.br/ingles-portugues/traducao/application.html,https://dictionary.cambridge.org/dictionary/english-portuguese/application,That AI – Apps no Google Play,application - Tradução em português,APPLICATION | Portuguese translation - Cambridge Dictionary,"That Ai é o seu assistente de IA minimalista e sem frescuras. Basta abrir o aplicativo, digitar sua pergunta em um único campo de texto e obter uma resposta ...Read more",application substantivo— · aplicação f (frequentemente utilizado) (plural: aplicações f) · pedido m · utilização f (plural: utilizações f) · solicitação f.Read more,"an official request for something, usually in writing solicitação, pedido, candidatura a letter of application uma carta de solicitaçãoRead more"
app that,5,990,6,2.21,91,I,replit.com,https://play.google.com/store/apps/details?id=app.that.wallet&hl=pt,https://that.en.uptodown.com/android/download,https://apps.apple.com/us/app/this-that/id550803762?l=pt-BR,THAT – Apps no Google Play,Download That 2.1.3 for Android,App This=That,"O THAT Directory é um aplicativo fácil de usar para descobrir lugares reais onde você pode gastar seu THAT. Seja para uma refeição, um corte de cabelo, ...Read more",Download the latest version of That for Android. Solve seating puzzles to test logic and problem-solving skills. Test your logical thinking and...,Drag numbers and choose operations to build creative equivalencies while practicing math facts. Recommended age: 8 years + No ads. No links to social media.Read more
engine tech,6,1900,33,0.03,46,"L,C",replit.com,https://enginetech.com/,https://www.enginetechcatalog.com/,https://www.econodata.com.br/consulta-empresa/08928375000128-engine-tech-mecanica-ltda,Home | Enginetech Inc. - The Engine Builder's Source,Enginetech Catalog,Engine Tech Mecanica Ltda - Consulta Empresa,Family-owned Enginetech has been delivering quality engine parts to professional engine rebuilders since 1982.,"Enginetech Inc. 1205 W Crosby Road, Carrollton, TX 75006, USA; Phone (972) 245-0110. Sales (800) 869-8711. Links. Specials ...Read more","O endereço de sua sede está localizada na Rua Jose Ferreira da Rocha, 180 - Pinheirinho, Curitiba - PR, 81.870-080. Sua atividade principal é de Comércio a ...Read more"
frame works,7,1300,36,1.61,70,"L,C",replit.com,https://frame.work/es/en,https://en.wikipedia.org/wiki/Framework,https://rideframeworks.com/,https://frame.work/es/en,Framework,Frameworks Bicycles,No information is available for this page.,A framework is a generic term commonly referring to an essential supporting structure on which other things are built. Framework may refer to: ...Read more,"Frameworks Bicycles · 2026 FRAMES ON SALE NOW · 2026 DH Frame · 2026 Enduro Frame. Regular price $3,999.00 USD. Regular price Sale price $3,999.00 USD. Sale ...Read more"
matlab if,8,990,16,0,51,I,replit.com,https://www.mathworks.com/help/matlab/ref/if.html,https://www.mathworks.com/help/simscape/lang/if.html,https://www.mathworks.com/help/matlab/matlab_prog/conditional-statements.html,if - Execute statements if condition is true - MATLAB,"if - Specify conditional equations, assignments, annotations ...",Conditional Statements - MATLAB & Simulink,"This MATLAB function evaluates an expression, and executes a group of statements when the expression is true.","To specify conditional equations, use if statements within the equations section. An if statement starts with an if keyword and ends with an end keyword.Read more",Conditional statements enable you to select at run time which block of code to execute. The simplest conditional statement is an if statement.Read more
figma desktop app,9,990,28,0.34,72,I,replit.com,https://www.figma.com/downloads/,https://www.figma.com/community/file/1193086625111048947/web-desktop-app,https://www.figma.com/,Figma Downloads | Web Design App for Desktops & Mobile,Web/Desktop App,Figma: The Collaborative Interface Design Tool,"Download the Figma web design app on desktop for macOS or Windows, plus the font installer and device preview apps.",Web/Desktop App. Design file. •. 70. •. 8.4k users. MD. SOHAN. Open in Figma. About. Comments 0. Tags. Desktop. A. Post. 0 comments. Share. For Figma.Read more,"Figma is the leading collaborative design platform for building meaningful products. Design, prototype, and build products faster—while gathering feedback ..."
browser based,10,920,35,0.19,67,I,replit.com,https://www.browserbase.com/,https://github.com/browserbase,https://browser-use.com/,Browserbase,browserbase,Browser Use - The way AI uses the internet,"Browsers Real browsers for your agent to use the web, without the headaches. language · Web Data APIs Search and fetch APIs to efficiently retrieve web data.Read more","Collection of templates, guides, and best practices to help you get the most out of Browserbase. TypeScript 140 16. Repositories. Loading. Type.Read more",The Way AI uses the web. Agents at scale. Undetectable browsers. The API for any website. Get Started. Trusted by teams at. Airbnb. Amazon. Anthropic.Read more
