keyword,priority,volume,kd,cpc,intent,seed,flag,published,Ссылка конкурента 1,Ссылка конкурента 2,Ссылка конкурента 3,Заголовок конкурента 1,Заголовок конкурента 2,Заголовок конкурента 3,Сниппет конкурента 1,Сниппет конкурента 2,Сниппет конкурента 3
freelancer for website,1,440,0,1.22,I,website for freelancers,ok,,,,,,,,,,
make a platform bed,2,480,11,0.29,C,make platform,ok,,,,,,,,,,
make platform bed,3,480,13,0.29,C,make platform,ok,,,,,,,,,,
top app making companies,4,590,17,10.53,"L,C",make app,ok,,,,,,,,,,
make ios apps on windows,5,480,7,1.93,I,make app,ok,,,,,,,,,,
site signs for builders,6,210,6,2.78,C,site builder for,ok,,,,,,,,,,
apps that make you look skinny,7,590,11,2.04,I,make app,ok,,,,,,,,,,
apps for restaurant managers,8,390,7,10.2,I,app for restaurants,ok,,,,,,,,,,
how to make a platform,9,320,6,1.07,I,make platform,ok,,,,,,,,,,
how to make a platforming game,10,320,6,1.07,I,make platform,ok,,,,,,,,,,
plans to make a platform bed,11,480,10,0.29,I,make platform,ok,,,,,,,,,,
software development companies for startups,12,390,17,5.72,"L,C",software for startups,ok,,,,,,,,,,
software development company for startups,13,390,17,5.72,"L,C",software for startups,ok,,,,,,,,,,
squarespace websites for photographers,14,590,13,2.61,I,website for photographers,ok,,,,,,,,,,
website template for church,15,590,13,2.17,I,website for churches,ok,,,,,,,,,,
webcam sites to make money,16,210,4,1.32,I,make site,ok,,,,,,,,,,
custom software development for startups,17,210,9,7.32,"L,C",software for startups,ok,,,,,,,,,,
making a platform bed,18,480,11,0.29,I,make platform,ok,,,,,,,,,,
making platform bed,19,480,11,0.29,I,make platform,ok,,,,,,,,,,
make a bed platform,20,480,11,0.29,I,make platform,ok,,,,,,,,,,
making a bed platform,21,480,11,0.29,I,make platform,ok,,,,,,,,,,
making platform beds,22,480,11,0.29,I,make platform,ok,,,,,,,,,,
how to make a platformer,23,320,7,1.07,I,make platform,ok,,,,,,,,,,
how to make a platformer game,24,320,7,1.07,I,make platform,ok,,,,,,,,,,
how to make platformer games,25,320,7,1.07,I,make platform,ok,,,,,,,,,,
apps that make you look skinnier,26,590,14,2.04,I,make app,ok,,,,,,,,,,
apps that make you look thinner,27,590,14,2.04,I,make app,ok,,,,,,,,,,
app to make you look skinny,28,590,14,2.04,I,make app,ok,,,,,,,,,,
make youtube app,29,590,14,0.87,I,make app,ok,,,,,,,,,,
template for church website,30,590,14,2.17,I,website for churches,ok,,,,,,,,,,
free website for nonprofit,31,480,12,5.94,I,website for nonprofits,ok,,,,,,,,,,
app that makes you look skinny,32,590,16,2.04,I,make app,ok,,,,,,,,,,
apps for small businesses,33,440,12,8,I,app for small business,ok,,,,,,,,,,
make a porn site,34,390,13,1.15,"I,N",make site,ok,,,,,,,,,,
how to make a dating app,35,480,14,2,I,make app,ok,,,,,,,,,,
how to make money off cash app stocks,36,480,14,1.9,I,make app,ok,,,,,,,,,,
how to make a site plan,37,320,9,1.8,I,make site,ok,,,,,,,,,,
best webcam sites to make money,38,320,9,1.28,I,make site,ok,,,,,,,,,,
how to make site plan,39,320,9,1.8,I,make site,ok,,,,,,,,,,
how to make platform games,40,320,9,1.07,I,make platform,ok,,,,,,,,,,
best hrms software for startups,41,320,9,29.07,I,software for startups,ok,,,,,,,,,,
templates for church websites,42,590,18,2.17,I,website for churches,ok,,,,,,,,,,
website templates for churches,43,590,18,2.17,I,website for churches,ok,,,,,,,,,,
top beat making apps,44,480,18,0.61,"I,N",make app,ok,,,,,,,,,,
make website iphone app,45,480,15,0,I,make app,ok,,,,,,,,,,
church templates for websites,46,590,19,2.17,I,website for churches,ok,,,,,,,,,,
best cam site to make money,47,320,10,1.28,I,make site,ok,,,,,,,,,,
best webcam site to make money,48,320,10,1.28,I,make site,ok,,,,,,,,,,
seo tools for digital agencies,49,480,32,0,"L,C",tool for agencies,ok,,,,,,,,,,
dating website for doctors,50,260,8,2,I,website for doctors,ok,,,,,,,,,,
bookkeeping software for startups,51,390,26,13.43,C,software for startups,ok,,,,,,,,,,
how to make a social media site,52,480,16,2.22,I,make site,ok,,,,,,,,,,
how do websites make money,53,480,16,0.27,I,make website,ok,,,,,,,,,,
how to make a social media website,54,480,16,2.22,I,make website,ok,,,,,,,,,,
delivery apps to make money,55,920,32,1,I,make app,ok,,,,,,,,,,
website packages for small business,56,390,13,5.37,I,website for small business,ok,,,,,,,,,,
how to make porn site,57,590,25,0.8,"I,N",make site,ok,,,,,,,,,,
templates for restaurant website,58,590,25,3.45,"I,N",website for restaurants,ok,,,,,,,,,,
making a podcast app,59,590,21,1.47,I,make app,ok,,,,,,,,,,
website templates for church,60,590,21,2.17,I,website for churches,ok,,,,,,,,,,
how to make a app game,61,480,17,2.16,I,make app,ok,,,,,,,,,,
how to make a platform game,62,320,11,1.07,I,make platform,ok,,,,,,,,,,
apps to make podcasts,63,590,22,1.47,I,make app,ok,,,,,,,,,,
apps to make a podcast,64,590,22,1.47,I,make app,ok,,,,,,,,,,
how to make a website to sell products,65,590,27,4.2,"I,N",make website,ok,,,,,,,,,,
iphone apps how to make,66,480,18,2.18,I,make app,ok,,,,,,,,,,
make porn website,67,390,18,1.15,"I,N",make website,ok,,,,,,,,,,
website template for photographers,68,320,12,2.15,I,website for photographers,ok,,,,,,,,,,
best website builder for nonprofits,69,320,12,7.02,I,website for nonprofits,ok,,,,,,,,,,
best website builders for nonprofits,70,320,12,7.02,I,website for nonprofits,ok,,,,,,,,,,
best church websites for small churches,71,320,12,1.65,I,website for churches,ok,,,,,,,,,,
project management tools for creative agencies,72,320,12,29.56,I,tool for agencies,ok,,,,,,,,,,
app that makes pictures move,73,590,23,1.25,I,make app,ok,,,,,,,,,,
website template for restaurant,74,590,23,3.45,I,website for restaurants,ok,,,,,,,,,,
website templates for restaurants,75,590,23,3.45,I,website for restaurants,ok,,,,,,,,,,
project management tools for startups,76,590,23,17.45,I,tool for startups,ok,,,,,,,,,,
project management tool for startups,77,590,23,17.45,I,tool for startups,ok,,,,,,,,,,
marketing tools for agencies,78,390,15,9.96,I,tool for agencies,ok,,,,,,,,,,
good beat making apps,79,480,19,0.61,I,make app,ok,,,,,,,,,,
how to make a social network site,80,480,19,2.22,I,make site,ok,,,,,,,,,,
how can i make a social networking site,81,480,19,2.22,I,make site,ok,,,,,,,,,,
best cam sites to make money,82,320,15,1.28,"I,N",make site,ok,,,,,,,,,,
how to make a social networking website,83,480,19,2.22,I,make website,ok,,,,,,,,,,
project management tool for creative agencies,84,320,15,29.56,"I,N",tool for agencies,ok,,,,,,,,,,
website builder for nonprofit organization,85,500,20,8.67,I,website for nonprofits,ok,,,,,,,,,,
website for making birthday cards,86,390,32,0.56,C,make website,ok,,,,,,,,,,
website templates for lawyers,87,260,10,4.24,I,website for lawyers,ok,,,,,,,,,,
make website microsoft,88,590,24,3.11,I,make website,ok,,,,,,,,,,
microsoft website making,89,590,24,3.11,I,make website,ok,,,,,,,,,,
apps for making friends,90,540,22,0.04,I,make app,ok,,,,,,,,,,
make a porn website,91,390,19,1.15,"I,N",make website,ok,,,,,,,,,,
outsourcing software development for startups,92,210,8,0,I,software for startups,ok,,,,,,,,,,
how do i make an app for my business,93,480,20,5.02,I,make app,ok,,,,,,,,,,
how to make dating app,94,480,20,2,I,make app,ok,,,,,,,,,,
how do i make a game app,95,480,20,2.16,I,make app,ok,,,,,,,,,,
how can i make an app for my business,96,480,20,5.02,I,make app,ok,,,,,,,,,,
make ios app on windows,97,480,20,1.93,I,make app,ok,,,,,,,,,,
how to make a social website,98,480,20,2.22,I,make website,ok,,,,,,,,,,
how do you make money from a website,99,480,20,0.27,I,make website,ok,,,,,,,,,,
app that makes you look skinnier,100,590,25,2.04,I,make app,ok,,,,,,,,,,
affordable websites for small businesses,101,590,25,7,I,website for small business,ok,,,,,,,,,,
best tools for seo agencies,102,590,25,0,I,tool for agencies,ok,,,,,,,,,,
software development services for startups,103,260,22,0,"L,C",software for startups,ok,,,,,,,,,,
software development services for startup,104,260,22,0,"L,C",software for startups,ok,,,,,,,,,,
making an app,105,810,36,4.49,I,make app,ok,,,,,,,,,,
app that makes images move,106,590,26,1.25,I,make app,ok,,,,,,,,,,
app that makes moving pictures,107,590,26,1.25,I,make app,ok,,,,,,,,,,
apps to make moving pictures,108,590,26,1.25,I,make app,ok,,,,,,,,,,
make moving pictures app,109,590,26,1.25,I,make app,ok,,,,,,,,,,
app to make moving pictures,110,590,26,1.25,I,make app,ok,,,,,,,,,,
how to make a website on github,111,590,26,2.46,I,make website,ok,,,,,,,,,,
how to make a github website,112,590,26,2.46,I,make website,ok,,,,,,,,,,
how to make a website with github,113,590,26,2.46,I,make website,ok,,,,,,,,,,
how to make github website,114,590,26,2.46,I,make website,ok,,,,,,,,,,
how to make website on github,115,590,26,2.46,I,make website,ok,,,,,,,,,,
how to make a social media platform,116,590,26,1.7,I,make platform,ok,,,,,,,,,,
how to make a game on the app store,117,480,21,1.72,I,make app,ok,,,,,,,,,,
make a website an app on iphone,118,480,21,1.57,I,make app,ok,,,,,,,,,,
make money from cash app,119,480,21,1.45,I,make app,ok,,,,,,,,,,
how to make a social site,120,480,21,2.22,I,make site,ok,,,,,,,,,,
make website app iphone,121,480,21,1.57,I,make website,ok,,,,,,,,,,
how to make a site secure,122,390,17,2.52,I,make site,ok,,,,,,,,,,
how to make a proxy site,123,320,14,1.98,I,make site,ok,,,,,,,,,,
make dating site,124,320,14,2.9,I,make site,ok,,,,,,,,,,
best cam sites for making money,125,320,17,1.28,"I,N",make site,ok,,,,,,,,,,
how to make proxy sites,126,320,14,1.98,I,make site,ok,,,,,,,,,,
app development for restaurant,127,320,14,11.59,I,app for restaurants,ok,,,,,,,,,,
mobile app development for restaurants,128,320,14,11.59,I,app for restaurants,ok,,,,,,,,,,
best hr software for startups,129,320,14,29.07,I,software for startups,ok,,,,,,,,,,
how to make a website in github,130,590,27,2.46,I,make website,ok,,,,,,,,,,
website content for lawyers,131,210,9,0,I,website for lawyers,ok,,,,,,,,,,
free beat making apps,132,480,22,0.4,I,make app,ok,,,,,,,,,,
how to make an app for my business,133,480,22,5.02,I,make app,ok,,,,,,,,,,
how do you make a social networking site,134,480,22,2.22,I,make site,ok,,,,,,,,,,
how to make a site in html,135,480,22,1.48,I,make site,ok,,,,,,,,,,
making mobile websites,136,480,22,4.39,I,make website,ok,,,,,,,,,,
app development for startups,137,260,24,8.24,"L,C",app for startups,ok,,,,,,,,,,
apps that make,138,660,31,4.49,I,make app,ok,,,,,,,,,,
making a porn website,139,390,22,1.15,"I,N",make website,ok,,,,,,,,,,
app to make a podcast,140,590,28,1.47,I,make app,ok,,,,,,,,,,
how to make photography website,141,590,28,3.17,I,make website,ok,,,,,,,,,,
making photography website,142,590,28,4.4,I,make website,ok,,,,,,,,,,
payroll app for small business,143,590,28,49.53,I,app for small business,ok,,,,,,,,,,
template for restaurant website,144,590,28,3.45,I,website for restaurants,ok,,,,,,,,,,
website templates for restaurant,145,590,28,3.45,I,website for restaurants,ok,,,,,,,,,,
how to make game app,146,480,23,2.16,I,make app,ok,,,,,,,,,,
make website an app on iphone,147,480,23,1.57,I,make app,ok,,,,,,,,,,
how to make a social networking site,148,480,23,2.22,I,make site,ok,,,,,,,,,,
how does a website make money,149,480,23,0.27,I,make website,ok,,,,,,,,,,
how to make a social network website,150,480,23,2.22,I,make website,ok,,,,,,,,,,
how do you make a social media website,151,480,23,2.22,I,make website,ok,,,,,,,,,,
how can a website make money,152,480,23,0.27,I,make website,ok,,,,,,,,,,
how to make a platform bed higher,153,140,6,0.25,I,make platform,ok,,,,,,,,,,
app development for restaurants,154,320,15,11.59,I,app for restaurants,ok,,,,,,,,,,
best website builder for nonprofit,155,320,15,7.02,I,website for nonprofits,ok,,,,,,,,,,
best apps for content creators,156,140,6,1.38,I,app creator for,ok,,,,,,,,,,
best driving app to make money,157,590,29,1,I,make app,ok,,,,,,,,,,
website hosts for nonprofits,158,590,29,4.39,I,website for nonprofits,ok,,,,,,,,,,
best tools for seo agency,159,590,29,0,I,tool for agencies,ok,,,,,,,,,,
website to make birthday cards,160,390,39,0.56,C,make website,ok,,,,,,,,,,
apps for restaurant management,161,390,19,10.2,I,app for restaurants,ok,,,,,,,,,,
app for restaurant management,162,390,19,10.2,I,app for restaurants,ok,,,,,,,,,,
how to make a game app,163,480,24,2.16,I,make app,ok,,,,,,,,,,
app to make barcodes,164,480,24,0.74,I,make app,ok,,,,,,,,,,
make a barcode app,165,480,24,0.74,I,make app,ok,,,,,,,,,,
cam sites to make money,166,210,10,1.32,I,make site,ok,,,,,,,,,,
outsource software development for startups,167,210,10,0,I,software for startups,ok,,,,,,,,,,
apps for making movies,168,590,30,0.84,I,make app,ok,,,,,,,,,,
affordable websites for small business,169,590,30,7,I,website for small business,ok,,,,,,,,,,
best website builder for photographers,170,590,30,3.96,I,website for photographers,ok,,,,,,,,,,
website development for startups,171,170,8,8.48,I,website for startups,ok,,,,,,,,,,
making a porn site,172,390,24,1.15,"I,N",make site,ok,,,,,,,,,,
how to make a site to sell stuff,173,390,20,3.46,I,make site,ok,,,,,,,,,,
how to make a dating site,174,260,13,1.51,I,make site,ok,,,,,,,,,,
how to make a website to sell stuff,175,390,20,3.46,I,make website,ok,,,,,,,,,,
best website design companies for small businesses,176,260,27,8.29,"L,C",website for small business,ok,,,,,,,,,,
seo reporting tools for agencies,177,390,20,0,I,tool for agencies,ok,,,,,,,,,,
how do sites make money,178,480,25,0.27,I,make site,ok,,,,,,,,,,
how do internet sites make money,179,480,25,0.27,I,make site,ok,,,,,,,,,,
make a website microsoft,180,590,31,3.11,I,make website,ok,,,,,,,,,,
make a website with microsoft,181,590,31,3.11,I,make website,ok,,,,,,,,,,
ideas for church websites,182,110,5,1.11,I,website for churches,ok,,,,,,,,,,
top website builders for photographers,183,590,38,3.96,"I,N",website for photographers,ok,,,,,,,,,,
average cost of website design for small business,184,590,32,2.23,I,website for small business,ok,,,,,,,,,,
how can make money from website,185,480,26,0.27,I,make website,ok,,,,,,,,,,
how do you make money with a website,186,480,26,0.27,I,make website,ok,,,,,,,,,,
how to make website an app,187,480,26,1.77,I,make website,ok,,,,,,,,,,
how do a website make money,188,480,26,0.27,I,make website,ok,,,,,,,,,,
how do i make money from a website,189,480,26,0.27,I,make website,ok,,,,,,,,,,
how do i make money with a website,190,480,26,0.27,I,make website,ok,,,,,,,,,,
how to make social media website,191,480,26,2.22,I,make website,ok,,,,,,,,,,
website templates for photographers,192,320,17,2.15,I,website for photographers,ok,,,,,,,,,,
how do you create an app for your business,193,480,26,5.02,I,create app for business,ok,,,,,,,,,,
how to make a website an icon,194,390,21,0.95,I,make website,ok,,,,,,,,,,
app to make podcast,195,590,39,1.47,"I,N",make app,ok,,,,,,,,,,
how to make platform shoes,196,140,7,0,I,make platform,ok,,,,,,,,,,
how to make platform sneakers,197,140,7,0,I,make platform,ok,,,,,,,,,,
cash app for churches,198,140,7,2.36,I,app for churches,ok,,,,,,,,,,
best driving apps to make money,199,590,33,1,I,make app,ok,,,,,,,,,,
app for restaurant menu,200,390,26,4.03,"I,N",app for restaurants,ok,,,,,,,,,,
apps for making music videos,201,480,27,0.9,I,make app,ok,,,,,,,,,,
make a slack app,202,480,27,7.71,I,make app,ok,,,,,,,,,,
make google find your website,203,480,27,5,I,make website,ok,,,,,,,,,,
best apps for small business,204,480,27,8,I,app for small business,ok,,,,,,,,,,
free website for nonprofit organization,205,480,27,5.94,I,website for nonprofits,ok,,,,,,,,,,
how to create an app for your business,206,480,27,5.02,I,create app for business,ok,,,,,,,,,,
how to create an app for my business,207,480,27,5.02,I,create app for business,ok,,,,,,,,,,
how do i create an app for my business,208,480,27,5.02,I,create app for business,ok,,,,,,,,,,
how can i create an app for my business,209,480,27,5.02,I,create app for business,ok,,,,,,,,,,
make a platform bed frame,210,110,12,0.42,C,make platform,ok,,,,,,,,,,
best app to make flyers,211,590,34,1.06,I,make app,ok,,,,,,,,,,
app to make apps free,212,590,34,3.53,I,make app,ok,,,,,,,,,,
best app for making flyers,213,590,34,1.06,I,make app,ok,,,,,,,,,,
how do you make a website on google,214,590,34,3.21,I,make website,ok,,,,,,,,,,
how to make a photography website,215,590,34,3.17,I,make website,ok,,,,,,,,,,
how to make a website on canva,216,590,34,1.94,I,make website,ok,,,,,,,,,,
best site builder for photographers,217,590,34,3.96,I,site builder for,ok,,,,,,,,,,
make a dating site,218,320,18,2.9,I,make site,ok,,,,,,,,,,
best website design company for small business,219,260,30,8.29,"L,C",website for small business,ok,,,,,,,,,,
make money on cash app,220,480,28,1.45,I,make app,ok,,,,,,,,,,
best app for restaurants,221,480,28,0.94,I,app for restaurants,ok,,,,,,,,,,
apps to make a photo video,222,590,35,1.08,I,make app,ok,,,,,,,,,,
making apps for free,223,590,35,3.53,I,make app,ok,,,,,,,,,,
how to make a website for photography,224,590,35,3.17,I,make website,ok,,,,,,,,,,
how to make money of website,225,390,23,0.73,I,make website,ok,,,,,,,,,,
best blogging platform to make money,226,260,15,1.27,I,make platform,ok,,,,,,,,,,
make money iphone apps,227,480,35,1.72,"I,N",make app,ok,,,,,,,,,,
how to make an app a widget,228,480,29,2.92,I,make app,ok,,,,,,,,,,
make webpage into app,229,480,29,1.74,I,make app,ok,,,,,,,,,,
how to make custom app icons,230,480,29,0.17,I,make app,ok,,,,,,,,,,
how to make a squarespace site,231,480,29,4.64,I,make site,ok,,,,,,,,,,
how to make a website html,232,480,29,1.48,I,make website,ok,,,,,,,,,,
how to make an html website,233,480,29,1.48,I,make website,ok,,,,,,,,,,
how to make social network website,234,480,29,2.22,I,make website,ok,,,,,,,,,,
best app for small business,235,480,29,8,I,app for small business,ok,,,,,,,,,,
website hosting for nonprofits,236,590,36,4.39,I,website for nonprofits,ok,,,,,,,,,,
how to make a business site on facebook,237,390,24,0.29,I,make site,ok,,,,,,,,,,
tools for marketing agencies,238,390,24,9.96,I,tool for agencies,ok,,,,,,,,,,
best survey app to make money,239,590,37,1.12,I,make app,ok,,,,,,,,,,
how do you make a game app,240,480,30,2.16,I,make app,ok,,,,,,,,,,
best business apps for small business,241,480,30,8,I,app for small business,ok,,,,,,,,,,
marketing apps for small business,242,320,20,5.92,I,app for small business,ok,,,,,,,,,,
template website for photographers,243,320,20,2.15,I,website for photographers,ok,,,,,,,,,,
template websites for photographers,244,320,20,2.15,I,website for photographers,ok,,,,,,,,,,
make a film app,245,590,38,0.84,I,make app,ok,,,,,,,,,,
app for movie making,246,590,38,0.84,I,make app,ok,,,,,,,,,,
microsoft make a website,247,590,38,3.11,I,make website,ok,,,,,,,,,,
make app store account,248,480,31,0,I,make app,ok,,,,,,,,,,
make money with cash app,249,480,31,1.45,I,make app,ok,,,,,,,,,,
payment apps for small businesses,250,390,25,9.44,I,app for small business,ok,,,,,,,,,,
website designers for small business near me,251,260,34,10.99,"L,C",website for small business,ok,,,,,,,,,,
app to make a video with photos,252,590,39,1.08,I,make app,ok,,,,,,,,,,
make a movie app,253,590,39,0.84,I,make app,ok,,,,,,,,,,
make receipts app,254,590,39,2.58,I,make app,ok,,,,,,,,,,
app for making video from photos,255,590,39,1.08,I,make app,ok,,,,,,,,,,
make a receipt app,256,590,39,2.58,I,make app,ok,,,,,,,,,,
google how to make a website,257,590,39,3.21,I,make website,ok,,,,,,,,,,
inexpensive websites for small businesses,258,590,39,7,I,website for small business,ok,,,,,,,,,,
app for small businesses,259,190,12,8,I,app for small business,ok,,,,,,,,,,
make website into app,260,480,32,1.74,I,make app,ok,,,,,,,,,,
how do you make a game on the app store,261,480,32,1.72,I,make app,ok,,,,,,,,,,
how to make a game on app store,262,480,32,1.72,I,make app,ok,,,,,,,,,,
how to make game apps,263,480,32,2.16,I,make app,ok,,,,,,,,,,
how to make an app from scratch,264,480,32,3.18,I,make app,ok,,,,,,,,,,
how can i make a game for the app store,265,480,32,1.72,I,make app,ok,,,,,,,,,,
make a webpage into an app,266,480,32,1.74,I,make app,ok,,,,,,,,,,
make a website into an app,267,480,32,1.74,I,make app,ok,,,,,,,,,,
best app for making beats,268,480,32,0.61,I,make app,ok,,,,,,,,,,
how to make proxy site,269,320,21,1.98,I,make site,ok,,,,,,,,,,
make a website for kids,270,480,32,0,I,make website,ok,,,,,,,,,,
how to make a website into an app,271,480,32,1.78,I,make website,ok,,,,,,,,,,
how to make a treehouse platform,272,320,21,0.05,I,make platform,ok,,,,,,,,,,
best apps for restaurants,273,480,32,0.94,I,app for restaurants,ok,,,,,,,,,,
invoice apps for small business,274,480,32,8,I,app for small business,ok,,,,,,,,,,
free website hosting for nonprofit organizations,275,320,21,3.52,I,website for nonprofits,ok,,,,,,,,,,
free website hosting for nonprofits,276,320,21,3.52,I,website for nonprofits,ok,,,,,,,,,,
seo tools for digital agency,277,480,32,0,I,tool for agencies,ok,,,,,,,,,,
how can i make a website to sell things,278,390,26,3.46,I,make website,ok,,,,,,,,,,
how do you make a website to sell things,279,390,26,3.46,I,make website,ok,,,,,,,,,,
best blog platform to make money,280,260,17,1.27,I,make platform,ok,,,,,,,,,,
delivery apps for restaurants,281,390,26,1.67,I,app for restaurants,ok,,,,,,,,,,
make a list app,282,590,40,0.85,I,make app,ok,,,,,,,,,,
making a free app,283,590,40,3.53,I,make app,ok,,,,,,,,,,
make a podcast app,284,590,40,1.47,I,make app,ok,,,,,,,,,,
app to make photos into a video,285,590,40,1.08,I,make app,ok,,,,,,,,,,
app to make pictures into a video,286,590,40,1.08,I,make app,ok,,,,,,,,,,
making a app for free,287,590,40,3.53,I,make app,ok,,,,,,,,,,
app that makes pictures into a video,288,590,40,1.08,I,make app,ok,,,,,,,,,,
how to make site responsive,289,590,40,1.2,I,make site,ok,,,,,,,,,,
how to make a responsive site,290,590,40,1.2,I,make site,ok,,,,,,,,,,
how do you make a website responsive,291,590,40,1.2,I,make website,ok,,,,,,,,,,
how can i make responsive website,292,590,40,1.2,I,make website,ok,,,,,,,,,,
making a website for photography,293,590,40,4.4,I,make website,ok,,,,,,,,,,
how do make money from websites,294,480,33,0.27,I,make website,ok,,,,,,,,,,
how do you make money from websites,295,480,33,0.27,I,make website,ok,,,,,,,,,,
best app for restaurant,296,480,33,0.94,I,app for restaurants,ok,,,,,,,,,,
free website for nonprofit organizations,297,480,33,5.94,I,website for nonprofits,ok,,,,,,,,,,
how to create app for your business,298,480,33,5.02,I,create app for business,ok,,,,,,,,,,
how do social media sites make money,299,210,14,0,I,make site,ok,,,,,,,,,,
website management services for small businesses,300,140,19,17.54,"L,C",website for small business,ok,,,,,,,,,,
website templates for churches for free,301,210,14,1.34,I,website for churches,ok,,,,,,,,,,
free website templates for church,302,210,14,1.34,I,website for churches,ok,,,,,,,,,,
cost of a website for a small business,303,390,27,2.58,I,website for small business,ok,,,,,,,,,,
website template for photographer,304,320,22,2.15,I,website for photographers,ok,,,,,,,,,,
how to make a basking platform for turtles,305,110,7,0.29,I,make platform,ok,,,,,,,,,,
best streaming platform to make money,306,110,7,1.53,I,make platform,ok,,,,,,,,,,
how to make a turtle basking platform,307,110,7,0.29,I,make platform,ok,,,,,,,,,,
money making apps iphone,308,480,34,1.72,I,make app,ok,,,,,,,,,,
apps to make music videos,309,480,34,0.9,I,make app,ok,,,,,,,,,,
how to make a site with html,310,480,34,1.48,I,make site,ok,,,,,,,,,,
how to make a website with html,311,480,34,1.48,I,make website,ok,,,,,,,,,,
how to make a website on squarespace,312,480,34,4.64,I,make website,ok,,,,,,,,,,
making affiliate marketing website,313,480,34,3.46,I,make website,ok,,,,,,,,,,
how do you make money on a website,314,480,34,0.27,I,make website,ok,,,,,,,,,,
how make a website in html,315,480,34,1.48,I,make website,ok,,,,,,,,,,
how to make a website on html,316,480,34,1.48,I,make website,ok,,,,,,,,,,
how make website in html,317,480,34,1.48,I,make website,ok,,,,,,,,,,
app development for startup,318,260,18,8.24,I,app for startups,ok,,,,,,,,,,
how do i make a site secure,319,390,28,2.52,I,make site,ok,,,,,,,,,,
how do you make a website secure,320,390,28,2.52,I,make website,ok,,,,,,,,,,
how to make a website and sell stuff,321,390,28,3.46,I,make website,ok,,,,,,,,,,
making a website into an app,322,480,35,1.74,I,make app,ok,,,,,,,,,,
poster making app,323,480,35,0.56,I,make app,ok,,,,,,,,,,
seo tools for seo agency,324,480,35,0,I,tool for agencies,ok,,,,,,,,,,
free templates for church websites,325,210,15,1.34,I,website for churches,ok,,,,,,,,,,
free website templates for churches,326,210,15,1.34,I,website for churches,ok,,,,,,,,,,
what kind of website should i make to make money,327,390,29,0,I,make website,ok,,,,,,,,,,
how to make a website for selling items,328,390,29,3.46,I,make website,ok,,,,,,,,,,
how to make a website icon,329,390,29,0.95,I,make website,ok,,,,,,,,,,
how to make an app for your business,330,480,36,5.02,I,make app,ok,,,,,,,,,,
make a mobile website,331,480,36,4.39,I,make website,ok,,,,,,,,,,
how to make a squarespace website,332,480,36,4.64,I,make website,ok,,,,,,,,,,
make website into mobile app,333,480,36,1.74,I,make website,ok,,,,,,,,,,
how make website in google,334,480,36,2.38,I,make website,ok,,,,,,,,,,
