keyword,priority,volume,kd,cpc,intent,seed,flag,published,Ссылка конкурента 1,Ссылка конкурента 2,Ссылка конкурента 3,Заголовок конкурента 1,Заголовок конкурента 2,Заголовок конкурента 3,Сниппет конкурента 1,Сниппет конкурента 2,Сниппет конкурента 3
app for international real estate,946,260,24,0.65,I,app for real estate,irrelevant,,,,,,,,,,
best app for commercial real estate,947,140,22,0.66,I,app for real estate,irrelevant,,,,,,,,,,
best real estate apps for buyers,948,110,38,1.21,I,app for real estate,irrelevant,,,,,,,,,,
apps for real estate investors,949,90,31,3.25,I,app for real estate,irrelevant,,,,,,,,,,
apps for real estate investing,950,90,20,3.25,"I,N",app for real estate,irrelevant,,,,,,,,,,
mobile apps for real estate,951,90,34,2.72,I,app for real estate,irrelevant,,,,,,,,,,
open house app for real estate agents,952,70,20,4.07,I,app for real estate,irrelevant,,,,,,,,,,
app for real estate photos,953,70,11,1.91,I,app for real estate,irrelevant,,,,,,,,,,
best real estate apps for agents,954,50,28,3.08,I,app for real estate,irrelevant,,,,,,,,,,
best apps for real estate investors,955,50,26,2.68,I,app for real estate,irrelevant,,,,,,,,,,
top apps for real estate agents,956,50,23,2.35,I,app for real estate,irrelevant,,,,,,,,,,
best real estate apps for realtors,957,50,35,3.08,I,app for real estate,irrelevant,,,,,,,,,,
best app for real estate investors,958,50,32,2.68,I,app for real estate,irrelevant,,,,,,,,,,
best mobile apps for real estate agents,959,50,32,3.08,I,app for real estate,irrelevant,,,,,,,,,,
website for wedding photographers,960,170,31,1.47,I,website for photographers,irrelevant,,,,,,,,,,
websites for wedding photographers,961,170,31,1.47,I,website for photographers,irrelevant,,,,,,,,,,
website templates for wedding photographers,962,90,19,1.95,I,website for photographers,irrelevant,,,,,,,,,,
website design for family lawyer,963,140,6,0,I,website for lawyers,irrelevant,,,,,,,,,,
content for lawyer websites,964,110,14,0,I,website for lawyers,irrelevant,,,,,,,,,,
content for lawyer website,965,110,16,0,I,website for lawyers,irrelevant,,,,,,,,,,
