keyword,priority,volume,kd,cpc,intent,seed,flag,published,Ссылка конкурента 1,Ссылка конкурента 2,Ссылка конкурента 3,Заголовок конкурента 1,Заголовок конкурента 2,Заголовок конкурента 3,Сниппет конкурента 1,Сниппет конкурента 2,Сниппет конкурента 3
app for small business owners,648,90,19,8.69,I,app for small business,ok,,,,,,,,,,
software developers for startups,649,90,39,4.59,"L,C",software for startups,ok,,,,,,,,,,
chat site to make friends,650,170,37,0,I,make site,ok,,,,,,,,,,
chat sites for making friends,651,170,37,1.31,I,make site,ok,,,,,,,,,,
best freelance websites for beginners,652,170,37,0.94,I,website for freelancers,ok,,,,,,,,,,
website designers for small business,653,60,26,10.77,"L,C",website for small business,ok,,,,,,,,,,
free website builder for churches,654,110,24,3.03,I,website for churches,ok,,,,,,,,,,
freelancing websites for beginners,655,140,31,1.05,I,website for freelancers,ok,,,,,,,,,,
website designers for churches,656,70,31,5.77,"L,C",website for churches,ok,,,,,,,,,,
making a site with wordpress,657,170,38,4.15,I,make site,ok,,,,,,,,,,
free time clock app for small business,658,170,38,9.53,I,app for small business,ok,,,,,,,,,,
website for freelance designers,659,170,38,2.37,I,website for freelancers,ok,,,,,,,,,,
website for nonprofit jobs,660,170,38,1.02,I,website for nonprofits,ok,,,,,,,,,,
free apps for small business,661,90,20,6.59,I,app for small business,ok,,,,,,,,,,
fundraising apps for schools,662,140,32,2.4,I,app for schools,ok,,,,,,,,,,
social media tools for agencies,663,140,32,9.98,I,tool for agencies,ok,,,,,,,,,,
chat sites to make friends,664,170,40,1.31,I,make site,ok,,,,,,,,,,
app for restaurant orders,665,170,40,7.54,I,app for restaurants,ok,,,,,,,,,,
apps for taking restaurant orders,666,140,33,2.85,I,app for restaurants,ok,,,,,,,,,,
website templates for restaurants free,667,140,33,3.03,I,website for restaurants,ok,,,,,,,,,,
website builder for lawyers,668,70,16,47.29,I,website for lawyers,ok,,,,,,,,,,
local seo tools for seo agency,669,140,33,0,I,tool for agencies,ok,,,,,,,,,,
recommended hr platforms for startups,670,70,16,0,I,platform for startups,ok,,,,,,,,,,
what is the best social media platform to make money,671,90,21,0.72,I,make platform,ok,,,,,,,,,,
mobile apps for small business,672,90,21,7.93,I,app for small business,ok,,,,,,,,,,
mobile apps for small businesses,673,90,21,7.93,I,app for small business,ok,,,,,,,,,,
best app for small business owners,674,90,21,8.56,I,app for small business,ok,,,,,,,,,,
app developers for startups,675,110,26,9.87,I,app for startups,ok,,,,,,,,,,
mobile app developers for startups,676,110,26,9.87,I,app for startups,ok,,,,,,,,,,
open table app for restaurants,677,140,34,1.66,I,app for restaurants,ok,,,,,,,,,,
cost of website design for small business,678,140,34,3.12,I,website for small business,ok,,,,,,,,,,
software product development company for startups,679,50,24,0,"L,C",software for startups,ok,,,,,,,,,,
create an app for business,680,140,34,7.84,I,create app for business,ok,,,,,,,,,,
how to make a bed platform with storage,681,70,17,0,I,make platform,ok,,,,,,,,,,
cash back apps for restaurants,682,140,35,1.49,I,app for restaurants,ok,,,,,,,,,,
how much does it cost for a small business website,683,140,35,2.6,I,website for small business,ok,,,,,,,,,,
how to create a church website for free,684,70,17,3.46,I,website for churches,ok,,,,,,,,,,
free website hosting for churches,685,70,17,1.69,I,website for churches,ok,,,,,,,,,,
sales tools for startups,686,70,17,0,I,tool for startups,ok,,,,,,,,,,
creating app for business,687,140,35,7.84,I,create app for business,ok,,,,,,,,,,
how to make a 2d platformer,688,50,12,0,I,make platform,ok,,,,,,,,,,
how to make a king size platform bed,689,50,12,0,I,make platform,ok,,,,,,,,,,
how to make a 2d platformer game,690,50,12,0,I,make platform,ok,,,,,,,,,,
how to make a queen platform bed frame,691,50,12,0,I,make platform,ok,,,,,,,,,,
best ecommerce websites for small business,692,110,28,6.45,I,website for small business,ok,,,,,,,,,,
how to make a website for restaurants,693,140,36,10.31,I,website for restaurants,ok,,,,,,,,,,
create website for restaurant,694,140,36,9.39,I,website for restaurants,ok,,,,,,,,,,
website design for small businesses,695,70,36,7.74,"L,C",website for small business,ok,,,,,,,,,,
website design agency for small business,696,70,36,3.72,"L,C",website for small business,ok,,,,,,,,,,
best website themes for photographers,697,90,23,2.57,I,website for photographers,ok,,,,,,,,,,
best tools for seo for startups,698,90,23,0,I,tool for startups,ok,,,,,,,,,,
how to make a website on google sites,699,140,37,1.8,I,make site,ok,,,,,,,,,,
how to make a shopping site,700,140,37,4.25,I,make site,ok,,,,,,,,,,
best mobile payment app for small business,701,140,37,11.19,I,app for small business,ok,,,,,,,,,,
website design tips for small business,702,110,29,1.59,I,website for small business,ok,,,,,,,,,,
website design tips for small businesses,703,110,29,1.59,I,website for small business,ok,,,,,,,,,,
project management tool for agencies,704,110,29,15.94,I,tool for agencies,ok,,,,,,,,,,
project management tools for agencies,705,110,29,15.94,I,tool for agencies,ok,,,,,,,,,,
website maintenance service for small business,706,70,22,0,"L,N",website for small business,ok,,,,,,,,,,
mobile app for small business,707,90,24,7.93,I,app for small business,ok,,,,,,,,,,
school apps for teachers,708,90,24,0,I,app for schools,ok,,,,,,,,,,
how to create a website for a church,709,90,24,3.7,I,website for churches,ok,,,,,,,,,,
make a platform game,710,50,13,0,I,make platform,ok,,,,,,,,,,
instructions for making platform bed,711,50,13,0,I,make platform,ok,,,,,,,,,,
how to make a king size bed platform,712,50,13,0,I,make platform,ok,,,,,,,,,,
restaurant apps for owners,713,50,13,14.26,I,app for restaurants,ok,,,,,,,,,,
ai tools for startup,714,110,30,7.15,I,tool for startups,ok,,,,,,,,,,
software development for startup,715,50,16,3.35,"I,N",software for startups,ok,,,,,,,,,,
website design costs for small business,716,140,39,3.12,I,website for small business,ok,,,,,,,,,,
how to photograph clothing for website,717,70,19,0.27,I,website for photographers,ok,,,,,,,,,,
best websites for nonprofit jobs,718,70,19,1.02,I,website for nonprofits,ok,,,,,,,,,,
best crm tool for startups,719,140,39,33.04,I,tool for startups,ok,,,,,,,,,,
white label tools for agencies,720,70,19,0,I,tool for agencies,ok,,,,,,,,,,
create mobile app for business,721,140,39,7.84,I,create app for business,ok,,,,,,,,,,
digital menu app for restaurants,722,90,25,5.71,I,app for restaurants,ok,,,,,,,,,,
apps for vegan restaurants,723,90,25,1.21,I,app for restaurants,ok,,,,,,,,,,
free website templates for nonprofits,724,90,25,2.03,I,website for nonprofits,ok,,,,,,,,,,
custom software development company for startups,725,50,28,0,"L,C",software for startups,ok,,,,,,,,,,
website designer for small business,726,60,34,10.77,"L,C",website for small business,ok,,,,,,,,,,
free blogging sites to make money,727,140,40,1.32,I,make site,ok,,,,,,,,,,
online platforms to make money,728,140,40,1.45,I,make platform,ok,,,,,,,,,,
app for ordering food at restaurant,729,140,40,0,I,app for restaurants,ok,,,,,,,,,,
freelance websites for data entry jobs,730,90,31,0,"I,N",website for freelancers,ok,,,,,,,,,,
best marketing apps for small business,731,110,32,0,I,app for small business,ok,,,,,,,,,,
mobile app for church,732,110,32,3.16,I,app for churches,ok,,,,,,,,,,
website templates for freelancers,733,50,14,0,I,website for freelancers,ok,,,,,,,,,,
showit website templates for photographers,734,90,26,1.09,I,website for photographers,ok,,,,,,,,,,
average cost of website for small business,735,90,27,1.71,I,website for small business,ok,,,,,,,,,,
average cost of a website for a small business,736,90,27,1.71,I,website for small business,ok,,,,,,,,,,
making a weightlifting platform,737,50,15,0.44,I,make platform,ok,,,,,,,,,,
free website builder for nonprofits,738,90,28,6.43,I,website for nonprofits,ok,,,,,,,,,,
website hosting for photographers,739,110,35,3.18,I,website for photographers,ok,,,,,,,,,,
website hosts for photographers,740,110,35,3.18,I,website for photographers,ok,,,,,,,,,,
app for startup,741,70,22,2.89,I,app for startups,ok,,,,,,,,,,
website for the tv show the doctors,742,70,22,0,I,website for doctors,ok,,,,,,,,,,
animation creator app for android,743,70,22,0,I,app creator for,ok,,,,,,,,,,
best website builder for nonprofit organization,744,90,29,9.29,I,website for nonprofits,ok,,,,,,,,,,
create app for church,745,50,16,2.43,I,app for churches,ok,,,,,,,,,,
free church app builder,746,50,16,2.43,I,app builder church,ok,,,,,,,,,,
church app builder free,747,50,16,2.43,I,app builder church,ok,,,,,,,,,,
food delivery app for restaurants,748,70,23,10.84,I,app for restaurants,ok,,,,,,,,,,
photographing clothing for website,749,70,23,0,I,website for photographers,ok,,,,,,,,,,
market research tools for startups,750,70,23,0,I,tool for startups,ok,,,,,,,,,,
best apps for small business accounting,751,90,30,8,I,app for small business,ok,,,,,,,,,,
music apps for school,752,60,20,0,I,app for schools,ok,,,,,,,,,,
mobile app for churches,753,110,38,3.16,I,app for churches,ok,,,,,,,,,,
best app for searching hotels,754,110,38,3.13,I,app for hotels,ok,,,,,,,,,,
ai tools for startups,755,110,38,7.15,I,tool for startups,ok,,,,,,,,,,
creating a website for a church,756,90,31,7.67,I,website for churches,ok,,,,,,,,,,
best app for small business receipts,757,70,24,5.58,I,app for small business,ok,,,,,,,,,,
free marketing tools for startups,758,50,17,0,I,tool for startups,ok,,,,,,,,,,
best tools for digital marketing agencies,759,50,17,0,I,tool for agencies,ok,,,,,,,,,,
freelance websites for web developers,760,90,32,2.34,I,website for freelancers,ok,,,,,,,,,,
app for dog friendly restaurants,761,70,25,0,I,app for restaurants,ok,,,,,,,,,,
best mileage tracking app for small business,762,70,25,3.25,I,app for small business,ok,,,,,,,,,,
maths apps for primary school,763,70,25,0,I,app for schools,ok,,,,,,,,,,
wordpress for church websites,764,70,25,1.65,I,website for churches,ok,,,,,,,,,,
inventory management app for small business,765,110,40,7.8,I,app for small business,ok,,,,,,,,,,
freelancers for website development,766,110,40,1.47,I,website for freelancers,ok,,,,,,,,,,
website host for photographers,767,110,40,3.18,I,website for photographers,ok,,,,,,,,,,
how to create an app for my business for free,768,110,40,2.73,I,create app for business,ok,,,,,,,,,,
best app for churches,769,90,33,2.87,I,app for churches,ok,,,,,,,,,,
top marketing apps for small business,770,50,18,0,I,app for small business,ok,,,,,,,,,,
website designer for restaurant,771,50,37,5.04,"L,C",website for restaurants,ok,,,,,,,,,,
website design for restaurants,772,50,18,5.04,I,website for restaurants,ok,,,,,,,,,,
website designer for photographers,773,50,37,8.68,"L,C",website for photographers,ok,,,,,,,,,,
wordpress websites for churches,774,70,26,1.65,I,website for churches,ok,,,,,,,,,,
best website builder for membership site,775,70,26,7.4,I,site builder for,ok,,,,,,,,,,
receipt tracking app for small business,776,90,34,4.81,I,app for small business,ok,,,,,,,,,,
software for startup,777,90,34,6.08,I,software for startups,ok,,,,,,,,,,
best ecommerce platform for startup,778,90,34,0,I,platform for startups,ok,,,,,,,,,,
best app developers for startups,779,70,27,15.18,I,app for startups,ok,,,,,,,,,,
hr apps for small business,780,70,27,21.97,I,app for small business,ok,,,,,,,,,,
website design for restaurant,781,50,19,5.04,I,website for restaurants,ok,,,,,,,,,,
average website cost for small business,782,90,35,1.71,I,website for small business,ok,,,,,,,,,,
personal trainer app for gym,783,90,36,2.9,I,app for gyms,ok,,,,,,,,,,
website development for restaurants,784,90,36,4.94,I,website for restaurants,ok,,,,,,,,,,
best platform to make money,785,70,28,1.02,I,make platform,ok,,,,,,,,,,
app for rating restaurants,786,70,28,0.85,I,app for restaurants,ok,,,,,,,,,,
wait time app for restaurants,787,70,28,0.71,I,app for restaurants,ok,,,,,,,,,,
marketing tools for startups,788,50,20,0,I,tool for startups,ok,,,,,,,,,,
free inventory app for small business,789,90,37,5.78,I,app for small business,ok,,,,,,,,,,
freelancing websites for web developers,790,90,37,2.34,I,website for freelancers,ok,,,,,,,,,,
book creator app for ipad,791,70,29,0,I,app creator for,ok,,,,,,,,,,
shipping app for small business,792,90,38,4.41,I,app for small business,ok,,,,,,,,,,
ecommerce websites for small business,793,90,38,5.6,I,website for small business,ok,,,,,,,,,,
free app creator for ios,794,90,38,3.27,I,app creator for,ok,,,,,,,,,,
make platform games,795,50,21,0,I,make platform,ok,,,,,,,,,,
making platform games,796,50,21,0,I,make platform,ok,,,,,,,,,,
best app for restaurant management,797,50,21,24.94,I,app for restaurants,ok,,,,,,,,,,
best receipt app for small business,798,70,30,5.58,I,app for small business,ok,,,,,,,,,,
ai tools for marketing agency,799,70,30,14.38,I,tool for agencies,ok,,,,,,,,,,
average cost for small business website,800,90,39,1.71,I,website for small business,ok,,,,,,,,,,
software for startup businesses,801,90,39,6.08,I,software for startups,ok,,,,,,,,,,
software developer for startup,802,90,39,4.59,I,software for startups,ok,,,,,,,,,,
fitness apps for the gym,803,90,40,1.99,I,app for gyms,ok,,,,,,,,,,
cost of creating a website for a small business,804,90,40,2.5,I,website for small business,ok,,,,,,,,,,
gym apps for beginners,805,70,31,2.08,I,app for gyms,ok,,,,,,,,,,
gym for beginners app,806,70,31,2.08,I,app for gyms,ok,,,,,,,,,,
free website builder for photographers,807,70,31,3.3,I,website for photographers,ok,,,,,,,,,,
booking website for photographers,808,70,31,7.98,I,website for photographers,ok,,,,,,,,,,
best ecommerce platforms for startups,809,70,31,0,I,platform for startups,ok,,,,,,,,,,
best app for creating business cards,810,70,31,1.79,I,create app for business,ok,,,,,,,,,,
custom mobile app development for startups,811,70,32,0,I,app for startups,ok,,,,,,,,,,
online ordering app for small business,812,70,32,7.06,I,app for small business,ok,,,,,,,,,,
receipt app for small business,813,70,32,4.95,I,app for small business,ok,,,,,,,,,,
best travel app for hotels,814,70,32,2.83,I,app for hotels,ok,,,,,,,,,,
booking websites for photographers,815,70,32,7.98,I,website for photographers,ok,,,,,,,,,,
book creator apps for ipad,816,70,32,0,I,app creator for,ok,,,,,,,,,,
cloud apps for small business,817,50,23,0,I,app for small business,ok,,,,,,,,,,
okr software for startups,818,50,23,0,I,software for startups,ok,,,,,,,,,,
cheating apps for school,819,60,28,0,I,app for schools,ok,,,,,,,,,,
apps for finding cheap hotels,820,70,33,3,I,app for hotels,ok,,,,,,,,,,
best freelance websites for writers,821,70,33,1.57,I,website for freelancers,ok,,,,,,,,,,
best websites for photographers portfolio,822,70,33,3.76,I,website for photographers,ok,,,,,,,,,,
website for freelancer,823,80,38,1.22,I,website for freelancers,ok,,,,,,,,,,
make video platform,824,70,34,1.75,I,make platform,ok,,,,,,,,,,
seesaw for schools app,825,70,34,0,I,app for schools,ok,,,,,,,,,,
wholesale websites for small business,826,70,34,3,I,website for small business,ok,,,,,,,,,,
best website for freelance graphic designers,827,70,34,1.93,I,website for freelancers,ok,,,,,,,,,,
best websites for freelance graphic designers,828,70,34,1.93,I,website for freelancers,ok,,,,,,,,,,
app for leftover food from restaurants,829,70,35,0.33,I,app for restaurants,ok,,,,,,,,,,
hr app for small business,830,70,35,21.97,I,app for small business,ok,,,,,,,,,,
buy now pay later apps for hotels,831,70,35,1.87,I,app for hotels,ok,,,,,,,,,,
website designs for small business,832,70,35,7.74,I,website for small business,ok,,,,,,,,,,
websites for freelance translators,833,70,35,0.85,I,website for freelancers,ok,,,,,,,,,,
best social media management tools for agencies,834,70,35,14,I,tool for agencies,ok,,,,,,,,,,
tool for seo agency,835,70,35,0,I,tool for agencies,ok,,,,,,,,,,
website designs for restaurants,836,50,25,5.04,I,website for restaurants,ok,,,,,,,,,,
website tips for small businesses,837,50,25,0,I,website for small business,ok,,,,,,,,,,
payroll software for startups,838,50,25,80.59,I,software for startups,ok,,,,,,,,,,
best reservation app for restaurants,839,70,36,7.78,I,app for restaurants,ok,,,,,,,,,,
best payment apps for small business,840,70,36,8.61,I,app for small business,ok,,,,,,,,,,
best website for photographers portfolio,841,70,36,3.76,I,website for photographers,ok,,,,,,,,,,
websites for nonprofits,842,60,31,3.51,I,website for nonprofits,ok,,,,,,,,,,
best website hosting for nonprofits,843,50,26,6.38,I,website for nonprofits,ok,,,,,,,,,,
how to create an app for business,844,50,26,3.81,I,create app for business,ok,,,,,,,,,,
free app for gym workout,845,70,37,0.88,I,app for gyms,ok,,,,,,,,,,
best websites for freelance writers,846,70,37,1.57,I,website for freelancers,ok,,,,,,,,,,
food delivery app for restaurant,847,70,38,10.84,I,app for restaurants,ok,,,,,,,,,,
gym workout apps for women,848,70,38,2.4,I,app for gyms,ok,,,,,,,,,,
websites for freelance writers,849,70,38,0.5,I,website for freelancers,ok,,,,,,,,,,
app creator for apple,850,70,38,4.36,I,app creator for,ok,,,,,,,,,,
crowdfunding websites for nonprofits,851,50,27,4.02,I,website for nonprofits,ok,,,,,,,,,,
how to make a website for a restaurant for free,852,50,33,5.15,"I,N",website for restaurants,ok,,,,,,,,,,
wordpress themes for church websites,853,50,33,1.12,"I,N",website for churches,ok,,,,,,,,,,
apps for startups,854,70,39,2.89,I,app for startups,ok,,,,,,,,,,
apps for restaurant wait times,855,70,39,0.71,I,app for restaurants,ok,,,,,,,,,,
free bookkeeping apps for small business,856,70,39,7.48,I,app for small business,ok,,,,,,,,,,
free bookkeeping app for small business,857,70,39,7.48,I,app for small business,ok,,,,,,,,,,
mobile apps for hotels,858,70,39,0,I,app for hotels,ok,,,,,,,,,,
website designing for small business,859,70,39,7.74,I,website for small business,ok,,,,,,,,,,
website for freelance translators,860,70,39,0.85,I,website for freelancers,ok,,,,,,,,,,
best website platform for photographers,861,70,39,3.34,I,website for photographers,ok,,,,,,,,,,
proofing website for photographers,862,70,39,2.31,I,website for photographers,ok,,,,,,,,,,
best website platforms for photographers,863,70,39,3.34,I,website for photographers,ok,,,,,,,,,,
seo tools for startups,864,70,39,0,I,tool for startups,ok,,,,,,,,,,
make platform game,865,50,28,0,I,make platform,ok,,,,,,,,,,
best free marketing apps for small business,866,50,28,0,I,app for small business,ok,,,,,,,,,,
realm app for church,867,50,28,1.28,I,app for churches,ok,,,,,,,,,,
photo hosting websites for photographers,868,50,28,2.09,I,website for photographers,ok,,,,,,,,,,
best portfolio website for photographers,869,50,28,2.17,I,website for photographers,ok,,,,,,,,,,
best music creator app for android,870,50,28,0.66,I,app creator for,ok,,,,,,,,,,
ai tools for marketing agencies,871,70,40,14.38,I,tool for agencies,ok,,,,,,,,,,
best freelance websites for developers,872,50,29,1.56,I,website for freelancers,ok,,,,,,,,,,
best freelance websites for programmers,873,50,29,1.56,I,website for freelancers,ok,,,,,,,,,,
clover websites for churches,874,50,29,2.96,I,website for churches,ok,,,,,,,,,,
how to make money on social media platforms,875,50,30,0.63,I,make platform,ok,,,,,,,,,,
scheduling app for restaurants,876,50,30,13.71,I,app for restaurants,ok,,,,,,,,,,
best booking apps for hotels,877,50,30,4,I,app for hotels,ok,,,,,,,,,,
best portfolio websites for photographers,878,50,30,2.17,I,website for photographers,ok,,,,,,,,,,
photographing products for website,879,50,30,2.71,I,website for photographers,ok,,,,,,,,,,
loyalty program app for small business,880,50,32,5.67,I,app for small business,ok,,,,,,,,,,
benefits of a website for small business,881,50,32,3.5,I,website for small business,ok,,,,,,,,,,
benefits of website for small business,882,50,32,3.5,I,website for small business,ok,,,,,,,,,,
google website builder for small business,883,50,32,5.4,I,website for small business,ok,,,,,,,,,,
best free websites for photographers,884,50,32,2.25,I,website for photographers,ok,,,,,,,,,,
app for church,885,60,39,0.92,I,app for churches,ok,,,,,,,,,,
why website is important for small business,886,50,33,0,I,website for small business,ok,,,,,,,,,,
logo creator app for android,887,50,33,0.76,I,app creator for,ok,,,,,,,,,,
make cross platform apps,888,50,34,2.8,I,make platform,ok,,,,,,,,,,
best receipt scanner app for small business,889,50,34,2.91,I,app for small business,ok,,,,,,,,,,
best booking app for hotels,890,50,34,4,I,app for hotels,ok,,,,,,,,,,
freelancing websites for students,891,50,34,0.73,I,website for freelancers,ok,,,,,,,,,,
freelance websites for students,892,50,34,0.73,I,website for freelancers,ok,,,,,,,,,,
best freelance website for developers,893,50,34,1.56,I,website for freelancers,ok,,,,,,,,,,
best crowdfunding websites for nonprofits,894,50,34,6.02,I,website for nonprofits,ok,,,,,,,,,,
ai driven seo tools for agencies,895,50,34,0,I,tool for agencies,ok,,,,,,,,,,
grubhub for restaurants app,896,50,35,3.64,I,app for restaurants,ok,,,,,,,,,,
gym workout apps for beginners,897,50,35,1.18,I,app for gyms,ok,,,,,,,,,,
best websites for small business owners,898,50,35,6.07,I,website for small business,ok,,,,,,,,,,
why websites are important for small business,899,50,35,0,I,website for small business,ok,,,,,,,,,,
ai-driven seo tools for agencies,900,50,35,0,I,tool for agencies,ok,,,,,,,,,,
cost to build a website for a small business,901,50,37,2.59,I,website for small business,ok,,,,,,,,,,
website benefits for small businesses,902,50,37,3.5,I,website for small business,ok,,,,,,,,,,
best freelance website for programmers,903,50,37,1.56,I,website for freelancers,ok,,,,,,,,,,
grants for website development for nonprofits,904,50,37,3.11,I,website for nonprofits,ok,,,,,,,,,,
best timesheet app for small business,905,50,38,11.14,I,app for small business,ok,,,,,,,,,,
free timesheet app for small business,906,50,38,8.51,I,app for small business,ok,,,,,,,,,,
clock in app for small business,907,50,38,16.84,I,app for small business,ok,,,,,,,,,,
free website templates for small business,908,50,38,0,I,website for small business,ok,,,,,,,,,,
why is a website important for small business,909,50,38,0,I,website for small business,ok,,,,,,,,,,
why a website is important for small business,910,50,38,0,I,website for small business,ok,,,,,,,,,,
app for gym workout plan,911,50,39,1.82,I,app for gyms,ok,,,,,,,,,,
website tips for small business,912,50,39,0,I,website for small business,ok,,,,,,,,,,
freelance writers for website content,913,50,39,0,I,website for freelancers,ok,,,,,,,,,,
website designers for photographers,914,50,39,8.68,I,website for photographers,ok,,,,,,,,,,
best video creator app for android,915,50,39,1,I,app creator for,ok,,,,,,,,,,
best calendar app for small business,916,50,40,5.04,I,app for small business,ok,,,,,,,,,,
best free invoice app for small business,917,50,40,5.57,I,app for small business,ok,,,,,,,,,,
apps for gym workout routines,918,50,40,1.82,I,app for gyms,ok,,,,,,,,,,
app for gym,919,50,40,1.72,I,app for gyms,ok,,,,,,,,,,
best website for small business owners,920,50,40,6.07,I,website for small business,ok,,,,,,,,,,
best freelance websites for software developers,921,50,40,1.56,I,website for freelancers,ok,,,,,,,,,,
best websites for photographers free,922,50,40,2.25,I,website for photographers,ok,,,,,,,,,,
how to make a gaming app,923,480,24,2.16,I,make app,irrelevant,,,,,,,,,,
best gym workout app for women,924,90,36,2.12,I,app for gyms,irrelevant,,,,,,,,,,
gym app for beginners,925,70,30,2.08,I,app for gyms,irrelevant,,,,,,,,,,
best gym app for beginners,926,70,31,1.81,I,app for gyms,irrelevant,,,,,,,,,,
gym app for women,927,70,38,2.02,I,app for gyms,irrelevant,,,,,,,,,,
gym workout app for women,928,70,38,2.4,I,app for gyms,irrelevant,,,,,,,,,,
gym workout app for beginners,929,50,36,1.18,I,app for gyms,irrelevant,,,,,,,,,,
app for best hotel deals,930,390,33,3.28,I,app for hotels,irrelevant,,,,,,,,,,
best app for last minute hotel deals,931,320,31,1.68,I,app for hotels,irrelevant,,,,,,,,,,
app for hotel management,932,210,27,7.88,I,app for hotels,irrelevant,,,,,,,,,,
apps for hotel management,933,210,30,7.88,I,app for hotels,irrelevant,,,,,,,,,,
best hotel app for rewards,934,70,21,2.28,I,app for hotels,irrelevant,,,,,,,,,,
apps for commercial real estate,935,590,16,0.59,I,app for real estate,irrelevant,,,,,,,,,,
app for commercial real estate,936,590,23,0.59,I,app for real estate,irrelevant,,,,,,,,,,
best apps for real estate agents,937,390,28,1.88,I,app for real estate,irrelevant,,,,,,,,,,
best app for real estate agents,938,390,34,1.88,I,app for real estate,irrelevant,,,,,,,,,,
mobile app development for real estate,939,390,16,4.75,"L,C",app for real estate,irrelevant,,,,,,,,,,
apps for real estate,940,330,30,0.86,I,app for real estate,irrelevant,,,,,,,,,,
apps for real estate agents,941,320,34,4.34,I,app for real estate,irrelevant,,,,,,,,,,
real estate apps for agents,942,320,22,4.34,I,app for real estate,irrelevant,,,,,,,,,,
real estate apps for realtors,943,320,28,4.34,I,app for real estate,irrelevant,,,,,,,,,,
apps for real estate brokers,944,320,28,4.34,I,app for real estate,irrelevant,,,,,,,,,,
app for real estate agents,945,320,29,4.34,I,app for real estate,irrelevant,,,,,,,,,,
