keyword,priority,volume,kd,cpc,intent,seed,flag,published,Ссылка конкурента 1,Ссылка конкурента 2,Ссылка конкурента 3,Заголовок конкурента 1,Заголовок конкурента 2,Заголовок конкурента 3,Сниппет конкурента 1,Сниппет конкурента 2,Сниппет конкурента 3
how i make a website in html,335,480,36,1.48,I,make website,ok,,,,,,,,,,
best apps for restaurant,336,480,36,0.94,I,app for restaurants,ok,,,,,,,,,,
best app for small businesses,337,480,36,8,I,app for small business,ok,,,,,,,,,,
websites templates for photographers,338,320,24,2.15,I,website for photographers,ok,,,,,,,,,,
website management services for small business,339,140,21,17.54,"L,C",website for small business,ok,,,,,,,,,,
good apps to make memes,340,480,37,0.49,I,make app,ok,,,,,,,,,,
android music making app,341,480,37,0.44,I,make app,ok,,,,,,,,,,
how to make ecommerce website,342,480,37,4.11,I,make website,ok,,,,,,,,,,
make affiliate marketing website,343,480,37,3.46,I,make website,ok,,,,,,,,,,
making mobile website,344,480,37,4.39,I,make website,ok,,,,,,,,,,
how to make website from html,345,480,37,1.48,I,make website,ok,,,,,,,,,,
best software to make website,346,480,37,3.29,I,make website,ok,,,,,,,,,,
apps for small business accounting,347,480,37,8.45,I,app for small business,ok,,,,,,,,,,
how do you make a site secure,348,390,30,2.52,I,make site,ok,,,,,,,,,,
accounting software for startup business,349,390,30,13.43,I,software for startups,ok,,,,,,,,,,
stamping platform for card making,350,50,7,0.19,C,make platform,ok,,,,,,,,,,
church app builder,351,210,16,3.82,I,app builder church,ok,,,,,,,,,,
church mobile app builder,352,210,16,3.82,I,app builder church,ok,,,,,,,,,,
app to make pic collage,353,480,38,0.95,I,make app,ok,,,,,,,,,,
beat making apps for free,354,480,38,0.42,I,make app,ok,,,,,,,,,,
make website on mobile,355,480,38,4.39,I,make website,ok,,,,,,,,,,
marketing app for small business,356,320,25,5.92,I,app for small business,ok,,,,,,,,,,
how to make website secure,357,390,31,2.52,I,make website,ok,,,,,,,,,,
how to make a website to sell items,358,390,31,3.46,I,make website,ok,,,,,,,,,,
inventory apps for small business,359,390,31,7.37,I,app for small business,ok,,,,,,,,,,
flag making site,360,170,27,1.12,"L,C",make site,ok,,,,,,,,,,
best seo reporting tools for agencies,361,170,13,0,I,tool for agencies,ok,,,,,,,,,,
music making apps for android,362,480,39,0.44,I,make app,ok,,,,,,,,,,
how to make a html website,363,480,39,1.48,I,make website,ok,,,,,,,,,,
websites to make beats for free,364,480,39,0.31,I,make website,ok,,,,,,,,,,
free websites for nonprofits,365,480,39,5.94,I,website for nonprofits,ok,,,,,,,,,,
seo tools for seo agencies,366,480,39,0,I,tool for agencies,ok,,,,,,,,,,
free app to make video with pictures and music,367,480,40,0.81,I,make app,ok,,,,,,,,,,
make mobile site,368,480,40,4.39,I,make site,ok,,,,,,,,,,
make mobile website,369,480,40,4.39,I,make website,ok,,,,,,,,,,
best software for making a website,370,480,40,3.29,I,make website,ok,,,,,,,,,,
best software to make a website,371,480,40,3.29,I,make website,ok,,,,,,,,,,
accounting app for small business,372,480,40,8.45,I,app for small business,ok,,,,,,,,,,
how to make a platform bed frame,373,140,11,0.21,I,make platform,ok,,,,,,,,,,
carpool app for schools,374,140,11,0,I,app for schools,ok,,,,,,,,,,
how to make a ecommerce site,375,390,33,3.68,I,make site,ok,,,,,,,,,,
how do i make a website secure,376,390,33,2.52,I,make website,ok,,,,,,,,,,
inventory app for small business,377,390,33,7.37,I,app for small business,ok,,,,,,,,,,
how to make google site public,378,170,14,1.88,I,make site,ok,,,,,,,,,,
how to make a membership site,379,260,22,4.34,I,make site,ok,,,,,,,,,,
how to create a website for a nonprofit organization,380,90,7,5.87,I,website for nonprofits,ok,,,,,,,,,,
how to make an icon for a website,381,390,34,0.95,I,make website,ok,,,,,,,,,,
how to make a website secure,382,390,34,2.52,I,make website,ok,,,,,,,,,,
how do social media platforms make money,383,210,18,0,I,make platform,ok,,,,,,,,,,
mobile app for schools,384,320,28,3.18,I,app for schools,ok,,,,,,,,,,
website design for startup,385,320,28,5.13,I,website for startups,ok,,,,,,,,,,
menu app for restaurants,386,390,35,4.03,I,app for restaurants,ok,,,,,,,,,,
mobile apps for restaurant,387,260,23,6.16,I,app for restaurants,ok,,,,,,,,,,
website examples for small business,388,260,23,1.28,I,website for small business,ok,,,,,,,,,,
free websites for churches,389,260,23,3.35,I,website for churches,ok,,,,,,,,,,
free website for church,390,260,23,3.35,I,website for churches,ok,,,,,,,,,,
free website for churches,391,260,23,3.35,I,website for churches,ok,,,,,,,,,,
free apps creator for android,392,390,35,2.43,I,app creator for,ok,,,,,,,,,,
apps for small business marketing,393,320,29,5.92,I,app for small business,ok,,,,,,,,,,
website development for nonprofit organization,394,320,29,12.28,I,website for nonprofits,ok,,,,,,,,,,
opentable for restaurants app,395,170,15,1.81,I,app for restaurants,ok,,,,,,,,,,
best website design for restaurant,396,170,15,3.76,I,website for restaurants,ok,,,,,,,,,,
best blogging platforms to make money,397,260,24,1.27,I,make platform,ok,,,,,,,,,,
job websites for nonprofit,398,320,30,0.61,I,website for nonprofits,ok,,,,,,,,,,
how to make site https,399,320,31,2.56,I,make site,ok,,,,,,,,,,
how to make your site https,400,320,31,2.56,I,make site,ok,,,,,,,,,,
how to make my site https,401,320,31,2.56,I,make site,ok,,,,,,,,,,
waitlist app for restaurants,402,260,25,3.38,I,app for restaurants,ok,,,,,,,,,,
payment app for small business,403,390,38,9.44,I,app for small business,ok,,,,,,,,,,
websites for freelance artists,404,110,10,1.59,I,website for freelancers,ok,,,,,,,,,,
job website for nonprofits,405,320,31,0.61,I,website for nonprofits,ok,,,,,,,,,,
best site builder for wordpress,406,390,38,3.08,I,site builder for,ok,,,,,,,,,,
hr software for startups,407,170,16,10.26,I,software for startups,ok,,,,,,,,,,
best okr software for startups,408,70,6,14.42,I,software for startups,ok,,,,,,,,,,
community church builder app,409,90,8,2.05,I,app builder church,ok,,,,,,,,,,
app making websites for free,410,390,39,3.78,I,make website,ok,,,,,,,,,,
how to make money websites,411,390,39,0.73,I,make website,ok,,,,,,,,,,
website design for startups,412,320,32,5.13,I,website for startups,ok,,,,,,,,,,
make your own porn site,413,210,25,0,"I,N",make site,ok,,,,,,,,,,
software product development services for startups,414,110,22,0,"L,C",software for startups,ok,,,,,,,,,,
best ipad apps for school,415,210,21,0,I,app for schools,ok,,,,,,,,,,
make your own pc website,416,390,40,0.25,I,make website,ok,,,,,,,,,,
apps for restaurant,417,180,18,1.23,I,app for restaurants,ok,,,,,,,,,,
how to make a forum site,418,320,33,1.88,I,make site,ok,,,,,,,,,,
financial modeling software for startups,419,320,40,15.44,"I,N",software for startups,ok,,,,,,,,,,
how to make a copy of a google site,420,140,14,0,I,make site,ok,,,,,,,,,,
best site to make a blog,421,260,27,2.78,I,make site,ok,,,,,,,,,,
loyalty apps for restaurants,422,260,27,7.8,I,app for restaurants,ok,,,,,,,,,,
loyalty app for restaurants,423,260,27,7.8,I,app for restaurants,ok,,,,,,,,,,
website design for freelancers,424,170,36,3.15,"L,C",website for freelancers,ok,,,,,,,,,,
making platform bed frame,425,110,11,0.42,I,make platform,ok,,,,,,,,,,
restaurant mobile app builder,426,110,11,12.79,I,app builder restaurant,ok,,,,,,,,,,
how to make a site mobile friendly,427,320,34,0.93,I,make site,ok,,,,,,,,,,
make google crawl my site,428,320,34,1.84,I,make site,ok,,,,,,,,,,
how to make my site show up on google,429,320,34,3.28,I,make site,ok,,,,,,,,,,
what makes a site credible,430,320,34,0.35,I,make site,ok,,,,,,,,,,
how to make a google site look good,431,210,22,2.92,I,make site,ok,,,,,,,,,,
website templates for small business,432,210,22,2.53,I,website for small business,ok,,,,,,,,,,
website templates for small businesses,433,210,22,2.53,I,website for small business,ok,,,,,,,,,,
website template for small business,434,210,22,2.53,I,website for small business,ok,,,,,,,,,,
apps for middle school students,435,90,9,0,I,app for schools,ok,,,,,,,,,,
church community builder app,436,90,9,2.05,I,app builder church,ok,,,,,,,,,,
make a fake site,437,260,28,1.28,I,make site,ok,,,,,,,,,,
making money with web site,438,260,28,1.2,I,make site,ok,,,,,,,,,,
best website builder for restaurants,439,260,28,8.01,I,website for restaurants,ok,,,,,,,,,,
how to make site mobile friendly,440,320,35,0.93,I,make site,ok,,,,,,,,,,
church website templates for wordpress,441,320,35,0.83,I,website for churches,ok,,,,,,,,,,
website hosting for churches,442,320,35,3.02,I,website for churches,ok,,,,,,,,,,
how to make an affiliate site,443,210,23,2.21,I,make site,ok,,,,,,,,,,
how to make fake site,444,210,23,0.99,I,make site,ok,,,,,,,,,,
making a lifting platform,445,140,15,1.18,I,make platform,ok,,,,,,,,,,
how to make a rotating platform,446,70,7,0,I,make platform,ok,,,,,,,,,,
how to make a wooden platform,447,70,7,0,I,make platform,ok,,,,,,,,,,
math apps for middle school,448,210,23,0,I,app for schools,ok,,,,,,,,,,
best website designers for small business,449,140,31,8.39,"L,C",website for small business,ok,,,,,,,,,,
best website builder for freelancers,450,70,7,2.34,I,website for freelancers,ok,,,,,,,,,,
best website builders for freelancers,451,70,7,2.34,I,website for freelancers,ok,,,,,,,,,,
best website designs for nonprofits,452,210,23,3.01,I,website for nonprofits,ok,,,,,,,,,,
best website design for churches,453,140,15,0.8,I,website for churches,ok,,,,,,,,,,
best website design companies for small business,454,260,29,8.29,I,website for small business,ok,,,,,,,,,,
free websites for church,455,260,29,3.35,I,website for churches,ok,,,,,,,,,,
google cloud platform for startups,456,260,35,14.72,"I,N",platform for startups,ok,,,,,,,,,,
website for restaurant reservations,457,320,36,1.78,I,website for restaurants,ok,,,,,,,,,,
website management for small business,458,320,36,5.41,I,website for small business,ok,,,,,,,,,,
best website builder for churches,459,320,36,4.59,I,website for churches,ok,,,,,,,,,,
best website builders for churches,460,320,36,4.59,I,website for churches,ok,,,,,,,,,,
best website design for restaurants,461,170,19,3.76,I,website for restaurants,ok,,,,,,,,,,
making site on google,462,320,37,5.15,I,make site,ok,,,,,,,,,,
how to make a site https,463,320,37,2.56,I,make site,ok,,,,,,,,,,
how does social media platforms make money,464,210,24,0,I,make platform,ok,,,,,,,,,,
mobile apps for restaurants,465,260,30,6.16,I,app for restaurants,ok,,,,,,,,,,
apps for content creators,466,140,16,1.39,I,app creator for,ok,,,,,,,,,,
how to make blog site,467,320,38,2.02,I,make site,ok,,,,,,,,,,
website templates for doctors,468,90,10,5.27,I,website for doctors,ok,,,,,,,,,,
best sites to make friends,469,170,20,0.53,I,make site,ok,,,,,,,,,,
how to make your site come up first on google,470,320,39,4,I,make site,ok,,,,,,,,,,
mobile apps for schools,471,320,39,3.18,I,app for schools,ok,,,,,,,,,,
apps for hotels deals,472,320,39,3.19,I,app for hotels,ok,,,,,,,,,,
best website designers for small businesses,473,140,34,8.39,"L,C",website for small business,ok,,,,,,,,,,
make money from site,474,260,32,1.2,I,make site,ok,,,,,,,,,,
best social media platform to make money,475,260,32,0.41,I,make platform,ok,,,,,,,,,,
app builder for restaurant,476,110,13,12.79,I,app builder for restaurants,ok,,,,,,,,,,
making a platform bed frame,477,110,13,0.42,I,make platform,ok,,,,,,,,,,
make a music site,478,320,40,3.06,I,make site,ok,,,,,,,,,,
best social media platforms to make money,479,260,33,0.41,I,make platform,ok,,,,,,,,,,
best website builders for restaurants,480,260,33,8.01,I,website for restaurants,ok,,,,,,,,,,
best website builder for restaurant,481,260,33,8.01,I,website for restaurants,ok,,,,,,,,,,
best free apps for small business owners,482,210,27,7.5,I,app for small business,ok,,,,,,,,,,
apps for small business owners,483,90,11,8.69,I,app for small business,ok,,,,,,,,,,
free payroll apps for small business,484,90,11,45.15,I,app for small business,ok,,,,,,,,,,
best website designs for small business,485,210,27,5.94,I,website for small business,ok,,,,,,,,,,
free card making site,486,260,34,0.27,I,make site,ok,,,,,,,,,,
free card making sites,487,260,34,0.27,I,make site,ok,,,,,,,,,,
best blog platforms to make money,488,260,34,1.27,I,make platform,ok,,,,,,,,,,
how to make your own game site,489,170,22,1.71,I,make site,ok,,,,,,,,,,
make a deadlift platform,490,110,14,0.42,I,make platform,ok,,,,,,,,,,
gluten free app for restaurants,491,110,14,0.97,I,app for restaurants,ok,,,,,,,,,,
making a platformer game,492,50,6,0,I,make platform,ok,,,,,,,,,,
make a platformer game,493,50,6,0,I,make platform,ok,,,,,,,,,,
make platformer games,494,50,6,0,I,make platform,ok,,,,,,,,,,
apps for restaurant owners,495,50,6,14.26,I,app for restaurants,ok,,,,,,,,,,
hr solutions for startups,496,50,6,0,I,solution for startups,ok,,,,,,,,,,
tools for digital marketing agency,497,260,36,13.14,I,tool for agencies,ok,,,,,,,,,,
best accounting software for startups,498,260,36,16.05,I,software for startups,ok,,,,,,,,,,
mvp solutions for startups,499,70,9,0,I,solution for startups,ok,,,,,,,,,,
best website templates for photographers,500,90,12,2.57,I,website for photographers,ok,,,,,,,,,,
best template websites for photographers,501,90,12,2.57,I,website for photographers,ok,,,,,,,,,,
creating a website for nonprofit organization,502,90,12,13.65,I,website for nonprofits,ok,,,,,,,,,,
make a social site,503,260,37,3.2,I,make site,ok,,,,,,,,,,
how to make sites load faster,504,260,37,1.8,I,make site,ok,,,,,,,,,,
websites for churches free,505,260,37,3.35,I,website for churches,ok,,,,,,,,,,
app creator for ios,506,260,37,3.78,I,app creator for,ok,,,,,,,,,,
best website for beginner freelance,507,170,24,0.94,I,website for freelancers,ok,,,,,,,,,,
make money with a web site,508,210,30,1.37,I,make site,ok,,,,,,,,,,
best website design for nonprofits,509,210,30,3.01,I,website for nonprofits,ok,,,,,,,,,,
creating an app for your business,510,210,30,9.39,I,create app for business,ok,,,,,,,,,,
make fake site,511,260,38,1.28,I,make site,ok,,,,,,,,,,
best sites to make blogs,512,260,38,2.78,I,make site,ok,,,,,,,,,,
school apps for ipad,513,140,20,0,I,app for schools,ok,,,,,,,,,,
apps for gyms,514,260,38,1.72,I,app for gyms,ok,,,,,,,,,,
websites for freelance,515,240,35,1.22,I,website for freelancers,ok,,,,,,,,,,
crm tools for startups,516,260,38,11.75,I,tool for startups,ok,,,,,,,,,,
freelancing websites for graphic designers,517,210,31,1.55,I,website for freelancers,ok,,,,,,,,,,
best friend making sites,518,170,25,0.53,I,make site,ok,,,,,,,,,,
freelance websites for programmers,519,170,25,1.09,I,website for freelancers,ok,,,,,,,,,,
how to make a 2d platformer in unity,520,70,12,0,"I,N",make platform,ok,,,,,,,,,,
how to make google sites look good,521,210,32,2.92,I,make site,ok,,,,,,,,,,
online order apps for restaurants,522,210,32,6.39,I,app for restaurants,ok,,,,,,,,,,
site builder for dummies,523,140,21,2.62,I,site builder for,ok,,,,,,,,,,
best sites for making a blog,524,260,40,2.78,I,make site,ok,,,,,,,,,,
best websites for restaurant reviews,525,260,40,0.39,I,website for restaurants,ok,,,,,,,,,,
how to make my site secure,526,170,26,3.49,I,make site,ok,,,,,,,,,,
how to make a platformer in game maker studio,527,50,7,0,I,make platform,ok,,,,,,,,,,
how to make a platformer in game maker,528,50,7,0,I,make platform,ok,,,,,,,,,,
how to make a platform game in game maker,529,50,7,0,I,make platform,ok,,,,,,,,,,
how to make a platformer game in game maker,530,50,7,0,I,make platform,ok,,,,,,,,,,
how to make a scrolling platformer in scratch,531,50,7,0,I,make platform,ok,,,,,,,,,,
best apps for restaurant managers,532,50,7,24.94,I,app for restaurants,ok,,,,,,,,,,
best time clock app for small business,533,210,33,19.41,I,app for small business,ok,,,,,,,,,,
best app for small business inventory,534,210,33,9.65,I,app for small business,ok,,,,,,,,,,
mobile app development for startups,535,110,17,0,I,app for startups,ok,,,,,,,,,,
website maintenance for small business,536,110,17,0,I,website for small business,ok,,,,,,,,,,
website maintenance for small businesses,537,110,17,0,I,website for small business,ok,,,,,,,,,,
create a church website for free,538,110,17,3.03,I,website for churches,ok,,,,,,,,,,
creating a church website for free,539,110,17,3.03,I,website for churches,ok,,,,,,,,,,
restaurant app builder,540,110,17,12.79,I,app builder restaurant,ok,,,,,,,,,,
ipad apps for schools,541,140,22,0,I,app for schools,ok,,,,,,,,,,
best website hosts for photographers,542,140,22,2.07,I,website for photographers,ok,,,,,,,,,,
best host website for photographers,543,140,22,2.07,I,website for photographers,ok,,,,,,,,,,
best hosting websites for photographers,544,140,22,2.07,I,website for photographers,ok,,,,,,,,,,
tools for startups,545,140,22,5.97,I,tool for startups,ok,,,,,,,,,,
best tools for startups,546,140,22,2.08,I,tool for startups,ok,,,,,,,,,,
best site to make friends,547,170,27,0.53,I,make site,ok,,,,,,,,,,
websites for nonprofit jobs,548,170,27,1.02,I,website for nonprofits,ok,,,,,,,,,,
make a free wordpress site,549,210,34,3.26,I,make site,ok,,,,,,,,,,
how to make a fake site,550,210,34,0.99,I,make site,ok,,,,,,,,,,
make automation platform,551,110,21,3.97,"I,N",make platform,ok,,,,,,,,,,
apps for restaurants,552,180,29,1.23,I,app for restaurants,ok,,,,,,,,,,
create a website for nonprofit organization,553,90,14,13.65,I,website for nonprofits,ok,,,,,,,,,,
rank tracking tool for agencies,554,90,14,0,I,tool for agencies,ok,,,,,,,,,,
ideas for software startup,555,90,14,0.39,I,software for startups,ok,,,,,,,,,,
best ecommerce platform for startups,556,90,14,0,I,platform for startups,ok,,,,,,,,,,
create an app for your business,557,210,34,9.39,I,create app for business,ok,,,,,,,,,,
create an app for my business,558,210,34,9.39,I,create app for business,ok,,,,,,,,,,
website design for small business near me,559,110,36,0,"L,C",website for small business,ok,,,,,,,,,,
best app for restaurant booking,560,210,35,2.41,I,app for restaurants,ok,,,,,,,,,,
educational apps for schools,561,210,35,2.03,I,app for schools,ok,,,,,,,,,,
essential technical seo tools for agencies,562,140,23,0,I,tool for agencies,ok,,,,,,,,,,
app development company for startups,563,90,30,18.16,"L,C",app for startups,ok,,,,,,,,,,
best website template for photographers,564,90,15,2.57,I,website for photographers,ok,,,,,,,,,,
ideas for software startups,565,90,15,0.39,I,software for startups,ok,,,,,,,,,,
freelance websites for beginners,566,140,24,1.05,I,website for freelancers,ok,,,,,,,,,,
best 'tools for startups,567,140,24,2.08,I,tool for startups,ok,,,,,,,,,,
making a platform game,568,50,8,0,I,make platform,ok,,,,,,,,,,
make platformer game,569,50,8,0,I,make platform,ok,,,,,,,,,,
dating website for lawyers,570,50,8,2.48,I,website for lawyers,ok,,,,,,,,,,
best inventory app for small business,571,210,37,9.65,I,app for small business,ok,,,,,,,,,,
creating an app for my business,572,210,37,9.39,I,create app for business,ok,,,,,,,,,,
apps for small business management,573,110,19,7.9,I,app for small business,ok,,,,,,,,,,
make a membership site,574,170,30,5.93,I,make site,ok,,,,,,,,,,
app development companies for startups,575,90,32,18.16,"L,C",app for startups,ok,,,,,,,,,,
app for taking orders in restaurants,576,140,25,2.85,I,app for restaurants,ok,,,,,,,,,,
square for restaurants app,577,140,25,4.9,I,app for restaurants,ok,,,,,,,,,,
free template for restaurant website,578,140,25,3.03,I,website for restaurants,ok,,,,,,,,,,
free templates for restaurant website,579,140,25,3.03,I,website for restaurants,ok,,,,,,,,,,
free website template for restaurant,580,140,25,3.03,I,website for restaurants,ok,,,,,,,,,,
freelance websites for graphic designers,581,210,38,1.55,I,website for freelancers,ok,,,,,,,,,,
website for freelance graphic designers,582,210,38,1.55,I,website for freelancers,ok,,,,,,,,,,
how to create a nonprofit website for free,583,70,12,4.42,I,website for nonprofits,ok,,,,,,,,,,
create app for my business,584,210,38,9.39,I,create app for business,ok,,,,,,,,,,
create app for your business,585,210,38,9.39,I,create app for business,ok,,,,,,,,,,
best site for making friends,586,170,31,0.53,I,make site,ok,,,,,,,,,,
loyalty app for small business,587,170,31,5.69,I,app for small business,ok,,,,,,,,,,
freelance websites for designers,588,170,31,2.37,I,website for freelancers,ok,,,,,,,,,,
freelancing websites for designers,589,170,31,2.37,I,website for freelancers,ok,,,,,,,,,,
app creator for ipad,590,170,31,2.47,I,app creator for,ok,,,,,,,,,,
make a free music site,591,210,39,2.37,I,make site,ok,,,,,,,,,,
online food ordering app for restaurants,592,210,39,6.39,I,app for restaurants,ok,,,,,,,,,,
best inventory apps for small business,593,210,39,9.65,I,app for small business,ok,,,,,,,,,,
best apps for school,594,210,39,1.47,I,app for schools,ok,,,,,,,,,,
best website design for small business,595,210,39,5.94,I,website for small business,ok,,,,,,,,,,
best website design for small businesses,596,210,39,5.94,I,website for small business,ok,,,,,,,,,,
website for graphic designers freelancers,597,210,39,1.55,I,website for freelancers,ok,,,,,,,,,,
make a wish site,598,170,38,1.78,"I,N",make site,ok,,,,,,,,,,
how to make money from your site,599,140,26,1.07,I,make site,ok,,,,,,,,,,
how to make a website for a restaurant,600,140,26,10.31,I,website for restaurants,ok,,,,,,,,,,
tools for startup,601,140,26,5.97,I,tool for startups,ok,,,,,,,,,,
make your own game site,602,170,32,1.53,I,make site,ok,,,,,,,,,,
app for splitting restaurant bill,603,170,32,0.4,I,app for restaurants,ok,,,,,,,,,,
app for splitting restaurant bills,604,170,32,0.4,I,app for restaurants,ok,,,,,,,,,,
website optimization for lawyers,605,170,32,0,I,website for lawyers,ok,,,,,,,,,,
best apps for schools,606,210,40,1.47,I,app for schools,ok,,,,,,,,,,
communication app for schools,607,210,40,5.81,I,app for schools,ok,,,,,,,,,,
scheduling app for restaurant employees,608,170,39,0,"I,N",app for restaurants,ok,,,,,,,,,,
best sites for making friends,609,170,33,0.53,I,make site,ok,,,,,,,,,,
good sites to make friends,610,170,33,0.53,I,make site,ok,,,,,,,,,,
making platformer games,611,50,9,0,I,make platform,ok,,,,,,,,,,
app for restaurant deals,612,140,27,1.01,I,app for restaurants,ok,,,,,,,,,,
free payroll app for small business,613,90,17,45.15,I,app for small business,ok,,,,,,,,,,
free app for small business,614,90,17,6.59,I,app for small business,ok,,,,,,,,,,
best website builder for small business reddit,615,90,17,5.47,I,website for small business,ok,,,,,,,,,,
website designs for photographers,616,140,27,5.02,I,website for photographers,ok,,,,,,,,,,
best friend making site,617,170,34,0.53,I,make site,ok,,,,,,,,,,
best apps for small business expense tracking,618,170,34,7.01,I,app for small business,ok,,,,,,,,,,
best app for tracking small business expenses,619,170,34,7.01,I,app for small business,ok,,,,,,,,,,
app creator for iphone,620,170,34,4.57,I,app creator for,ok,,,,,,,,,,
seo audit tool for agencies,621,170,34,0,I,tool for agencies,ok,,,,,,,,,,
free website templates for restaurants,622,140,28,3.03,I,website for restaurants,ok,,,,,,,,,,
websites designs for photographers,623,140,28,5.02,I,website for photographers,ok,,,,,,,,,,
opentable app for restaurants,624,140,34,1.66,"I,N",app for restaurants,ok,,,,,,,,,,
create a free website for church,625,110,22,3.03,I,website for churches,ok,,,,,,,,,,
full service website design and management for small business,626,90,18,0,I,website for small business,ok,,,,,,,,,,
full service website design and management for small businesses,627,90,18,0,I,website for small business,ok,,,,,,,,,,
how to make a site using html,628,170,35,1.5,I,make site,ok,,,,,,,,,,
loyalty apps for small businesses,629,170,35,5.69,I,app for small business,ok,,,,,,,,,,
loyalty apps for small business,630,170,35,5.69,I,app for small business,ok,,,,,,,,,,
best websites for startups,631,170,35,3.05,I,website for startups,ok,,,,,,,,,,
freelance websites for web designers,632,170,35,2.37,I,website for freelancers,ok,,,,,,,,,,
video editing apps for content creators,633,170,35,1.23,I,app creator for,ok,,,,,,,,,,
how to make a platform bed with storage,634,70,14,0,I,make platform,ok,,,,,,,,,,
how to make a 2d platformer game in unity,635,70,14,0,I,make platform,ok,,,,,,,,,,
mobile payment apps for small businesses,636,140,29,6.97,I,app for small business,ok,,,,,,,,,,
website designers for small businesses,637,60,25,10.77,"L,C",website for small business,ok,,,,,,,,,,
how to make a website using google sites,638,170,36,2.63,I,make site,ok,,,,,,,,,,
how to use google sites to make a website,639,170,36,2.63,I,make site,ok,,,,,,,,,,
coupon apps for restaurants,640,170,36,1.11,I,app for restaurants,ok,,,,,,,,,,
inventory app for restaurants,641,170,36,10,I,app for restaurants,ok,,,,,,,,,,
free time clock apps for small business,642,170,36,9.53,I,app for small business,ok,,,,,,,,,,
mobile app development for startup,643,110,23,0,I,app for startups,ok,,,,,,,,,,
best website host for photographers,644,140,30,2.07,I,website for photographers,ok,,,,,,,,,,
easiest social media platform to make money,645,90,19,0.75,I,make platform,ok,,,,,,,,,,
toast app for restaurants,646,90,23,4.78,"I,N",app for restaurants,ok,,,,,,,,,,
best apps for small business owners,647,90,19,8.56,I,app for small business,ok,,,,,,,,,,
