keyword,priority,volume,kd,cpc,intent,seed,flag,published,Ссылка конкурента 1,Ссылка конкурента 2,Ссылка конкурента 3,Заголовок конкурента 1,Заголовок конкурента 2,Заголовок конкурента 3,Сниппет конкурента 1,Сниппет конкурента 2,Сниппет конкурента 3
how to make a game in the app store,92,480,31,1.72,I,make app,ok,,https://www.apple.com/app-store/developing-for-the-app-store/,https://www.iubenda.com/en/blog/how-to-make-a-game-for-the-app-store-and-avoid-rejection/,https://support.google.com/googleplay/android-developer/thread/238604449/how-do-i-create-a-game-and-upload-it-to-the-app-store?hl=en,Developing for the App Store,How to Make a Game for the App Store (and Avoid ...,How do I create a game and upload it to the app store?,The App Store lets you build an app once and distribute it to 175 stores around the world in up to 40 languages. You get automatic access to a user base that ...Read more,Beginner's Guide on How to Make a Mobile Game · Define your game concept · Be clear on your budget · Refine your game development basics · Plan for launch and ...Read more,"Oct 10, 2023 — How do I create a game and upload it to the app store? · Choose a game development engine. · Design your game. · Develop your game. · Test your ...Read more"
how to make a game for app store,93,480,31,1.72,I,make app,ok,,,,https://support.google.com/googleplay/android-developer/thread/238604449/how-do-i-create-a-game-and-upload-it-to-the-app-store?hl=en,5 Best App Builders of 2026 - How to Build Your Own App,Create Games Instantly - Make a Game No Code,How do I create a game and upload it to the app store?,,,"Oct 10, 2023 — How do I create a game and upload it to the app store? · Choose a game development engine. · Design your game. · Develop your game. · Test your ...Read more"
how to make a app store game,94,480,31,1.72,I,make app,ok,,,,,,,,,,
google how to make a website,95,590,39,3.21,I,make website,ok,,,https://support.google.com/a/users/answer/9310491?hl=en,https://sites.google.com/site/horstwebdesign/about-google-sites,Construtor De Sites,Create your first site with Google Sites,Google Sites - Free Website Builder - Sign in,,"On a computer, open a site in Google Sites. · At the right, click Pages. · At the bottom right, hover over Add New page . · Click New page Add . · Enter the page ...Read more",Anyone can use Google Sites to easily create and host simple business websites for free. Google Workspace customers can utilize Google Sites to develop secure ...Read more
how can i make a game for the app store,96,480,32,1.72,I,make app,ok,,https://www.iubenda.com/en/blog/how-to-make-a-game-for-the-app-store-and-avoid-rejection/,https://developer.apple.com/app-store/submitting/,https://support.google.com/googleplay/android-developer/thread/238604449/how-do-i-create-a-game-and-upload-it-to-the-app-store?hl=en,How to Make a Game for the App Store (and Avoid ...,Submitting - App Store,How do I create a game and upload it to the app store?,Beginner's Guide on How to Make a Mobile Game · Define your game concept · Be clear on your budget · Refine your game development basics · Plan for launch and ...Read more,"Set up in App Store Connect. When you distribute on the App Store, people around the world can discover and download your apps and games in 175 storefronts and ...Read more","Oct 10, 2023 — How do I create a game and upload it to the app store? · Choose a game development engine. · Design your game. · Develop your game. · Test your ...Read more"
how to make a game on app store,97,480,32,1.72,I,make app,ok,,https://support.google.com/googleplay/android-developer/thread/238604449/how-do-i-create-a-game-and-upload-it-to-the-app-store?hl=en,https://www.iubenda.com/en/blog/how-to-make-a-game-for-the-app-store-and-avoid-rejection/,https://developer.apple.com/app-store/submitting/,How do I create a game and upload it to the app store?,How to Make a Game for the App Store (and Avoid ...,Submitting - App Store,"Oct 10, 2023 — How do I create a game and upload it to the app store? · Choose a game development engine. · Design your game. · Develop your game. · Test your ...Read more",Beginner's Guide on How to Make a Mobile Game · Define your game concept · Be clear on your budget · Refine your game development basics · Plan for launch and ...Read more,"Make sure your app's name, icon, description, screenshots, app previews, and keywords are ready for your App Store product page. You can also take this ...Read more"
how to make an app from scratch,98,480,32,3.18,I,make app,ok,,,,,,,,,,
how to make a website into an app,99,480,32,1.78,I,make app,ok,,,,,,,,,,
how to make game apps,100,480,32,2.16,I,make app,ok,,,,,,,,,,
how do you make a game on the app store,101,480,32,1.72,I,make app,ok,,https://developer.apple.com/app-store/submitting/,https://www.iubenda.com/en/blog/how-to-make-a-game-for-the-app-store-and-avoid-rejection/,https://www.reddit.com/r/gamedev/comments/y1mynx/what_are_the_steps_to_make_a_game_on_ios/,Submitting - App Store,How to Make a Game for the App Store (and Avoid ...,What are the steps to make a game on iOS? : r/gamedev,"Make sure your app's name, icon, description, screenshots, app previews, and keywords are ready for your App Store product page. You can also take this ...Read more",Beginner's Guide on How to Make a Mobile Game · Define your game concept · Be clear on your budget · Refine your game development basics · Plan for launch and ...Read more,"I want to put it on the App Store for iOS, but I've been having some trouble finding the exact steps I'll need to take.Read more"
how to make an app group on iphone,102,320,21,0.02,I,make app,ok,,https://support.apple.com/guide/iphone/organize-your-apps-in-folders-iph822ece7dd/ios,https://www.youtube.com/watch?v=6qKNUL1mc-Q,https://www.youtube.com/shorts/Fd34HMNXRHU,Organize your apps in folders on iPhone,Create an App Folder on your iPhone Easily and Organize ...,How to group your Apps together on iPhone #iphonetipsandtricks ...,"Go to the Home Screen. · Touch and hold the Home Screen background until the apps begin to jiggle. · To create a folder, drag an app onto another app, then drag ...Read more",Learn how to easily create an app folder on your iPhone and organize your screen. I'll show you step-by-step how to group apps and make ...,This video is going to show you how on the iOS you can add your apps such as say like the photos and weather into a box like this.
how to make proxy site,103,320,21,1.98,I,make site,ok,,https://www.reddit.com/r/selfhosted/comments/1avvq2p/how_can_i_create_web_proxy/,https://sites.google.com/view/exploitsnstuff/unblockers/make-your-own-proxy,https://uk.pcmag.com/proxy/158839/i-set-up-my-own-proxy-server-heres-why-and-how-you-can-do-it-yourself,How can I create Web Proxy? : r/selfhosted,[👷‍♂️Make Your Own Proxy],"I Set Up My Own Proxy Server—Here's Why, and How You ...","I want to visit domain_name.com and have it load the content of google.com, but with the IP address of the server on which it is hosted instead of the client's ...Read more","You can launch the proxy from sites like google drive, canvas, this site, google classroom, and most others. Some sites that don't work are IXL and New Tab.Read more","Jun 30, 2025 — Open Settings and navigate to the Network & Internet tab. Next, select your Wi-Fi connection and look for Proxy under advanced settings. Set it ...Read more"
how to make a responsive site,104,590,40,1.2,I,make site,ok,,https://www.w3schools.com/html/html_responsive.asp,https://developer.mozilla.org/en-US/docs/Learn_web_development/Core/CSS_layout/Responsive_Design,https://www.reddit.com/r/Frontend/comments/ti1bca/easiest_way_to_make_website_responsive_on_all/,HTML Responsive Web Design,Responsive web design - Learn web development | MDN,Easiest way to make website responsive on all screens?,"Responsive Web Design is about using HTML and CSS to automatically resize, hide, shrink, or enlarge, a website, to make it look good on all devices.Read more","Dec 19, 2025 — Responsive web design (RWD) is a web design approach to make web pages render well on all screen sizes and resolutions while ensuring good usability.Read more",My suggestion is to simply look at the page while you resize the browser. Keep resizing until you feel it doesn't look good anymore.Read more
how to make site responsive,105,590,40,1.2,I,make site,ok,,https://www.w3schools.com/html/html_responsive.asp,https://developer.mozilla.org/en-US/docs/Learn_web_development/Core/CSS_layout/Responsive_Design,https://www.reddit.com/r/Frontend/comments/ti1bca/easiest_way_to_make_website_responsive_on_all/,HTML Responsive Web Design,Responsive web design - Learn web development | MDN,Easiest way to make website responsive on all screens?,"Responsive Web Design is about using HTML and CSS to automatically resize, hide, shrink, or enlarge, a website, to make it look good on all devices.Read more","Dec 19, 2025 — Responsive web design (RWD) is a web design approach to make web pages render well on all screen sizes and resolutions while ensuring good usability.Read more",My suggestion is to simply look at the page while you resize the browser. Keep resizing until you feel it doesn't look good anymore.Read more
how can i make responsive website,106,590,40,1.2,I,make website,ok,,https://www.w3schools.com/html/html_responsive.asp,https://developer.mozilla.org/en-US/docs/Learn_web_development/Core/CSS_layout/Responsive_Design,https://www.reddit.com/r/Frontend/comments/ti1bca/easiest_way_to_make_website_responsive_on_all/,HTML Responsive Web Design,Responsive web design - Learn web development | MDN,Easiest way to make website responsive on all screens?,"Responsive Web Design is about using HTML and CSS to automatically resize, hide, shrink, or enlarge, a website, to make it look good on all devices.Read more","Dec 19, 2025 — Responsive web design (RWD) is a web design approach to make web pages render well on all screen sizes and resolutions while ensuring good usability.Read more",My suggestion is to simply look at the page while you resize the browser. Keep resizing until you feel it doesn't look good anymore.Read more
how do you make a website responsive,107,590,40,1.2,I,make website,ok,,,,,,,,,,
how do make money from websites,108,480,33,0.27,I,make website,ok,,,,,,,,,,
how do you make money from websites,109,480,33,0.27,I,make website,ok,,,,,,,,,,
how to make a free app,110,590,41,2.81,I,make app,ok,,https://www.linkedin.com/pulse/how-create-free-app-without-knowing-code-dr-diane-hamilton-gvglc,https://www.figma.com/solutions/ai-app-builder/,https://www.appypie.com/app-builder/appmaker,How To Create A Free App Without Knowing How To Code,Free No-code AI App Builder - Idea to App in Seconds,App Builder | App Maker to Make Free App without Coding,"Next you will need to go to Netlify.com and create a free account. Click ""Add new site"" then ""Import from Git."" Choose GitHub and find the ...Read more","Apr 2, 2026 — How to build an app with AI in Figma Make · Step 1. Start with a frame · Step 2. Describe your app · Step 3. Watch your prototype come to life ...Read more",Build your app in minutes without coding. Create native Android and iOS apps with Appy Pie's cloud-based no-code app maker platform. Try our free app ...
how to make the website responsive,111,590,41,1.2,I,make website,ok,,,,,,,,,,
how do i make a website on google,112,590,41,3.21,I,make website,ok,,,,,,,,,,
how do social media sites make money,113,210,14,0,I,make site,ok,,,,,,,,,,
how to make responsive sites,114,590,42,1.2,I,make site,ok,,https://www.w3schools.com/html/html_responsive.asp,https://developer.mozilla.org/en-US/docs/Learn_web_development/Core/CSS_layout/Responsive_Design,https://www.reddit.com/r/Frontend/comments/ti1bca/easiest_way_to_make_website_responsive_on_all/,HTML Responsive Web Design,Responsive web design - Learn web development | MDN,Easiest way to make website responsive on all screens?,"Responsive Web Design is about using HTML and CSS to automatically resize, hide, shrink, or enlarge, a website, to make it look good on all devices.Read more","Dec 19, 2025 — Responsive web design (RWD) is a web design approach to make web pages render well on all screen sizes and resolutions while ensuring good usability.Read more",My suggestion is to simply look at the page while you resize the browser. Keep resizing until you feel it doesn't look good anymore.Read more
how to make a site with html,115,480,34,1.48,I,make site,ok,,,,,,,,,,
how do you make money on a website,116,480,34,0.27,I,make website,ok,,,,,,,,,,
how make a website in html,117,480,34,1.48,I,make website,ok,,,,,,,,,,
how make website in html,118,480,34,1.48,I,make website,ok,,,https://www.w3schools.com/howto/howto_make_a_website.asp,https://developer.mozilla.org/en-US/docs/Learn_web_development/Getting_started/Your_first_website/Creating_the_content,Build with Codex,How To Make a Website,HTML: Creating the content - Learn web development | MDN,,First Step - Basic HTML Page. HTML is the standard markup language for creating websites and CSS is the language that describes the style of an HTML document.Read more,"Nov 7, 2025 — This article provides a basic understanding of HTML and its functionality, and shows you how to create the basic content for your first website.Read more"
how to make a website on squarespace,119,480,34,4.64,I,make website,ok,,,,,,,,,,
how to make a website with html,120,480,34,1.48,I,make website,ok,,,,,,,,,,
how to make a website on html,121,480,34,1.48,I,make website,ok,,,,,Build with Codex,Make A Website For Free,To create a simple webpage using HTML – Technophiles,,,
how do i make a site secure,122,390,28,2.52,I,make site,ok,,https://www.reddit.com/r/javascript/comments/12nu84v/askjs_seeking_advice_on_building_a_secure_website/,https://developer.mozilla.org/en-US/docs/Learn_web_development/Extensions/Server-side/First_steps/Website_security,https://www.cloudflare.com/learning/security/how-to-secure-a-website/,[AskJS] Seeking advice on building a secure website for ...,Website security - Learn web development | MDN,How to secure a website,HTTPS encryption: Make sure the website has HTTPS encryption enabled. This ensures that any data exchanged between your browser and the website ...Read more,"Apr 11, 2025 — A few key messages · Use more effective password management. · Configure your web server to use HTTPS and HTTP Strict Transport Security (HSTS).Read more","Technical measures include using SSL certificates to encrypt data and authenticate the web host for clients, deploying a web application firewall (WAF) to block ...Read more"
how do you make a website secure,123,390,28,2.52,I,make website,ok,,,,,,,,,,
how can we make a website on google,124,590,43,3.21,I,make website,ok,,,,,Construtor De Sites,Start Building Now at No Cost,Create a Website in Minutes,,,
how to make a website for selling products,125,590,43,4.2,I,make website,ok,,https://www.reddit.com/r/smallbusiness/comments/1jhpa1k/creating_a_website_to_sell_products/,https://squareup.com/us/en/online-store,https://slickplan.com/blog/creating-website-to-sell-products,Creating a website to sell products? : r/smallbusiness,Sell online - build a free online store or eCommerce website,Create a Website to Sell Products: 7 Simple Steps 2026,"So there are things that need to be in place before you start building a site. Then you need to know who your target audience is, what the value ...Read more",Create and customize an eCommerce website that fits your brand with the all-in-one website platform. Start your free trial today.,"In this 7-step guide, you'll learn how to find your audience, choose a domain, design your site, add products, set up payments, optimize for search engines and ...Read more"
how to make games for the app store,126,480,35,1.72,I,make app,ok,,https://www.iubenda.com/en/blog/how-to-make-a-game-for-the-app-store-and-avoid-rejection/,https://www.reddit.com/r/programmingforkids/comments/okq11s/creating_and_publishing_a_simple_game_app/,https://developer.apple.com/app-store/submitting/,How to Make a Game for the App Store (and Avoid ...,Creating and publishing a simple game app,Submitting - App Store,Beginner's Guide on How to Make a Mobile Game · Define your game concept · Be clear on your budget · Refine your game development basics · Plan for launch and ...Read more,"You can't use Scratch to make a game for the App Store. You could use MIT app inventor. Even though app inventor is block-based, like ...Read more","Set up in App Store Connect. When you distribute on the App Store, people around the world can discover and download your apps and games in 175 storefronts and ...Read more"
how to create a website for my business,127,1100,82,6.16,I,create website for business,ok,,,,,,,,,,
how to make music app,128,210,15,2.08,I,make app,ok,,,,,5 Best App Builders of 2026 - 10 Best Application Builders,Suno: Make Music,Build An App For Free,,,
how to make money off an app,129,260,19,1.84,I,make app,ok,,,,,,,,,,
how to make a website for selling items,130,390,29,3.46,I,make website,ok,,https://www.reddit.com/r/smallbusiness/comments/1jhpa1k/creating_a_website_to_sell_products/,https://squareup.com/us/en/online-store,https://www.wix.com/blog/how-to-make-a-website-to-sell,Creating a website to sell products? : r/smallbusiness,Sell online - build a free online store or eCommerce website,How To Make a Website to Sell Online in 10 Steps,"So there are things that need to be in place before you start building a site. Then you need to know who your target audience is, what the value ...Read more",Create and customize an eCommerce website that fits your brand with the all-in-one website platform. Start your free trial today.,"Apr 2, 2026 — Start by defining your product and audience, then create a user-friendly site with clear branding, smart categories and strong product pages.Read more"
what kind of website should i make to make money,131,390,29,0,I,make website,ok,,https://www.reddit.com/r/SEO/comments/1oznl4z/what_kind_of_website_is_worth_building_today_if/,https://elementor.com/blog/most-successful-website-ideas-to-make-money/,https://www.hostinger.com/tutorials/website-ideas,What kind of website is worth building today if the goal is to ...,32 Most Successful Website Ideas to Make Money in 2026,30+ profitable website ideas to make money,"I'm planning to launch a website as a revenue generating project (content site, tool, service), but I'm not sure which direction makes the ...Read more","Dec 18, 2025 — 1. High-Ticket Online Courses The online education market is booming, especially for specialized, high-value courses.Read more","Feb 20, 2026 — 1. Ecommerce website. Starting an online store is one of the most popular ways to make money. An ecommerce store provides a space to sell your ...Read more"
how to make an app for your business,132,480,36,5.02,I,make app,ok,,https://www.reddit.com/r/Entrepreneur/comments/1leisms/whats_the_easiest_way_to_build_a_mobile_app_for_a/,https://www.goodbarber.com/blog/how-to-make-an-app/,https://stripe.com/resources/more/how-to-start-a-business-app-a-quick-guide-for-businesses,What's the easiest way to build a mobile app for a local ...,How to Create an App - 7 Steps to Make an app in 2026,How to start a business app: A quick guide for businesses,"If you're making a mobile app, you'd have to put it on google/android/apple stores, pay the cost of each. I think making a PWA will be easier.Read more","Mar 27, 2026 — This 7-step guide will help you to create a mobile app for Android, iOS or a PWA from scratch, in a very simple and intuitive way.Read more","May 14, 2025 — Learn the basics of building a business app, including how to design and market your own, and what it can bring to your brand."
how make website in google,133,480,36,2.38,I,make website,ok,,,,,Start Building Now at No Cost,Create a Website in Minutes,Construtor De Sites,,,
how i make a website in html,134,480,36,1.48,I,make website,ok,,https://www.w3schools.com/howto/howto_make_a_website.asp,https://developer.mozilla.org/en-US/docs/Learn_web_development/Getting_started/Your_first_website/Creating_the_content,https://medium.com/@glenpaulson/building-a-simple-html-css-js-website-9cc04a8bd761,How To Make a Website,HTML: Creating the content - Learn web development | MDN,"Building a simple HTML, CSS & JS Website",First Step - Basic HTML Page. HTML is the standard markup language for creating websites and CSS is the language that describes the style of an HTML document.Read more,"Nov 7, 2025 — This article provides a basic understanding of HTML and its functionality, and shows you how to create the basic content for your first website.","Building a simple HTML, CSS & JS Website Why? I'm a react front-end developer I love to create & document the progress — no matter how small ..."
how to make a squarespace website,135,480,36,4.64,I,make website,ok,,https://www.squarespace.com/,https://www.squarespace.com/blog/how-to-make-a-website,https://www.paigebrunton.com/blog/build-squarespace-site-fast,Website Builder – Easily Create Your Own Website ...,How to Make a Website from Scratch in 5 Steps,14 design secrets to build a Squarespace website fast,"To create your own website, choose a professionally designed website template or use Squarespace's AI website builder to get started in minutes. No credit card ...Read more","Sep 28, 2021 — How to Make a Website: A Beginner's Guide · 1. Do your research · 2. Choose a template or use AI · 3. Create your website pages · 4. Add content ...Read more","Apr 29, 2025 — Pre-design tips for building your Squarespace site fast · 1. Download the Start your Squarespace website workbook · 2. Pick your template wisely.Read more"
how to make ecommerce website,136,480,37,4.11,I,make website,ok,,,,,,,,,,
how to make website from html,137,480,37,1.48,I,make website,ok,,,,,Build with Codex,Criador de sites & apps - Crie sites web com IA,JavaScript Website Builder,,,
how to make an app on the app store,138,390,30,2.71,I,make app,ok,,,,,Easy App Creation - Design Apps Fast,How To Make Your Own App - A Step-by-Step Guide,Build An App For Free,,,
how to make apps for the app store,139,390,30,2.71,I,make app,ok,,,,,,,,,,
how do you make a site secure,140,390,30,2.52,I,make site,ok,,https://www.reddit.com/r/javascript/comments/12nu84v/askjs_seeking_advice_on_building_a_secure_website/,https://www.cloudflare.com/learning/security/how-to-secure-a-website/,https://www.thesslstore.com/blog/how-do-i-make-my-website-secure/,[AskJS] Seeking advice on building a secure website for ...,How to secure a website,How Do I Make My Website Secure? The Essential Guide,HTTPS encryption: Make sure the website has HTTPS encryption enabled. This ensures that any data exchanged between your browser and the website ...Read more,"Technical measures include using SSL certificates to encrypt data and authenticate the web host for clients, deploying a web application firewall (WAF) to block ...Read more","Feb 2, 2024 — There are physical security measures you can use — keeping your database server(s) locked up, implementing secure access using ID cards, ...Read more"
how can i make a game app,141,260,20,2.33,I,make app,ok,,https://www.reddit.com/r/GameDevelopment/comments/1hwdsf9/how_hard_would_it_be_to_make_a_mobile_game_app/,https://play.google.com/console/about/guides/build-a-high-quality-app-or-game/,https://gdevelop.io/,How hard would it be to make a mobile game app like this?,Build a high-quality app or game | Google Play Console,"GDevelop: Free, Fast, Easy Game Engine - No-code, AI ...",Start doing any basic Unity tutorial first for a basic mobile app. Build a simple 2d game tutorial . Gradually do more tutorials for login / ...Read more,"App quality is a key factor in driving long term success for your apps. Find out more about how to improve your content, user experience, and technical ...","Make your own game. Publish it on Steam and the App Stores. GDevelop is the best open-source, no-code & AI game engine, and the fastest way to create.Read more"
how to make a site responsive,142,590,47,1.2,I,make site,ok,,https://www.w3schools.com/html/html_responsive.asp,https://developer.mozilla.org/en-US/docs/Learn_web_development/Core/CSS_layout/Responsive_Design,https://www.reddit.com/r/Frontend/comments/ti1bca/easiest_way_to_make_website_responsive_on_all/,HTML Responsive Web Design,Responsive web design - Learn web development | MDN,Easiest way to make website responsive on all screens?,"Responsive Web Design is about using HTML and CSS to automatically resize, hide, shrink, or enlarge, a website, to make it look good on all devices.Read more","Dec 19, 2025 — Responsive web design (RWD) is a web design approach to make web pages render well on all screen sizes and resolutions while ensuring good usability.Read more",My suggestion is to simply look at the page while you resize the browser. Keep resizing until you feel it doesn't look good anymore.Read more
