keyword,priority,volume,kd,cpc,intent,seed,flag,published,Ссылка конкурента 1,Ссылка конкурента 2,Ссылка конкурента 3,Заголовок конкурента 1,Заголовок конкурента 2,Заголовок конкурента 3,Сниппет конкурента 1,Сниппет конкурента 2,Сниппет конкурента 3
what makes a site credible,192,320,34,0.35,I,make site,ok,,https://dl.acm.org/doi/10.1145/365024.365037,https://usingsources.fas.harvard.edu/evaluating-web-sources-0,https://business.trustpilot.com/blog/build-trusted-brand/10-things-that-make-a-website-credible-the-ultimate-checklist,What makes Web sites credible?: a report on a large ...,Evaluating Web Sources,How to know if your website is credible: The ultimate checklist,"In order of impact, the five types of elements that increased credibility perceptions were “real-world feel”, “ease of use”, “expertise”, “trustworthiness”, and ...Read more","When you find a source online, you will need to assess whether it is a credible source. Because web sources can be created by anyone and therefore are riskier.Read more","Jan 24, 2024 — Maintain visual consistency across the website · Use a clear visual hierarchy · Incorporate white space · Prioritize intuitive navigation · Steer ...Read more"
how to make a google site look good,193,210,22,2.92,I,make site,ok,,https://www.youtube.com/watch?v=dRMksrdiRds,https://www.reddit.com/r/GoogleSites/comments/octah4/amazing_website_created_on_google_sites/,https://www.youtube.com/watch?v=E1OHTjd5R1s,Google Sites TIPS and TRICKS to making it better.,Amazing Website Created on Google Sites : r/GoogleSites,Make Google Sites Stand Out with These Pro Tips!,I'm going to be sharing additional tips and tricks to making your Google site better so of course if you'd like to know more then stay tuned.,"I think the biggest thing that I learned is that for the main page, you should definitely utilize a full sized banner with a cool pattern and a ...Read more",I'm sharing with you seven tips that will save you hours of frustration and make your website so much better.
how to make site mobile friendly,194,320,35,0.93,I,make site,ok,,,,,,,,,,
how to make a free website,195,590,66,2.9,I,make website,ok,,,,,,,,,,
how to make fake site,196,210,23,0.99,I,make site,ok,,,,,,,,,,
how to make an affiliate site,197,210,23,2.21,I,make site,ok,,https://www.youtube.com/watch?v=NwH7OUKqkvI,https://www.reddit.com/r/Affiliatemarketing/comments/ynrukx/i_want_to_start_my_own_affiliate_website_and_i/,https://impact.com/affiliate/how-to-build-a-successful-affiliate-marketing-website/,How to Create an Affiliate Website in 5 Minutes? | COMPLETE ...,I want to start my own affiliate website and I want to do it ...,How To Build An Affiliate Marketing Website in 8 Steps,"Criar um Site de Afiliados é muito mais simples do que você imagina. Hoje eu vou te mostrar como fazer isso, usando uma plataforma que cria ...","A few things you can do to find this balance include looking for underserved markets, focusing on quality over quantity, and differentiating your product or ...Read more",Step 1: Choose a topic · Step 2: Buy a domain name · Step 3: Build your site · Step 4: Get familiar with publishing platforms and tools · Step 5: Sign up for ...Read more
how to make an e commerce site,198,390,44,3.68,I,make site,ok,,,,,Construtor De Sites - 5 Melhores Criadores de Sites,Ecommerce builder - Criar loja virtual,Ecommerce Website Builder | Create a Free Store in Minutes - Shopify,,,
how to make your business website,199,590,68,5,I,make website,ok,,https://www.canva.com/create/business-websites/,https://www.wix.com/business/website,https://www.website.com/,Free Business Website Maker - Create a ...,Create a Small Business Website,Create Your Free Website | Free Website Builder | Website.com,Create a business website with our free business website builder. Choose from beautiful templates and customize with easy drag-and-drop editing.,"How to make a business website. Follow these 6 simple steps to create your own business website today. Select your template, or start from a blank canvas.Read more","Create a professional website for free with the Website.com website builder. Domain names, web hosting, website templates, and ecommerce solutions included."
how to make a site https,200,320,37,2.56,I,make site,ok,,https://www.reddit.com/r/webdev/comments/437bnn/enabling_https_on_your_website_for_individuals/,https://web.dev/articles/enable-https,https://www.en.sitew.com/How-to-grow-your-online-business/Create-https-website,Enabling HTTPS on your website (for individuals who ...,Enable HTTPS on your servers | Articles,How to make a website https?,"So all you need to do is create your own OpenSSL certificate valid for a year, set a calendar reminder for yourself, and have valid HTTPS on ...Read more","This page provides guidance for setting up HTTPS on your servers, including the following steps: Generate keys and certificate signing requests.Read more","May 21, 2025 — Method to make your website https · Make a certificate signing request (CSR) on your server to collect the necessary data (public key certificate) ...Read more"
how much do app developers make,201,260,30,3.01,I,make app,ok,,https://www.reddit.com/r/iOSProgramming/comments/10azwdr/developers_how_much_do_you_earn_with_your_apps/,https://www.businessofapps.com/app-developers/research/ios-android-developer-salary/,https://www.ziprecruiter.com/Salaries/App-Developer-Salary,Developers: How much do you earn with your apps?,App Developer Salary Guide (2025),App Developer Salary: Hourly Rate April 2026 USA,"Many indie devs report earning anywhere from a few dollars a month to a full-time income, it really depends on niche, monetization strategy, and ...Read more","Feb 27, 2025 — It starts with $78,000 annual salary for the Junior Level skills, followed by $105,000 once you reach the Mid-level stage, at the Senior level, ...Read more",How much do App Developer jobs pay per hour? The average hourly pay for a App Developer job in the US is $52.64. Hourly salary range is $17.07 to $84.86.
how do you create a website for your business,202,590,70,5,I,create website for business,ok,,https://www.canva.com/create/business-websites/,https://www.wix.com/business/website,https://www.reddit.com/r/smallbusiness/comments/1bg74au/best_way_to_make_a_website_for_small_business/,Free Business Website Maker - Create a ...,Create a Small Business Website,Best way to make a website for small business?,"Create a website for your business—no coding required. With our free business website maker, you can build a beautiful, one-page website in minutes.Read more",1. Plan your website ; 2. Build with AI or choose a template ; 3. Customize your website ; 4. Get a domain name ; 5. Optimize for search engines ...Read more,"Start with a website builder, most of them cover free trial period. Get a feel for how it works, and see how you can use that to grow locally.Read more"
how much is making a website,203,480,57,2.29,I,make website,ok,,https://www.reddit.com/r/Entrepreneur/comments/u4hn2f/how_much_did_it_cost_you_to_get_a_website_made/,https://www.upwork.com/resources/how-much-does-it-cost-to-build-website,https://www.forbes.com/advisor/business/software/how-much-does-a-website-cost/,How much did it cost you to get a website made? And what ...,How Much Does It Cost To Build a Website in 2026?,How Much Does A Website Cost? (2026 Guide),"We've built thousands of sites (from as low as $500 to as high as $50,000). The costs for a site will always vary based on the requirements.Read more","Jan 7, 2026 — Across industries and use cases, the cost of a website typically falls between $300 and $5,000. This range depends on factors like project scope ...Read more","Jan 19, 2026 — Initial DIY build: $0 to $450; Professional website design (optional): $1,500 and up; Hosting and apps: $15 to $150 monthly; Maintenance: $20 to ...Read more"
how to make blog site,204,320,38,2.02,I,make site,ok,,https://www.canva.com/create/blog-websites/,https://support.google.com/blogger/answer/1623800?hl=en,https://www.reddit.com/r/webdev/comments/rlsxqk/if_i_was_going_to_create_my_own_blog_website_what/,Free Online Blog Website Maker,Create a blog - Blogger Help,"If I was going to create my own blog website, what would ...",How to make a blog website · Launch Canva. Open Canva on the mobile app or website to create a blog website design for free. · Select a blog website template.Read more,"Sign in to Blogger. · On the left, click the Down arrow Down arrow . · Click New blog. · Enter a name for your blog. · Click Next. · Choose a blog address or URL.Read more","Create a page that has a form for all the properties of each blog post, that way you fill out everything for the blog post and submit the form ...Read more"
app how to make,205,220,26,2.82,I,make app,ok,,https://developer.android.com/codelabs/basic-android-kotlin-compose-first-app,https://about.appsheet.com/how-to-create-an-app/,https://www.reddit.com/r/learnprogramming/comments/1byvl25/how_do_i_build_an_app_from_scratch/,Create your first Android app - Android Developers,How to create an app,How do I build an app from scratch? : r/learnprogramming,"In this codelab, you create your first Android app with a project template provided by Android Studio. You use Kotlin and Jetpack Compose to customize your app.Read more","The easiest and fastest way to get started is to select Create > App > Blank app, to generate a simple app with default data in AppSheet's first-party, native ...Read more","Hello folks! I'm thinking about building an app for my personal use and perhaps even share with a larger user-base, if it's come out decent ...Read more"
how much make a website,206,480,58,2.29,I,make website,ok,,https://www.reddit.com/r/Entrepreneur/comments/u4hn2f/how_much_did_it_cost_you_to_get_a_website_made/,https://elementor.com/blog/how-much-does-it-cost-to-build-a-website/,https://www.upwork.com/resources/how-much-does-it-cost-to-build-website,How much did it cost you to get a website made? And what ...,How Much Does It Cost to Build a Website in 2026 ...,How Much Does It Cost To Build a Website in 2026?,"We've built thousands of sites (from as low as $500 to as high as $50,000). The costs for a site will always vary based on the requirements.Read more","Jan 28, 2026 — Website costs range dramatically: A DIY website can cost as little as $60 – $300 per year. Hiring a freelance designer typically ranges from ...Read more","Jan 7, 2026 — Across industries and use cases, the cost of a website typically falls between $300 and $5,000. This range depends on factors like project scope ...Read more"
how much can app developers make,207,260,31,3.01,I,make app,ok,,,,,,,,,,
how to make ecommerce site,208,390,47,3.68,I,make site,ok,,,,,,,,,,
how to make your site come up first on google,209,320,39,4,I,make site,ok,,https://www.reddit.com/r/web_design/comments/evqnz6/how_can_i_make_my_website_appear_at_the_top_in/,https://www.wix.com/blog/how-to-get-your-business-found-on-google,https://www.leanlabs.com/blog/how-to-get-website-to-show-up-on-google,How can I make my website appear at the top in Google ...,How to get your website on Google in 10 simple steps,How To Get My Website To Show Up on Google: 7 Expert ...,Get a verified Google My Business Listing · Submit your website sitemap to Google Search Console. · Add local business schema to your website. · Do ...Read more,"Jan 8, 2026 — Is your business's website getting the search results attention it deserves? Here's how to get your website on Google, broken down into 9 ...",How To Get My Website To Show Up on Google: 7 Expert SEO Tips · 1. Create a Clear Site Architecture · 2. Prioritize Content Quality · 3. Optimize Your Website For ...Read more
how to make a good site,210,390,48,3.17,I,make site,ok,,,,,Make Your Own Website,"Lovable - Modern Websites, Zero Setup",How To Plan a Website in 2026 - Build with Total Freedom,,,
how much does a mobile app developer make,211,260,33,3.01,I,make app,ok,,https://www.ziprecruiter.com/Salaries/Mobile-Application-Developer-Salary,"https://www.glassdoor.com/Salaries/mobile-applications-developer-salary-SRCH_KO0,29.htm",https://www.reddit.com/r/iOSProgramming/comments/10azwdr/developers_how_much_do_you_earn_with_your_apps/,"Salary: Mobile Application Developer (Apr, 2026) US",Mobile Applications Developer Salaries,Developers: How much do you earn with your apps?,The average MOBILE APPLICATION DEVELOPER SALARY in the United States as of April 2026 is $53.12 an hour or $110482 per year. Get paid what you're worth!,"The average salary for a Mobile Applications Developer is $126208 per year in United States. Click here to see the total pay, recent salaries shared and ...","Many indie devs report earning anywhere from a few dollars a month to a full-time income, it really depends on niche, monetization strategy, and ...Read more"
how to make a mobile friendly site,212,320,41,0.93,I,make site,ok,,https://www.reddit.com/r/learnprogramming/comments/1948sz/web_design_making_a_website_mobile_friendly/,https://www.wix.com/blog/how-to-make-website-mobile-friendly,https://www.figma.com/resource-library/mobile-website-design/,[Web design] Making a website mobile friendly,How to make a website mobile-friendly,Mobile Website Design: 10 Examples + Best Practices,"Build your site using percentages: as in, your main container or wrapper will be say 60-70% of a large screen, 80% of a mid-size screen, and 90- ...Read more","Mar 25, 2026 — 18 easy tips to make your website mobile-friendly · 01. Start with a mobile-first approach · 02. Choose a mobile-responsive template · 03. Avoid ...Read more","Create a scroll-friendly layout that helps users navigate your site quickly and confidently. Keep menus short, use a hamburger icon to save space, and avoid ...Read more"
how do i make a free website of my own,213,480,63,3.22,I,make website,ok,,,,,,,,,,
how do i make an app,214,290,38,2.55,I,make app,ok,,https://www.reddit.com/r/learnprogramming/comments/1byvl25/how_do_i_build_an_app_from_scratch/,https://developer.android.com/codelabs/basic-android-kotlin-compose-first-app,https://www.figma.com/resource-library/how-to-design-an-app/,How do I build an app from scratch? : r/learnprogramming,Create your first Android app - Android Developers,How To Design an App in 5 Steps,"If you want a simple android application ONLY, then Kotlin with Android studio is a good choice, however, again, there is a lot of things you ...Read more",Create your first Android app · 1. Before you begin · 2. Create a project using the template · 3. Find project files · 4. Update the text · 5. Change the ...Read more,"Step 1: Define your app idea. Every app starts with a clear idea. The more focused the concept, the easier it is to design, test, and build something that users ...Read more"
learn how to make mobile apps,215,260,34,2.71,I,make app,ok,,https://developer.android.com/codelabs/basic-android-kotlin-compose-first-app,https://www.reddit.com/r/learnprogramming/comments/1llwtzo/how_to_start_building_mobile_applications/,https://www.codecademy.com/catalog/subject/mobile-development,Create your first Android app - Android Developers,How to start building mobile applications?,Mobile Development Courses & Tutorials,"In this codelab, you create your first Android app with a project template provided by Android Studio. You use Kotlin and Jetpack Compose to customize your app.Read more","I'd like to build a mobile app. I already have a general idea of what I want to create, but I'm pretty new to mobile development. I've worked on ...Read more","Codecademy offers certified mobile development courses: Android, iOS, React Native, Kotlin Into, Flutter Into, Swift Closures & more. Master mobile app now."
how to make my own website for free,216,480,64,3.22,I,make website,ok,,,,,,,,,,
how to make an own website,217,480,64,3.07,I,make website,ok,,,,,,,,,,
how to make a cash app,218,390,52,0.2,I,make app,ok,,https://cash.app/help/us/en-US/6485-getting-started-with-cash-app,https://cash.app/,https://cash.app/help/us/en-US/6522-create-a-cash-app-business-account,Getting Started with Cash App,"Send, Receive, Invest, & Manage Your Money with Cash App",Create a Cash App Business account,"Download the app from the Apple App Store or Google Play Store, or go to cash.app and click Sign up · Create a Cash App account · Link a Visa, MasterCard, or ...Read more","Download Cash App to send & receive money instantly, spend with the Cash App Card, buy bitcoin, invest in stocks, & manage your finances.","Creating a Cash App Business account is simple and free. Once you have a personal Cash App account, you can create a business account directly in the app.Read more"
apps how to make,219,220,29,2.82,I,make app,ok,,,,,,,,,,
how to make the app,220,220,29,2.82,I,make app,ok,,,,,,,,,,
what apps can you make money on,221,480,65,1.98,I,make app,ok,,https://www.reddit.com/r/povertyfinance/comments/1mdx7yy/best_moneymaking_apps_that_actually_work/,https://www.sidehustlenation.com/apps-that-pay-you/,https://play.google.com/store/apps/details?id=us.current.android&hl=en,Best money-making apps that actually work?,37 Apps That Pay You Real Money: The Best ...,Make Money: Play to Earn Cash - Apps on Google Play,2. PlayMAX: They have fire bonus tasks that pay a lot and they also give free daily gifts and very often it is x2 all rewards. You should try ...Read more,"Jan 2, 2026 — Several apps pay you to play games, including Swagbucks, KashKick, and others. Still, there are other apps where you can make more money so ...Read more",MAKE MONEY from your phone & get paid in gift cards on the Mode Earn App! EARN CASH! The only earn app where you can play and earn REAL MONEY!Read more
how can i make my own website for free,222,480,65,3.22,I,make website,ok,,https://www.wix.com/,https://www.canva.com/website-builder/,https://www.reddit.com/r/website/comments/1azpume/how_do_i_create_a_website_for_free/,Wix.com: Website Builder - Create a Free Website In Minutes,Website Builder - Create a Free Website,how do I create a website for free,"Get everything you need to build a website your way. Wix's free, easy-to-use website builder offers 2000+ templates, built-in AI tools and a custom domain.","Design and launch a professional, no-code website in minutes with Canva's free website builder. Publish in moments, not months.Read more","Yes, you can create a website for free without any web development knowledge. Use WordPress.com, Wix, Weebly, Google Sites, or GitHub Pages.Read more"
how to make a website domain,223,390,53,5.75,I,make website,ok,,,,,Why Buy a Domain If It's Free? - Free Domains for Life,Register a new domain name,Register Your Domain Now,,,
how i make own website,224,480,66,3.07,I,make website,ok,,https://www.wix.com/,https://www.canva.com/website-builder/,https://medium.com/startup-grind/how-to-build-a-website-when-youre-not-a-designer-or-developer-29315e287b1e,Wix.com: Website Builder - Create a Free Website In Minutes,Website Builder - Create a Free Website,How to build a website when you're not a designer or ...,"Get everything you need to build a website your way. Wix's free, easy-to-use website builder offers 2000+ templates, built-in AI tools and a custom domain.",Create free professional websites on your own domain in minutes. Canva's website builder makes launching a one-page website easy with customizable templates ...,"This 8-step guide is perfect for freelancers, but it can work for anyone who needs a website for their business, side-hustle, products, or whatever else you ...Read more"
how to make in app,225,220,30,2.82,I,make app,ok,,https://www.make.com/en/how-to-guides/build-custom-app-in-make,https://pt.goodbarber.com/help/shop/conectar-seu-app-e-automatizar-fluxos-de-trabalho-r148/conectar-seu-app-ao-make-e-automatize-as-operacoes-a503/,https://prefeitura.aracaju.se.gov.br/virtual-library/3FdTTe/7AD223/HowDoYouMakeAnApp.pdf,How to Build a Custom App in Make [Tutorial],Conectar seu app ao Make e automatize as operações,How Do You Make an App,"Jan 18, 2023 — Head to your custom app dashboard in Make, go to the “Connections” tab, and then click “Create a new connection”. create-new ...Read more","1. Na plataforma Make, clique no botão ""Criar um novo cenário"". 2. Pesquise ""GoodBarber"" na lista de apps oferecidos e selecione o gatilho, ação ou pesquisa que ...Read more","Common programming languages for mobile app development include Swift and. Objective-C for iOS apps, Java and Kotlin for. Android apps, and JavaScript ...Read more"
how make own website,226,480,67,3.07,I,make website,ok,,,,,,,,,,
how to make own websites,227,480,67,3.07,I,make website,ok,,https://www.canva.com/website-builder/,https://www.wix.com/,https://medium.com/startup-grind/how-to-build-a-website-when-youre-not-a-designer-or-developer-29315e287b1e,Website Builder - Create a Free Website,Wix.com: Website Builder - Create a Free Website In Minutes,How to build a website when you're not a designer or ...,"Design and launch a professional, no-code website in minutes with Canva's free website builder. Publish in moments, not months.Read more","Get everything you need to build a website your way. Wix's free, easy-to-use website builder offers 2000+ templates, built-in AI tools and a custom domain.","This 8-step guide is perfect for freelancers, but it can work for anyone who needs a website for their business, side-hustle, products, or whatever else you ...Read more"
how to make own website,228,480,67,3.07,I,make website,ok,,,,,,,,,,
how much does app developers make,229,260,36,3.01,I,make app,ok,,https://www.reddit.com/r/iOSProgramming/comments/10azwdr/developers_how_much_do_you_earn_with_your_apps/,https://www.businessofapps.com/app-developers/research/ios-android-developer-salary/,https://www.indeed.com/career/application-developer/salaries,Developers: How much do you earn with your apps?,App Developer Salary Guide (2025),Application developer salary in United States,"Many indie devs report earning anywhere from a few dollars a month to a full-time income, it really depends on niche, monetization strategy, and ...Read more","Feb 27, 2025 — Cupertino is where iOS developers make the most – on average $153,000 a year, meanwhile Android app developers make less – $148,ooo a year. Even ...Read more","The average salary for a application developer is $97,393 per year in the United States and $5,000 cash bonus per year.6.1k salaries taken from job postings on ...Read more"
how much do mobile app developers make,230,260,36,3.01,I,make app,ok,,,,,,,,,,
how can i make app,231,210,29,3.53,I,make app,ok,,https://developer.android.com/codelabs/basic-android-kotlin-compose-first-app,https://www.reddit.com/r/learnprogramming/comments/1byvl25/how_do_i_build_an_app_from_scratch/,https://www.goodbarber.com/blog/how-to-make-an-app/,Create your first Android app - Android Developers,How do I build an app from scratch? : r/learnprogramming,How to Create an App - 7 Steps to Make an app in 2026,"In this codelab, you create your first Android app with a project template provided by Android Studio. You use Kotlin and Jetpack Compose to customize your app.Read more","If you want a simple android application ONLY, then Kotlin with Android studio is a good choice, however, again, there is a lot of things you ...Read more","Mar 27, 2026 — This 7-step guide will help you to create a mobile app for Android, iOS or a PWA from scratch, in a very simple and intuitive way.Read more"
how to make good site,232,390,55,3.17,I,make site,ok,,,,,,,,,,
companies who make apps,233,260,37,13.01,I,make app,ok,,,,,5 Best App Builders of 2026 - Our Best Choices for 2026,Build Your Dream App,Best App Builder 2026 | We Tried Them All,,,
how to make sites load faster,234,260,37,1.8,I,make site,ok,,https://www.cloudflare.com/learning/performance/speed-up-a-website/,https://learn.microsoft.com/en-us/answers/questions/4129148/make-sites-load-faster,https://developers.google.com/speed,Tips to improve website speed | How to speed up websites,Make sites load faster - Microsoft Q&A,Make the Web Faster | Google for Developers,Use browser HTTP caching. The browser cache is a temporary storage location where browsers save copies of static files so that they can load recently visited ...Read more,"Jun 21, 2023 — Try to temporarily disable hardware acceleration in Chrome. From the upper-right corner of your Chrome browser, click the three dots icon.Read more",Leverage Google's infrastructure · Speed up your browsing with Google Public DNS. Leverage Google Public DNS to improve security and speed of your browsing ...Read more
how to make my own website free,235,480,71,0,I,make website,ok,,,,,,,,,,
how can i make my own website free,236,480,71,3.22,I,make website,ok,,https://www.wix.com/,https://www.canva.com/website-builder/,https://www.youtube.com/watch?v=65ALoG4S4mU,Wix.com: Website Builder - Create a Free Website In Minutes,Website Builder - Create a Free Website,How To Create a Free Website in 2026 (with Free Domain and ...,"Get everything you need to build a website your way. Wix's free, easy-to-use website builder offers 2000+ templates, built-in AI tools and a custom domain.","Design and launch a professional, no-code website in minutes with Canva's free website builder. Publish in moments, not months.Read more",In this tutorial I'm going to show you how to create a website completely for free by the end of this video you'll have a fully custom website.
how do i make my own website free,237,480,71,3.22,I,make website,ok,,,,,Construtor De Sites - 5 Melhores Criadores de Sites,Build Your Website Free Today,10 Best Free Web Hosting 2026 - Set Up Website For Free,,,
