keyword,priority,volume,kd,cpc,intent,seed,flag,published,Ссылка конкурента 1,Ссылка конкурента 2,Ссылка конкурента 3,Заголовок конкурента 1,Заголовок конкурента 2,Заголовок конкурента 3,Сниппет конкурента 1,Сниппет конкурента 2,Сниппет конкурента 3
how make site map,143,590,47,1.69,I,make site,ok,,https://developers.google.com/search/docs/crawling-indexing/sitemaps/build-sitemap,https://www.xml-sitemaps.com/,https://www.figma.com/templates/sitemap-generator/,Build and Submit a Sitemap | Google Search Central,XML Sitemaps Generator: Create your Google Sitemap Online,Free Sitemap Generator | Online Template,"Google supports several sitemap formats. Follow this guide to learn about formats, how to build a sitemap, and how to submit a sitemap to Google.",Free and simple. Suitable when you need to quickly create a sitemap for a small web site (up to 500) pages. No registration required and you get sitemaps ready ...Read more,"Plan out website architecture, content and user flows with your entire team. Try our free sitemap generator today."
how make responsive website,144,590,47,1.2,I,make website,ok,,,,,,,,,,
how make website responsive,145,590,47,1.2,I,make website,ok,,https://www.w3schools.com/html/html_responsive.asp,https://developer.mozilla.org/en-US/docs/Learn_web_development/Core/CSS_layout/Responsive_Design,https://www.reddit.com/r/Frontend/comments/ti1bca/easiest_way_to_make_website_responsive_on_all/,HTML Responsive Web Design,Responsive web design - Learn web development | MDN,Easiest way to make website responsive on all screens?,"Responsive Web Design is about using HTML and CSS to automatically resize, hide, shrink, or enlarge, a website, to make it look good on all devices.Read more","Dec 19, 2025 — Responsive web design (RWD) is a web design approach to make web pages render well on all screen sizes and resolutions while ensuring good usability.Read more",My suggestion is to simply look at the page while you resize the browser. Keep resizing until you feel it doesn't look good anymore.Read more
how to make website responsive,146,590,47,1.2,I,make website,ok,,https://www.w3schools.com/html/html_responsive.asp,https://developer.mozilla.org/en-US/docs/Learn_web_development/Core/CSS_layout/Responsive_Design,https://www.reddit.com/r/Frontend/comments/ti1bca/easiest_way_to_make_website_responsive_on_all/,HTML Responsive Web Design,Responsive web design - Learn web development | MDN,Easiest way to make website responsive on all screens?,"Responsive Web Design is about using HTML and CSS to automatically resize, hide, shrink, or enlarge, a website, to make it look good on all devices.Read more","Dec 19, 2025 — Responsive web design (RWD) is a web design approach to make web pages render well on all screen sizes and resolutions while ensuring good usability.Read more",My suggestion is to simply look at the page while you resize the browser. Keep resizing until you feel it doesn't look good anymore.Read more
how to make responsive website,147,590,47,1.2,I,make website,ok,,,,,,,,,,
how to make a website responsive,148,590,47,1.2,I,make website,ok,,https://www.w3schools.com/html/html_responsive.asp,https://developer.mozilla.org/en-US/docs/Learn_web_development/Core/CSS_layout/Responsive_Design,https://www.reddit.com/r/Frontend/comments/ti1bca/easiest_way_to_make_website_responsive_on_all/,HTML Responsive Web Design,Responsive web design - Learn web development | MDN,Easiest way to make website responsive on all screens?,"Responsive Web Design is about using HTML and CSS to automatically resize, hide, shrink, or enlarge, a website, to make it look good on all devices.Read more","Dec 19, 2025 — Responsive web design (RWD) is a web design approach to make web pages render well on all screen sizes and resolutions while ensuring good usability.Read more",My suggestion is to simply look at the page while you resize the browser. Keep resizing until you feel it doesn't look good anymore.Read more
how to make a responsive website,149,590,47,1.2,I,make website,ok,,https://www.w3schools.com/html/html_responsive.asp,https://developer.mozilla.org/en-US/docs/Learn_web_development/Core/CSS_layout/Responsive_Design,https://www.reddit.com/r/Frontend/comments/ti1bca/easiest_way_to_make_website_responsive_on_all/,HTML Responsive Web Design,Responsive web design - Learn web development | MDN,Easiest way to make website responsive on all screens?,"Responsive Web Design is about using HTML and CSS to automatically resize, hide, shrink, or enlarge, a website, to make it look good on all devices.Read more","Dec 19, 2025 — Responsive web design (RWD) is a web design approach to make web pages render well on all screen sizes and resolutions while ensuring good usability.Read more",My suggestion is to simply look at the page while you resize the browser. Keep resizing until you feel it doesn't look good anymore.Read more
how to make responsive site,150,590,48,1.2,I,make site,ok,,https://www.w3schools.com/html/html_responsive.asp,https://developer.mozilla.org/en-US/docs/Learn_web_development/Core/CSS_layout/Responsive_Design,https://www.reddit.com/r/Frontend/comments/ti1bca/easiest_way_to_make_website_responsive_on_all/,HTML Responsive Web Design,Responsive web design - Learn web development | MDN,Easiest way to make website responsive on all screens?,"Responsive Web Design is about using HTML and CSS to automatically resize, hide, shrink, or enlarge, a website, to make it look good on all devices.Read more","Dec 19, 2025 — Responsive web design (RWD) is a web design approach to make web pages render well on all screen sizes and resolutions while ensuring good usability.Read more",My suggestion is to simply look at the page while you resize the browser. Keep resizing until you feel it doesn't look good anymore.Read more
how to make a html website,151,480,39,1.48,I,make website,ok,,https://developer.mozilla.org/en-US/docs/Learn_web_development/Getting_started/Your_first_website/Creating_the_content,https://www.w3schools.com/html/html_website.asp,https://medium.com/@madhupgahlot1989/how-to-build-your-first-web-page-with-html-css-based-on-my-personal-experience-0d999c37d785,HTML: Creating the content - Learn web development | MDN,Create HTML Website Server,How to Build Your First Web Page with HTML & CSS,"Nov 7, 2025 — This article provides a basic understanding of HTML and its functionality, and shows you how to create the basic content for your first website.Read more",How it works · 1. Join W3Schools - and create a space. Choose a template - or start from scratch · 2. Choose a template - or start from scratch. Edit your code ...Read more,"Conclusion · Begin with small, achievable projects. · Learn HTML structure before diving deep into CSS. · Use online resources like MDN Web Docs ...Read more"
how to make apps for app store,152,390,32,2.71,I,make app,ok,,,,,,,,,,
how do you make an app for the app store,153,390,32,2.71,I,make app,ok,,,,,,,,,,
how to make app for app store,154,390,32,2.71,I,make app,ok,,,,,,,,,,
how to make an app icon,155,390,32,0.29,I,make app,ok,,https://developer.android.com/studio/write/create-app-icons,https://developer.apple.com/documentation/Xcode/creating-your-app-icon-using-icon-composer,https://medium.com/@flarup/designing-better-app-icons-bac276f89ead,Create app icons | Android Studio,Creating your app icon using Icon Composer,Designing better app icons,"Aug 4, 2025 — Create an action bar or tab icon · In the Icon Type field, select Action Bar and Tab Icons. · Select an Asset Type, and then specify the asset ...Read more","In the project editor, select the target and the General tab. Under App Icons and Launch Screen, ensure that the name in the App Icon text field matches the ...Read more",I go through 5 major aspects of app icon design and give real work examples of how I've worked with those qualities.Read more
how do you make an app on the app store,156,390,33,2.71,I,make app,ok,,https://developer.apple.com/app-store/,https://www.mestresdaweb.com.br/tecnologias/aprenda-a-publicar-aplicativos-no-apple-store,https://www.apple.com/app-store/developing-for-the-app-store/,Distribute on the App Store,Como publicar aplicativos na Apple Store? Guia completo,Developing for the App Store,"People can make In-App Purchases on the App Store and within your apps and games using their payment method on file. So whether you offer items, add-ons, or ...","Aprenda o passo a passo de como publicar apps na Apple Store em 2025. Guia completo com dicas, requisitos, custo para criar app, taxas da plataformas e mais!Read more",The App Store lets you build an app once and distribute it to 175 stores around the world in up to 40 languages. You get automatic access to a user base that ...Read more
how to make a ecommerce site,157,390,33,3.68,I,make site,ok,,,,,Ecommerce Website Builder | Create a Free Store in Minutes - Shopify,How To Create An eCommerce App - A Step-by-Step Guide,We Tried Them All - Our Best Choices for 2026,,,
how do i make a website secure,158,390,33,2.52,I,make website,ok,,https://www.reddit.com/r/javascript/comments/12nu84v/askjs_seeking_advice_on_building_a_secure_website/,https://developer.mozilla.org/en-US/docs/Learn_web_development/Extensions/Server-side/First_steps/Website_security,https://www.cloudflare.com/learning/security/how-to-secure-a-website/,[AskJS] Seeking advice on building a secure website for ...,Website security - Learn web development | MDN,How to secure a website,HTTPS encryption: Make sure the website has HTTPS encryption enabled. This ensures that any data exchanged between your browser and the website ...Read more,"Apr 11, 2025 — A few key messages · Use more effective password management. · Configure your web server to use HTTPS and HTTP Strict Transport Security (HSTS).Read more","Technical measures include using SSL certificates to encrypt data and authenticate the web host for clients, deploying a web application firewall (WAF) to block ...Read more"
how to make money of websites,159,390,33,0.73,I,make website,ok,,https://www.reddit.com/r/webdev/comments/10invr2/people_who_have_built_sites_for_a_passive_income/,https://adsense.google.com/start/,https://www.coursera.org/articles/how-do-sites-earn-money,"People who have built sites for a passive income, what did ...",Google AdSense - Earn Money from Your Website with ...,How Do Sites Earn Money? A Beginner-Friendly Guide,"If you're looking for a simpler way to start earning online without building a whole site, FreeCash is a decent alternative since you can make ...Read more",Start earning money from your website through ad and content monetization. Learn how to start using AdSense for your website today.,"Feb 2, 2026 — Websites earn money through advertising, product sales, subscriptions, paid services, and more, depending on their audience and business model.Read more"
how to make games for app store,160,480,41,1.72,I,make app,ok,,https://developer.apple.com/games/,https://www.reddit.com/r/programmingforkids/comments/okq11s/creating_and_publishing_a_simple_game_app/,https://www.iubenda.com/en/blog/how-to-make-a-game-for-the-app-store-and-avoid-rejection/,Games,Creating and publishing a simple game app,How to Make a Game for the App Store (and Avoid ...,"Learn about building games for iOS, iPadOS, macOS, and tvOS with the latest Apple game technologies.","You can't use Scratch to make a game for the App Store. You could use MIT app inventor. Even though app inventor is block-based, like ...Read more",Beginner's Guide on How to Make a Mobile Game · Define your game concept · Be clear on your budget · Refine your game development basics · Plan for launch and ...Read more
who make whatsapp app,161,480,41,0,I,make app,ok,,https://en.wikipedia.org/wiki/WhatsApp,https://www.whatsapp.com/about,https://www.facebook.com/100045329687904/posts/the-story-of-the-man-who-created-whatsapp-why-you-dont-need-to-be-a-genius-to-be/1364264798427830/,WhatsApp,Sobre nós,The Story of the Man Who Created WhatsApp: ...,"Owned by Meta Platforms, the service allows users to send text messages, voice messages, and video messages, make voice and video calls, and share images, ...Read more","O WhatsApp foi fundado por Jan Koum e Brian Acton, que já haviam trabalhado juntos no Yahoo por 20 anos. O WhatsApp se juntou ao Facebook em 2014, mas continua ...Read more","Yet he built an app that sold for $19 billion. His name? Jan Koum. The co-founder of WhatsApp, the app you probably use every day, for free. Jan ...Read more"
how to make a html site,162,480,41,1.48,I,make site,ok,,,,https://www.w3schools.com/howto/howto_make_a_website.asp,Build with Codex,Construtor De Sites,How To Make a Website,,,"We will combine HTML and CSS to create a basic web page. Note: If you don't know HTML and CSS, we suggest that you start by reading our HTML Tutorial.Read more"
how do i make a website,163,880,76,3.44,I,make website,ok,,https://www.canva.com/website-builder/,https://www.wix.com/,https://medium.com/@o.polesny/how-to-start-creating-an-impressive-website-for-the-first-time-9ae400347094,Website Builder - Create a Free Website,Wix.com: Website Builder - Create a Free Website In Minutes,How to start creating an impressive website for the first time,Create free professional websites on your own domain in minutes. Canva's website builder makes launching a one-page website easy with customizable templates ...,"Get everything you need to build a website your way. Wix's free, easy-to-use website builder offers 2000+ templates, built-in AI tools and a custom domain.","First, think about what you want to achieve with the website. Throughout this series of articles I will follow all the steps with you, so let me start with the ...Read more"
how to make a google website,164,480,41,2.38,I,make website,ok,,https://support.google.com/a/users/answer/9310491?hl=en,https://sites.google.com/site/horstwebdesign/about-google-sites,https://workspace.google.com/products/sites/,Create your first site with Google Sites,Google Sites - Free Website Builder - Sign in,Google Sites: Website Creator and Hosting,"Add a site title · On a computer, open a site in Google Sites. · In the top left, click Enter site name. · Enter the name of your site. · Press Enter or Return.Read more",Anyone can use Google Sites to easily create and host simple business websites for free. Google Workspace customers can utilize Google Sites to develop secure ...Read more,Easily create and edit your sites with drag-and-drop design. The automatic grid layout ensures everything looks great and scales perfectly on any device.Read more
how to make a website in html,165,480,41,1.48,I,make website,ok,,https://www.w3schools.com/howto/howto_make_a_website.asp,https://developer.mozilla.org/en-US/docs/Learn_web_development/Getting_started/Your_first_website/Creating_the_content,https://learn.shayhowe.com/html-css/building-your-first-web-page/,How To Make a Website,HTML: Creating the content - Learn web development | MDN,Building Your First Web Page - Learn to Code HTML & CSS,First Step - Basic HTML Page. HTML is the standard markup language for creating websites and CSS is the language that describes the style of an HTML document.Read more,"Nov 7, 2025 — This article provides a basic understanding of HTML and its functionality, and shows you how to create the basic content for your first website.Read more",Within this book I'm going to show you how to build your own websites using the two most dominant computer languages—HTML and CSS ...Read more
how do you make money off an app,166,260,22,1.84,I,make app,ok,,https://www.reddit.com/r/reactnative/comments/xe3t32/lets_be_honest_do_you_think_you_can_make_money/,https://base44.com/blog/how-to-build-an-app-and-make-money,https://www.iubenda.com/en/blog/how-to-create-an-app-for-free-and-make-money/,Lets be honest. Do you think you can make Money with an ...,How to build an app and make money,How to Create an App for Free and Make Money,"Monetization methods like ads, in-app purchases, or subscriptions can work, but yes, App Store/Play Store fees (30% cut) are real and hurt your ...Read more","You could sell products, offer paid subscriptions for premium content, charge a one-time download fee or run in-app ads. Some apps use a ""freemium"" model, where ...Read more","Affiliate marketing: Free apps can also generate income by promoting other apps, products, or services within the app. App developers earn a commission for ...Read more"
how to make a membership site,167,260,22,4.34,I,make site,ok,,https://www.wix.com/blog/how-to-create-membership-sites,https://www.gillianperkins.com/blog/how-i-started-a-10k-month-membership-site,https://replit.com/build/membership-website-builder,How to create a membership site that clicks with your ...,How I started a $10K/month membership site in 6 months,AI Membership Website Builder | Create for Free,"Feb 26, 2026 — How to create a membership site · 01. Choose a membership model and define your niche · 02. Select a domain and host · 03. Pick a website ...Read more","Aug 23, 2025 — If you want to learn how to make passive income by starting an online membership like me, then check out this article!",Build a membership website in minutes for free with AI. Write in plain English or tap buttons to create your website. Build a content membership site that ...Read more
how do you make a website for your business,168,590,62,5,"I,N",make website,ok,,https://www.canva.com/create/business-websites/,https://www.wix.com/,https://www.squarespace.com/,Free Business Website Maker - Create a ...,Wix.com: Website Builder - Create a Free Website In Minutes,Website Builder – Easily Create Your Own Website ...,Create a business website with our free business website builder. Choose from beautiful templates and customize with easy drag-and-drop editing.,"Get everything you need to build a website your way. Wix's free, easy-to-use website builder offers 2000+ templates, built-in AI tools and a custom domain.","To create your own website, choose a professionally designed website template or use Squarespace's AI website builder to get started in minutes. No credit card ...Read more"
how can i make a website on google,169,590,52,3.21,I,make website,ok,,https://support.google.com/a/users/answer/9310491?hl=en,https://workspace.google.com/products/sites/,https://sites.google.com/site/horstwebdesign/about-google-sites,Create your first site with Google Sites,Google Sites: Website Creator and Hosting,Google Sites - Free Website Builder - Sign in,"On a computer, open a site in Google Sites. · At the right, click Pages. · At the bottom right, hover over Add New page . · Click New page Add . · Enter the page ...Read more",Easily create and edit your sites with drag-and-drop design. The automatic grid layout ensures everything looks great and scales perfectly on any device.Read more,Anyone can use Google Sites to easily create and host simple business websites for free. Google Workspace customers can utilize Google Sites to develop secure ...Read more
how to make an app open on startup,170,260,23,0,I,make app,ok,,https://www.reddit.com/r/Windows11/comments/vute57/how_do_i_make_it_so_an_app_launches_right_away_at/,https://support.microsoft.com/en-us/windows/configure-startup-applications-in-windows-115a420a-0bff-4a6f-90e0-1934c844e473,https://support.lenovo.com/us/en/solutions/ht513728-how-to-run-apps-automatically-at-startup-in-windows-10,How do I make it so an app launches right away at startup ...,Configure Startup Applications in Windows,How to run apps automatically at startup in Windows 10 or 11,"Select the Start button and scroll to find the app you want to run at startup. Right-click the app, select More, and then select Open file ...Read more",Right-click on Start and select Task Manager · Select the Startup apps tab · Select the app that you want to configure. Select Enable to start the app ...Read more,1. Open Start and Settings. Settings · 2. Select Apps. Select Startup. Startup · 3. Turn the toggle switch on/off to launch apps at startup.Read more
how to make responsive websites,171,590,54,1.2,I,make website,ok,,https://www.w3schools.com/html/html_responsive.asp,https://developer.mozilla.org/en-US/docs/Learn_web_development/Core/CSS_layout/Responsive_Design,https://www.reddit.com/r/Frontend/comments/ti1bca/easiest_way_to_make_website_responsive_on_all/,HTML Responsive Web Design,Responsive web design - Learn web development | MDN,Easiest way to make website responsive on all screens?,"Responsive Web Design is about using HTML and CSS to automatically resize, hide, shrink, or enlarge, a website, to make it look good on all devices.Read more","Dec 19, 2025 — Responsive web design (RWD) is a web design approach to make web pages render well on all screen sizes and resolutions while ensuring good usability.Read more",My suggestion is to simply look at the page while you resize the browser. Keep resizing until you feel it doesn't look good anymore.Read more
how to make a qr code for my website,172,480,44,4.24,I,make website,ok,,https://www.canva.com/qr-code-generator/,https://www.qr-code-generator.com/,https://www.adobe.com/express/feature/image/qr-code-generator,Free QR Code Generator - Create QR codes with ease,QR Code Generator | Create Your Free QR Codes,Free Online QR Code Generator | Adobe Express,Canva's Free Online QR Code Generator lets you create custom QR codes in a few clicks. Download or embed your QR code into any Canva design.,"QR Code Generator for URL, vCard, and more. Add logo, colors, frames, and download in high print quality. Get your free QR Codes now!","Create a free QR code quickly and easily with the Adobe Express QR code maker. Generate a quality, customized QR code that links to your site in seconds."
how to make a website by html,173,480,44,1.48,I,make website,ok,,https://www.w3schools.com/howto/howto_make_a_website.asp,https://developer.mozilla.org/en-US/docs/Learn_web_development/Getting_started/Your_first_website/Creating_the_content,https://www.wix.com/builder/html,How To Make a Website,HTML: Creating the content - Learn web development | MDN,HTML Website Builder: Create For Free,First Step - Basic HTML Page. HTML is the standard markup language for creating websites and CSS is the language that describes the style of an HTML document.Read more,"Nov 7, 2025 — This article provides a basic understanding of HTML and its functionality, and shows you how to create the basic content for your first website.Read more",Create without limits using an HTML website builder. Build a unique powerful website using 1000s of intuitive design features and advanced AI tools.Read more
how to make app store apps,174,390,36,2.71,I,make app,ok,,,,,Criar App APK com Manus Fácil,Base44: Build iOS App with AI,How To Make Your Own App - A Step-by-Step Guide,,,
how to make a website for your business,175,590,55,5,I,make website,ok,,https://www.canva.com/create/business-websites/,https://www.website.com/,https://www.reddit.com/r/smallbusiness/comments/1bg74au/best_way_to_make_a_website_for_small_business/,Free Business Website Maker - Create a ...,Create Your Free Website | Free Website Builder | Website.com,Best way to make a website for small business?,Create a business website with our free business website builder. Choose from beautiful templates and customize with easy drag-and-drop editing.,"Create a professional website for free with the Website.com website builder. Domain names, web hosting, website templates, and ecommerce solutions included.","Start with a website builder, most of them cover free trial period. Get a feel for how it works, and see how you can use that to grow locally.Read more"
what can i make with these ingredients app,176,320,31,0.46,I,make app,ok,,,,,,,,,,
how to make your site https,177,320,31,2.56,I,make site,ok,,,,,,,,,,
how to make site https,178,320,31,2.56,I,make site,ok,,,,,,,,,,
how to make my site https,179,320,31,2.56,I,make site,ok,,,,,,,,,,
how to create a website for your business,180,590,59,5,I,create website for business,ok,,,,,,,,,,
how long does it take to make an app,181,320,32,2.62,I,make app,ok,,,,,,,,,,
how to make money off apps,182,260,26,1.84,I,make app,ok,,,,,,,,,,
how to make a google web site,183,480,49,2.38,I,make site,ok,,,,,,,,,,
how to make app icons,184,390,40,0.29,I,make app,ok,,,,,,,,,,
how to make a forum site,185,320,33,1.88,I,make site,ok,,,,,,,,,,
how to make qr code for my website,186,480,50,4.24,I,make website,ok,,,,,,,,,,
how do i make a qr code for my website,187,480,50,4.24,I,make website,ok,,https://www.canva.com/qr-code-generator/,https://www.qr-code-generator.com/,https://www.adobe.com/express/feature/image/qr-code-generator,Free QR Code Generator - Create QR codes with ease,QR Code Generator | Create Your Free QR Codes,Free Online QR Code Generator | Adobe Express,Canva's Free Online QR Code Generator lets you create custom QR codes in a few clicks. Download or embed your QR code into any Canva design.,"QR Code Generator for URL, vCard, and more. Add logo, colors, frames, and download in high print quality. Get your free QR Codes now!","Create a free QR code quickly and easily with the Adobe Express QR code maker. Generate a quality, customized QR code that links to your site in seconds."
how to make python app,188,260,27,1.57,I,make app,ok,,,,,,,,,,
how to make a great site,189,390,41,3.17,I,make site,ok,,,,,,,,,,
how to make a site mobile friendly,190,320,34,0.93,I,make site,ok,,,,,,,,,,
how to make my site show up on google,191,320,34,3.28,I,make site,ok,,,,,,,,,,
