keyword,priority,volume,kd,cpc,intent,seed,flag,published,Ссылка конкурента 1,Ссылка конкурента 2,Ссылка конкурента 3,Заголовок конкурента 1,Заголовок конкурента 2,Заголовок конкурента 3,Сниппет конкурента 1,Сниппет конкурента 2,Сниппет конкурента 3
how to make an app,1,9900,70,2.75,I,make app,ok,,https://www.reddit.com/r/learnprogramming/comments/1byvl25/how_do_i_build_an_app_from_scratch/,https://developer.android.com/codelabs/basic-android-kotlin-compose-first-app,https://www.figma.com/resource-library/how-to-design-an-app/,How do I build an app from scratch? : r/learnprogramming,Create your first Android app - Android Developers,How To Design an App in 5 Steps,"Building a mobile app is more difficult than building a web app, and requires more to get started initially. There's much more documentation and ...Read more",Create your first Android app · 1. Before you begin · 2. Create a project using the template · 3. Find project files · 4. Update the text · 5. Change the ...Read more,"Step 1: Define your app idea. Every app starts with a clear idea. The more focused the concept, the easier it is to design, test, and build something that users ...Read more"
how to make apps,2,6600,73,2.75,I,make app,ok,,https://developer.android.com/codelabs/basic-android-kotlin-compose-first-app,https://www.reddit.com/r/learnprogramming/comments/1byvl25/how_do_i_build_an_app_from_scratch/,https://about.appsheet.com/how-to-create-an-app/,Create your first Android app - Android Developers,How do I build an app from scratch? : r/learnprogramming,How to create an app,Create your first Android app · 1. Before you begin · 2. Create a project using the template · 3. Find project files · 4. Update the text · 5. Change the ...Read more,Build a web app in a framework like React first. The code is then really easy to put on mobile with React Native.Read more,"The easiest and fastest way to get started is to select Create > App > Blank app, to generate a simple app with default data in AppSheet's first-party, native ...Read more"
how to make your own website,3,6600,85,2.88,I,make website,ok,,,,,Create Your Own Website,Criador de sites web com IA - Crie sites e apps com IA,Build a Website,,,
how to make app,4,3600,73,3.03,I,make app,ok,,https://developer.android.com/codelabs/basic-android-kotlin-compose-first-app,https://www.reddit.com/r/learnprogramming/comments/1byvl25/how_do_i_build_an_app_from_scratch/,https://www.figma.com/resource-library/how-to-design-an-app/,Create your first Android app - Android Developers,How do I build an app from scratch? : r/learnprogramming,How To Design an App in 5 Steps,Create your first Android app · 1. Before you begin · 2. Create a project using the template · 3. Find project files · 4. Update the text · 5. Change the ...Read more,"Hello folks! I'm thinking about building an app for my personal use and perhaps even share with a larger user-base, if it's come out decent ...Read more","Step 1: Define your app idea. Every app starts with a clear idea. The more focused the concept, the easier it is to design, test, and build something that users ...Read more"
how to make a dating app,5,480,14,2,I,make app,ok,,,,,,,,,,
how to make money off cash app stocks,6,480,14,1.9,I,make app,ok,,https://cash.app/help/us/en-US/5010-selling-stock,https://cash.app/stocks,https://www.bitget.com/wiki/how-to-make-money-off-cash-app-stocks,Selling Stock,Buy and Trade Stocks on Cash App | Start Investing Today,How to Make Money Off Cash App Stocks: Beginner's Guide,Tap the Money tab on your Cash App home screen · Tap on the Stocks Tile · Scroll down to Stocks you own · Tap on company whose stock you want to sell · Tap Sell.Read more,"Invest in stocks with Cash App. When you buy and trade stocks on Cash App, there are no commission fees. Start with as little as $1.","Start Small: Cash App allows fractional share investing, so you can begin with as little as $1. This reduces risk and helps you learn the platform.Read more"
how to make a site plan,7,320,9,1.8,I,make site,ok,,https://www.canva.com/create/site-plans/,https://www.mysiteplan.com/blogs/news/site-plan-the-ultimate-guide,https://cedreo.com/blog/how-to-create-a-site-plan/,Free Online Site Plan Design Creator,Site Plans: Everything You Need To Know In 2026,How to Create a Site Plan Online: 8 Simple Steps,How to make a site plan · Launch Canva Whiteboards · Choose a site plan template · Customize your site plan design in a few clicks · Add the finishing touches · Save ...Read more,"Feb 13, 2026 — Site plan essentials for 2026: Learn what a site plan is, when you need one, how to create or order online, permit steps, costs, ...","Apr 28, 2025 — How To Make A Site Plan With Cedreo · Step 1: Sketch Property Boundaries · Step 2: Adjust Exterior Components and Terrain · Step 3: Draw The ...Read more"
how to make site plan,8,320,9,1.8,I,make site,ok,,https://www.canva.com/create/site-plans/,https://www.mysiteplan.com/blogs/news/site-plan-the-ultimate-guide,https://cedreo.com/blog/how-to-create-a-site-plan/,Free Online Site Plan Design Creator,Site Plans: Everything You Need To Know In 2026,How to Create a Site Plan Online: 8 Simple Steps,How to make a site plan · Launch Canva Whiteboards · Choose a site plan template · Customize your site plan design in a few clicks · Add the finishing touches · Save ...Read more,"Feb 13, 2026 — Site plan essentials for 2026: Learn what a site plan is, when you need one, how to create or order online, permit steps, costs, ...","Apr 28, 2025 — How To Make A Site Plan With Cedreo · Step 1: Sketch Property Boundaries · Step 2: Adjust Exterior Components and Terrain · Step 3: Draw The ...Read more"
how to make website,9,2400,83,2.98,I,make website,ok,,,,,,,,,,
how to make a social media site,10,480,16,2.22,I,make site,ok,,https://www.reddit.com/r/webdev/comments/1az5v0s/how_hard_is_it_to_create_a_social_media_site/,https://softwaremind.com/blog/how-to-build-a-social-media-website-from-scratch/,https://replit.com/discover/how-to-make-a-social-media-website,How hard is it to create a social media site? : r/webdev,How to Build a Social Media Website from Scratch,How to Make a Social Media Website: A Step-by-Step Guide,Making the site is going to be a ton of work. It's just that much more work to get and retain users. Even apps like Mastodon and BlueSky seem to be struggling.Read more,"Jun 12, 2025 — Start by defining your audience and the unique value your platform offers. From there, develop a feature set that includes profiles, messaging, content sharing ...Read more","Dec 15, 2025 — Learn how to make a social media website with our expert guide. We cover key steps, common pitfalls, user privacy compliance, ..."
how do websites make money,11,480,16,0.27,I,make website,ok,,,,,,,,,,
how to make a social media website,12,480,16,2.22,I,make website,ok,,,,,,,,,,
how to make apps download faster,13,390,13,0,I,make app,ok,,,,,,,,,,
how to make an app download faster,14,390,13,0,I,make app,ok,,https://www.reddit.com/r/jailbreak/comments/3if1ye/tutorial_how_to_make_appstore_downloads_faster/,https://us.norton.com/blog/how-to/how-to-increase-download-speed,https://support.microsoft.com/en-us/office/maximize-upload-and-download-speed-8eeadfb8-501f-406d-997b-98ab6ff67f43,[Tutorial] How to make AppStore downloads faster!,10 ways to increase your download speed - Norton Antivirus,Maximize upload and download speed,"Open Flex 2 and click the ""+"" button on the top right corner. · Click the AppStore. · Click ""Add Units"" and scroll down to ""StoreServices"" and ...Read more","Jun 24, 2024 — 1. Download one file at a time · 2. Clear your cache · 3. Disconnect devices you don't need from your network · 4. Test your modem and router · 5.Read more",Here are some tips for maximizing the transfer speed: Use a wired instead of a wireless connection. Avoid running other apps on your computer when you're ...Read more
how to make games app,15,480,17,2.16,I,make app,ok,,,,,,,,,,
how to make a app game,16,480,17,2.16,I,make app,ok,,,,,,,,,,
how to make app to iphone,17,480,17,2.18,I,make app,ok,,https://developer.apple.com/ios/get-started/,https://www.reddit.com/r/iOSProgramming/comments/1h9wsgj/what_do_i_need_to_develop_a_mobile_app_for_iphone/,https://www.instructables.com/Creating-your-first-iOS-app/,Get Started - iOS,what do i need to develop a mobile app for iphone?,Creating Your First IOS App : 6 Steps (with Pictures),"Get started with this easy-to-navigate collection of videos, documentation, and tools to build great apps and games.Read more","You will need an apple developer account in order to use all tools needed to develope the app, to test it and to deploy it. For that you will ...Read more",1. Open Xcode. · 2. Go to File>New>Project. · 3. Click on Single View Application and click next. · 4. Name it Hello World! · 5. Decide whether you want it to be an ...Read more
how to make a social media app,18,320,11,2.31,I,make app,ok,,,,,,,,,,
how to make a website to sell products,19,590,27,4.2,"I,N",make website,ok,,https://www.reddit.com/r/smallbusiness/comments/1jhpa1k/creating_a_website_to_sell_products/,https://squareup.com/us/en/online-store,https://www.wix.com/blog/how-to-make-a-website-to-sell,Creating a website to sell products? : r/smallbusiness,Sell online - build a free online store or eCommerce website,How To Make a Website to Sell Online in 10 Steps,"So there are things that need to be in place before you start building a site. Then you need to know who your target audience is, what the value ...Read more",Create and customize an eCommerce website that fits your brand with the all-in-one website platform. Start your free trial today.,"Apr 2, 2026 — Start by defining your product and audience, then create a user-friendly site with clear branding, smart categories and strong product pages.Read more"
iphone apps how to make,20,480,18,2.18,I,make app,ok,,,,,,,,,,
how to make a social networking app,21,390,15,2.49,I,make app,ok,,,,,,,,,,
how to make a social network app,22,390,15,2.49,I,make app,ok,,,,,"AI AppGen, Enterprise Secure",Criar App APK com Manus Fácil | Criar App Web sem Código,Build your own app,,,
how to make a social network site,23,480,19,2.22,I,make site,ok,,,,,,,,,,
how can i make a social networking site,24,480,19,2.22,I,make site,ok,,,,,,,,,,
how to make a social networking website,25,480,19,2.22,I,make website,ok,,,,,,,,,,
how do i make a game app,26,480,20,2.16,I,make app,ok,,,,,,,,,,
how to make dating app,27,480,20,2,I,make app,ok,,https://www.reddit.com/r/AskProgrammers/comments/1bh5hdz/building_a_dating_app/,https://innowise.com/blog/how-to-make-dating-app-like-tinder/,https://www.appypie.com/dating-app-builder,Building a dating app : r/AskProgrammers,How to create a dating app like Tinder,Dating App Builder to Create a Dating App Without Coding,I have an idea for a dating app and I was wondering how much it would cost to build a dating app similar to ThaiFriendly.Read more,"Jun 10, 2025 — In this guide, I'll walk you through the real blueprint for how to build an app like Tinder, from defining your audience and choosing your tech stack to ...Read more","Apr 2, 2026 — Create a Dating App like Tinder and Bumble for Free with Appy Pie's Best Online Dating App Builder. Our No-Code Dating App Maker and DIY ..."
how can i make an app for my business,28,480,20,5.02,I,make app,ok,,https://www.reddit.com/r/Entrepreneur/comments/1leisms/whats_the_easiest_way_to_build_a_mobile_app_for_a/,https://www.goodbarber.com/blog/how-to-make-an-app/,https://stripe.com/resources/more/how-to-start-a-business-app-a-quick-guide-for-businesses,What's the easiest way to build a mobile app for a local ...,How to Create an App - 7 Steps to Make an app in 2026,How to start a business app: A quick guide for businesses,"How I Took My Mobile App Business from $0 to Over $4,000 in Just 4 Months - Seeking Your Advice! r/Entrepreneur.Read more","Mar 27, 2026 — This 7-step guide will help you to create a mobile app for Android, iOS or a PWA from scratch, in a very simple and intuitive way.Read more","May 14, 2025 — Learn the basics of building a business app, including how to design and market your own, and what it can bring to your brand."
how do i make an app for my business,29,480,20,5.02,I,make app,ok,,https://info.microsoft.com/ww-Landing-The-DIY-Guide-to-Building-Your-First-Business-App.html?LCID=EN-GB,https://www.reddit.com/r/Entrepreneur/comments/1leisms/whats_the_easiest_way_to_build_a_mobile_app_for_a/,https://www.goodbarber.com/blog/how-to-make-an-app/,Building a Business App,What's the easiest way to build a mobile app for a local ...,How to Create an App - 7 Steps to Make an app in 2026,This DIY guide shows you the 5 steps to build a custom business app in hours with Microsoft Power Apps—no coding experience required.,"How I Took My Mobile App Business from $0 to Over $4,000 in Just 4 Months - Seeking Your Advice! r/Entrepreneur.Read more","Mar 27, 2026 — This 7-step guide will help you to create a mobile app for Android, iOS or a PWA from scratch, in a very simple and intuitive way.Read more"
how to make a social website,30,480,20,2.22,I,make website,ok,,https://softwaremind.com/blog/how-to-build-a-social-media-website-from-scratch/,https://www.ning.com/,https://www.reddit.com/r/webdev/comments/1az5v0s/how_hard_is_it_to_create_a_social_media_site/,How to Build a Social Media Website from Scratch,NING: Create your own social network with the best ...,How hard is it to create a social media site? : r/webdev,"Jun 12, 2025 — Start by defining your audience and the unique value your platform offers. From there, develop a feature set that includes profiles, messaging, content sharing ...Read more",Ning - is the largest online community building platform in the World ☆ Create your own social network in a matter of minutes ⚡️ Take your 14 days trial.,Making the site is going to be a ton of work. It's just that much more work to get and retain users. Even apps like Mastodon and BlueSky seem to be struggling.Read more
how do you make money from a website,31,480,20,0.27,I,make website,ok,,,,,,,,,,
how to make a website on github,32,590,26,2.46,I,make website,ok,,https://docs.github.com/en/pages/getting-started-with-github-pages/creating-a-github-pages-site,https://www.reddit.com/r/github/comments/1gxr8bk/how_to_create_github_website_portfolio/,https://pages.github.com/,Creating a GitHub Pages site,How to create GitHub website / portfolio,GitHub Pages documentation - GitHub Docs,"In the upper-right corner of any page, select , then click New repository. · Use the Owner dropdown menu to select the account you want to own the repository.Read more","Publish with GitHub Pages: Navigate to the repository's settings, select the ""Pages"" section, and choose the main branch as the source. Your ...Read more",GitHub Pages turns any GitHub repository into a live website—no separate hosting required. Quickstart Overview. Articles. All categories.Read more
how to make a website with github,33,590,26,2.46,I,make website,ok,,https://docs.github.com/en/pages/getting-started-with-github-pages/creating-a-github-pages-site,https://www.reddit.com/r/github/comments/1gxr8bk/how_to_create_github_website_portfolio/,https://lexi-jones.github.io/website-creation/,Creating a GitHub Pages site,How to create GitHub website / portfolio,How I Made This Website with Github,"Creating your site · On GitHub, navigate to your site's repository. · Decide which publishing source you want to use. See Configuring a publishing source for ...Read more","Publish with GitHub Pages: Navigate to the repository's settings, select the ""Pages"" section, and choose the main branch as the source. Your ...Read more","Mar 9, 2024 — This video tutorial shows you how to edit the website with the text editor Visual Studio Code and Git commands.Read more"
how to make a github website,34,590,26,2.46,I,make website,ok,,https://docs.github.com/en/pages/getting-started-with-github-pages/creating-a-github-pages-site,https://www.reddit.com/r/github/comments/1gxr8bk/how_to_create_github_website_portfolio/,https://lexi-jones.github.io/website-creation/,Creating a GitHub Pages site,How to create GitHub website / portfolio,How I Made This Website with Github,"Creating your site · On GitHub, navigate to your site's repository. · Decide which publishing source you want to use. See Configuring a publishing source for ...Read more","Publish with GitHub Pages: Navigate to the repository's settings, select the ""Pages"" section, and choose the main branch as the source. Your ...Read more","Mar 9, 2024 — This video tutorial shows you how to edit the website with the text editor Visual Studio Code and Git commands.Read more"
how to make github website,35,590,26,2.46,I,make website,ok,,https://docs.github.com/en/pages/getting-started-with-github-pages/creating-a-github-pages-site,https://www.reddit.com/r/github/comments/1gxr8bk/how_to_create_github_website_portfolio/,https://lexi-jones.github.io/website-creation/,Creating a GitHub Pages site,How to create GitHub website / portfolio,How I Made This Website with Github,"In the upper-right corner of any page, select , then click New repository. · Use the Owner dropdown menu to select the account you want to own the repository.Read more","Publish with GitHub Pages: Navigate to the repository's settings, select the ""Pages"" section, and choose the main branch as the source. Your ...Read more","Mar 9, 2024 — This video tutorial shows you how to edit the website with the text editor Visual Studio Code and Git commands.Read more"
how to make app store games,36,480,21,1.72,I,make app,ok,,,,,5 Best App Builders of 2026 - We Tried Them All,Create iOS & Android Apps,Build An App For Free,,,
how to make a game on the app store,37,480,21,1.72,I,make app,ok,,https://www.iubenda.com/en/blog/how-to-make-a-game-for-the-app-store-and-avoid-rejection/,https://support.google.com/googleplay/android-developer/thread/238604449/how-do-i-create-a-game-and-upload-it-to-the-app-store?hl=en,https://developer.apple.com/app-store/submitting/,How to Make a Game for the App Store (and Avoid ...,How do I create a game and upload it to the app store?,Submitting - App Store,Beginner's Guide on How to Make a Mobile Game · Define your game concept · Be clear on your budget · Refine your game development basics · Plan for launch and ...Read more,"Oct 10, 2023 — How do I create a game and upload it to the app store? · Choose a game development engine. · Design your game. · Develop your game. · Test your ...Read more","Make sure your app's name, icon, description, screenshots, app previews, and keywords are ready for your App Store product page. You can also take this ...Read more"
how to make a web based app,38,480,21,3.43,I,make app,ok,,https://www.reddit.com/r/webdev/comments/ixnddw/where_do_i_start_with_building_a_web_app_im_a/,https://medium.com/@isaac.adams/part-1-from-0-to-1-creating-a-full-stack-web-application-platform-from-scratch-and-operating-it-cd56ed8c2b0a,https://bubble.io/blog/web-app/,Where do I start with building a web app? I'm a complete ...,Part 1: From 0 to 1 — Creating a Full-Stack Web ...,How to Create a Web App: A Step-by-Step Guide (2024),"I'd recommend starting with a simple project using Python + Flask and basic HTML/CSS/JS. Once it works locally, look into deploying it on ...Read more",I'm approaching this series by creating a simple website and iterating through several rounds of scaling and refactoring it to eventually support web-scale ...Read more,Getting started with web apps doesn't have to be difficult. We've broken down the entire process into 11 steps. Follow along and build your web app today!Read more
how to make a social site,39,480,21,2.22,I,make site,ok,,https://softwaremind.com/blog/how-to-build-a-social-media-website-from-scratch/,https://www.reddit.com/r/webdev/comments/1az5v0s/how_hard_is_it_to_create_a_social_media_site/,https://www.ning.com/,How to Build a Social Media Website from Scratch,How hard is it to create a social media site? : r/webdev,NING: Create your own social network with the best ...,"Jun 12, 2025 — Start by defining your audience and the unique value your platform offers. From there, develop a feature set that includes profiles, messaging, content sharing ...Read more",Making the site is going to be a ton of work. It's just that much more work to get and retain users. Even apps like Mastodon and BlueSky seem to be struggling.Read more,Ning - is the largest online community building platform in the World ☆ Create your own social network in a matter of minutes ⚡️ Take your 14 days trial.
how to make social networking app,40,390,17,2.49,I,make app,ok,,https://www.reddit.com/r/webdev/comments/x6gy8e/how_to_get_started_building_a_social_media_app/,https://softwaremind.com/blog/how-to-make-a-social-media-app-a-step-by-step-guide/,https://www.codebridge.tech/articles/how-to-make-a-social-network-app-steps-features-and-cost,How to get started building a social media app? : r/webdev,How to Make a Social Media App: A Step-by-Step Guide,"How to Make a Social Network App: Steps, Features, and ...","Best way to approach it is to start small with the basics - auth, user profiles, posting, feed - and then build out features like notifications ...Read more","Mar 25, 2025 — Learn how to make a social media app step-by-step from design to security, including monetization and scaling, that leads to a more secure, engaging, and ...Read more","May 12, 2025 — The key steps include defining your niche, conducting market research, choosing the right feature set, creating UX/UI designs, selecting a tech ...Read more"
how to make a site secure,41,390,17,2.52,I,make site,ok,,https://www.reddit.com/r/javascript/comments/12nu84v/askjs_seeking_advice_on_building_a_secure_website/,https://www.cloudflare.com/learning/security/how-to-secure-a-website/,https://citysecuritymagazine.com/cyber-security/six-steps-to-creating-a-secure-website/,[AskJS] Seeking advice on building a secure website for ...,How to secure a website,Six Steps to creating a Secure Website,HTTPS encryption: Make sure the website has HTTPS encryption enabled. This ensures that any data exchanged between your browser and the website ...Read more,"Best practices include using strong passwords, implementing two-factor authentication, limiting administrative access to only those who need it, and regularly ...Read more","Aug 14, 2025 — Start with a strong setup · Using a trusted web host that offers strong security protocols · Installing a valid SSL certificate (so your domain ...Read more"
how to make a proxy site,42,320,14,1.98,I,make site,ok,,https://sites.google.com/view/exploitsnstuff/unblockers/make-your-own-proxy,https://www.reddit.com/r/selfhosted/comments/1avvq2p/how_can_i_create_web_proxy/,https://www.pcmag.com/how-to/i-set-up-my-own-proxy-server-heres-why-and-how-you-can-do-it-yourself,[👷‍♂️Make Your Own Proxy],How can I create Web Proxy? : r/selfhosted,"I Set Up My Own Proxy Server—Here's Why, and How You ...","You can launch the proxy from sites like google drive, canvas, this site, google classroom, and most others. Some sites that don't work are IXL and New Tab.Read more","I want to visit domain_name.com and have it load the content of google.com, but with the IP address of the server on which it is hosted instead of the client's ...Read more","Jun 30, 2025 — Open Settings and navigate to the Network & Internet tab. Next, select your Wi-Fi connection and look for Proxy under advanced settings. Set it ...Read more"
how to make proxy sites,43,320,14,1.98,I,make site,ok,,https://www.reddit.com/r/selfhosted/comments/1avvq2p/how_can_i_create_web_proxy/,https://sites.google.com/view/exploitsnstuff/unblockers/make-your-own-proxy,https://uk.pcmag.com/proxy/158839/i-set-up-my-own-proxy-server-heres-why-and-how-you-can-do-it-yourself,How can I create Web Proxy? : r/selfhosted,[👷‍♂️Make Your Own Proxy],"I Set Up My Own Proxy Server—Here's Why, and How You ...",I need to visit a blocked website by the ISP. The primary reason for creating a web proxy is to learn how exactly things work and gain more ...Read more,"You can launch the proxy from sites like google drive, canvas, this site, google classroom, and most others. Some sites that don't work are IXL and New Tab.Read more","Jun 30, 2025 — Open the Settings app and navigate to Network & Internet options. Under Proxy, select the Manual Proxy Setup option and toggle the proxy server ...Read more"
how to make a music app,44,210,9,2.08,I,make app,ok,,,,,,,,,,
how to make an app for my business,45,480,22,5.02,I,make app,ok,,https://info.microsoft.com/ww-Landing-The-DIY-Guide-to-Building-Your-First-Business-App.html?LCID=EN-GB,https://www.reddit.com/r/Entrepreneur/comments/1leisms/whats_the_easiest_way_to_build_a_mobile_app_for_a/,https://www.goodbarber.com/blog/how-to-make-an-app/,Building a Business App,What's the easiest way to build a mobile app for a local ...,How to Create an App - 7 Steps to Make an app in 2026,This DIY guide shows you the 5 steps to build a custom business app in hours with Microsoft Power Apps—no coding experience required.,"How I Took My Mobile App Business from $0 to Over $4,000 in Just 4 Months - Seeking Your Advice! r/Entrepreneur.Read more","Mar 27, 2026 — This 7-step guide will help you to create a mobile app for Android, iOS or a PWA from scratch, in a very simple and intuitive way.Read more"
